"Me parece increíble que aún no se hayan dignado a poner un mísero ascensor, ya que es una estación que está más concurrida que otras las cuales si cuentan con uno."
"Sin ascensor...... Un Metro de Madrid que volará,para unos pocos"
"Buena linea de metro, mala parada así podemos resumir Ascao la linea 7 es una linea rápida, pero la estación es pequeña siempre con algún problema en las escaleras, poco espacio en el anden y sin ascensor por lo que no esta adaptada para ciertas personas. El lector de tarjetas falla cada dos por tres que al final alguna gente sale a por el dinero indignan te. Actualización: Encima ahora ponen cruzar puertas dos puertas para entrar sin sentido y más pesadas que las anteriores.""TTenga el mondo a sus pies! Una pequeña metropole dentro de una gran metropole. De 10 a 12 minutos de Avenida de America por linea 7 o quinze minutos hasta Gregorio Marañon para linea 10. Muy bien ubicado entre Pueblo Nuevo linea 5, cerca de Conslada central por cercanias y muchas facilidads de percorrer hasta el corazón  central de Madrid y Sol. Excelete zona comercial, cafés, bares, danceterias y toda comodidad para vivir o socializarse. Encantada!"
"Queda relativamente cerca de muchos sitios de interés"
"Parada de metro la cual necesita alguna reforma urgente"
"Una buena zona para vivir, Colegios, una gran variedad de restaurantes. Lineas de buses, cerca de las línea 7, línea 5  y línea 2"
"No hay ascensor, a cambio solo hay un tramo d escaleras. Con lo cuál está muy buen. Limpio."
"¡Hola! Buen día para tod@s por favor poner el bombillos a la escalera de la calle  llevamos un mes así sin luz muchas gracias...."
"Falta acceso con silla de rueda , las escaleras cada 2x3 están dañadas.por lo demás bien"
"Bien"
"Estación de metro que se encuentra en reforma.  No hay mucho acceso a escaleras automáticas."
"Estación con un solo acceso/salida. No tiene ascensores."
"Una gran zona para vivir, hay de todo y con todos los servicios, un buen lugar para vivir."
"Una estación de metro no corriente lo malo lleva meses en obras y no tiene acceso de minusválidos para las personas que lo necesiten ni ascensor"
"Un lugar tranquilo con un parque muy cuco."
"Es muy limpia y segura!"
"Muy bien citio para vivir tranquilos con La familia y amig@s"
"No tiene cobertura. Solo existe una salida y no tiene ascensor/acceso para personas discapacitadas."
"Buen acceso y bastante limpia. Esta una en obras"
"Me ha ayudado bastante con la circulación y el dolor muy bueno"
"Me molaba más antes... Ha perdido su esencia. Esencia Askaense loko!"
"El dia que fui estaba sucio"
"No tiene ascensor para silla de ruedas y no hay cobertura pata el móvil"
"Lugar ameno y divertido con canchas deportivas y parque infantil"
"Un barrio multicultural. Me gusta"
"Barrio aparentemente tranquilo con bastantes parquecitos"
"…"
"no funciona directamente, es super frustrante lo mal y lento que va"
"Fue una noche de luna llena…"
"Una zona comercial tranquila y agradable"
"…"
"Estación antigua, necesita reforma"
"Muy bello"
"Suscribiros a mi canal de Youtube e3ivan YT"
"Por qué es mi barrio"
"Solo encuentro malo que no tiene ascensor"
"PRECIO CALIDAD Y SERVICIO MUY BUENA"
"vivo actualmente en está zona de Madrid. Gracias."
"No tiene cobertura a la conexión de datos"
"Zona residencial no turístico"
"Habitualmente funciona muy bien"
"Desfasada, porque no hay ascensor."
"Buen barrio"
"Metro de madrid"
"Arboles de navidad en la biblioteca de ascao"
"Todo funciona con normalidad."
"Muy bonito"
"Una simple estación de metro."
"Calor y sudor"
"Una estación más de metro"
"Ascao Nevado"
"calma"
"De acuerdo"
