"Es una típica estación de metro. Hay muchas salidas,  ascensores para minusvalidos y escaleras mequanicas. Esta bien adaptado para su uso."
"Una vergüenza para estar en el centro de la ciudad. Llena de goteras, vieja y depende del día huele mucho a alcantarilla. Necesita una buena reforma. Como punto positivo hay que decir que está buen comunicada con las principales líneas de la ciudad."
"Las estaciones están muy bien empalmadas para llegar a cualquier sitio, y las frecuencias son muy buenas."
"Completamente vergonzoso lo que acaba de ocurrir ahora mismo. He accedido al metro con mi perro de 5 kg en brazos pues esta mañana cuando he salido de casa se me ha olvidado coger el bozal, aunque recalcar que siempre lo llevo cuando viajo con mi perro en el metro y así lo he explicado. No solo no me han dejado subir al metro después de pagar el billete sino que además, no una, TRES trabajadoras de avanzada edad (una de seguridad y las otras dos de Metro) me han escoltado hasta la salida como si fuera una delincuente, alucinante. Y todo por llevar un perro de 5 kg en brazos sin bozal. Entiendo que por supuesto las normas están para cumplirlas y así lo intento hacer siempre pero este comportamiento por parte del personal ha sido completamente vergonzoso e inadmisible."
"El lugar céntrico y siempre está muy bien"
"Una estacion ubicada en el barrio de Chamberi, con tiendas y cafeterias cerca. Ahora reformada y modernizada a los tiempos Limpia y accesible"
"Estación de la línea de metro 1 ( centenario) y de la cuatro.  Esta muy limpia y recién arreglada. Se ha restaurado un anuncio publicitario de la primera época con la decoración de Antonio Palacios, que estaba oculto tras un kiosco de prensa."
"Hoy he tenido un pequeño accidente porque se me han caído la cajita de los cascos a los andenes del tren, he solicitado ayuda para recuperarlos a las personas que trabajan en el metro de Bilbao, me atendieron muy amables y comprendiendo la situacion. Fueron en todo momento muy serviciales, fue un proceso bastante rápido, siguiendo todas las normativas correspondientes a la situación, les agradezco una vez más por la atención tan buena que recibí ante el inconveniente. Muchas gracias!"
"La estación esta genial, te deja muy bien para varias entradas del retiro y para bares muy de moda"
" Ha quedo muy bien la actualización del metro.…"
"Había menos gente que en otras estaciones."
"exelente zona de España muy tranquila gente agradable buen comercio"
"Una de las glorietas más conocidas del centro de Madrid. Con muchos bares y cafeterías, entre los que destaca el Café Comercial abierto en 1987 y que tiene ciertas relación con la famosa obra de Camilo José Cela, ""La Colmena"""
"Es una de las estaciones más viejas de Madrid, necesita un lavado de cara urgente, además es una estación muy muy rara"
"Una ciudad increíble y preciosa , mas ahora que después de 2 años vuelve Aste Nagusi que son las jaiak de Bilbao. Ambiente fiestero por doquier y que todo el mundo debería de ver y vivir esa experiencia alguna vez en su vida."
"Un museo fácil de encontrar y llegar en transporte público en el cual se puede aprender sobre parte de la historia de madrid. Lo recomiendo personal muy amable. Tiempo estimado para recorrerlo 2 horas, habrá quien tarde más y quien tarde menos. Animaros."
"Lamentable. Luego dicen que cojas el transporte público, llegas a la estación y no puedes acceder al interior del vagón. Son las 19,38 de la tarde, entre llegadas de uno y otro son 7 minutos, accedes al interior y no te puedes ni mover de la cantidad de personas que somos. Que pasa con el COVID? Que pasa con los billetes que pagamos? Es lamentable el trato que recibimos los usuarios."
"Han dejado la estación bonita y limpia. La única pega que le pongo y es en lo que nunca Metro nunca se fija y por eso le quito una estrella es en el suelo que es súper sucio limpie quien lo limpie."
"Los camareros del local muy agradables, el trato excelente aunque, la ensalada de atún no la recomiendo mucho. Deberían probar el lenguado al horno, uno de los mejores pescados de Málaga."
"No logro informale a Google Maps de que el metro no para en la estacion de Bilbao por trabajos de remodelacion que estan ejecutando. No me queda otra que enviarles la foto que indica lo que informo. El Metro de Madrid Deberia informarle a Google Maps de estos cambios porque es muy incomodo enterarte al momento y no estar enterado en el momento y pasar el mal rato. Google Maps hace lo maximo pero si no le informan de todas las obras que estan ejecutando en el metro de Madrid, no se van a enterar. Asi pasó con el cierre de la estacion del Retiro y tambien del cierre la estacion de Gran Via. Google Maps no ha sido enterado."
"LA ESTACIÓN DE METRO ES DE LAS PRIMERAS LÍNEAS Y AUNQUE MODERNIZADA SIGE SIENDO INCÓMODA PARA VIAJEROS MAYORES. HAY ASCENSORES PERO MAL SEÑALADOS."
"Muy bonita"
"gran metro mejor ciudad"
"Buena zona de Madrid para pasear, comprar, ir al cine, tapear informalmente y también comer o cenar más formal. Está muy bien comunicada tanto por metro como por autobús."
"Intuyo que se refiere a la Ciudad.Por una parte está la zona cerca del río muy industrializada, pero a la vez como otra ciudad está los que normalmente pocos conocen. La gastronomía es excelente así como la gente de allí, lo conozco desde muchos años y siempre me sentí como en casa, de echo aún no pareciendo los madrileños y Bilbaínos nos parecemos mucho si te interesa romper el muro de la cultura o presunta desconfianza hacia lo que no se conoce."
"Estación bastante concurrida y fácil acceso. La limpieza era correcta y el personal era muy amable y simpático. Tuve problemas para poder sacar un billete y el personal me ayudó"
"El olor a alcantarilla de esta estación es nauseabundo. Y supuestamente ""arreglaron"" la linea 1 completa que pasa por esta estación , me pregunto si de verdad hicieron algo..."
"Bilbao es una estación del servicio de metro de Madrid línea 1 y 4 en la glorieta de Bilbao es la antigua estación de metro de Madrid línea 1 en Chamberí esta antigua para la línea 1 y en la actualidad pasan la línea 1 Pinar de Chamartín y valdecarros y la línea 4 entre San Bernardo y Alonso Martínez en la glorieta de Bilbao como la ciudad del país Vasco en Madrid España"
"El vigilante de seguridad negro con acento cubano es un maleducado y va provocando. Si algún día alguien le sigue el rollo y termina con lo que él quiere, estaba trabajando miercoles 14 de agosto a las 21h. Importunó a varias personas, que le respondieron bien, y él respondía "pero no me grites, estamos hablando", cuando él mismo era el que hablaba levantando la voz y en tono provocador. Espero que no cause nada nunca."
"La glorieta de Bilbao es una zona en la cual convergen principales avenidas de Madrid y dan entrada por la calle Fuencarral a Madrid Central"
"Estación muy antigua que de vez en cuando tiene goteras. Necesita mejorar, aunque es muy segura e incluso tiene perros anti explosivos"
"Sucia y ponzoñosa, ¿de quien será la culpa? De los barrenderos no, de la gente que lo transita tampoco. La suciedad es tan solo fruto de una ciudad mal gestionada."
"Es una estación de metro antigua. Lo bueno es que tiene mucha seguridad tanto en el subsuelo como en tierra. Siempre suele haber policías. Este metro te deja en una zona estupenda de tiendas y bares."
"Pues hay mucho camino por recorrer en ésa estación de la línea uno del metro, pero aún así no está mal"
"Una de las glorietas de Madrid más emblemáticas de la zona centro con histórico Café Comercial."
"Estación de Metro Madrid cómoda, sencilla y amplia. Conección a las calles más pintorescas del centro de la capital."
"Linda pero los qreparan las veredas llenan de polvo a todos los bares de alrededor, muchooo polvo"
"Una estación de metro y una plaza/rotonda con panaderías, cafés, bares,tiendas de fotos de plantas, un herbolario,alguna que otra sucursal de Banco, un sitio estupendo"
"Varias salidas. Falta de ascensores."
"Ha quedado bien después de la reforma"
"Estación muy tradicional. Bien cuidada y atendida"
"Es una zona repleta de bares y cafeterías ideal para charlar , quedar , comer y disfrutar , muy bonito Chamberí, Madrid espectacular …"
"El metro de Bilbao está siendo remodelado y adaptado, para que todos los ciudadanos podamos disfrutar de él."
"Los trenes de línea 4 no hacen parada en sus andenes por obras. La línea 1 sigue fincionando"
"es un sitio muy cómodo buen ambiente y se come escelente"
"Tanto Bilbao como Tribunal siempre apestan a alcantarilla. Siempre ha sido así o está relacionado con la invasión hipster en la zona?"
"Me encantan las tiendas vintage!"
"Otra estación de metro, como todas las que tiene el metro de Madrid"
"Los techos están muy bajos, ¿por qué cambiaron las paredes de los andenes de la línea 4?"
"Muy buena"
"Es una estación del metro madrileño, con varias líneas, L1, L4"
"Metro Bilbao. Atención estación en curva, al salir tengan cuidado de no introducir el pie entre coche y andén"
"Clásico de Madrid, zona de salir universitaria, cerca de Malasaña"
"Muy limpio y con mucha información al viajero"
"Lindo lugar hay una. Hay una parroquia hermosa."
"Buena experiencia"
"Una parada de metro con un enlace... Qué más quieres? Je je je"
"Estación de metro muy linda tiene un rincón de historia del metro."
"Una glorieta castiza y maravillosa"
"Mal trasbordo entre las 2 líneas y, cuando llueve, malos olores y goteras. Necesita reformas ya"
"Buen sitio y buen lugar."
"Es una estación que siempre huele a cloaca. Debería de solucionar ese gran problema."
"Muy bonita, mantiene la estética original del metro"
"Línea 1 y línea 4, nada destacable"
"Muy buena ubicación y comunicación pero muy vieja ,sucia y descuidada."
"Estación de metro, normal, cómo otra cualquiera."
"Bonito cómodo seguro"
"No trabaja muy bien la señal aqui"
"El metro es antiguo y necesita una remodelación urgente ya que huele fatal."
"Maravillosa ciudad y gentes! Un lujazo"
"Estación sencilla y limpia"
"Esta muy bien , aunque podría mejorar algún cosa."
"Un trocito de la Red de metro de la línea 1, de sus tiempos."
"Esta bien"
"Buena estación y renovada"
"Calor calor calor calor calor calor calor , poner el aire acondicionado ."
"Estación de metro normalita"
"Los accesos y la estación muy viejos."
"Tal como anuncian, pasa el tren y te lleva a otro puntos de la ciudad."
"Nada q destacar."
"Hay que andar demasiado"
"Estación de la línea 1 y 4..."
"Estación de metro de la linea 1 con conexión con la linea 4 del metro de Madrid."
"Una estacin de metro  mas"
"Bien"
"Debería mejorarse, se nota que la estación es antigua."
"Excelente trato y servicios"
"Buen sitio de paseo"
"Muy agradable lugar"
"El peor lugar del mundo, lugar de nacimiento del vasco"
"Transbordo de 3-4 min de la línea 4 a la 1"
"Demasiada gente y muchas escaleras."
"Metro Bilbao, lineas 1 y 4"
"Muy limpio"
"Estación de metro con buenas combinaciones."
"Muy concurrente"
"La entrada es bonita"
"Muy comoda."
"Estación de metro normal"
"Aunque todavía está en obras"
"Personal absurdo, no dan soluciones."
"Súper organizado."
"Bien"
"Exelente …"
"Muy mal..."
"Preciosa estacion"
"Bien"
"La plaza de Bilbao"
"izban es mejor"
"Buena ubicación céntrica en lo alto de Malasaña, la línea 4 va hasta el aeropuerto hasta Mar de Cristal, donde se cambia a la línea 8 hasta el aeropuerto."
"Una estación de metro típica que esperarías de una ciudad importante."
"Es bueno ver al personal y la seguridad alrededor.  Me hace sentir seguro."
"¡Una ciudad de lo más artística y llena de encanto!"
"Bonito lugar muy bien comunicado con la ciudad y cerca de lugares de moda como Malasana."
"La estación está ubicada en el centro muy convenientemente."
"Estación de metro bastante cercana al centro, cruce para ir a la Feria."
"¡Bellooo!"
"Bien"
"Bien"
"Limpio."
"Buena comunicación."
