"La estación de ""La Fortuna"" pertenece a la Linea 11 (la que es de color verde oscuro). Está situada en el Municipio de Leganes, en el Distrito de La Fortuna entre la calle de San José con calle Puerto de los Leones. Se encuentra dentro de la zona ""B1"" de la Comunidad de Madrid. Está estación tiene accesibilidad ya que cuenta con ascensor para personas con movilidad reducida, cochecitos para bebes y personas mayores, ademas cuenta con escaleras mecanicas; todo en buen estado y de buen uso. Es una estación con bastante profundidad y dentro de ella puedes apreciar una especie de museo fotográfico (fotos de la construcción de la estación). La misma fue inaugurada el 05 de octubre de 2010 de esta forma paso a convertirse en cabecera de la linea 11 y rinde su nombre al mismo barrio que se llamó La Fortuna ya que asi se llamaba la mujer del empresario de origen portugués dueño de esos terrenos. Posee una unica salida y su ascensor exterior, justo enfrente de esta estación pasan autobuses diurnos que conectan con los Distritos la Latina y Carabanchel de Madrid y nocturnos que conectan directamente con Atocha."
"Estación moderna muy grande,limpia y también muy luminosa.  Personal amable y atento. Buenos accesos para personas con movilidad reducida ascensores y escaleras mecánicas . Línea 11 de METRO. Comunica el barrio de la FORTUNA con MADRID directamente. Si vas al centro comercial SAMBIL te deja en la misma puer. 100% muy recomendable.…"
"La funcionaria que trabaja en el turno de 17:45 del día de hoy 19 de Agosto 2023, trabaja de mala gana y malas formas. Debería estar acostumbrada a las personas que llegan a ésta zona y que por alguna razón no adquirieron el ticket con anterioridad para entrar en la zona B. Sino le gusta su trabajo pues que pida traslado pero no que haga comentarios como ""me encanta la lectura selectiva de la gente"" y poner malas caras a todo los que le pedíamos ayuda. Si supieramos lo que hacemos, no pediríamos ayuda."
"Estación de metro super tranquila, grande y limpia, se debe tener acceso de abono de la Zona B1 de Madrid o pagar la diferencia de zona para entrar y salir de la misma."
"En general, el Barrio La Fortuna es un lugar muy agradable para vivir puesto que es bastante tranquilo, cuenta con una amalgamada mezcla de razas y religiones, gente trabajadora, gran cantidad de locales comerciales de la más amplia variedad, tiene la suerte de contar con extensas áreas de esparcimiento y recreación, además de un excelente Centro Comercial como lo es el Sambil Outlet. Tiene además un clima particular pues está rodeado de áreas verdes y en una especie de loma. Es muy grato para vivir."
"Uno de los mejores barrios de Madrid... O pertenece a Leganés? Es q no está unido no sé"
"Esta calle esta llena de camellos, que con todo el descaro se forran traficando.  A que esperan para detenerlos, los vecinos estamos hartos de esta situacion y la Pojicia no hace nada. Pues pagamos impuestos como todos."
"Estación bien ubicada en el barrio, al lado de un gran parque con zonas verdes. A 2 minutos del CC Sambil, y al lado de una parada de bus para ir por el barrio de La Fortuna."
"Agradable, pero se puede mejorar mucho mas en recogida de basura ya son obsoletos e incomodos para la mayoria de personas"
"Estación amplia y moderna. Está justo al lado del centro comercial Sambil. La pega es que no llega cobertura. Tiene ascensor"
"Última estación de metro de la línea 11 Hay un centro comercial Aconsejo a todos que lo visiten Hay muchos productos baratos"
"Parece que los empleados se esconden. Si necesitas ayuda tienes que esperarlos en el vestibulo"
"Excelente atención, me atendió una muchacha morena súper amable, buen gusto, buen trato. 5 estrellas por su servicio."
"Nos viene muy bien para salir hacia Madrid nos falta la línea hacia Leganés esa sería también muy importante"
"Una estafa, para salir de la fortuna así sea una sola parada cuenta como otra área y te daban el doble."
"Bello lugar para pasarlo tranquilo"
"Bien"
"Estación bastante moderna y limpia."
"Para llegar cafetería ssahrawi en getafe"
"Buena"
"Bien"
"Metro La Fortuna L 11"
"Zona tranquila para dormir. Un parque muy bonito, muchas flores. También hay muchos parques infantiles. Hay un complejo comercial para todos. hay un metro"
"Excelente medio de transporte... hermoso, ordenado, personal agradable... Y seguro...…"
"El outlet es sencillo, pero los precios son realmente rebajados."
"lugar más hermoso"
"Ventas todo el tiempo"
