"Por fuera parece pequeño pero en cuanto pisas el acceso para entrar es impresionantemente enorme. La zona de restaurantes está muy bien distribuida , pero cuando accedés al interior alucinas lo grande y espacioso que es y que estupendas tiendas. Hay que ir a verlo para sentir esa sensación de tranquilidad que no tienen otros centros."
"Buen lugar para hacer ciertas compras"
"Muy lindo lugar para pasear o vivir me encanta …"
"Me gusta mucho porque es muy cercana a las tiendas y supermercados, es bastante concéntrica con todo y me queda cerca del parque igualmente."
"Un parque genial para pasar la tarde"
"Otra nueva reseña ayer iban las escaleras mecánicas de un lado y otra vez se rompen es una vergüenza"
"Escalera mecánica en mantenimiento hace más de 2 meses."
"Como no, día sí y día también. Pagas tu abono mensual de transporte para que? Para sufrir aún más con los dolores de rodillas, porque tardan la vida en arreglar unas simples escaleras mecánicas. ¿Os creéis que dais un servicio gratis? No, señores, está más que pagado. Si no cumplís con vuestro trabajo, a la calle y que otra persona lo haga. Que os pongáis las pilas, vagos. A fecha 12 de octubre del 2023. Estación Parque Oeste Línea 12 de metro de Madrid."
"Otro parque comercial como otros muchos de España"
"Es una zona que alberga varias zonas comerciales, aunque prácticamente hay que ir moviendo el coche o darse una buena caminata. Por ejem. Leroy Merlín está al otro extremo de Tienda animal, si no vas cargada, es un paseo. Cada tienda tiene su parking. Podemos encontrar, además de las anteriormente mencionadas...Alcampo, Aldi, Maison du monde, Conforama, Tedi, Nike, Vips, Burger King, Museo del jamón etc etc"
"El encargado Israel es un crack saca el trabajo rapido y eficaz me gusta mucho ponerle mas horas"
"Es un lugar interesante; ya que, en un mismo sitio puedes encontrar diferentes tipos de establecimiento, lo que te permite ahorro de tiempo en desplazamiento."
"Sitio para pasar en familia en un día de compras pues hay tiendas y restaurantes de todo tipo . Con muy buenos aparcamientos y muchísima amplitud . Se puede ir en Metro ."
"Tiene bastantes tiendas y están muy bien aunque hay bastante distancia en tres unas y otras. Por el resto todo genial!"
"Muchas gracias por el buen trato familiar y profesional a la vez. También por la eficacia de la resolución del siniestro."
"Muy completo hay mucha variedad de tiendas y sitios en dónde comer."
"La estación, limpia cuidada como siempre, muy buen acceso a esta zona comercial. Solo reseñar que el personal del mostrador de acceso una Sra. bastante negativa y poco colaboradora. Hay una persona fuera del torno pidiendo por favor que le dejen acceder al metro no tiene dinero necesita ir al hospital de Móstoles, ni ella, ni el guardia de seguridad, ni la gente le atiende, me lo pide a mi mí y accedo a cargar su billete en mi tarjeta de transporte ya que hoy en día no te venden un billete solo. Cómo está persona debe salir en el hospital de Móstoles le pido a esta señora tan poco operativa que nos de un pase tipo billete para que este hombre pueda salir en la estación que ya está pagado su viaje y me dice que no, cuando yo sé que existen porque a mí en una ocasión que se estropeó la tarjeta me dieron uno que me permitía atravesar el torno. Este hombre pedía por favor que le dejarán entrar no hizo amago ni intención de colarse, y la empatía o colaboracion por parte de estos dos sujetos a sido nula. He puesto una queja espero que me contesten, antes yo pagaba el billete a quien quisiera y no me obligaba a ir con el de la mano para que pueda salir de las instalaciones de metro. Mal muy mal"
"Hemos cenado en el museo del jamón ya que ibamos a comprar unas lamparas en Vieco pero a las 21:10 la tienda estaba ya cerrada...en pleno black friday nos ha sorprendido mucho"
"Me encanta tienes ocio restaurantes cine tiendas preciosas ropa muebles de todo"
"Gran variedad de tiendas ...y cosas baratas tmb"
"La verdad, cada vez está mejor, excepto el Ikea, que antes era más fácil, ahora si no vas en coche, no puedes, entrar tan cómodamente, como hace unos años."
"Supongo que porque depaso que vas a comprar algo concreto en LEROY MERLIN, puedes hacer la compra en Alcampo, hacer una revision a tu coche, o poner gasolina, y ya de paso tomarte algo de pendiendo la hora, un cafe o un vermut."
"Es un lugar que me gusta, hay diferentes tipos de tiendas donde puedes encontrar lo que te gusta."
"Tiene de todo, me gusta mucho ir ahí, encuentras muchos establecimientos de diferentes cosas, es un lugar muy lindo."
"Gran variedad de tiendas y comercios con precios y descuentos especiales."
"Parque Comercial con múltiples tipos de artículos  para comprar,  facilidad de aparcamiento en todas las tiendas. Amplio abanico de Restauración."
"Esta cerca pero lejos, vamos que esta cerca lejos de todo, pero tiene el mesón del jamón cerca, que si achuchar el hambre o necesitas ir al baño vas servido, de noche da un poco de miedo porque no pasa ni perry, esta cercalejos de la…"
"El trato es muy bueno, como allí a menudo y todo muy bien lis empleados son muy atentos"
"Es muy completo. Hay variedad de centros grandes. Desde Leroy Merlín,porcelanosa,Alcampo,Kiabi,media mark,worten, decathlon"
"me canta ir es el mejor metro de mundo"
"Buenas tiendas aunque falta alguna."
"Tienes muchas empresas y puedes comprar de todo. Hotel, gasolinera, hospital, Burger, italiano etc."
"Hoy fatal, los chipirines a la plancha no sabian a nada y encima traian un trozo de alambre k se lo dije a la camarera dos veces y como si se li digo a la pared no pienso volver"
"La estación de Metro Sur de Parque Oeste fue inagurada el 11 de abril de 2003. Presta servicio la Linea 12 (Verde oscuro). La estación se encuentra en la intersección de la Calle Estambul con Calle Luxemburgo en el municipio de Alcorcón. Esta estación está próxima a Ikea del Parque Comercial Oeste, incluye otras 50 tiendas más, y la Universidad Rey Juan Carlos del Campus de Alcorcón."
"Un lugar lleno de grandes superficies comerciales y bien comunicado con transporte público"
"Estación de metro que pertenece a la línea 12 (Metrosur). Dispone de una sola salida al exterior. Además dispone de ascensor."
"Comprar y comer, siempre es menester."
"Amplio y grande, vimos mucha restauración y tiendas"
"para mi ,el más bonito de madrid"
"Ahora se está de lujo con el aire acondicionado."
"Buen sitio para dar un paseo en familia"
"Los empleados son súper amables y todo muy bien"
"Estación de metro de la línea 12 cerca de varios centros comerciales."
"Muchas y variadas tiendas: alimentación, deporte, muebles, ropa...imprescindible en la zona sur."
"Bien"
"Ya sabeis, no soy de centros comerciales; voy a Norauto, Leroy Merlin, pero solo por necesidad."
"Desde verano sin escalera mecánica"
"Un buen sitio para dar un paseo sin aglomeraciónes"
"Buen sitio para pasear con la familia"
"Centro comercial super completo"
"Centro comercial al uso, muy completo."
"Bien ubicado, cómodo, practico"
"Parque oeste es una estación muy bonita"
"Es un hospital, Quirón maravilloso …"
"Buen Lugar para pasear"
"Esta muy bien tiene de todo"
"Un lugar que suelo visitar con gusto"
"Ideal para llegar al polígono comercial de Alcorcón"
"Nada relevante una estación de metro como cualquier otra"
"Todo bien"
"Perfecto para compras y cenar"
"Pequeño centro de compras con buen supermercado"
"Mr gusts por du variación de productos"
"Bien"
"Excelente"
"Parque Comercial con buena comunicación."
"Tiene de todo"
"Oferta variada"
"Un poco escondida la.parada si no conoces la zona."
"Gran sitio"
"De acuerdo"
"…"
"Encantador"
