"Excelente parada de metro si vives cerca. Fuí desde la calle Marsella, suelo coger la estación de Avda. De Guadalajara (que está genial) pero una vez preferí esta para ir a Alonso Cano y hacer menos transbordos y me pareció una estación de metro normal y corriente, sin acceso para discapacitados pero bien cuidada."
"Es mi barrio de siempre de toda la vida, pues nací justamente donde vivo y donde duermo, es decir mi casa, pués a mi mamá no le dió tiempo ir al hospital,y me parió en la cama donde duermo desde hace muchos años. Que me parece Simancas? Un barrio humilde ,sano y obrero de siempre, con un maravilloso parque de EL PARAISO, sus bares de toda la vida, como el LUMI, o el DOMINGUEZ (un beso y abrazo a Rocío y Dani), las terrazas de la calle Zumel, el antiguo y presente INSTITUTO SIMANCAS, el añorado colegio AGUSTÍN DE FOXÁ,  mi querido COLEGIOS TEIDE, donde por cierto, estudio ALEJANDRO SANZ, (si, si, creedme es el famosísimo cantante), y bueno tantas cosas, lugares, gentes y recuerdos, que podría escribir un entretenido libro. SOLO DECIR QUE ME SIGUE GUSTANDO SIMANCAS, con sus más y sus menos pero aquí aprendí a jugar a las chapas, etc etc etc. Y así estaría hablando de MI barrio siempre. MERECE LA PENA VISITARLO SOBRE TODO POR SU PRECIOSO PARQUE. Animaros y hacernos una visita, seguro que alguna caña nos tomamos. SALUDOS Y HASTA SIEMPRE."
"Los guardias de esta estación en concreto el señor algo de color de piel negra y la señora de edad avanzada, son muy mal hablados, y no hacen respetar la estación, siempre están yonkis en los pasillos durmiendo o colebrando , muy mal por parte de los guardias que  realidad son muchos más guardias pero ninguno hace nada, la peor estación que he transitado"
"Estación de metro abandonada por los servicios de limpieza, debido a la frecuencia de personas adictas que la frecuentan. Debe ser una de las causas."
"Línea 7, entrada por Castillo de Ucles. Esta estación se ha quedado anticuada, pues hace falta escalera automática para salir a la calle o ascensor. Ningún discapacitado puede acceder desde ninguna de sus dos entradas."
"Una estación ya por fin con cobertura móvil. Lo de poner ascensores y escaleras mecánicas en salida y entrada a la boca de metro como que no es lo vuestro no? Llevo 18 años viajando en metro y lo único que habéis hecho en esta parada es cerrar las ventanillas de acceso Castillo de Ucles y cambiar en los tornos lo de acceso para la tarjeta actual, si no ni eso. Claro la clase pobre no tenemos derecho a buenos servicios cuándo lo estamos pagando. Vaya parada...y por no hablar de los yonkis."
"Sucia en vestíbulo 2, sin nadie de metro que te ayude. Una pena. Eso sí metro de Madrid. VUELA"
"Estuve paseando a los perros en el parque el paraíso. Es amplio y los fines de semana cortan la calle para que sea peatonal. Hay grupos de amigos y familias disfrutando del parque siempre que hay buen tiempo"
"Estaciones de Simancas y García Noblejas, un poco  abandonadas por dentro, no tienen cobertura Internet ni movil. Lamentablemente las personas con movilidad reducida o personas mayores lo pasan fatal para acceder o salir. La de Simancas en el exterior en ocasiones tiene un ambiente que deja mucho que desear. No queremos estaciones de lujo, necesitamos estaciones cómodas, accesibles y bien iluminadas. Gracias."
"Es una salida de metro cerca de un descampado, poco transitado. No es accesible para personas con movilidad reducida. Es una estación antigua que necesita mejoras."
"Mejor no salir por la Calle Amposta, para que no te atraquen, no te pinchen o ver a un yonki pinchándose en las escaleras. Se necesita presencia policial en la salida del metro y alrededores con urgencia."
"Sin acceso para movilidad reducida, como viene siendo habitual en los barrios obreros."
"Estacion que tomo para ir al CAT San Blas a realizar voluntariado de Cruz Roja, la ruta puedes reducirla usando bus alfrente."
"Debería tener más vigilancia ya que muchas personas se quitan la mascarilla en el metro y alrededores"
"Fantástico el Servicio pero Sería ideal poder medir las distancias entre puntos. Si ya se puede intentad  hacerlo mas visible, no lo veo."
"Muy agradable su gente sus parques seguridad bonito comercio"
"Muy buena parada de metro"
"Ta bien pero te pinchan si sales por arriba, hay que tener cuidao"
"No tiene acceso para gente con movilidad reducida..."
"Churrería y fábrica patatas fritas Quiroga, muy buen producto, como las de toda la vida"
"Deprimente por dentro y por fuera de la estación. Renovación ya."
"No tiene cobertura fatal"
"No tiene cobertura a la conexión de datos"
"No hay acensor!"
"Me ha encantado"
"Único y acogedor"
"Buen vecindario"
"Para nosotros, los extranjeros, aquí todo está bien y claro para llegar al lugar correcto."
"solo estoy conduciendo"
"gracias me gusta mucho"
"metro"
"SANBLAS.!!    ¡PARA SIEMPRE! …"
