"Buena plaza con variopintos puestos, desde puestos de flores hasta terrazas para tomar algo. Mucha animación a todas horas. Tiene parada de metro y muchos locales de ocio alrededor, incluido teatros. Está muy bien para tomar algo y dar un paseo."
"Parada histórica de la línea 1 [ azul ] del metro de Madrid.  Conserva los azulejos originales en el hall de la estación.  A la salida podemos encontrar la plaza con diversos puestos de Flores . Perfecta para ir al "" Rastro "" ."
"Es un desastre y un asco. Hay ratas por la noche. Está lleno de gente indigente y sobre todo de chavales jóvenes sin tutela que roban. Lo más triste de la zona es que en el mapa aparece como verde pero todos los árboles están medio muertos está todo lleno de piedras y cemento. Los bares que hay en la zona son cutres, que sirven fritanga y cerveza barata a extranjeros a precio desorbitados. Yo me abstendría de la zona por completo. Lo único que merece la pena son los puestos de flores."
"Es una zona con un ambiente variopinto..conviven terrazas y puestos de flores con indigentes y otras personas que van buscándose la vida en una zona con mucho tránsito de gente.No es una plaza que destaque por su limpieza,sobre todo si pasas después de un fin de semana por ejemplo.El estar tan céntrica y contar con una salida de metro hace de esta zona un lugar muy concurrido,a veces demasiado"
"El vestibulo de Tirso de Molina, llamado Conde de Ramanones, data del año 1921, siendo una de las estaciones conservadas más antiguas del metro de Madrid. Está decorada por azulejos blancos y azules, enmarcado por cenefas ornamentales y destaca su gran escudo de Madrid en bronce sobre mosaico"
"La estación de metro es muy linda, y saber esa historia del cementerio, me impresiona!!! En la salida del metro tiene unas ventas de flores  hermosas, variadas…"
"Encantadora entrada azulejada conservada tal cual se hizo hace un siglo."
"Muy bonito espacio público, con mucha magia y mucha mística - Sabina mediante - que ha hecho que esta pequeña plaza sea conocida en todo el mundo."
"De las mas antiguas del Metro de Madrid, en la linea 1, de cuando se amplio el trazado de esta linea desde Sol a Atocha. La entrada por Conde de Romanones conserva la decoración original con baldosín blanco."
"Cuándo váis a colocar un ascensor? Tanta gente mayor, con niños, maletas y demás que necesitamos este servicio. Tengan piedad!"
"Excelente plaza con mucho ambiente, buen comercio, y hostelería deliciosa, con buenos locales, además de parada de METRO."
"Esta plaza tiene muy buena vibra, esta rodeada por restaurantes y teatros. Viene mucha gente sobre todo los viernes y fines de semana. Muy comun salir de una obra y quedarse en un bar picando algo y tomando cañitas."
"Plaza bonita y popular con puestos de flores y terrazas para tomar algo."
"El día martes fuimos con una amiga a tomar algo y el camarero nos invitó a sentarnos en una mesa la cual estaba sucia de  los clientes anteriores, paso más de 40' aproximadamente y el camarero jamás apareció para tomarnos el pedido. Sinceramente me ha parecido de muy mal gusto y vergonzoso el trato recibido por este empleado."
"Una plaza que fue perdiendo encanto mientras ganaba en inseguridad. Da acceso al Rastro y otras atracciones. Hay bares alrededor, sin embargo esta orientada al turismo y la gentrificación. Mejor callejear hacia el Rastro que hacía Atocha. Sólo mi opinión."
"La plaza de tirso de Molina no es preciosa,pero tiene un ambiente multicultural Lo malo?mucha policia y a veces... Yo voy los Domingos a el rastro a trabajar y están las terracitas de los bares puestas y mucha,mucha gente,y la boca del metro está en la plaza"
"Estación clave en Madrid que conecta bien, pero a menudo está abarrotada y podría mejorar en señalización y comodidades."
"Es un barrio muy tranquilo me gusta sus arquitecturas también es un lugar donde a veces hacen fiestas quienes hay en todo el metro donde venden flores también puedes tomarte una copa con tapa y pasarlo bien con amigos es genial que se Molina me gustó"
"Preciosa plaza del centro madrileño, la pena es que a veces la habita gente ""regular"". Hay un poco de inseguridad ciudadana"
"A pesar de ser un lugar emblemático de la ciudad, lamentablemente siempre hay mal olor... Hay personas que prácticamente viven allí, en la calle, y no solo dejan basura sino que orinan en la acera, cada tanto alguna revuelta que hace que la policía deba intervenir, lo que arruina realmente a tan bella plaza. De todos modos, vale la pena visitarla, sus fuente, puestos de flores y restaurantes son muy buenos. Para más tranquilidad, recomiendo ir de día."
"Es un lugar único,  pero no es de los más seguros ,pero al rededor hay supermercados, bares y restaurantes, también puedes ir caminando a lavapies y encontrar una gran cantidad de restaurantes indues con buen precio y una gastronomía increíble"
"Precioso visitar el vestíbulo original, es una maravilla histórica!!! Recomendado 100%"
"Un encanto de plaza señorial y castiza"
"Estación vieja y poco modernizada para ser accesible a discapacitados en movilidad. No dispone de buena ventilación o aire acondicionado, ni en el andén, ni en la propia línea 1, que ya es para darle al ayuntamiento con la mano abierta."
"Estación histórica con una entrada singular. Decorada con azulejos. Muy elegante."
"Conserva la decoración de su inauguración en 1921 atribuible al arquitecto Antonio Palacios. La mayoría de los viajeros que transitan por la estación diariamente, ignoran que tras sus paredes se encuentran los restos humanos pertenecientes a los monjes de un antiguo convento que aquí se hallaba."
"Parada del metro de Madrid en Línea 1 . Zona céntrica y bastante concurrida , tiene muchísima restauración y ocio cercana"
"Plaza de punto de encuentro donde además poder degustar en esta magnífica plaza algo para picar mientras esperas a toda la panda de amigos. Cuando hace buen tiempo todos los bares de alrededor ponen sus mesas en esta plaza y tomar al fresquito de la noche de verano algún refrigerio."
"La estación es de las más antiguas del metro de Madrid. Pertenece a la línea 1. Conserva parte del tramo original. La estación suele estar limpia. Lo malo es la salida la gente que hay en la plaza"
"Tirso de Molina es un lugar con muchos negocio, hay de todo al rededor y algunos otros a unos cuantos pasos, tenemos Lidl, Carrefour, bares, bazares, panaderia y pastelerias, farmacias, a unos cuantos pasos el popular rastro más grande de Madrid, lavanderias, tienda de bisiterias, peluquerias, uñas, buses, y multiples conecciones desde el metro de Tirso de Molina hacia diferentes zonas y mucho más"
"Plaza muy sucia, en las esquinas se puede ver y sentir la olor a orin, muchísima suciedad humana, y muchas latas de cerveza vacías."
"Parte del trazado original de la Linea 1 del Metro, la estación data de la primera ampliación (1921). A punto de cumplir 100 años. Han tenido el acierto de conservar la azulejería y el escudo de Madrid, que no queda en prácticamente ninguna estación."
"Sitio interesante y muy típico de Madrid. La plaza de Tirso de Molina (antes llamada Plaza del Progreso) es un espacio público en el centro de Madrid con planta triangular, que se prolonga hacia la calle de la Magdalena y la vecina plaza de Antón Martín. Se denomina así en honor al dramaturgo español del siglo XVII que tiene en ella una de las estatuas dedicadas a Tirso en la capital de España. El conjunto urbanístico forma el límite norte del barrio de Lavapiés."
"Una plaza super conocida por el ambiente cosmopolita y la originalidad de sus puestos de floristería al aire libre, así como de varios stands de librerías y artículos ultra, muy cercana al famoso Rastro de la ciudad."
"Estación muy antigua. A veces no puede con el tránsito que tiene. La plaza, por un lado tiene encanto y vidilla, por otro lado está perpetuamente llena de gente borracha que utiliza las jardineras como baño."
"La única estación de metro de Madrid que el vestíbulo sigue siendo gran parte el original, con sus azulejos en blanco para dar más luminosidad y otros azulejos en colores y relieves para dar ese toque de lujo. En el centro se sitúa el escudo antiguo de la ciudad, que se encontraba en la estación de Sol. En la plaza de Tirso de Molina se situaba un convento de la Merced, en el que había un cementerio. Cuando hicieron las obras del metro se dieron cuenta de más de 200 nichos. Los que estuvieron en buen estado los dejaron entre las paredes del metro y el propio metro. Tirso de Molina fue un fraile, dramaturgo y narrador del Barroco que vivió en ese convento."
"Bastante descuidada y sucia. Mucho olor a orín. Las terrazas muy caras para la atención y aperitivo que ponen. Bastante cutre y penosa."
"Muy bien comunicada con el centro, y no es de esas estaciones con escaleras interminables. Suele haber personal de seguridad y en las taquillas; disponible máquina para sacar tarjeta de transporte."
"En pleno centro de Madrid,La Plaza Tirso de Molina es un lugar muy interesante,dónde se mezclan todo tipo de tazas,vaya es multicultural...¡Cada día me gusta más!Ven a visitarla y disfruta de alguna bebida en las terrazas.También llamada la Plaza de las Flores,hay 5 puestos de flores de todo tipo lo qué hace Tirso de Molina un sitio muy especial en pleno centro de Madrid..."
"La famosa parada de metro de Tirso de Molina, cuenta con muchas leyendas de fantasmas y espíritus. Se habla desde hace muchos años, concretamente desde los años 20 del siglo XX, momento de la construcción de la estación Tirso de Molina, de fantasmas en los vagones de metro, otros que merodean por la estación y es famosa la historia de la chica que subió sola al último vagón de la noche y se encontró con la mirada fija e incesante de una mujer protegida por dos hombres. En la siguiente parada un hombre subió, se sentó al lado de la joven y la susurro al oído: ""baja conmigo y no la mires"". Luego este hombre le contó que era medium y que esa mujer era un fantasma. Fue en 1921, cuando una vez inaugurada la estación, el publico paso a conocer la historia de los frailes que allí habitaban antes de la destrucción del Convento de la Merced en 1834. Estos monjes, disponían de un cementerio, cuyos restos encontraron los obreros de la construccion de la linea 1 de metro de Madrid. Sin saber que hacer, cogieron los restos, y los volvieron a enterrar bajo los azulejos en las paredes y los suelos de la estacion. Desde entonces y todavia, por la macabra historia de no saber que hacer con los muertos y volver a enterrarlos tras los azulejos de la estacion, han surgido todas estas leyendas en torno a fantasmas en la estación. Simplemente, que en paz descansen los monjes del Convento de la Merced."
"Una plaza grande y que huele a flores de las tiendas que están en ella. Ahora está en obras."
"La entrada por la Plaza de Tirso de Molina (calle colegiata), es bonita. La estación acaba de remodelarse tiene carteles de accesibilidad pero es mentira. Sólo hay escaleras."
"Una estación bonita. Tenemos mucha suerte tener este sistema de metro, porque es muy buena"
"Mítica plaza de Madrid para tomarse una cerveza, pero no de los bares de la propia plaza, son muy caros, hay un supermercado ahí mismo para comprarla y disfrutarla en uno de los bancos mirando a la gente."
"Mi experiencia no puede ser peor, por culpa del vigilante de seguridad, llevaba una perrita pomenaria toy, un kilo, en un bolso, se acercó a mi a grito limpio los artículos pesados los tuve que dejar, vamos me quito la cesta con la compra y sólo le faltó empujarme a la puerta, a la que vino detrás me mi. Seguro que a gente multicultural de la zona ni se le ocurre, Es que soy Española, será eso. No pienso volver a Lidl."
"Plaza para ir a comprar a tiendas de muebles da y accesorios al mayor, pero por la noche no es muy segura la zona"
"Plaza preciosa.....muchos bares donde tomar algo.....visitar sobre todo casa de Granada y sala equis Hall de metro de los más bonitos"
"Vibrante y llena de vida, a tiro de piedra del Rastro, muchos bares y buen ambiente. Esta precioso el domingo con los puestos de flores"
"Muy linda y pintoresca la plaza,y muy cerca de El Rastro,con muchos locales para comprar de todo y barato. Ademas de comerse unos ricos platitos de crustaceos por donde camines …"
"Los andenes son un poco angostos, pero está bien conectado con el centro."
"Estación que aún conserva el estilo y diseño original del Metro de Madrid cuando se inauguró en 1919"
"Plaza de Tirso de Molina, lugar de mercado de flores,  el Teatro Apolo. Está al lado de la estación de metro de Tirso de Molina (línea 1), la Taberna de Tirso de Molina adornada  de cerámica con pinturas de Toulouse Lautrec"
"Estación muy céntrica de la linea 1"
"Para los amantes de Juaquin Sabina es un lujo conocer este lugar. Un paseo unico por una zona impecable de Madrid."
"La plaza está muy sucia. Los kioskos de flores (siendo muy buena idea) están lleno de pintadas. Descuidada..."
"Plaza absolutamente degradada y peligrosa, llena de yonkis y delincuentes, además de basura. Triste."
"Multicultural, hay de todo lo que te puedas imaginar. Lo que más me gusta es que siempre hay gente."
"Me encanta esta plaza y sus lugares de venta de flores y plantas"
"Oriana RueEBNOS en tres días y que se le ha gustado mucho y me lo puedes hacer un cambio radical que se puede ser que la colocó la primera guerra mundial que la información del negocio y me lo puedes hacer es una especie que me ha llegado nada más para poder"
"Mítica estación de Madrid. Imprescindible para ir al Rastro los domingos por la mañana. Muy bien comunicada."
"Hay mucha gente , terraza , flores,y mucha actividad"
"Es un restaurante, muy bonito tiene vidrieras antiguas,se come muy bien."
"Tirso de Molina línea 1"
"Está echa una pena, básicamente como toda la línea 1. A pesar de la reforma de hace un año sigue estando destartalada y anticuada."
"buen  sitio  para comprar   ademas   hay una fundacion que reparte comida gratis  para los necesitados    ahonque aveces   no es muy segua"
"tiene un numero de escalones impar....no se que significa esto pero quizás hay que estudiarlo y analizarlo fríamente, ¿Qué otras estación tiene el mismo numero?, ¿es una conspiración?, hummm..."
"Plaza peatonal con gran animación multicultural."
"Plaza muy típica de Madrid."
"Paso a menudo por esta plaza."
"Estación algo vieja y descuidada sin acceso para inválidos. Siempre huele muy mal."
"…"
"Bonita la plaza de las flores"
"Estoriko total.…"
"Agradable muy comercial sus vecinos son muy calidos"
"Estación de la línea 1 de metro."
"Zona buena para tapear por el centro."
"Encantadora ahora se debia llamar la plaza de las flores"
"Muy rico se come y muy bien atendidos"
"Unas de las plazas más populares de Madrid"
"Los domingos de Rastro y los puestos de flores"
"Muy bello todo, excelente concepto académico"
"Una referencia en la decoración clásica de azulejos. Todavía quedan restos del diseño original."
"Buena estación de metro. Limpia y clara"
"Un poco sucia y descuidada la plaza, menos mal que tiene los puestos de flores"
"Mugre y más mugre..."
"la linea 1 es la mejor linea de tirso de molina la del oceano me gusta"
"Buen sitio para perderse, ideal cuando vayas al rastro."
"Taberna de Tirso de Molina en una plaza castiza que ha recuperado su esplendor"
"Muy bien"
"También llamada la plaza del puf, por el intenso olor a meado que hay"
"Bonito escudo de Madrid en su acceso de Cde. Romanones"
"Esta estación de metro no tiene escaleras eléctricas"
"No es una plaza muy agradable"
"inseguro y mal cuidado"
"Viene un tren cada pocos minutos y te lleva a otro sitio"
"Agradable …"
"Lo mejor de esta plaza son sus puestos de flores."
"Por la falta de limpieza y higiene ya hecha habitual en metro"
"Sitio estraordinario losdomingos puestos rrepublicanos"
"La plaza de Tirso de Molina, un lugar con encanto"
"Tiene una entrada hermosa. Algo sucia"
"Sucio"
"Hermoso"
"Plaza histórica del centro de Madrid"
"Buena estación, muy bonita."
"Me gusta esta estación"
"Correcto"
"Estación de metro muy próxima a Sol"
"Hermoso lugar!"
"En sus inicios se llamó ""progreso"""
"Gran ambiente."
"Buena estacion pero vieja"
"Línea 1 de Metro"
"Excelente"
"Un lugar diferente y comospolita"
"Fantástico."
"Antigua y sucia"
"Estuve una semana frente a Tirso de Molina y ¡fue la mejor decisión que pude haber tomado! El lugar es sumamente tranquilo, con un mercado cercano, restaurantes cercanos (de diferentes culturas, ¡no solo españoles!) y un metro muy tranquilo. Caminamos hasta allí en diferentes horarios, temprano en la mañana, en la mañana, en la tarde, y en ningún momento me sentí insegura, incluso caminé mucho por toda la región y la ubicación era excelente para llegar a las atracciones turísticas a pie."
"Me alojé en un apartamento cerca de esta estación de metro. Este lugar es tranquilo y, al mismo tiempo, hay maravillosas pastelerías y tiendas de delicatessen alrededor, y hay un supermercado cerca, por lo que es un lugar muy agradable. También puedes caminar hasta la Plaza Mayor. Esta es una zona muy recomendable para tu estancia en Madrid. Sin embargo, cuando fui unos 2 kilómetros hacia el sur, había mucha gente negra y sentí que el ambiente era un poco desagradable."
"Esta estación de metro bastante antigua tiene un extraño encanto. Está nada menos que en el trazado de la línea 1 del metro de Madrid, aunque ha sido remodelado desde los años 30. Te lleva a una de las zonas más pintorescas de esta ciudad, por lo que durante tu estancia en Madrid te verás allí en algún momento."
"La parada Tirso de Molina es una estación de metro de Madrid, situada en el distrito de Lavapiés. Inaugurado en 1921, lleva el nombre del dramaturgo español Tirso de Molina. La estación es un nodo central para locales y visitantes, brindando fácil acceso a sitios históricos como la Plaza Mayor y el Mercado de San Miguel. El barrio circundante es conocido por su diversidad cultural, callejuelas animadas, bares de tapas y ambiente bohemio. La parada de Tirso de Molina juega así un papel vital en la conectividad de Madrid y sirve como punto de entrada dinámico a la historia y la vida contemporánea de la ciudad."
"¡Excelente! …"
"¡Esta es mi parada de metro favorita en todo el mundo! ¡Ojalá pudiera mudarme a Madrid sólo para poder dormir aquí todas las noches! Por favor, no me juzguen, simplemente me gusta experimentar las áreas metropolitanas de todo el mundo. Le doy un 4,8, redondeado a 5 estrellas; serían 5 estrellas si no tuviera tantas escaleras. Mis piernas espinosas no pueden subir muchas escaleras. Creo que necesito ir más al gimnasio."
"Estación muy singular! Está situado en una placita espléndida llena de bares y con el Lidl al lado (útil para comprar sobre la marcha) con precios muy económicos."
"Estación de metro en medio de una pequeña plaza popular. Sirve al Museo de las Ilusiones."
"Punto céntrico de Madrid. Una ciudad que encantará a quien la visite"
"Estacion muy hermosa"
"Buena parada de metro, pero un poco antigua. Esta estación sólo cuenta con la línea 1. Desde aquí se puede llegar andando a la Plaza Mayor."
"bastante fresco y relajado como un lugar para tomar el metro"
"Huele muy mal y suele haber muchas botellas rotas. Parece un punto de encuentro de personas sin hogar."
"Muy bonito lugar pintoresco, todo fue excelente!"
"Delicioso desayuno en esta panadería."
"Buen lugar pero con mucho nordel."
"bien"
"Súper."
"BIEN"
"Plaza multicultural y florecida"
"carlo"
