"Estaci칩n de Metro un tanto antigua, pen칰ltima antes de llegar al nudo de Cuatro Caminos por la L칤nea 1. Solo te conduce a las Estaciones al norte de la L칤nea 1 y al sur a Cuatro Caminos y siguientes de la L칤nea 1. Necesita una renovaci칩n."
"Muy bien"
"pues resulta que voy y estaba llena de ropa de mascota , cuna de tela y todo lleno de pelos..se me quitaron las ganas de llevar la ropa..el precio son 8 la de 18kg creo recordar"
"He nacido en este barrio. Ahora mismo existe un cruce intercultural inmenso, tan inmenso como la suciedad que reina en sus calles"
"Lo han dejado muy bonito  es un sitio agradable para desayunar"
"Estaci칩n un poco anticuada, pero al menos es bien sencilla"
"Es una estacion comoda. Aunque no he visto que tenga acceso para personas que necesiten ayuda con la movilidad No hay demasiadas escaleras y la salida est치 en pleno Bravo Murillo(muy comercial)"
"Es una estaci칩n viejilla, pero est치 bien mantenida. No hay acceso sencillo para gente con problemas de movilidad, y hay muy pocas (o ninguna) escaleras mec치nicas."
"ESTACI칍N DE METRO, MUY NORMALITA...!!! SIN ACCESO, YA QUE NO TIENE ESCALERAS MEC츼NICAS NI ASCENSORES. PARA AYUDAR A LOS PROBLEMAS DE MOVILIDAD REDUCIDA. MUY BIEN LIMPIA, ESO SI. Y CON LA RED DE ASISTENCIA, EN CASO DE PROBLEMAS DE INSUFICIENCIA Y PROBLEMAS DE RESPIRACI칍N. #HELLOMADRIDNEWS #LETSGUIDE #GOOGLEMAPS #MADRIDCITY #GOOGLEART #LOCALGUIDE #LOCALGUIDECONNECT #METRO #GOOGLEFAMILY #SPAINCITY #VISITORINFLUENCER #MADRID 游쀯릖 #GOOGLENEWEXPERT #GOOGLE"
"No tiene cuarto  de ba침o ni salida minusval칤a."
"Estaci칩n de metro peque침a de linea 1, la l칤nea m치s antigua del metro de Madrid"
"Estaci칩n de metro bastante antigua. Tiene varias salidas a la calle. No dispone de ascensores."
"De esas pocas estaciones de metro de Madrid con los techos bajos y en los que te la pegas como vayas con algo de prisa y te abres la cabeza. Caaaution..."
"Estaci칩n de f치cil acceso y bien se침alizada"
"Si pierdes el tren en Cuatro Caminos vente corriendo a esta estaci칩n, quiz치s llegas antes y lo pillas."
"Hacia mucho q no cogida el metro... R치pido y como siempre con mucha gente"
"El metro de Madrid es estupendo, comparado con otros de Europa."
"Muy agradable seguridad comodidad"
"Alvarado es una estaci칩n del servicio de metro de Madrid l칤nea 1 en el barrio Tetu치n en Madrid Espa침a"
"Funcionamiento normal, servicio r치pido como la mayor칤a del metro"
"Una zona muy agradable y mucho comercio."
"Buenos, mas o menos"
"No tiene escaleras mec치nicas ni ascensor."
"No hay escaleras mec치nicas ni ascensores"
"Muy bien ubicados los locales."
"Una tradicional estaci칩n de metro"
"Buena atenci칩n"
"Normal como llegar al Hospital de la Cruz Roja."
"Peque침a y c칩moda"
"Es una estaci칩n al algo vieja."
"Se ve viejo"
"Buena estaci칩n de metro."
"Metro de Alvarado"
"Una estaci칩n conveniente con solo dos salidas, que se encuentran en lados opuestos de la carretera. Por eso no da miedo cometer un error. Hay todo lo que necesitas en la calle."
"Estaci칩n Media de Metro de Madrid"
"Es una tienda iluminada."
"BIEN"
"Lindo"
"horrible"
"Bueno y acogedor."
