"La estación de metro Argüelles es una importante estación en la red de Metro de Madrid, ubicada en el distrito de Moncloa-Aravaca. Es conocida por su proximidad a la calle Princesa y por ser un punto de conexión clave en la ciudad. ### Líneas de Metro En Argüelles confluyen las siguientes líneas de metro: - **Línea 3 (Villaverde Alto - Moncloa)** - **Línea 4 (Argüelles - Pinar de Chamartín)** - **Línea 6 (Circular)** ### Ubicación La estación de Argüelles se encuentra en una zona céntrica, muy cercana a la calle Princesa, una importante arteria comercial y de ocio de Madrid. También está cerca de lugares de interés como el Parque del Oeste y el Templo de Debod. ### Servicios y Facilidades La estación ofrece una variedad de servicios para los pasajeros: - **Ascensores y escaleras mecánicas** para mejorar el acceso. - **Instalaciones accesibles** para personas con movilidad reducida. - **Máquinas expendedoras** de billetes y recarga de abonos. - **Conexiones con autobuses urbanos**, facilitando el acceso a otras partes de la ciudad. ### Historia Argüelles es una de las estaciones más antiguas del Metro de Madrid, inaugurada en 1919 como parte de la primera línea de metro de la ciudad. Ha sido modernizada y ampliada a lo largo de los años para incluir nuevas líneas y mejorar sus instalaciones. ### Importancia Esta estación es un importante nodo de transporte debido a su ubicación estratégica y la intersección de tres líneas de metro. Es especialmente transitada por su cercanía a zonas comerciales, residenciales y turísticas, así como por ser un punto de acceso importante para quienes viajan hacia el campus universitario de Moncloa. Si necesitas información adicional, como horarios específicos o detalles sobre los servicios disponibles en la estación, estaré encantado de proporcionártela.""Argüelles Es una parada de metro donde se cruzan tres líneas , línea 3 ,línea 4 , línea 6 Es muy grande y espaciosa.  Muchas escaleras pero cuenta con ascensores tiene varias bocas que salen a calles diferentes ,, también tiene. Staff on site."
"No está mal pero es un poco laberíntica la comunicación entre líneas. Y me da la impresión que en caso de transbordo con sillas de ruedas sería más complicado. Al menos la Señalética es muy buena y evita perderse."
"Una estación de metro más que, además es cabecera/final de una de las líneas. Tiene acceso por ascensor también."
"Situada en una zona muy comercial. Ascensores. Por esta estación es cabecera de la línea 4 y por ella también transcurren las líneas 3 y 6. El nombre de la estación hace referencia al barrio en el que esta situada: Arguelles que a su vez lleva el nombre del político y abogado Agustín de Argüelles Álvarez (Ribadesella, 18 de agosto de 1776 – Madrid, 26 de marzo de 1844)."
"Tiene 3 líneas de metro (3, 4 y 6), las salidas están ubicadas en zonas de tiendas, una de ellas da a El Corte Inglés de la calle princesa"
"Es una estación bastante antigua, pero han puesto ascensor"
"Buena estación de metro, cuidada y con múltiples accesos. Con entrada/salida desde C/Alberto Aguilera C/Princesa  entre otras, y con acceso a las líneas Tres(Villaverde alto/Moncloa) Cuatro(Argüelles/Pinar de Chamartín) y Seis (Circular)"
"Súper bien y super tranquilo no hay pérdida"
"Parada de metro que es muy complicada, deberían de darle una vuelta a las indicaciones para encontrar tu línea de metro"
"Muy buenas conexiones de metro!"
"Muy mala señalización en el metro para indicar las combinaciones con otras líneas. El metro de Madrid complica mucho las señalizaciones y terminas dando vueltas y perdiendo tiempo."
"Es una buena zona comercial en la calle Princesa de Madrid  . Tiene Corte Inglés  , Metro , y multitud de comercios y cafeterías , restaurantes,  etc...."
"Está el corte inglés hay sitios curioso que visitar hay muchos restaurantes con muy buenos precios... Hay que visitarlo lo recomiendo"
"Buena estación, accesibilidad, limpia, ordenada."
"Posiblemente mi para de metro favorita"
"La estación esta genial, el corte inglés está a la salida"
"Un barrio de clase media alta muy bien situado. Ideal para quedar por esa misma razón. Plaza España, Princesa, Gran vía o Moncloa, todos esos lugares están a tiro de piedra desde Arguelles, incluso si eres algo bohemio, andando por Alberto Aguilera llegarás a Malasaña, barrio donde nació la famosa movida madrileña. Saludos."
"Muy buena estación."
"Me tome un par de cervezas y mi amiga sofia un cafe. El sitio estaba bien."
"Bonito 👍…"
"Buena comunicación de líneas Salida al Corte Inglés"
"Ninguna estación de metro como tal tiene baño, por tanto la puntuación es baja"
"Una gran estación de Metro con diferentes líneas para moverte. Está situado en una zona estupenda y además, dispones de diferentes autobuses a la salida. Lo mejor de esta estación es que tiene ascensor, lo malo es que cierran los accesos pronto, con lo cual si un día vas con el carrito, te toca subir escaleras. Una noche un señor en silla de ruedas no podía subir, menos mal que había otras personas que pudieron ayudarlo. Dispone de diferentes máquinas expendedoras y por norma general siempre hay gente para poder ayudarte."
"Estación muy bien conectada"
"Me ha gustado, es tranquilo, tiene todo cerca y tiene la línea 6 del metro que conecta con todo"
"La estación dispone de un cajero Telebanco, así como de muchas máquinas expendedoras, siempre hay personal de Metro dispuesto a atenderte y es una estación con mucho tránsito ya que confluyen tres líneas de Metro. La cobertura de teléfono es muy irregular."
"Está bastante bien, pero llegar a la gris con un carrito de bebé desde el ascensor de Alberto Aguilera es muy complicado...debe de haber una manera más sencilla, pero si se va en silla de ruedas yo me informaría antes"
"Lo de ""SUCIA"" será según a que horas. Yo he pasado sobre las 10am y estaba de lo más limpia. Cómo todas las estaciones del centro, puedes llegar dónde quieras."
"Estación con 3 líneas de conexión, 3,4 y 6.. Con salida al C.C del Corte inglés."
"Mucha gente, mucho ruido, pero claro son zonas céntricas de mi MADRID."
"No hay escaleras mecánicas todo a pie, si tienes alguna enfermedad en las piernas, lo pasas muy mal"
"La estación de Argüelles se inauguró el 15 de julio de 1941. Debe su nombre al abogado y político Agustín Argüelles. La juventud que marca la vida diaria de Moncloa se extiende también hacia esta zona, que ya en los 80 conoció una época dorada de diversión en los bares y pubs de los conocidos ‘bajos de Argüelles’. Es este ambiente estudiantil el que rejuvenece este barrio burgués de señoriales residencias. El eje principal es la calle Princesa, centro social y comercial donde se aglutinan numerosas tiendas de ropa. Por ella pasan las líneas 3, 4 y 6 del Metro de Madrid ubicada bajo el cruce de la calle Princesa con Alberto Aguilera y Marqués de Urquijo, entre los distritos de Moncloa-Aravaca y Chamberí. Fue inaugurada como cabecera de la línea 3, ubicándose bajo la calle de la Princesa en el tramo comprendido entre el cruce con Alberto Aguilera y el cruce con Altamirano. Ha sufrido una profunda remodelación, pasando los andenes de 60 a 90 m y haciéndola accesible para personas con movilidad reducida. Los andenes de la línea 4 se encuentran bajo la calle Alberto Aguilera entre los cruces con Gaztambide y Andrés Mellado. Está situada a la misma profundidad que la estación de la línea 3 y comunica con esta a través de un vestíbulo común ubicado en la intersección de Princesa y Alberto Aguilera. Los andenes de la línea 6 se encuentran a mayor profundidad que los de las otras dos líneas, y son paralelos a los de la línea 3. Conectan con los andenes de las otras dos líneas mediante escaleras mecánicas, unas van a parar al vestíbulo común de las tres líneas y otras al andén central de la línea 4."
"Hoy unas viejas maleducadas volviendo a pedir las tarjetas nada más pasar los tornos. Absurdo, y encima amenazando. Si la gente no sabe trabajar de cara al público, que se quede en su casa"
"Estoy encantado de poder estar en la fundación inclusive y también estoy encantado de poder estar en la universidad Pontificia de Comillas de Cantoblanco"
"Hemos visitado la estación de metro, y el único defecto es que no tiene ascensor para ingresar"
"Fin de estación de línea 4. Tiene acceso a escaleras eléctricas y asensor.  Estación con señal 4G de telefonía móvil."
"Porque es un buen sitio para pasear sin prisas, dejar la moto, volver a caminar, caminar despacio"
"Me gusta mucho el mural en esta estación de arguelles"
"Un lugar muy bonito, con hermosos lugares que visitar y recorrer..."
"Es un sitio agradable por el trato de los profesionales en barra. Son buenos precios y tienen una oferta interesante en raciones. Dan buenos aperitivos."
"Muy buena estación"
"Buen barrio y muy bonito de Madrid.  Muy agradable para pasear sin prisas."
"Es un barrio bueno de Madrid, sin más."
"Bonito"
"Estación de metro centrica y con varias entradas."
"Normal ,limpio y la gente es amable"
"Lugar público, transporte de tren, circular, atención amable, precios regulares..."
"Uno de los puntos mejor conectados de Madrid. Lineas al centro, al circular, al barrio salamanca, a ciudad universitaria, etc."
"Muy buena estación porque a la que salí había unos jóvenes regalando barritas de cereales."
"Muy bien comunicado. Con todo tipo de servicios. Parques, colegios, grandes hospitales a un paso. Se aparca fatal, eso sí"
"Es una zona muy concurrida hay muchas tiendas y centros comerciales desde el Corte inglés, Decatlon, Aldi etc..."
"Bueno, es una estación de metro como cualquier otra... Mucha gente."
"Una estación de metro, limpia, con algún asiento y bien señalizada"
"Automóviles Argüelles gente muy maja muy profesional muy sincera muy simpática y agradable hace bueno precio, buenos coches"
"Estación de metro. La utilizamos para ir a la Universidad de Nebrija"
"Bonito seguro limpio comodo"
"Es una estación de metro comoda con el ascensor"
"Las luces navideñas decoran toda la zona de Argüelles."
"Viejo"
"Cómo todas las estaciones de metro. Tiene rampas y ascensor"
"Estaba muy sucio y con poca sesación de seguridad, parece que los vigilantes de metro están de vacaciones en Agosto."
"Histórica estación del metro de Madrid. Es la primera de la línea 4."
"Parada bien comunicada . Salida directa a zona comercial"
"Sona tranqui para pasear con la familia puedes encontrar por los alrrededores tiendas para todo ."
"Limpieza y seguridad"
"Barrio moderno hay de todo cerca"
"Local muy incómodo para comer por el frío que hace en el local en pleno invierno de Madrid. No recomendado ni repetiría."
"Estación bien comunicada y de fácil acceso"
"Una estación de metro, sin más. Cumple su función."
"Barrio de Madrid por donde se puede pasear tranquilo."
"Una estación grande. Un poco lioso. Pero solo haya ir seguir carteles."
"Los precios son económicos, pero la recepcionista es de las que dan lecciones como si fueras ingenuo y fueras a someterte a una operación a corazón abierto, te desilusiona!"
"Vacío y muy bueno para aparcar en estas fechas"
"Argüelles es una estación de metro de Madrid línea 3 , 4 y 6 de metro de Madrid al lado del paseo de la princesa"
"Se pasa mucho calor en la línea 3"
"Céntrica pero fatal para aparcar. Todo zona azul."
"Bonita estacion de metro. Bien señalizada y limpia"
"Unas de las mejores zonas de Madrid para el Heavy Metal, ""Los bajos de Argüelles"""
"Una gran estación  para moverse. Pero está de masiado. SUCIA"
"Una estación de metro mientras no tenga nada malo esta bien..."
"Excelente 🤭💖lugar, todo cerca…"
"Céntrica con varias líneas, bien comunicada pero con difícil aparcamiento y en ocasiones tardan en avisar cuanto tardará la línea 3"
"Una estación de metro bien adaptada."
"💪👍…"
"Esta bien"
"No está mal, tampoco es que vaya a cambiar mi vida."
"El.metro además de que es muy caro como.parado con México por ejemplo, no tiene buena señalizado debería de invertir en hacer más grandes las cslcomanias adentro del vagón"
"Excelente gracias"
"Salida del metro de Arguelles, junto al El Corte Ingles de Princesa, Madrid"
"Vestíbulo a hora punta saturado con flujo constante entre usuarios de línea 3 y 4 a hora punta"
"Buena estación, espacio de Madrid"
"Excelente. Muy cuidada"
"acceso accesible con ascensor Alberto Aguilera esquina cobrar gaztambide"
"Mejor zona de Chamberi"
"Del diez"
"Exelente llego donde me lo propongo ."
"Excelente"
"Esra muy bien"
"Ordenado"
"Nada que comentar"
"Excelente lugar"
"Va demasiado lento"
"Bueno"
"Estación de metro con ascensor"
"Estación de autobuses.sin comentarios"
"Mucha vuelta"
"Un barrio bonito"
"Porque puedo montar en el metro"
"👌…"
"Zona de comprar"
"Es mi barrio"
"Muchos salidas"
"Excelente"
"Lindo"
"Porque limpio"
"Muy animado"
"La estación de metro más liosa de la ciudad"
"👍👏🇪🇦💯💯💯💯💯🇪🇦👏👍.…"
"Estación de metro"
"Buena"
"Estoy muy agradecida de que una miembro del personal me ayudara a encontrar la chaqueta que quería encontrar. No estaba en esta tienda (quizás agotado), pero buscó en la web y descubrió que el producto está en otra tienda. ¡Gracias! ¡Gracias! ¡Con todo mi corazón!"
"Bonito barrio de Madrid, bueno para ir de compras y simplemente pasear, con muchos parques y arquitectura del siglo XIX. Excelentes conexiones de autobús y metro en la cercana Moncloa."
"Bonita estación de metro con trenes frecuentes, fácilmente navegable gracias a una buena señalización."
"Buena infraestructura."
"Es una estación de metro tranquila con muchas salidas y centros comerciales muy cerca..."
"Un tremendo punto de transición"
"El servicio es bueno, pero no hay nada que quiera comprar."
"¡Acabo de llegar!"
"Buena estación. Señales claras."
"Normal"
"¡Hermoso!"
"BIEN"
"Normal"
"buen metro!"
"Gracias"
"excelente"
