"En la entrada se colocan niños a jugar y te tocan el botón del elevador y faltan el respeto no hay seguridad, y cuando buscas al personal del metro no están por ningún lado."
"Metro concurrido generalmente por sufridos currantes de Atento Contact center"
"Llevan de obras desde el año 2022, esperando que el ayuntamiento de Madrid acabe de una vez que ya va siendo hora"
"Siempre impecable, tengo un metro aparcado cada vez que llego, creo que me espera..."
"Estación de metro de la línea 7. Apto para todo el mundo, ascensor, escaleras metálicas. Cuando funcional, ya que es normal que tengamos avería. Limpia y siempre hay personal para problemas q puedan aparecer. Imposible aparcar coche en los alrededores,  todo lleno siempre."
"El ascensor tiene más demanda de usuarios que el Primark de Gran Vía"
"No es bonita ni fea, normal, pero hay que bajar 4 escaleras eléctricas hasta llegar al mostrador, por eso mucha gente coge el ascensor aunque no lo necesiten. Para padres con carro a veces es molesto. Tampoco hay una entrada normal para carros o minusválidos, hay que llamar cada vez para que abren una puerta especial."
"Estación de metro de línea 7, tiene los servicios de escaleras eléctricas y asesor, es medio el nivel de  recorrido que tienes que hacer para llegar al metro.  De todo las instalaciones están aún en buen estado."
"Lugar muy tranquilo , esta estación tiene ascensor"
"Bastante bueno el metro de Madrid"
"Estación limpia y buen control de acceso, dependiendo la hora pues como en todas puedes encontrar un poco más de transito de lo habitual. Buen acceso y no suele haber problemas con las maquinas de control y no te hacen perder el tiempo, sobre todo por la mañana que para mi en muy importante."
"Una estación enorme, limpia y con buen acceso."
"Es una excelente avenida, con todo tipo de comercios, puedes encontrar, peluquerías, venta de tabaco, fruterías, panaderías, farmacias, tiendas de ropa, lotería, librería, etc"
"Estación de metro moderna, el único defecto es que los viajeros no respetan la prioridad en el uso del ascensor"
"Mas profunda que pozo Soton, para cuando has conseguido llegar abajo pasas de carnet joven de transporte a jubilado"
"Estación de metro muy espaciosa y cuidada. Sólo circulan trenes pertenecientes a la línea 7."
"Acceso a linea 7 de metro.No es el mejor sitio para dejar el coche y coger el metro porque no suele haber mucho sitio libre."
"Mucho trafico, van a mucha velocidad. Deberían de moderar la velocidad."
"Estación de metro espaciosa. Personal de metro eficaz y educad@s"
"És una estaciones de las que llamo subterráneas, por la cantidad de pisos que hay que bajar"
"Voy a mi sesión de ozono"
"Es una estación muy amplia."
"Sitio preparado para todos los,viajeros,."
"Buen acceso y amplitud"
"Muy amplia y luminosa."
"Estación muy amplia"
"Amplio y buen servicio!!!"
"Estación de metro"
"Está bien"
