"Hace un año","Anoche llegaba con una compañera y el señor de seguridad me paró después de haber escuchado como pasé mi tarjeta de metro me hizo pasar vergüenza diciendo que no pagué el viaje puso la tarjeta en la máquina para saber si tenía saldo luego cuando vio que había no conformado fue a la máquina a saber si me había colado fue lamentable me parece una falta de respeto y una manera de actuar fuera de lo normal cuando verificó que el se había equivocado no me pidió ni disculpas no debería trabajar gente así sinceramente lamentablemente pasé vergüenza cuando me paró de esa manera lamentablemente deja mucho que desear perdón"
"Hay un ascensor que no funciona casi nunca, la escalera mecánica hace años que no funciona por lo que el tema de minusvalía lo tiene mal para acceder por aquí"
"Una estación de metro normal, pero lo que no es normal que METRO DE SEVILLA  no tengan aseos en las estaciones. No comprendo cómo el Ayuntamiento que exige va los bares aseos públicos, permita y que no los tengan las estaciones del METRO."
"Primer día de "" obras "" en la parte final de la línea hacia Olivar de Quintos. El servicio de bus gratuito desde Pablo Olavidr nos ha hecho hacer un espera de más de 10 minutos al sol. No hay mucha coordinación entre la llegada de Metro y salida del bus. Espero que la cosa se regularice...... queda mucha obra"
"Aunque el ascensor exterior falla mucho en general es muy comoda"
"Por que es como si llevas una brújula y tu propio jepeese seguro que%100×100 no te pierdes,"
"El mejor transporte urbano que se aya construido en la capital de Sevilla y que se debería de seguir avanzando.!!"
"Buena estación de metro fácil aparcamiento"
"No se admiten animales en la Línea 1 de metro."
"Amplio y puedes dejar el coche muy cerca"
"Buena entrada y todo en buen estado"
"Maratón hoy"
"Los alrededores están sucios y descuidados."
"Línea 1"
"Amplia estación de metro"
"no está mal"
"Línea 1"
"Mucho aparcamiento"
"Estación de metro muy limpia y moderna. Estación totalmente de aire acondicionado."