"Le bajo dos estrellas porque luego de las refacciónes quedó muy fea. La línea 6 tenía paredes y columnas de mármol y muchos asientos muy bonita, ahora es una estación del montón sin nada de eso."
"Es el transbordo más largo que conozco. Ya podían instalar pasillos o cintas transportadoras como las de Nuevos Ministerios. Además no tiene ascensor."
"La chica del metro de Diego de leon me acaba de faltar el respeto por mis tatuajes una mal educada la seguridad lo a visto todo y cre que su comentario a sido fuera de lugar solo m a pedido disculpas cuando le e dicho que le tenía que poner una hoja de reclamaciones no puedo ya que viajo alas cinco de la tarde hacia valencia"
"Lleno de cucarachas en el anden de la linea 5. Un asco, facil de solucionar pero lleva semanas (por lo menos) así"
"Estación de metro de líneas 4, 5 y 6."
"La estación esta genial, hay muchísimos restaurantes y cafeterías por la zona"
"📌 Tiene varias salidas, lo que le falta son los ascensores para personas con movilidad reducida.…"
"Fui en febrero de 2020, venía de la línea 6 y me disponía a hacer el trasbordo a la línea 4, cuando finalmente llegué, cogí el metro, y me bajé en la primera parada, me encontré con la sorpresa de que la calle estaba desierta. Resulta que habían declarado un estado de alarma, confinado a la población, prorrogado el estado de alarma, y todo eso en lo que yo hacía el trasbordo. Fuera de bromas: esta parada está bien comunicada, pero los trasbordos son eternos, si vas a la línea seis o cuatro, mejor bajarse en Avenida de América."
"Para ser una estación con tres líneas de metro 5, 6 y 4, transbordos larguísimos y no tener una sola escalera mecánica, y ni hablar de elevadores/ascensores. Que en pleno 2021 no exista accesibilidad para todas las personas es una vergüenza."
"No es accesible, muchas barreras para personas con movilidad reducida. Lo bueno es que está muy ilusionada y limpia."
"Es una estación con 3 lineas, pero es uno de los transbordos más largos de Madrid. Están las tres vías de metro conectadas, sí, de la manera más eficiente no, porque para ir de la línea 4 a la 6, primero pasas por la 5. Así que te compensa más salir y caminar por arriba. Eso sí, por abajo puedes llegar, pero te va a parecer un pasillo en el que no avanzas."
"Cuenta con tres líneas de metro (la 4, 6 y 5), aún así, y estoy de acuerdo con lo que se comenta en las demás reseñas, el recorrido de los pasillos del transbordo es demasiado largo y a veces, confuso."
"Estaciión de metro de las líneas 4,  5 y 6. Es una estación de metro de las antiguas por lo que no es muy amplia y sus pasillos no son muy anchos además de las zonas de espera de andén de las diferentes estaciones de metro. Normalmente dispone de personal en las diferentes entradas o salidas a quien recurrir en caso de necesidad. No está adaptada para sillas de ruedas."
"Pertenece a las líneas 4, 5 y 6 de metro. La estación es bastante antigua y deberían reformarla, aparte de poner ascensor para gente minusválida y el pasillo de transbordo de la línea 6 y 4 es horrible, demasiado largo, parece que nunca se termina"
"Una estación vieja que le hace falta una pequeña reforma, sobretodo la conexión entre línea 5 y 6, con escaleras que ni siquiera están adaptadas y luego ponen el símbolo de minusválidos. Deja que desear."
"La parada de metro es muy similar al resto, pero el transbordo de la linea 6 a la 4 está muy mal hecho y es demasiado largo... para hacerlo así mejor que no se haga que en avenida america hay el mismo cambio."
"Estacion de metro que pertenece a las lineas 4, 5 y 6. No dispone de ascensores pero si de cobertura movil. El trasbordo para ir a la line 4 desde las otras lineas es bastante largo..."
"La peor estación de Madrid, enorme, con un montón de escaleras y nada mecánico. Estamos en 2019 y para una persona discapacitada o en muletas puede parecer una prueba de atletismo"
"Esta estacion deberia tener ascensor y comodidad para sillas de ruedas y coches de bebes en la misma no hay esta opcion hay que caminar mucho y subir grandes escaleras"
"Entiendo lo de los transbordos porque comparte 3 lineas, pero desde hace meses huele a alcantarillado, y no he visto solucion"
"No está adaptada, y los trasbordos en está estación son eternos"
"GRACIAS A ESTA CLÍNICA TENGO""SÍNDROME DEL DOLOR REGIONAL COMPLEJO"" que es una afección de un dolor crónico. Mi vida diaria y laboral se ve limitada en todos los sentidos, por culpa de esta clínica voy a tener dolores clínicos toda mi vida porque el cirujano no supo hacer bien su trabajo. Y LO QUE ES AÚN PEOR ES QUE LA CLÍNICA NO SE HA ECHO RESPONSABLE DE NADA, LLEVO PELEANDO CON ELLOS CASI DOS AÑOS . NO RECOMIENDO PARA NADA ESTA CLÍNICA,  DE VERDAD HAY MUCHAS OTRAS OPCIONES MEJORES EN DONDE OPERARSE QUE EN ESTA CLÍNICA."
"Las salidas no están bien señaladas, no hay guardias ni taquilleros"
"Es tan antigua y huele tan mal a alcantarillado. No es accesible, tiene un laberinto de pasillos con escaleras."
"Es una estación enorme, hacer transbordo de una línea a otra es horrible porque se tarda muchísimo tiempo. Tiene varias salidas diferentes a bastante distancia unas de otras."
"Hay un pasillo desde la línea 4 a las líneas 5 y 6 que si conocéis el pasillo interminable del metro de Paseo de Gracia os parecerá un recibidor comparado con este infierno de baldosas y neones."
"Estación metro un poco larga para hacer conexión. Con accesibilidad adecuada"
"Parada de buses con poca frecuencia a las 20:45h de un sábado.Está enfrente Hospital Princesa"
"Transbordos muy  largos, además la estación no está mínimamente adaptada a gente con problemas de mobilidade."
"Es una estación super engorrosa para conseguir la línea 6 es un dilema y los recorridos son demasiados largo para ir de un extremo a otro"
"Si vives en la zona este de Madrid y para llegar aquí necesitas la línea 9 es mejor hacer transbordo por Sainz de Baranda. Acortas mucho camino."
"Lo peor que tiene esta estación son los transbordos, hay que caminar bastante para cambiar de linea o subir a la calle. Da mucha pereza, por lo que lleva a decantarse por otra opción de transporte."
"Transbordos eternos sobre todo entre la línea 4 y 6. No hay acceso para minusválidos y escaleras mecánicas solo en las líneas 5 y 6"
"Muy buena. La estación está bien, no tengo nada de que quejarme; pero es bueno que sigan en la misma linea, y que mejoren cuando sea necesario."
"Los pasillos son muy largos y resultan inseguros a ciertas horas del día."
"Hay tres lineas de metro y puede ser una pesadilla intercambiar."
"Diego de León es una estación del servicio de metro de Madrid línea 4 5 y 6 en el distrito Salamanca en la calle Diego de León además la línea 4 y 6 van a avenida América en Madrid España"
"Ve el seguridad a una señora con un carrito que va a subir las escaleras y se da media vuelta. Valiente trato al cliente"
"hay mucha inseguridad no hay vigilancia pasillos interminables sucio parece tercermundista"
"Excelente estación de metro, es una estación antigua y muy amplia."
"En google maps esta MAL el sentido!! Del metro numero 6, el anden 1 y 2 tienen direcciones contrarias en google maps!"
"Tanta reforma y sin acceso a minusválidos... Donde se va nuestro dinero familia?"
"Muy bien todo y limpio .Me gusta mucho la zona ."
"Es muy probable que te pierdas intentando buscar la salida correcta, porque hay caminos enormes entre salidas no demasiado bien señalizados."
"Han quitado muchos bancos y asientos"
"Es una zona de Madrid que tiene muchas tiendas y atenciones"
"Un metro muy descuidado. Hay cucarachas a día de hoy 25-06-18."
"Me parece una estación de metro adecuada a la gran ciudad que es Madrid"
"Me gusta aunque el metro de Londres pasa cada minuto"
"Trasbordos larguisimos y sin acceso a minusvalidos o carritos de bebe"
"Buena estación aunque los pasillos son demasiado largos."
"Muy bonita y organizada"
"Super incomoda, tienes que subir 10 minutos en escaleras interminables"
"Sigue teniendo los pasillos más largos."
"😃…"
"Pasillos excesivamente largos y carece de accesos para silla de ruedas"
"Explica muy bien la ubicación y como llegar, el camino más corto.... Gracias"
"El transbordo es muy largo y no tiene ascensor."
"Infinito pasillo de conexión entre la línea 4 con la 5 y 6."
"Nada adaptado."
"Bien"
"Es hostipal inmenso y completo"
"Muy bueno"
"Tres líneas. Aunque los trasbordos son eternos."
"Excelente"
"los pasillos del transbordo parecen de la peli del resplandor"
"Un lugar más de Madrid"
"Buena estación céntrica."
"El peor transbordo de Madrid, infinito"
"Un clásico del metro."
"Excelente lugar"
"Bien"
"Espectacular parada oye"
"Demasiada separación entre lineas"
"Laberíntica."
"Caca"
"Un engaño de parada."
"Buena"
"Sistema de metro superior. Me llevó algún tiempo descubrir cómo funciona exactamente, ya que tienen una tarjeta especial para ""turistas"". Entonces la mejor manera de viajar es: Compra tarjeta anónima y recarga con autobús-metro 10 viajes. También puedes utilizar esta tarjeta para varias personas."
"Una de las peores estaciones de metro de todo Madrid. Hay que caminar medio kilómetro para llegar a los trenes. Además, los pequeños túneles te hacen sentir claustrofóbico e incluso asustado."
"Tiene muchos puntos de acceso diferentes y es bonito y limpio. Los músicos tocan allí regularmente."
"No es un buen lugar para conectar entre líneas a menos que te ENCANTA caminar."
"3 rojos"
"Fácil de usar incluso si eres inglés, como yo."
"buena realidad virtual"
"laaaaargo"
"Lindo"
"Lindo"
