"Una vergüenza el metro de Madrid, salir de tu trabajo para ir a tu casa a comer, llegar al metro un domingo y ver que el metro tarda 12 min... Así todos los fin de semana. Uno paga su abono para que el servicio sea pésimo y los que trabajamos en la zona, tengamos que perder tiempo valioso en llegar a nuestras casas"
"Hospital comarcal relativamente Nuevo Tiene instalaciones en mal estado y las está utilizando el paciente EL personal, depende... Hay algunas que debería aprender Educación y Respero Mucha espera para Consultas Externas"
"Negligencia tras negligencia. Gracias a la terrible gestión de este ""hospital"" y cierto personal médico, mi tía ha estado a punto de morir, y se encuentra ahora en la paz en la uci luchando por vivir. Si no hubiese pasado por el infanta sofia no habría llegado nunca al estado actual. Y no es la primera negligencia, ya ha habido operaciones anteriores mal hechas, dejando gasas dentro y medio ciega a mi tía hace años. 3 denuncias van ya, y ahora vamos a por la 4. Ojalá cambien su modus operandi y empiecen a valorar la vida de las personas como merecen, derivando a especialistas cuando es necesario y sin dejar pasar el tiempo y dando altas aleatorias para que los pacientes tengan que volver aún en peores condiciones que como entraron al principio. La sanidad pública debería ser de calidad y protegerse y desde luego este hospital no la representa en absoluto."
"Contrario a lo que diga la mayoría, el trato en urgencias es excelente, teniendo en el personal que disponen. Hemos estado 3 veces en urgencias y siempre nos han atendido muy bien y el tiempo de espera es uno normal para la cantidad de personas que había. De mi parte les doy un 10 por el esfuerzo ."
"A mi siempre el trato genial. Gracias a ellos sigo aquí. Un 100 por 100 con ellos"
"Gran Hospital aunque tine infinidad de cosas que mejorar todas asumibles haber si los gestores desean realizarlas."
"Es una vergüenza de lugar si vienes de urgencias. He llegado a esperar hasta 3 horas para el resultado de una radiografía. Me considero una persona empática y comprendo que hay mucho trabajo y poco personal, pero al final las pacientes somos quienes nos vemos afectadas y, de verdad, es una vergüenza."
"Más de 6 horas de lista de espera para ser atendido en urgencias. Personas quejándose por el dolor horas y horas sin ser atendidos, gente agotada durmiendo sobre los bancos, pasando frío en la sala de espera, gente con tos que parecía que se le iba a partir el pecho, con fiebre...pero el hospital parecía abandonado, sin personal...sin vida. Destacar la buena predisposición del personal de seguridad, que aparte de realizar sus funciones, también realizaba la de celador."
"El comentario es para urgencias : un 0 ya sería mucho....En varias ocasiones he tenido esperas de más de 4 horas, sin tener las salas llenas, y en el exterior los ats de urgencias fumando un cigarrillo en grupo. Poca o nula profesionalidad"
"Las únicas personas agradables las mujeres de recepción de ginecología, vas para una urgencia a las 9;45, y hasta las 11 de la mañana no aparecen l@s ginecólogos, y para una urgencia!! Luego si vas por qué te preocupa algo que no has tenido en tu vida , parece como si les molestará , tampoco tienen empatía, claro que sí podés cita a tu médico te la dan para dentro de mucho cuando ya o te has muerto o se te ha pasado el dolor👍🏼, de p. Pena!"
"Una vergüenza estar 5 horas esperando en urgencias por una reacción alérgica severa en la cara con muchísimo picor . Llegué a las 6:20 de la mañana , y solo éramos 3 pacientes en urgencias , y me he marchado a las 11:40. Agradecer tanto a la enfermera que te atiende en la primera consulta de tríaje como a la persona que me atendió en atención al paciente su preocupación y ganas de ayudarme . Cuando al fin me vio el equipo de dermatólogos , muy decepcionada con la atención , lo primero que me dicen que por qué he ido al hospital en vez de a la clínica estética donde me pautaron unas cremas que me han creado esta reacción alérgica . Porque tengo derecho a la sanidad pública, que para eso la pago, y a las 6 de mañana sin aguantar ya más , te vas a urgencias , buscando ayuda . La dermatóloga Insistiendo en que marche a la clínica de estética y me hagan el seguimiento allí . Finalmente me pautó un tratamiento debido a mi desesperación porque alguien me ayudase a calmar los picores , pero todo el rato refiriéndose que me pautaba eso pero que fuese a la clínica estética porque ella no sabia si me iba a ir bien con ese tratamiento, y le expliqué absolutamente paso por paso los síntomas , cuando empezó todo y demás. Alucinando si un especialista no puede ayudarme o duda de ello, cuando es la persona experta en ese campo. ¿ De verdad esta es la Sanidad Pública que tenemos hoy en día ? Yo entiendo que puedan estar hartos , pero los pacientes que acudimos SOMOS PERSONAS, y quien va a urgencias o al médico no es por gusto."
"Demasiadas negligencias para quitarse a la gente de encima, muy mal, fatal, diagnósticos nefastos que lo único que hacen es complicarte la vida. Tiemblo sólo de pensar en acudir allí si a mi familia o a mi nos hiciera falta..."
"El tiempo de espera en urgencias es tan alto, que ir al medico por cita es ligeramente mas lento que ir de normal a urgencias. La ultima vez que fui acabe peor que como estaba antes de llegar. A pesar de que fui a emergencias una reaccion alergica por un medicamento, tuve que esperar 6 horas y media, empeorando considerablemente en el proceso. Para luego tener que esperar otra hora para los resultados de las pruebas Y aun asi, despues de esperar por todo ese tiempo, tuve que esperar aun mas a que me atendiesen, ya que la doctora simplemente no estaba en la consulta cuando me llamaron. La unica razon por la cual le doy un valoracion de dos estrellas en vez de una, es por el mero hecho de que los demas servicios son medio decentes. Es casi mas recomendable ir a un hospital que este mas lejos que venir a este hospital de urgencias, ya que incluso con el tiempo de viaje adiccional, seguramente acabes estando menos tiempo en cola que si vinieses a este hospital por una urgencia. En conclusión, si vienes aqui alguna vez de urgencias, mas te vale prepararte fisica y mentalmente ya que probablemente salgas peor por la espera que cuando hayas llegado."
"Muy atenta la radióloga ,agradable la  atención al realizar los exámenes . Falta organización en la recepción ,se limitan a ciertas cosas y No ayudan cuando no s está en el sistema la persona ,eso hace que se pierda tiempo .felicitaciones. Ala radióloga y el chico de la entrada"
"pongo una estrella por que no se puede menos… llevo arrastrando un problema cutáneo desde diciembre del año pasado, consigo por fin cita con el dermatólogo y cuando voy el muchacho recién sacada la carrera no hace ni caso a lo que le explico sobre mi problema, sintomas,etc …le digo que si me expongo al sol me provoca problemas en la piel, dolores de cabeza y nauseas y su consejo es que no puede hacer nada si no me salen dichas manchas, que me exponga al sol y ya si eso que vuelva pero por urgencias por qué el no puede hacer nada… para colmo me receta un medicamento sin saber antes lo que me ocurre y sin un diagnóstico claro,uno de los posibles efectos de dicho medicamento son taquicardias y soy fumadora(cosa que no me pregunto en ningún momento ), añadiendo que en la sala de al lado había como 3 o 4 doctores con la televisión puesta pasando el rato….sinceramente de vergüenza"
"La sanidad pública nos trata como auténtica BASURA!!!!!!!!! Una vergüenza!!! Hospital con personal muy poco cualificado , y nada humano. Pagamos Seguridad Social para NADA!!!!!! Un hospital FATÍDICO Y MALO!!!"
"Sara,la asesora de lactancia, deberia dedicarse a ser asesora y no a otras funciones! Tengo conocimiento de que en invierno ayuda a las recientes mamás con algo tan frustante como la lactancia y a las que damos a luz en verano no puede porque esta haciendo otras funciones y todas,mas si eres primeriza como yo,necesitamos ayuda"
"Tanto yo como mi familia hemos sido pacientes de este hospital. Mi madre en concreto paciente de oncología, y me duele oír las malas críticas que se están produciendo sobre el hospital y sus profesionales. Desgraciadamente hemos necesitado el servicio de urgencias a lo largo de nuestra vida, y siempre ha sido estupendo. Este fin de semana otra vez hemos acudido a urgencias, y hemos visto que el tiempo de espera con respecto a otras ocasiones se ha triplicado. Pero antes de lanzar tantas críticas malas (que todo el mundo está en su derecho) deberíamos pensar en que la plantilla de profesionales ha sido reducida para llevarse a su personal a otro hospital (ya sabemos cuál) así como a otros centros para la vacunación, en lugar de reforzar plantilla. creo que deberíamos reflexionar, y no permitir este desmantelamiento de nuestra sanidad pública. Yo personalmente, apoyo a todo el personal, médicos, enfermeros/as, celadores.... Siempre nos han dado un trato exquisito, y son verdaderos profesionales en su trabajo. Yo, en contra de algún comentario que he leído por aquí, pienso que se merecen aplausos, y mucho más, y que yo personalmente no me llegará la vida para agradecerles su trabajo."
"En la especialidad de Reproducción y fertilidad, muy mala experiencia. Para ser un proceso duro, largo y complicado nunca se interesan de cómo estás. El proceso y las citas son estándar, eres un número, no te tratan como un caso individual. No te explican la medicación, te llaman por teléfono y te dicen que te pongas un tutorial en YouTube, penoso y falta de empatía. Y por último, falta de control durante el proceso. Si tienes oportunidad de elegir otro hospital, piénsatelo."
"Por favor, que modifiquen el personal que está en la primera planta para las citaciones. Es una pena que un hospital como éste, con buenos médicos, baje la calidad por las VIEJAS PEDORRAS  que están deseando jubilarse y sólo obstaculizan al enfermo, en vez de dar soluciones. Con la cantidad de personas que hay en España deseando desempeñar un puesto como éste, darían la calidad que el paciente necesita."
"Este hospital es una vergüenza. Pésima atención a nivel profesional y humano. Tardan meses en llamarte para citas y/o no te llaman nunca. Siempre que vas te toca cola porque no tienen suficiente personal. Y si vas por urgencias preparate para estar 4 horas fijo. Un desastre."
"Hoy he estado para hacer una analítica a mi hija. Hora y media de espera, un caos organizativo, la máquina de dar citas para el mostrador rota. Hemos visto como una de las que atendía el mostrador colaba a una amiga y a su acompañante. Una experiencia horrible. Penosa la organización."
"Terrible hoy tenía analítica a las 9 y 10 he llegado y había hordas de gente esperando, con la máquina colapsada y sin saber su turno un caos total ...recién en el mostrados me dicen que se tiene que estar en ayunas ..nadie llamo nunca ni me explicaron como sería el proceso y que llevar ni como ir ni siquiera el medico..soy joven pero a personas mayores esto se les complica aún más ..y para completar me dicen que no me pueden ayudar que tengo que regresar al siguiente día o me tiran toda la analítica llevada a la basura y comenzar el proceso desde 0 por k ese no es su problema si no el mio . Trabajo y estar pidiendo permiso cada 5 minutos no se puede encima pedían que regresara a las 13 horas del día y ni baja y alta me querían dar .👎"
"Tengo que valorar al personal (maternidad  y pediatría) El embarazo me lo han llevado un poco regular la ginecóloga(S)que me las han cambiando después de unos meses, pero el parto y la atención después ha sido impecable!A mi hijo le han tratado super bien, nacio prematuro pero bien.La atención  todos los dias que han tenido con el y conmigo es inmejorable!! Les tengo que agradecer muchísimo el trato! Nada tiene que ver el trato con las otras especialidades que ahi ya no hay palabras para describir la dejadez y la poca atención !"
"Servicio lamentable, nos llaman para darnos cita por teléfono y nos la dicen equivocada y tras hablar con el personal, nos la programan al final del turno. Cuando volvemos al final del turno, nos atiende una obstetra que no hace mas que quejarse de que por nuestro error ya tenía que estar fuera, que ella tiene cosas que hacer y nos hace la consulta de muy malas maneras y de manera nada profesional, sus dos compañeras de consulta, no sabían donde meterse…era la cita para la primera ecografía y nos estropearon el momento totalmente, por educación no la dije nada, pero no me faltaron ganas, hay que ser más profesional y mucho más humilde. Desde luego, una vergüenza"
"Fue de urgencias, y esta pesimamente señalizado para acceder a la zona de urgencias una vez uno esta dentro del hospital. El hospital sin nadie a quien poder preguntar. Me encontré con otra persona en la misma situación, perdidos por los pasillos del hospital sin encontrar donde teníamos que ir. Preguntamos a una enfermera y al parecer es algo habitual. Para evitar la misma situación al salir, pregunte a una enfermerá para regresar al parking, y me informó que lo más facil, era POR FUERA DEL HOSPITAL y entrando por el acceso al parking para coches! Imagínense si te recomiendan salir con un bebe a las 4.00am por fuera del hospital.... porque por dentro es mas complejo.... La atención de la pediatra de guardia, pésimo.... con las notas de universidad haciendo consulta y me remitió al medico para el día siguiente."
"Peor hospital y malas  profesionales , Di a luz a mi bebe hace dos días en este hospital y ninguna enfermera me ayudo primer baño de mi bebé. Dicen eso no son su trabajo. me genera mucho miedo tener que volver a este hospital. No tenemos familia en España yo esperaba un poco ayuda parte de estas enfermeras pero mucha pena. Mi marido y yo ya llevamos trabajando 10 años, y ayudábamos a mucha gente hasta hoy . Me siento muy sola en España en esta vez ."
"Las instalaciones, la burocracia y el tiempo de espera en urgencias o para pruebas son detalles que se pueden mejorar. El trato de los profesionales que trabajan en el hospital es, en general, excepcional. A pesar del estado de la sanidad actual cuando hay una urgencia de verdad son las personas que trabajan en el hospital los que demuestran lo que es la sanidad pública. GRACIAS A TODOS!"
"Siempre que hemos tenido que ir con el peque nos han atendido muy bien. En algunas ocasiones hemos tenido que esperar más pero es lo normal, depende de la cantidad de pacientes y de la gravedad de estos. Las consultas con los especialistas y las intervenciones quirúrgicas a las que hemos tenido que acudir han sido muy satisfactoria. Han demostrado una gran profesionalidad."
"Me mandan fos cartas programandome citas sin consiltar disponibilidad y pone que en caso de cambio llame a un telefono que no lo han cogido en 1 mes. Para saber el horario de atención hay que ir allí y nunca es buena hora. Cuando haces la cola en un mostrador te dicen que ahí no era, que pueden ver las citas pero no cambiarlas. Que hay que ir al otro donde hay otra cola de horas."
"Estoy esperando a la consulta de neurologia, que tenía hoy a las 15:25. Deberia haber acabado ya, pero no, resulta que en un hospital público también hay ""preferentes"", esto es , llegan sin número ni leches, a lo único que esperan es a que venga la enfermera ""conocida o amiga"" y les cuele por el morro. Falta de respeto total. Consulta 34, por cierto. Media hora más tarde de mi cita, y aquí seguimos a que salgan los ""preferentes"". Las 16:05, y aquí seguimos. Cuando acabemos aqui, tocará esperar otro tanto para poner una reclamacion  en atencion al paciente. Olé,  Olé y Olé"
"El servicio de alergología bastante lamentable. Me tuve que ir a una privada para que me descubrieran lo que tenía y me pusieran tratamiento. Ahí su solución fue, no comas fruta y verdura y listo. Adiós. Te largan a la mínima y listas de espera de meses. Tú aportando con tus impuestos para tener una sanidad decente y los de fuera haciendo turismo sanitario. Poco nos pasa para lo pringados que somos. Buenismo de bolsillo ajeno."
"Me derivan un lunes del centro de salud a urgencias por una posible apendicitis. Me hacen análisis y todo bien,me mandan para casa, pero no me dicen el por qué de los dolores. Me dicen que vuelva si sigo así. Vuelvo 4 días más tarde (los dolores no se han ido) y estoy en urgencias esperando durante 3h... No ayuda que en la sala de espera de urgencias la gente hable como si estuviera en un bar. No se puede oir si te llaman por megafonía o no. Por favor, que la gente no se traiga a familias de 12 personas a pasar la tarde."
"Llevo esperando 7 mese para una cita de traumatología, me llaman dos días antes a decir que no vaya a , que no podrán atenderme, no me.dan otra solución , simplemente me anulan la.cita . Tendré que esperar un año ?? O cuánto tiempo más ?? Mientras tanto tengo la mano fatal sin poder trabajar al 100%"
"No hay hidrogel ni en baños, ni en pasillos ni en habitaciones de pacientes. Qué vergüenza!! El paciente ingresado o está acompañado o está perdido!!! Entiendo que el personal sanitario está agotado y muy tocado pero hay pacientes que los necesitan. El que no pueda desempeñar su trabajo con eficacia y empatía que se baje del carro."
"Se trata de un edificio moderno en el que las diferentes áreas del hospital están claramente diferenciadas por pasillos con letreros. Recomiendo al equipo de alergología del hospital, porque saben tratar y superar alergias mucho mejor que en el Hospital La Paz. No que no me gusta es el sistema de pedir citas. Nunca puedes solicitar una cita para dentro de 1 año o en vacaciones porque siempre están cerradas las listas y uno tiene que estar llamando más tarde (y siempre está ocupado) para preguntar si las han abierto. Habiendo tanto personal administrativo, todo debería estar más organizado y tendrían que prever todo tipo de situaciones."
"Vergonzoso!! Ir el sábado a urgencias dejar el coche en el parking público que hay, que media hora es gratis y las otras 6 horas quién las pagaa?? Casi 12€,, de vergüenza!! todo el parking vacío y tener que pagar esas cantidades,, es un abuso. Tan difícil es tener las barreras abiertas cuando solo hay 4 coches aparcados??"
"Yo entiendo que tenemos que esperar pero yo avido días q e ido a urgencias y no me a dado tiempo ni a sentarme casi como va por orden de llegada con el papelito ese donde si que tuve que esperar fue dentro de la sala de espera pero bueno yo no puedo hacer nada si no atienden rápido será porque no pueden están atendiendo personas o desayunando que también tienen derecho o en el baño yo que se yo cuando voy para que me atiendan a mi voy tranquila si no es algo muy muy muy urgente pero si voy con alguien de mi familia ya me pongo nerviosa"
"El servicio de urgencias es completamente vergonzoso, acudo por caída con dolor de pie e hinchado. Tardan 4 horas en atenderme, me hacen radiografía y la traumatóloga indica que “se ve una línea en la radiografía pero que no es clara por la postura del pie” mes y medio después sigo con dolores e hinchazón me pago pruebas privadas, resultado, fractura en la cabeza del peroné y esguince. No se que clase de inútiles hay en ese hospital. Desde luego el paciente queda totalmente desprotegido. ¿A quién se le reclama los daños que me van a quedar?"
"Mi madre está ingresada y me ha llamado por teléfono diciendome con voz apagada que apenas puede respirar, ella está débil y no llega al botón rojo para llamar a los enfermeros, llevo 1h llamando al teléfono del hospital, he llamado al 112, al 061 y nada, no hay forma de contactar con el hospital. Literalmente mi madre de podría estar muriendo y no hay manera de hacérselo saber. El peor hospital que he conocido."
"Pongo una estrella porque ninguna es imposible, han llevado a mi marido de urgencias hace 9h, solo le han hecho un TAC y analisis de sangre, y a estas horas aun no han emitido informe, no dicen nada, no dan información de ningún tipo, y lo tienen solo en una sala sin que nadie le diga nada. Es inhumano y lamentable, a mi me echaron a la calle como si nada."
"Otro abuso por parte de uno de los empleados del metro en San Sebastian de los Reyes que me acusa de no haber pagado el billete volviendo de Madrid con mi hija y una amiga de mi hija. Cuando inspecciona el billete y se da cuenta de que esta pagado, en lugar de pedir disculpas se enfada porque le digo que tenia prisa. Me dice que me va a denunciar porque cuando le di la tarjeta para que comprobará el billete, le golpeé en la mano con ella. Esto después de que a la ida en la misma estación tuve que perder 15 minutos para recargar la targeta porque una máquina no funcionaba y la otra solo aceptaba efectivo. Increíble actitud de un empleado publico. Un poco de educación es importante y no cuesta nada."
"En la visita de urgencias de las 12:30 avisan del inminente alta del paciente. Se solicita en cuanto lo confirmen avisen por teléfono para iniciar trámites de traslado. Al final hasta la siguiente visita no dan ningún aviso siendo dado de alta en la visita de las 19:00 Se solicita ambulancia para el paciente de alzheimer encamado y hasta después de las 00:00 no es recogido a pesar de haber ambulancias que tras traer pacientes permanecen en espera hasta 30 minutos después de haber limpiado ambulancia y camilla. Algo falla en el sistema de ambulancia o en la coordinación"
"Lejos de desacreditar al personal que trabaja en este hospital, se nota que cada vez cuentan con menos medios por los recortes de la Comunidad de Madrid. El pasado 26 de diciembre, yo y otras 20 personas interpusimos una reclamación en el servicio de Urgencias porque durante dos horas, no hubo ningún médico que nos atendiera. Estaba embarazada de seis meses e iba derivada por mi centro de salud por un episodio alérgico por todo el cuerpo. Estuve ocho horas en Urgencias hasta que me atendieron, y mi marido tuvo que esperar todo ese tiempo fuera porque no le dejaron entrar. Tras quejarnos todos los que estábamos allí y conseguir que bajara una responsable, conseguimos que nos pusieran un médico para atendernos. Negaron en todo momento que fuera por los recortes, pero decían que todos sus recursos estaban centrados en otros pacientes más urgentes. Yo nunca estuve allí por gusto. Fuí derivada por mi centro de salud, que por cierto también estaba bajo mínimos en navidades. El trato fue nefasto y en el escrito de la Comunidad de Madrid me responden que hay ciertas urgencias que deben tratar los centros de salud. Señores responsables de la sanidad pública. Si mi centro de salud está bajo mínimos en navidades y me remiten al Hospital y allí, el trato es aún peor. ¿A dónde acudo? ¿No será que en época de festividades, no reponen al personal sanitario para ahorrar costes? Eso sí, a costa del ciudadano."
"Me derivaron del ambulatorio con electro ya hecho por posibles "" avisos de angina de pecho ""...llevo más de seis horas y todavía no me ha llamado el médico para el resultado. Nada más llegar te toma la tensión un enfermero, luego te tiras más de seis horas en una sala de espera."
"Vas  a urgencias con una persona de ochenta y seis años con deterioro físico y mental te tienen desde la una hasta las cinco y media de la tarde sin coner acabas comprando un sándwich de maquina y menos mal  lo avisas a atención al paciente y de nada sirve y lo peor que en un carrefour Sfera o corte inglés casi te obligan a pasar por caja antes que nadie  que falta de empatía y compasión hacia nuestros mayores que Dios les perdone"
"El pasado 19 de enero la especialista de aparato digestivo me pide una prueba diagnóstica, gastroscopia con sedación, y me dice que me enviarán la notificación de la cita a casa. Mi indignación es mayúscula cuando recibo dicha notificación en la que me dicen que fijan la fecha de la prueba para el 23 DE MAYO DE 2022, CASI UN AÑO Y MEDIO DESPUÉS. Una absoluta vergüenza."
"Esta tarde han operado a mi madre de cataratas y la han tratado como un animal. Mi madre tiene 75 años y es minusvalida y solo le ha faltado pegarla. En este hospital son unas malas bestias"
"Una pena que el dinero público se gaste en hospitales como este. La parte médica parece funcionar bien, pero la parte administrativa es un caos. Te confunden todo lo que pueden. Atención al paciente parece un filtro para evitar reclamaciones; no informan, sino que intentan convencerte de que desistas. En la LEQ más de lo mismo; hay dos personas y cada una dice una cosa, no les Importa contradecirse. A ver si la Consejería de Salud toma medidas y reconduce esta situación. Nuestro dinero ha de administrarse bien y Acciona no lo está haciendo bien en este hospital"
"Hay mas salas de espera que consultorios. El trabajo esta muy mal organizado. Hay un solo celador en urgencias que hace el trabajo de 10 personas. para llevar a mi abuela de la sala de espera a la sala donde tenia que hacerse la prueba el personal de urgencias le interrumpió en 12 ocasiones, no exagero."
