"Mi pareja tenía una cita el pasado día 19 del presente mes para realizarla una ecografía pues desde hacía algún tiempo que se quejaba de un dolor agudo en uno de los aductores. la prueba fue pedida por nuestro medico de familia, pues en unas radiografias hechas con anterioridad, aparecieron unas manchas que según el radiologo podrían corresponder con unos clips quirúrgicos a la altura del apendice, y otra mancha a la altura de las trompas de falopio, que según el mismo especialista podría ser una ligadura de trompas. mi pareja si que esta operada de apendicitis pero no está intervenida para ligadura de trompas. el caso es que fuimos el dia de la cita, y al entregar el volante a la enfermera tambien le dimos grapada junto al volante una hoja que hoy por hoy nos entregan en el médico con todo tu historial clínico, ordenado por fechas. pues bien a la hora de realizarle la prueba nuestra sorpresa fue que la señorita que le estaba realizando dicha ecografía, la dijo a mi pareja que estaba todo bien y que no entendía cómo la habían mandado una ecografia para relacionar esta con un cuadro de insomnio. mi pareja contestó que ella había ido por unas manchas que la vieron en una radiografía  por la zona del utero, ademas tiene usted ahí el informe clínico, la dijo. a lo que la enfermera o doctora o lo que sea que esté realizando la prueba la contestó que esas manchas no se ven en una ecografía, que de todas maneras a veces los clichés de las radiografías podían tener aberraciones y pudieran ser manchas de dicho cliché, además, continua la chica de la ecografía, a veces tambien confunden las radiografias y lo mismo no son ni tuyas. ¿ !!! COOOMOOOO!!!! ?. Esto paso el dia 19 de enero a las 16:45 mas o menos. Después quisimos ir a atención al paciente pero estaba cerrado,¿ por las tardes no hay pacientes o que? igual la poco profesional de la chica del aparato tuviese razón, que eso no se veía en una ecografía, y que era necesaria otro tipo de prueba, tambien entiendo que los recortes de sanidad afectan a todo el personal, incluyendo a la atención al paciente, pero no creo que cojan a personal de preescolar para saber cómo tratar a un paciente que además lleva dos meses esperando a realizarse una sencilla prueba. un saludo y espero que solucionen pronto el tema del personal y tengan a alguien competente en lugar de niñatas que se creen muy importantes por tener una carrera, que yo tambien la tengo y no trato así a nadie,"
"Fui de urgencias en plena huelga y me atendieron fenomenal, con poquísima espera, con profesionalidad y amabilidad. Gracias 😊…"
"Se nota que con los recortes vamos de mal en peor, tube un hijo hace ya 5 años en este hospital hay que decir que todo muy bien el trato y la profesionalidad se notaba pero hoy mismo que tenia cita con obstétrico para mi segundo embarazo tengo que decir el medico fenomenal super profesional y agradable pero la enfermera una sinvergüenza, no tiene respeto hacia a nadie ni al profesional que tenia al lado de hecho la hizo callar el propio doctor. me parece un trato de lo mas bajo, se cree que por ser de fuera tiene derecho a tratar de mala manera a las personas. señora como la dije personlmente y sera una queja por escrito, se equivoco mucho llevo muchos años viviendo aqui y pagando mis inpuestos como usted en este pais y ese trato no nos lo merecemos ya que su sueldo lo pagamos los ciudadanos"
"Lleve a urgencias a mi marido con dolor en el pecho lo ingresaron, a las 4 horas le digo  a la srta. atención al paciente que si le ha visto un cardiologo me dice que no hay de urgencias, le pido que le lleven de urgencias en una ambulancia al HOSPITAL LA PAZ, se niega. El resultado le llevaron a Hosp. la Paz a la semana a ponerle 3 esten, y ha perdido medio corazón."
"Esto va de mal en peor. Se supone que cuando elijes una carrera es porque te qusta. Es realmente triste ver como trabajan supuestos medicos. Puedo entender que hay de toda clase de personas que viene a visitar al medico. Algunos por gusto,por pesados y otros por necesidad. Pero es necesario tratar a todos igual de mal? Yo ni nadie tiene la culpa que el otro no te cae bien o estás cansado o si tienes problema personales. Todos los tenemos. Hay que tener paciencia y saber escuchar y explicar. Y no hace falta ser borde y despachar como si fuéramos animales. Yo si supiera todo desde luego no perdería mi tiempo visitando medicos. Espero que la situación mejore y de que los señores médicos se den cuenta de mal que hacen su trabajo. Menos mal que no tengo nada grave,po porq si dependiera de ellos....."
"El personal sanitario muy profesional y muy majo, la atención muy buena aun con la falta de medios que tienen que se queda corta con la cantidad de pacientes que reciben diariamente más los que van sin cita, llamadas etc... El personal sanitario no tiene la culpa de la falta de medios y los recortes que sufre la sanidad madrileña por parte del gobierno regional del pp y Ayuso al frente"
"Me han operado de vesícula. La atención y el trato han sido inmejorables. Desde que entré en preoperatorio hasta el momento que me han dado el alta. No tengo ningún tipo de queja más bien al contrario. Muchas gracias a tod@s los profesionales que me han atendido. 🥰🥰🥰"
"Mucha infraestructura y un módulo completamente cerrado desde su inauguración.  Penosa gestión administrativa y con muy pocas ganas de trabajar. Para conseguir un justificante médico he tenido que acudir a 3 sitios diferentes. La señorita rubia de media melena de la recepción bien podría irse al paro, seguramente hay personas con más ganas de trabajar que ella. Este hospital se define en 2 palabras: ambulatorio grande."
"Pésima atención, todas las máquinas para sacar cita están rotas. El personal muy antipático, probablemente harto de que les pregunten, no siquiera responden a las preguntas. Muy mal organizado y diseñado, parece un hospital del tercer mundo"
"Horrible experiencia con Urgencias. Vine a una revisión gastrointestinal y tardaron 4h en asignarme un doctor. Luego me hicieron pasar la noche en un cuarto con 3 personas delirando toda la noche, pasando frío y sin pegar ojo. No pienso volver allí en mi vida..."
"Hola, Llevé a mi hija al hospital porque tenia cita el 11 de febrero en Rehabilitación. Le atendió el Dr. Javier López, consulta 5. Yo tengo tres niñas dos de ellas tienen retraso madurativo del lenguaje y motricidad. En esta ocasión mi hija mayor de 7 años tenía consulta porque le duelen mucho los pies cuando camina. El doctor López haciendo su informe me preguntó cuando mi hija había gateado y cuando caminó. Yo le contesté que no lo recordaba y en dos ocasiones me dijo ""en serio que no lo recuerda"" le volví a contestar que no  y luego añadió ""¿ si yo me sentía bien no sabiéndolo?"" porque "" el también tiene niños pequeños"". Este doctor por sus ""brillantes"" comentarios es conocido en el hospital porque es un ""doctor peculiar"" y además es ""reincidente"", por otro comentario de otro empleado del hospital dice que ese doctor ""no tiene trato"". Para poner una reclamación tienes que irte a Atención al paciente y esperar el correspondiente turno (siempre para lleno y atienden dos personas) osea que tienes que esperar una media de 1 hora o más para poner una reclamación. Nadie tiene porque aguantar las ""peculiaridades"" de nadie, ni poner en duda mi tarea de madre. Además uno va al hospital para que te traten con respeto (los doctores son los primeros que te exigen en que no puedes insultarlos ni agredirlos pero y ¿ellos?) y te diagnostiquen y te ayuden a curarte o que te hagan tu vida más llevadera no para escuchar como te juzgan por una tontería haciendo un comentario fuera de lugar. Creo que este Dr. Javier López ha visto demasiado la serie ""House"". Pienso que mejor deje sus ""peculiaridades"" en su casa porque el hospital es su centro de trabajo y entre todos le pagamos su sueldo."
"Los grupos   de de urgencias enfermeras celadores y la administración dejan mucho que desear ,por qué no trabajan a posta ,,la única la  doctora los demás mal educados ,y sin ganas de trabajar"
"Contactar por teléfono es más difícil que encontrar agua en el desierto. No tiene página web, por lo cual tampoco se puede contactar por esa vía. Se nota que tratan de ganar dinero reduciendo gastos. Claro está gestionado por empresa privada!."
"Nefasto. 2 horas con la cita en mano esperando que me llamen para que cuando pregunte que pasa salga una enfermera echando espumas por la boca acusando me de que no estaba ahí. Me he largado sin que me atiendan."
"Última visita a traumatólogo  el 18 de noviembre del 2019 por una caída y escayola. En el informe pone revisión en 4 semanas y a fecha de hoy Febrero de 2020 todavía no hemos recibido fecha. Reclamación Enel hospital y toda sin respuesta"
"Sevicio lamentable, 5 horas de espera para que me digan tomate paracetamol!!! Personal LAMENTABLE, solo se dedican a tomar cafés y bromear con los compañeros mientras tu te estés muriendo de dolor!"
"Horrible, el servicio de urgencias, atención al paciente de urgencias, la poca empatía con el paciente y su familia, información nula y de la doctora Noemí montero Torres ni hablar, mucho q aprender te queda , seguro q cuando vaya tu madre actúas de otra manera, y luego aplausos para los sanitarios??? Pues para estos en concreto de este hospital nada, haber si aprendemos a tener un poco de humanidad no basta solo con la carrera"
"es una vergüenza, menuda gestión más nefasta. en nuestro caso, citaron  a varias personas a las 10:30 y claro, normal que haya retrasos y los médicos de los nervios, porque llevan un retraso de aquí te espero.  y esperando con un niño. no hay derecho."
"No me voy a enrollar, solo doy unos datos....sábado por la tarde de julio.Sospecha de covid tras una semana de pegarme el segundo chute de Pfizer..El médico me manda 2 pruebas..test de antígenos y radio de tórax...5H HORAS DE RELOJ en lo que se supone son Urgencias."
"Es un hospital pequeño y muy acogedor. Tiene unos profesionales de categoría. Yo tengo una dolencia crónica que en este hospital me han controlado divinamente , mientras que la privada me daba mucha  palabrería y poca solución.   Tenemos una sanidad pública fantástica!!!!!   Gracias a todos!!!"
"Es el peor hospital con diferencia. No tienen una buena gestión de citas, se dedican a pasear sin trabajar y te dan citas, mueves rl dia entero, porq te pasas el día entero, y después de todo ni te atienden."
"En nombre de los hijos y familiares de Natividad Jimenez Castaño, que ha estado hospitalizada en la torre 2, planta 5º habitación 553 de este hospital, hasta su fallecimiento el pasado 18 de enero. Quiero agradecer a todo el personal desde doctores, enfermeras, celadores, personal de limpieza, personal de administración...el trato exquisito recibido por parte de la paciente y los familiares que han estado con ella. Ha sido tan gratificante en estos momentos de dolor, saber que estaba cuidada, mimada y acompañada en todo momento, que no era un número sino un ser humano al que han dado muestras de afecto, interes, profesionalidad y cariño, a cualquier hora del día y de la noche, igualmente a todos los familiares que han estado con ella, se han sentido arropados y atendidos con una calidez humana de sobresaliente. Enhorabuena a todos estos grandes profesionales y grandes personas por su trabajo y atención porque a veces cuano ya la medicina no puede hacer nada es muy reconfortante una palabra de cariño y animo, o una simple sonrisa que te haga sentir que siempre hay esperanza. Gracias a todos de corazón."
"Es grande amplio cuando voy me atienden enseguida hay un equipo de enfermeras médicos doctores y lo siento no poder decir más pero no me se la escala  de tantos  especialistas pero en general son todos muy buenos"
"Pésimo trato hacia los familiares de la persona ingresada , tratan mal  con soberbia , faltas de respeto del personal y  atención nula cuando se necesita . Todo pésimo muy mal"
"No me deja poner 0 pero bueno urgencias un asco vegilantes lo mismo todo un asco pero solo fue con un amigo gracias voy. SANITAS llevo 15 años con ellos sin problema pero pagamos por algo q cada año va peor"
"Quiero dar las gracias, primero a las personas de atencion al paciente por toda su ayuda.muchas gracias , era la silla8 entre el dia 11 gracias de todo corazón por la ayuda del tf luego wuiero dar un abrazo y decir que son geniales las enfermer@ del cobi en urgencias en el comedor, 2 y sobretodo a la tacita de te."
"Aquí han nacido mis 2 hijos. Las habitaciones son individuales, con baño para el niño. La atención es perfecta y los trabajadores parece que son de la máxima profesionalidad. No en vano es el 2º mejor hospital de Madrid para ser madre."
"Hasta la fecha viene siedo un excelente hospital perteneciente Servicio Madrileno de Salud, situado en San Sebastian de los Reyes. Se abrió en 2007 y cuenta con excelentes profesionales, personal del sistema público, altamente cualificado. Desconocemos cómo cambiará cuando, próximamente, empresas privadas que manejan capitales de riesgo adquieran la concesión de la asistencia sanitaria especializada en esta zona y pase a ser un hospital público de gestión privada..."
"Pésima experiencia. Mi abuelito con 93 años ingresado, le dan el alta a las 14 horas son las 0:38 y sigue allí. Mala atención Mal servicio. Aguirre mucho abrir hospitales que funcionan de culo."
"Una verguenza de hospital llamas no cogen el telf en atencion al paciente pesima mala gestion es un hospital no cualificado en todos los aspectos es denunciable no cogen el telf y sale un automativo q te cuelga el telf directamente no es l unica incidencia este hospital es denunciable gestionandose a mixto dinero publico de todos gestionandose a privado una verguenza donde la falta de profesionalidad supura en las negligencias"
"Cada uno comenta su experiencia según le va .La experiencia que he tenido yo en el hospital ha sido de diez.Los médicos, enfermeros y todo el personal excelente"
"Vergonzoso es poco. Las urgencias son una auténtica vergüenza. Por no decir cosaa peores."
"LES PEDIRÍA POR FAVOR QUE EL TF NO LO DEJEN LLAMAS Y LLAMAS Y NO TE LO COGEN .ESTAMOS CONFINADOS QUE HACEMOS IR EN BANDAD AL HOSPITAL!!!!!!.y luego llenamos las urgencias eso no creo que haga grc a los sanitarios que trabajan allí!!!todo el día una llamada de hasta 20minutos madremia ."
"Agradezco a todo el equipo de ginecología oncología lo que han hecho por mi.Me han tratado fenomenal en los momentos en los que estaba muy baja de moral.Son unos grandísimos profesionales, me han curado de la enfermedad tan seria que tenia. Os lo agradeceré toda la vida.Muchas gracias a todos de mi parte y de mi familia. Graciass."
"Es un hospital moderno, con habitaciones amplias, personal muy atento y con muy buenos medic@s y enfermer@s. Lo malo es la falta de medios. El aparcamiento es complicado en la zona y el parking bastante caro."
"Una vergüenza estar en un hospital y que no nos quieran solicitar una ambulancia! Atención al paciente cero ."
"Hace 5 meses tuve a mi bebe, La unica atención buena fue de la matrona, pero a la hora de tener a mi bebe venia con 2 vueltas de cordón, las ginecologas con muy poco tacto, horrible la atencion. Que triste"
"Atención excelente, personal muy preparado vengo de Guadalajara con mi hija y de verdad sin palabras para definir tantas atenciones. Mil gracias a todos,  al personal de  urgencias,  enfermeras, y doctores de  oftalmología."
"Pésimo servicio, tienes un hijo y el padre duerme no te dan ni sabana ni almuada, y el trato con algunas es increíble antipacas no tienen ni delicadeza, y encima estamos recibiendo un servicio pésimo, mal hospital organizado no saben cuidar al paciente en las plantas, por qué en el paritorio Las chicas jn cielo, mejores y dejen que los españoles pagen tanto iba para una salud pública pésima,"
"Una verguenza de hospital tenia que estar privatizado ya verias como corria a atender a la gente ademas medicos prepotentes y chulos, asqueroso ni vocacion ni nada funcionarios cobrando sin trabajar"
"Me duele la tripa y llevo 6H esperando a q me Digan algo , una vergüenza la verdad... después dicen q porque nos automedicamos. Nada aconsejable , yo me he sacado un seguro privado por 30€/mes porque eSto es lamentable"
"Creo que los recortes han hecho mella en este hospital.Los profesionales muy bn pero me harté de ver manchas por todo el pasillo, paredes sucias, falta de información en ese laberinto, puertas cerradas a las 22hs, en fin.."
"Este es un hospital, que parece una clínica privada, impresionantes instalaciones y atención de calidad, mi hija ha nacido ahí y ha sido una experiencia muy agradable, los recomiendo al 100%, es el hospital del norte de Madrid, el acceso es muy bueno, en coche por la A1 y en metro es la ultima estación de la linea 10, los autobuses salen de la estación de plaza de castilla."
"La gente que trabaja allí son profesionales,amables,ayudan mucho siempre,agradezco mucho su atención en cada momento,deberían subirles el sueldo por lo que hacen ❤️"
"Llevé a mi niño de cuatro años después de haber sido supuestamente violado y tras la valoración y algunas llamadas al grume y a servicios sociales decidieron que al niño no le había ocurrido nada.el crío estaba con el culete muy dilatado que le dolía mucho y los brazos y cuerpo lleno de arañazos moratones"
"Llegue con otitis aguda, llevo esperando tres horas, me he acercado a ventanilla y dicen q tienen jaleo, estoy contando 5 personas en la sala de espera"
"Excelentes instalaciones y atención aceptable pero, si tienes que hacerte un TAC en el mismo día que una extracción de sangre, ni se te ocurra pedirles que te dejen la vía puesta para que no te pinchen de nuevo en radiología... no lo harán y el regaño excede, de lejos, los niveles soportables de la humillación y el vejamen."
"Es el Hospital que me pertenece por mi vivienda de Talamanca. El día 4/4/2017 asistí a la consulta del Doctor Franco López, todo muy profesional y eficaz. En la foto está el acceso de entrada."
"Es una pena que un centro por el que se paga una fortuna a Acciona, tenga edificios cerrados por no querer contratar personal sanitario."
"Urgencias Pediátricas … un desastre como organización y atención … 6 niños en la sala y en hora y media no me han pasado todavía Vocación??????????? Por dios"
"No os aconsejo tener hijos aquí, mala atención en todos los aspectos. Trato en su mayoría poco agradable, no limpian, tardan en atenderte, se van pasando la pelota unos a otros y no te solucionan nada, esta todo medio roto... Deseando salir de aquí e irme a mi casa."
"ATIENDE A 306 MIL PERSONAS DE VARIAS POBLACIONES Y SOLO TIENE 6 PLAZAS DE MINUSVÁLIDOS EN LA PUERTA, VERGONZOSO. ADEMÁS EL PARKING CARO SIN OPCIÓN A QUE SEA GRATUITO, CUANDO VAS A PRUEBAS Y TE TIRAS TODA LA MAÑANA  TE SALE POR UN OJO DE LA CARA. LO PODÍAN HACER DE TAL MANERA QUE LOS QUE TIENEN CITA NO PAGUEN, Y TENGAN TIEMPO DE SALIR, UNA MEDIA HORA DESDE QUE LLAMAN  SU NÚMERO A LA ÚLTIMA CONSULTA QUE SE TENGA. SOLUCIONES HAY, PERO ES PREFERIBLE GANAR MUCHO DINERO ANTES QUE MIRAR POR EL PACIENTE. MAL SEÑALIZADAS LAS TORRES, CORREDORES, ASCENSORES... PODÍAN PONER SEÑALIZACIÓN EN LOS ASCENSORES DE LAS PLANTAS Y LO QUE CONTIENE CADA UNA, ASÍ COMO EN LAS TORRES, Y CARTELES DE DÓNDE SE ENCUENTRA UNO. ALGUNOS MÉDICOS BORDES, ES POCO, POCA EMPATÍA CON LOS PACIENTES. NO COJEN EL TELÉFONO NUNCA, PARA CONSULTAR UNA CITA QUE ME HAN DADO MAL HE ESTADO LLAMANDO 3 DÍAS CADA 5 MINUTOS Y NO DESCUELGAN NUNCA. LO ÚNICO QUE SE SALVA Y TIENE NOTA DE 10, ES EL HOSPITAL DE DÍA, MUY BUEN TRATO."
"18 días ingresado, las cosas no serán perfectas pues la perfección no existe pero tengo q romper una lanza x el personal sanitario, profesional, humano y empatico, estoy muy agradecido."
"4 personas en urgencias, llevamos desde las 00:00, son las 3:30 y aquí seguimos"
"Muy mala, hemos entrado de urgencias a las 14,10 y nos han atendido a las 17,00. 3 horas. Sin ninguna explicación coherente"
"No contestan Al telefono...servicio patetico. No te Dan resultados en Meses. A mi vecino casi le operan la Mano equivocada. Esto es de susto"
"En rehabilitacion muy bien .Las fisioterapeutas muy amables y profesionales."
"Encuanto a organización el peor hospital que me he encontrado y he estado en unos cuantos"
"Nunca he entendido por qué los hospitales públicos no cuentan con un parking público lo más cercano posible. A ver si es verdad que el gobierno municipal decide cambiar las cosas!!"
"YO SOY UNA PERSONA QUE DESDE EL MOMENTO QUE ME DICEN QUE ME TIENEN QUE PINCHAR. ME TIEMBLA TODO EL CUERPO. Y DESDE LUEGO SON UNOS FENÓMENOS TANTO EN AMABILIDAD COMO EL PINCHAZO. GRACIAS"
"Llevo con la mano rota en la sala de espera más de 3 horas y media. Un servicio de urgencias vergonzoso. Pésimo, lamentable."
"A parte de nefasto porfavor una limpieza más profunda este hospital necesita una limpieza adecuada"
"Estación de servicio no limpio buena atención pero el dinero acumulado en la tarjeta bp tiene caducidad de un mes, tiempo corto para quien hace pocos kilómetros, gracias."
"Puntuación máxima para la planta 4 de pediatría."
"Quiero agradecer a RAUL PEREZ En estos días tan malos nos ha escuchado y ha hecho todo lo posible De verdad MUCHAS GRACIAS ojalá existieran más personas como tú"
"No critiquen a la estación de metro como si fuese el hospital por favor, la estación está bastante bien y es muy accesible ya que te deja justo frente al hospital."
"He llegado con una amiga con un esguince los geles desinfectantes agotados, en el baño tampoco hay jabón, ¿Cómo nos desinfectamos?"
"Llevo toda la mañana llamando, no cogen el teléfono. Te cuelgan. Me parece una verdadera vergüenza!!!!"
"Desde Barcelona llevo mas de media hora llamando por ingreso familiar y no responden----Servicio lamentable en mi opinion"
"Bajo mi punto de vista se ha quedado pequeño para atender a todos aquellos que vivimos al norte de la comunidad de Madrid."
"Una estación bastante movida por su cercanía al hospital."
"Deficiente servicio y atención. La peor gestión hospitalaria.."
"No hay maxirofacial y urgencias sabes cuando entras pero no cuando sales son muy lentos"
"Es enorme, creo que tiene zonas sin usar"
"Perdón, la reseña se refería al Hospital. La estación de metro, como todas las de la línea 10 son excelentes"
"te atienden en la siguiente vida , porque es lo que tardan en llamarte ...preparate para unas 5-6 horas de esperas"
"Gracias por atender mi Madre.. y se precuban, se edican al Paciente. Gracias"
"Increíble la baja calidad de servicio público Especulación en estado puro He temido por la salud de mis familiares"
"Pesima atencion,pesima gestion,mala atencion en urgencias."
"Pésima gestión profesionales buenos gestión pésima"
"Siempre utilizo esta parada y nunca he tenido un problema"
"Muy buena atención por parte de todo el personal. Incluyendo TODOS TODOS TODOS👌👍👏👏👏👏…"
"Como todos los hospitales pero le falta completarse un poco mas"
"Excelente instalaciones y un trato muy bueno en general."
"Muy concurrido."
"Miles de gracias a todo el personal del Servicio de Urgencias!!!"
"Es mi hospital de referencia"
"Grande y moderno pero deja que desear"
"Estamos para qué operen a mi mujer"
"Trato y ambiente magnifico"
"Gran atención y profesionalidad."
"Puffff hay mucho que trabajar"
"nunca cogen el teléfono"
"Justo en la recepción del hospital"
"Fatal enserio"
"SANTIAGO 7ANIOS"
"El hijo de mi amigo padecía pancreatitis y fue hospitalizado aquí. Las magníficas habilidades del médico le devolvieron la salud."
"Terminal de la línea 10. Estación moderna"
"Personal grosero, no me permitieron hacer preguntas, muy mal servicio."
"Arriba"
"Bien."
"atencion rara"
