"Amplio, cómodo, limpio. Tiene 3 salidas, una de ellas totalmente accesible para personas con movilidad reducida"
"La uso a diario y presta muy buen servicio, excelente"
"Buena estácion de metro, varias salidas a la calle principal , todas con escaleras tradiciones y escaleras mecánicas. Tiene varias máquinas en el hall para comprar billetes y siempre hay alguien que te puede ayudar si lo necesitas. Dispone de ascensor para acceder a los andenes. Muy cerca de la fundación Jiménez Díaz"
"Es una estación de metro amplia y diáfana. Los andenes también anchos. En limpieza: impecable."
"Metro complicado, solo una línea de metro pero con muchas salidas diferentes"
"Estación amplia con escaleras mecánicas"
"Una estación muy moderna, limpia y amplia tiene ascensores y escaleras eléctricas que facilita el acceso a sillas de ruedas. Es la estación que queda cerca de la Fundación Jiménez Díaz. Comparándola con otras es de lo mejor que hay en cuestión de estaciones en el centro. Se podría echar en falta la cobertura móvil que en estos tiempos es más útil que una vanidad. Y las escaleras eléctricas que en una de las salidas se queda a medias."
"Estación muy limpia, con acceso facilitado con ascensores y con buen mantenimiento."
"Estación de Metro Islas Filipinas, perteneciente a Metro de Madrid, situado en el distrito de Moncloa, y en el barrio de Moncloa igual que la parada de esta estación, en Madrid ciudad. Recorre por ella la linea 7 del metro, color mostaza que hace el recorrido desde Hospital de Henares hasta Pitis. La estación siempre se encuentra Limpia y en buena condiciones, tiene  acceso para discapacitados en silla de rueda. Es una estación segura, ya que siempre hay vigilante de seguridad y personal de la empresa Metro de Madrid trabajando y dando asistencia, ayudando a los viajeros, con una amabilidad, correctos, con una gran sonrisas y disposición a  los diferentes usuarios que necesita que le ayuden. En la salida de la estación se encuentra también paradas de autobuses por lo que complementa bastante las conexiones y la usabilidad del uso del transporte público de Madrid. Consiguiendo que se pueda usar todos los servicios colectivos, menos contaminante para el medio ambiente y por un precio correcto. También se encuentra cerca bajando la calle el Hospital Clínico o Jiménez de los Ríos. Para poder usar el servicio, hay distintas modalidades, desde abonos mensuales, hasta para billetes sencillos. Para los turista hay un abono para un uso como su nombre indica turístico. Por eso es una opción cien por ciento recomendable por mi parte y le doy la máxima puntuación."
"Antes vivía en este barrio y ME ENCANTA. Sus calles están llenas de vida sin estar abarrotadas, tienes multitud de lugares para ir a comer, tomarte un café o unas cervezas por la tarde noche."
"Un acceso accesible ascensor cea bermudez con andres mellado tiene 4 salidas con escaleras mecánicas hasta medio camino luego no son mecánica. ... una Salida Tiene un ascensor accesible hasta la calle. ..esquina cea bermudez con andres mellado.  estupendo máquina interior para recargar  tarjeta. ascensor interno"
"Buena y moderna estación de metro con ascensor para acceso a personas con problemas de movilidad"
"Una estación así de grande y céntrica debería tener cobertura."
"Tienes 2 hospitales al lado. Fundación Jiménez Díaz Hospital Clínico San Carlos. El metro de Islas Filipinas tiene ascensor."
"Excelente estación muy amplia la uso siempre..... Gracias Atte.cemarye"
"Es una línea de metro en toda regla, con su máquina expendedora de billetes, escaleras, andenes para que circulen los trenes en ambas direcciones. Muy recomendable"
"Estación amplia con ascensor y escaleras mecánicas"
"Estacion de metro  moderna y cumple sus funciones"
"Estación grande y limpia, con variedad de líneas bien localizadas pero.. la señal móvil es penosa."
"Una estación faraónica. Un hall enorme, grandes escaleras mecánicas y amplios andenes. Ojalá fueran todas así !!!"
"Bien y muy buen barrio a veces demasiadas obras"
"Ésta vez funcionaba todo y parece que han arreglado lo de las goteras del año pasado."
"Estación de metro bastante amplia"
"Estación de la línea 7 del Metro de Madrid. Limpia y amplia."
"De fácil acceso, amplia y mucha señalización."
"Punto de acceso bien dotado"
"Una grande estación, limpia, con mala señal para los móviles,"
"Me parece que con solo un acero en ascensor hasta la calle es insuficiente ya Qué no funciona desde el día 7 de diciembre"
"Islas Filipinas es una estación del servicio de metro de Madrid línea 7 en el barrio Chamberí en Madrid España"
"El metro de Madrid de lo mejorcito del mundo mundial."
"tiene ascensor"
"Zona tranquila con muchas terrazas"
"Parada de metro mas cercana para Hospitales Clinico y Jimenez Diaz"
"Allí pase mi niñez en casa de mi abuela muy feliz"
"Buena zona de Madrid"
"Una estación de metro como todas"
"Bien limpio"
"Buen sitio"
"Estación sucia, metro lento"
"Bien como siempre"
"bien conectado"
"suelo venir aquí"
"Una estacion más"
"Una zona bonita...."
"¡Quiero internet!"
"Mitre"
"Buena"
"Buena estación de metro"
"No hay cobertura"
"Limpio, espacioso, algo nuevo, pero aquí no hay absolutamente ninguna recepción celular."
"Una parada sin señal Es probable que no haya personal en el lugar."
"Izlas zin mar es el océano, de hecho"
"BIEN"
