"La estación es bastante amplia y moderna, como todas las actuales. La estación suele estar siempre limpia. Además comunica con el metro ligero 1, que se coge en la calle, puesto que las vías están en la calle."
"Barrio residencial con mucha oferta de bares y copas. Nivel medio alto. Buenos supermercados, avenidas y calles amplias. Muy cerca de la A-1."
"Estación muy buena."
"Las señoras de recepción, en concreto la del pelo negro y rizado, fue bastante desagradable explicando. Se pueden decir las cosas con una amabilidad mejor. Hay personas que no salimos de la zona A señora y no sabemos cómo funciona el cambio…"
"Instalaciones modernas, sin cobertura móvil.   Por la mañana está abarrotada de gente, los viernes a las 15hs también."
"Un barrio estupendo para vivir. Con muchas zonas verdes, bien comunicado con metro y autobuses y con muchos restaurantes."
"Excelente estación. Bonita vista organizado. Sin embargo, si vas en sentido línea 10 puerta azul creo que sale mejor seguir en metro ligero hasta pinar de charmartin y luego tomar la línea 1 hasta plaza…"
"Una estación de metro sin mas"
"No me parece normal que en pleno sábado haya que esperar 11 minutos al próximo tren..."
"Hermoso barrio de madrid, ideal para gente joven, muchos colegios e institutos"
"Conociendo Las Tablas primera vez. Lugar inmenso."
"Bonito barrio para vivir.  Cerca de Madrid centro. Buenas comunicaciones"
"Buen espacio, no hay mucha cantidad de gente en las calles. Se puede caminar, o hacer ejercicios con tranquilidad."
"Parada de metro con afluencia. Le faltan más máquinas para adquirir los billetes...solo tiene 2 y otra de metro ligero.... Con la afluencia de gente que hay últimamente Deberían poner más...muchos tornos pero poco personal y máquinas de billetes de metro..."
"Estación donde confluyen metro, cercanías y ML. Muy espacioso, limpio y bien señalizado."
"Es un barrio muy abierto, con calles anchas y muchas zonas verdes ajardinadas."
"Rápido y bien conectado. La pena el trasbordo de Tres Olivos, sino te plantas en la Glorieta en Alonso Martínez en 30min."
"Esta todo muy solo .... paseas y no hay nadie no viviría alli"
"Es una estación con una salida bastante bonita, está cerca de un parque enorme. Bastante cómodo el recorrido hacia aquí."
"Estación moderna y súper limpio..."
"Estación de Metro L10, con conexión a Metro Ligero a la salida de la estación. No hay cobertura en el andén."
"Increíble que tarden 16 minutos entre tren y tren…"
"Buena estación de metro, moderna, cómoda y perfecta para quedar"
"Muy bien señalizado, limpio y ordenado"
"Una boca de metro situada al norte de Madrid"
"Limpio"
"Deberian mejorar la seguridad sobre todo los fines de semana, el resto muy bien"
"Simplemente el mejor barrio"
"Estación de línea 10 de metro en el barrio de Las Tablas con una gran oferta de restauración en la zona."
"El metro ligero es más lento que el caballo del malo borracho y además no cumplen con el horario."
"Las tablas es una estación del servicio de metro de Madrid línea 10 en el barrio las tablas en Madrid España"
"Muy moderna."
"Muy limpia, organizada y moderna"
"Practico y sencillo de usar"
"Muy buen sitio"
"Estación de metro bien comunicada."
"Cerca a mi residencia ordenada y fácil acceso"
"Muy buena estructura y servicio"
"Lugar moderno, slegre y jubenil"
"Hermoso"
"Linda zona"
"Estación moderna"
"Buena"
"cerca del nucleo urbano"
"Sin cobertura"
"😍😍…"
"Gran cantidad de espacios abiertos y verdes con zonas de juegos infantiles y infantiles, teniendo buena conectividad con el alquiler de Madrid por la línea 10 del metro y el metro lejerio 1 (metro ligero 1) que discurre por vía terrestre, también tiene buena conectividad con autobuses."
"Es un buen lugar para vivir si te gustan los lugares grandes y menos ruidosos. Te sientes seguro en las calles y hay algunos restaurantes para ir solo o en grupo.…"
"En Metro, Las Tablas está a 10 minutos del centro de Madrid. Es un barrio muy tranquilo, con agradables parques y muy buenos hoteles más económicos que en el centro de la ciudad."
"POR FAVOR AYUDAME A ENCONTRAR A MI AMIGO JORGE"
"Excelente lugar"
"Fenomenal vivir aquí"
"mo poen"
"Bien"
