"La linea 12 de metro es una de las más modernas de la red, en Loranca aparte de la estación hay unas cocheras de la línea, los trenes siempre paran un poquito más de lo normal, como es una línea circular es como si fuese una cabecera de línea, también hacen cambio de conductor. La linea de metro le dio mucho valor al barrio de Loranca, las ciudades crecen normalmente del centro hacia fuera, y este barrio es uno de esos casos escepcional que se encontraba muy aislado y con pocos servicios, al principio apenas eran cuatro torres aisladas como a cinco km del pueblo, hoy junto con el barrio de vivero es una de las zonas residenciales más bonitas de la ciudad, sin desmerecer otros claro. Cuenta con un edificio de distrito municipal, centro médico de salud, biblioteca que ha pasado a ser de dominio municipal, colegios infantil, primaria; institutos, colegio concertado,  un gran equipamiento deportivo, un gran parque, un gran centro comercial de Alcampo, salas de cine de última tecnología y una galería comercial más pequeña con un Dia, viviendas individuales y en edificios, 100% residencial. Si te ha sido de utilidad esta información gracias por dar un like (me gusta)s"
"La estación está siempre limpia y es grande. La pega es que no llega cobertura móvil. Tiene ascensor"
"Gran barrio para vivir y bien ubicado"
"Estoy hasta los... Del metro de Madrid sur. 2 veces me han echo bajar del metro que cojo en Fuenlabrada para esperar al próximo tren que viene a Loranca y encima esperando en el andén 10 minutos a qué pase otro. No te dan explicaciones, no ponen otro tren de refuerzo para no esperar tanto. No puedo estar ajustando mis planes, citas o entrada al trabajo por qué estos señores les de la gana. Pondré una hoja de reclamaciones y hablaré con quién proceda. No es normal llegar tarde a los sitios por culpa de estos  cabro...."
"Accesible, buen mantenimiento, estéticamente OK, la estación normalmente está desértica y no tiene casi cobertura."
"Estación de la línea 12 no muy grande. Dispone de ascensor como entrada para personas con movilidad reducida y el trato del personal suele ser muy bueno. Esta limpia y cerca del centro de este barrio. El cambio de conductor en ocasiones es demasiado largo o algunos trenes solo circulan hasta esta parada."
"Es un sitio ideal para vivir tiene de todo es una pasada"
"La estación ha estado cerrada meses para reparar las filtraciones de agua y cuando han abierto lo han hecho igual que antes, con cubos por las escaleras por las goteras. Los trabajadores de esta estación brillan por su ausencia, ya te puede pasar cualquier problema que no los encuentras nunca en su puesto."
"Loranca es un barrio precioso para visitar , tiene un lago enorme con varios tipos de animales y un centro comercial ""El Alcampo"" que es bastante conocido. Muchos colegios y un centro de salud con buenos médicos y pediatras. No le hace falta de nada , tiene de todo cerca."
"La estación de Metro Sur de Loranca fue inagurada el 11 de abril de 2003. Presta servicio la Linea 12 (Verde oscuro). La estación se encuentra en la intersección de la Calle Alegría con Avenida Madres de Mayo en el municipio de Fuenlabrada. Esta estación es la parada para llegar a la urbanización de Loranca, dispone de un gran centro comercial a un paseo."
"Un distrito pertenece a Fuenlabrada llenó de gente, gracias por el parque de Lago, caminos para hacer el deporte y su gran centro comercial Alcampo con tiendas de Marca..."
"Es un barrio a las afueras de Madrid... Cerca de la M- 50. A una media hora de Madrid centro"
"El barrio está estupendo, siempre se puede mejorar pero es muy buen barrio"
"Un lugar chulo para pasar el día de compras, paseando y disfrutando de su gran parque"
"Super tranquilo para vivir"
"Buen posicionamiento, frecuencia aceptable de trenes y instaleciones cuidadas, que solo sufren con lluvias fuertes."
"Estación de Metro de Loranca. Si dispones de mucho tiempo es una buena forma de bajar al centro de Madrid"
"Servicio de metro línea 12"
"Muy bien tranquilo"
"Muy profesionales"
"Buena"
"Mi barrio...Ciudad Jardín, La Moraleja del Sur."
"Estación bien situada y moderna"
"Loranca se escribe así. Loranka con K."
"Centro comercial,accesible"
"Goteras, escaleras rotas, retrasos ..."
"muy desplazado todo"
"Exposición ABE Bonsái, IMPRESIONANTE"
"Ta rikisimo a"
