"Es una plaza muy bonita con parques para niños, también tiene máquinas para hacer ejercicios y banquillos para sentarte a descansar un rato rodeado de hermosa vegetación."
"Un hermoso lugar tranquilo pacífico para andar"
"Personal muy amable."
"Utilicé este servicio de metro durante 8 años, enlaza con el tren, con el abono mensual me movía desde allí hasta Madrid Central, me fue súper útil y nunca tuve problemas.  En todos los metros y trenes del mundo hay gente de todo tipo y hay retrasos, a mi las personas que piden ayuda no me molestan y si hay algún retraso lo entiendo ... es el mundo real.  Es una estación de metro que no es vieja, está limpia, tiene servicio para minusválidos y los trenes igual, a mí me parece muy bien!!"
"Bastante contento, el personal muy amable y  siempre intentando ayudarte en todo lo posible se tienen merecido su sueldo. Lo único malo que tiene que de vez en cuando las instalaciones están bastantes sucias y las pantallas informativas de horarios no funcionan algunos días. Pero si vas a preguntar a los empleados casi siempre te dan informacion."
"Estación de Metro normalita, cómo todas...!!!"
"Es una parada del metro en Fuenlabrada. Tiene una gran zona verde, un telepizza y estos dias y los venideros de calor, una escapada a estas tardes torridas. Yo solo pido que por favor recojamos los excrementos de nuestros perritos, y luego nos quejamos que a los demás, los que no tienen mascota nos llamen de todo. Con lo bien que se está tirado al cesped. Ánimo, unas bolsitas y a la papelera."
"Esta muy lleno siempre, dentro del tren es imposible moverte y encima encuentras gente así pidiendo dinero."
"Excelente lugar con áreas verdes ideales para grandes y chicos"
"La estación de Metro Sur de Parque de los Estados fue inagurada el 11 de abril de 2003. Presta servicio la Linea 12 (Verde oscuro). La estación se encuentra en la intersección de la Calle Miguel de Unamuno con Avenida de los Estados en el municipio de Fuenlabrada. Cercano a esta estación se encuentra la comisaría de Policía Local de Fuenlabrada."
"Buenos accesos y muy bien mantenida."
"Un parque bonito con mucha vida"
"Depende de nosotros tener un parque en buen estado."
"Siempre ordenado y limpo"
"Mal servicio lo parámetro de tiempo que pone en los carteles no son correctos"
"No vivo allí pero el barrio cada vez está más bonito"
"Agradable parque, tiene varias alturas con fuentes y patos."
"Una estación moderna, bastante amplia y en general bastante bien"
"Muy buena comunicación"
"Es una estación amplia"
"El personal podría ser mas amable y ayudar al que necesita"
"Como todas las estaciones de metro sur. Dos bocas de metro fácil de encontrar"
"Una parada de metro como todas las demás."
"Muy bonito."
"Lo hago porque ese es mi barrio😊…"
"Bonito"
"Buen acceso de metro"
"Hermoso"
"Me pilla al lado del trabajo"
"Precioso parque"
"El personal pésimo"
"Personal amable"
"Gente amable"
"Lugar familiar tranquilo"
"Metro"
"Molaaa"
