"Es una zona residencial, muy tranquila de fácil acceso."
"Accesibilidad mal, el ascensor meses estropeado hasta que lo repararon, es prioritario para la gente que no puede usar las escaleras, además de que sólo hay 1 para el acceso."
"La puerta por donde pasan las sillas de ruedas y carritos de bebé no funcionaba, no contestaban la llamada y nos han tratado fatal. Nos amenazaban con echarnos del metro a patadas"
"Parada de metro accesible para personas con movilidad reducida"
"El metro está bien pero las obras en el ascensor están tardando demasiado y hay personas q tienen silla de ruedas y carrito de bebe hay q agilizar las obras ."
"📌 Tiene buena ubicación y de fácil acceso.…"
"En lo que se refiere  a transporte muy bien  pero creo que hay que  modernizar la entrada   para poder pasar instalar un espacio de cruze mejor para personas en cilla de rueda o coches para bebés"
"Ascensor que da a la calle siempre averiado. Ya no vamos a usar ésa estación porque vamos con un carro de bebé y son tres tramos de escalera. Aparte de que la persona que está ociosa en dicha atención se toma con muuuuucha calma el abrir el portón para pasar el carrito sin mediar palabra alguna, y anda que avisa que no íbamos a poder subir fácilmente la silla. Muy agradecidos."
"Hoy uno de sus trabajadores me trató con muy poca educación, me parece una falta de respeto considerable. Es totalmente personal, pero quería dejarlo por escrito para que todos sepan como algunos trabajadores pueden tratar a los ciudadanos. También es una vergüenza que Renfe permita en los tiempos actuales tantísima aglomeración de gente en los metros, llegan cada 7-10 minutos, hay enormes aglomeraciones, y se rompen cada poco. Y eso que es principio de linea."
"Resulta que hoy estaba suspendido el servicio entre valdezarza y canal (me iba a montar en peñagrande), estaba una señora con el pelo largo, rubio y rizado parando a todo el mundo y diciendo que no se podía entrar en el metro, a lo que me ha preguntado que a donde iba y mi respuesta ha sido que al trabajo, a lo que me suelta ""pues te coges un taxi o un autobús, me da igual lo que hagas pero aquí no montas"". Llevo un cabreo del 15 y ahora ¿¿quien me paga lo que me he gastado en el taxi??? Indignante vamos"
"Es un barrio muy tranquilo y bonito muy aseado todo céntrico zona residenciales privadas ,"
"Limpia y sencilla. Lo mejor es el servicio de asecnesores para andar con valijas, niños o cochecitos de bebes."
"Estación de metro de la línea 7. Apto para todo eliminó, ascensor, escaleras metálicas. Limpio y siempre hay personal para posibles problemas."
"Cuenta con ascensor y no tiene cobertura móvil"
"Estación muy amplia, limpia y acorde con los tiempos actuales."
"PARA DESCANSAR TRANQUILO"
"Accesibilidad terrible, limpieza pésima."
"Un metro más..."
"Muy limpias las instalaciones"
"A mi me gusta, es más tranquilo que otros muchos sitios"
"Un buen sitio para vivir"
"El ascensor se estropea muy, muy, a menudo. Es lo peor de esta estación."
"Porque céntrico tranquilo me puede pasear con mi perra"
"Me encanta cocinar"
"Acogedora estación de Metro, está siempre muy limpia y perfecta"
"Excelente"
"Muy bien"
"Lugar tranquilo"
"Un barrio en la zona norte"
"Muy cómoda"
"Te envío la factura del"
"Excelente"
"Estación d metro con ascensor"
"Excelente"
"Barrio residencial"
"Qqqqq"
"está bien"
