"Que desastre servicio tiene el metro de Madrid, exactamente el metro del barrio del puerto, la segunda vez que pierdo mi dinero por nada hasta el atención de cliente no sabe explicar le hice caso 2 veces y me causó gastarme el dinero por nada y también la personal que trabaja en esta estación de pueblo nuevo es una mujer habla con mala leche y no trata bien a los clientes. ... 0 estrella"
"Estación de metro Pueblo Nuevo. Hola, hoy me encontré una cucaracha de 5 cm correteando por el ascensor que sube al vestíbulo. Por favor señores de Metro fumiguen esa zona. No es muy agradable ver cucarachas. Saludos! Os adjunto foto."
"Esta estación de Metro me trae muchos recuerdos de mi infancia. Mis abuelos vivían el Pueblo Nuevo y la utilizaba muchas veces. Era un barrio tan castizo, tan de Madrid, y me da pena todo lo que ha cambiado. La gente que lo compone, los establecimientos, ya no es lo mismo. Pero siempre, esta estación tendrá un huevo en mi ❤️"
"Linea 7 de metro. Agil por la mañana. Puntual y no muy colapsada"
"### UBICACIÓN Y ACCESIBILIDAD LA ESTACIÓN DE METRO PUEBLO NUEVO SE ENCUENTRA EN EL BARRIO DE PUEBLO NUEVO, EN EL DISTRITO DE SAN BLAS-CANILLEJAS, AL NORTE DE MADRID. ES UNA PARADA DE LAS LÍNEAS 7 Y 5 DEL METRO. ### DISEÑO Y ESTRUCTURA PUEBLO NUEVO TIENE UN DISEÑO MODERNO Y FUNCIONAL, CON VARIAS ENTRADAS Y SALIDAS BIEN SEÑALIZADAS. LA ESTACIÓN ESTÁ EQUIPADA CON ESCALERAS MECÁNICAS Y ASCENSORES, FACILITANDO EL ACCESO A PERSONAS CON MOVILIDAD REDUCIDA Y A OTROS USUARIOS. ### SERVICIOS Y COMODIDADES - **CONECTIVIDAD:** LA ESTACIÓN DE PUEBLO NUEVO OFRECE UNA EXCELENTE CONEXIÓN A TRAVÉS DE LAS LÍNEAS 7 Y 5, PERMITIENDO A LOS USUARIOS ACCEDER A DIFERENTES ÁREAS DE MADRID Y TRANSFERIRSE FÁCILMENTE ENTRE ESTAS LÍNEAS. - **ENTORNO:** LA ESTACIÓN ESTÁ UBICADA EN UNA ZONA RESIDENCIAL Y COMERCIAL, CON ACCESO A VARIOS SERVICIOS LOCALES, COMO TIENDAS Y RESTAURANTES. ES UNA ÁREA TRANQUILA EN COMPARACIÓN CON OTRAS PARTES MÁS CENTRALES DE MADRID. - **SEGURIDAD:** PUEBLO NUEVO ESTÁ BIEN VIGILADA CON CÁMARAS DE SEGURIDAD Y CUENTA CON PERSONAL DE SEGURIDAD, LO QUE OFRECE UN ENTORNO SEGURO PARA LOS VIAJEROS. ### EXPERIENCIA DE USUARIO LOS USUARIOS VALORAN LA ESTACIÓN DE PUEBLO NUEVO POR SU UBICACIÓN CÓMODA Y SU BUENA CONEXIÓN ENTRE LÍNEAS. LA LIMPIEZA Y EL MANTENIMIENTO SON ADECUADOS, Y LA SEÑALIZACIÓN ES CLARA Y EFICAZ. LAS MÁQUINAS EXPENDEDORAS DE BILLETES Y LOS PUNTOS DE INFORMACIÓN SON ACCESIBLES Y ÚTILES. ### OPINIÓN GENERAL PUEBLO NUEVO ES UNA ESTACIÓN EFICIENTE EN LA RED DE METRO DE MADRID, DESTACADA POR SU UBICACIÓN EN UNA ZONA RESIDENCIAL Y COMERCIAL TRANQUILA. SU FUNCIONALIDAD Y ACCESIBILIDAD LA CONVIERTEN EN UNA PARADA CONVENIENTE Y PRÁCTICA PARA LOS VIAJEROS. EN RESUMEN, LA ESTACIÓN DE METRO PUEBLO NUEVO ES UNA PARADA BIEN EQUIPADA QUE OFRECE UNA BUENA CONEXIÓN A DIFERENTES PARTES DE MADRID Y PROPORCIONA UNA EXPERIENCIA DE USUARIO POSITIVA GRACIAS A SU DISEÑO FUNCIONAL Y SU UBICACIÓN EN UNA ÁREA RESIDENCIAL TRANQUILA."
"Una estación de metro, algo renovada y más actual y moderna, puesta al día en las expectativas y sugerencias que nos exige la tecnología en la atención y transporte de viajeros. Y también añadir que habiendo estado trabajando como Guardia de seguridad en Metro de Madrid muchos años, dando cobertura en planificación, seguridad y control, pues me parece estupendo que la Seguridad Privada haya mejorado bastante desde que yo dejé mi puesto en Metro, y hay más control y mejor dedicación al servicio. Puesto que es de cara al público, me parece que ha mejorado como un 70 por ciento más desde mi época. ENHORABUENA A TODA LA SEGURIDAD PRIVADA Y TAMBIEN A LOS EMPLEADOS DE METRO. Gracias y Saludos muy cordiales. SEGUIR ASI. Hasta siempre compañeros VIGILANTES."
"Generalmente está muy limpio, aunque hay bastante gente, pero hace mucho calor."
"Una buena parada de metro suelen funcionar las escaleras mecánicas, hay opción siempre de ascensor, se encuentra adaptado, tiene linea de metro 5 y 7, la 7 es más rápida."
"Estación de metro normal con ascensor y escaleras metálicas. 2 máquinas para extender billetes."
"Estación de metro algo vieja. Los abcensor huelen a alcantarilla increíble.... Hace muchísimo calor en esta estación, no hay una ventilación adecuada. La limpieza en los pasillos y sobretodo en la línea 5 muy muy regular. Aproposito la gente se suele colar muy frecuentemente y fácilmente saltando."
"Huele muy mal, siempre que paso por esta parada Huele fatal. Siempre que paso por este metro lo encuentro todo muy mal. Y cuando voy de paso que ni siquiera tengo que bajarme en esta parada el holor entra a presión de lo mal que huele. No necesito mirar ni escuchar para saber la parada en la que estoy gracias lo mal que huele.. Entre cañería, sobaco y a saber que más. Se supone que se le da mantenimiento pero no se yo ehh."
"Guardias super amargados. No nos dejaron pasar con el perro en carrito aunque este totalmente cubierto, ni siquiera muerde. No pone ninguna regla que no puede ir un perro en carrito. Quieren que vaya en un transportin y dicen que en carrito no.y eso que siempre nos han dejado. Menos los dos, una señora y un señor viejo que estaban ahi hoy. Ni siquiera era la hora cuando no permiten perros. UNA VERGÜENZA. .|. Mejor en otro pais que no discriminan a los perros, no como aqui."
"La unión de las 5 y 7 además de la 11 en un futuro una gran estación y nudo de comunicación"
"Tiene varias salidas/accesos a ambos lados de la calle de Alcalá. Dispone de ascensores."
"Es una estación de metro de Madrid con bastante tráfico de pasajeros, donde convergen las líneas 5 y 7, son bien mantenidas y operativas, se observa que conserva facilidades de ciertos años, diría entorno a más de 20 años"
"Hay todo tipo de comercios en este lugar"
"La estación en sí no está nada de mal. El personal que presta información en las máquinas expendedoras de billetes y recarga de tarjetas, es amable y bastante servicial. Hace tiempo dije que los escalones de acceso desde la calle, sobre todo en la boca más cercana a la C/Hermanos de Pablo eran muy estrechos. Bueno, la cosa ha cambiado desde su remodelación y ahora esos escalones son de una anchura apropiada."
"He vivido allí 30 años. La calle de Alcalá divide en dos los precios, tanto en tiendas, bares y a nivel inmobiliario.  La parte lisa es la cara. La parte cuesta abajo nos acerca un poco a precios menores"
"Como barrio merece la pena"
"Está muy adaptado."
"📍Tiene varias salidas y un ascensor 👍🏼…"
"En la zona de ascensores al anden línea 5, salida hermanos... Apesta desde hace días a gas sin que nadie le dé importancia. Y si huele a gas, hay gas cerca. Lo que puede ser un indicador de peligro por contaminación del aire, incendio, explosión, etc."
"Bello como todo Madrid, con sus encantos ay de todo comercios y donde comer muchos menus y tapas y café exelente todo tipo de tienda al caminar muy entretenido y seguro y muy limpio todo se ve que es un sector muy agradable"
"Está genial que haya facilidades para sillas de ruedas y bebés. Los ascensores estaban muy muy sucios."
"Me gusta mucho vivir en el barrio. Tiene de todo, mercados tiendas bares etc..."
"Pensaba que después del cierre de la línea 5, por 2 meses este verano 2017,  la dejarian estupenda pero no fue así. No se lo que hizo el Ayuntamiento de Madrid com Carmena a la cabeza pero no resolvieron nada, ni el aire de los andenes ni el Aspecto ni los olores y es una pena porque es una línea muy importante por el volumen de gente que transporta"
"Ahora mismo están haciendo control de tarjetas de transporte y la manera tan borde de una señora de baja estatura y con el pelo pintado de rubio, (trabajadora del metro) deja mucho que desear, a ver si les enseñan un poco de educación y empatía con las personas mayores..."
"Pueblo Nuevo? Será pueblo apestoso...Que asco como huele la estación 🤢…"
"Vivo aquí, el barrio está muy bien situado con respecto al resto de Madrid, comercios, locales de comida, supermercados etc"
"Parece un sauna, la calefacción encendida en la estación cuando aún no ha terminado verano(?).. No se entiende.."
"Me a parecido bien"
"Por qué está mañana en el primer metro se corta la línea en Cartagena sin avisar en el andén?vaya banda de ineptos."
"patetica la mujer que estaba en la garita la noche del 4 de marzo...una señora rubia...le comente que habia perdido la cartera y solo llevaba 1 euro ....le comente el problema y le pedi que le daba el euro que tenia y que si por favor me podia dejar pasar....me dijo que no...que  cojiera un bus a ver si alli me podian ayudar..eso si, no dijo nada a los chavales que al instante saltaron para colarse gratis.....finalmente fui en bus....la señora que me etendio realmente patetica....cuando le pase a ella...."
"Un metro que ,si el ascensor no funciona   (que es a menudo) pues te toca subir con el carrito de bebé a hombros que fue mi caso porque no hay escalera eléctrica.."
"La estación está bien, pero deberían controlar más la salida de Vicente Espinal, porque se cuela todo el mundo."
"Pagamos abonos de transportes mensuales carísimos para que las instalaciones no estén en condiciones, dos veces en una semana y en fin de semana de puente, TODAS las escaleras mecánicas de la linea 7 apagadas, Insólito!!!!!!"
"Luego de las reformas es más amplio pero aún quedan cosas por mejorar"
"es bastante viejo aunque algo reformado e incluso no es accesible para personas con problemas de movilidad reducida se incluso para algunos invidentes."
"Estación de metro que pertenece a las líneas 5 y 7. Estación antigua. Dispone de varios accesos a la calle ademas de que dan a un centro comercial (que no es lo más)"
"Me gusta ☺️"
"Muy pocos trenesen hora punta...8 minutos esperando a diario a las 3 de la tarde...en muchas paradas, los carteles.funcionan xo no te dicen cuanto tardael.tren.Mal el transporte publico...masificado hasta en verano"
"Estación de metro normalita. Sin aseos, como todas, y sin ascensores como todas las antiguas. Conexión entre líneas 7 y 5"
"Muy  concurrido y tiene todas las opciones de compras etc"
"Pueblo nuevo un barrio muy bonito con metros y varias paradas de autobúses tiendas, restaurantes, supermercados, parques también."
"Podían cuidarla mucho mejor. Demasiadas escaleras por todas partes. Es un coladero de gente sin billete, una vergüenza."
"Estación muy grande,limpia,buena atención etc ."
"Tiene varias salidas que dan a la calle Alcalá. Tiene ascensor. Algunos aspectos mejorables como el trato de los trabajadores de seguridad."
"Es un barrio muy acogedor con todos los servicios necesarios cerca."
"Desde que quitaron la taquilla para los billetes se cuela todo el mundo"
"Es un sitio transitado y encuentras todo lo que buscas ahí.. supermercado; transporte público; tiendas!!"
"Lugar para caminar y ver tiendas, me encanta"
"Tiene todos los servicios de una estación de metro y esta cuidada estéticamente. El único fallo son las distancias a recorrer"
"Están reformando y está quedando genial. Con 2 líneas que son súper importantes"
"Haces mas bicicletas que robiho de todas las caca que hay"
"Pueblo nuevo siempre puedes ir a cualquier desde hay"
"Todo bien"
"Por favor, hay que cuidar la limpieza de esta estación. Mal olor y más luz"
"Tienen problemas desde hace 15 minutos y no dicen nada.... sólo pone que está funcionando con normalidad.... es una vergüenza... pasan y pasan los metros sin q pueda entrar un alma nadie dice nada...."
"Una estación de metro muy completa y limpia"
"Pueblo nuevo es una estación del servicio de metro de Madrid línea 5 y 7 en el distrito ciudad lineal en Madrid España"
"tiene ascensores"
"Sucio y poco seguro"
"Te refieres al barrio, o, la parada del metro?"
"Muchas tiendas en puerta. Calle muy comercial"
"Es un barrio y tiene metro"
"Pensáis poner el aire frío en algún momento? Es jodidamente insoportable el calor que hace aquí"
"Encuentro de todo en esta zona comercial"
"Mucho calor y el metro de linea 5 antiguo, muy muy concurrido"
"Pasé por debajo... Iba en metro."
"Zona comercial buena y está perfectamente comunicado"
"Estación de metro cuidada, renovada y eficiente"
"😀👍…"
"Deberían de avisar antes la separación que hay entre andén 1 y 2 de la línea 5"
"Bien"
"Estación antigua de tooooda la vida. La han remodelado hace poco."
"Buena.... Tranquilo y limpio"
"Tranquilo cómodo seguro"
"Me gusta el único fallo es que huele mal"
"Un lugar anodino para vivir"
"Accesible a todos los servicios"
"Me pareció tranquilo"
"Muy acojedor esta comunidad"
"Normal. Estación de metro amplia"
"Pueblo Nuevo Vida Nueva"
"Una zona con buen trasporte, buenos comercios"
"Muy bien"
"Cuenta con buenos y rápidos accesos a los andenes."
"La conexión entre las líneas 5 y 7 no es muy cómoda"
"Voy a estudios de mercado"
"Hay de todo"
"Barrio obrero con bastantes comercios"
"Solo de paso"
"Bien"
"Faltan escaleras mecánicas"
"Bello lugar"
"Estación tranquila."
"Muchas tiendas"
"Buena estación"
"👍👍👍👍👍👍…"
"Estación de metro de las líneas 5 y 7"
"Excelente"
"Hermoso lugar"
"BIEN"
"normal"
