"URL","Usuario","Info","Fecha","Reseña"
"https://lh3.googleusercontent.com/a-/ALV-UjUcKi-RfaQkzSDxEc4AbgnMPLjf0yWmeI1kaSvNpAK6NtIqFPWP=w45-h45-p-rp-mo-ba5-br100","NAS","Local Guide · 474 reseñas · 423 fotos","Hace un mes","En verano la ventilación es nula. Tampoco tiene ascensor para personas con movilidad reducida."
"https://lh3.googleusercontent.com/a/ACg8ocJY8NF_yYJsZDUjIrVGGyYxeYEsFyqSf0AA-fIS_1veFS3IcBLT=w45-h45-p-rp-mo-ba6-br100","pepe lopez","Local Guide · 336 reseñas · 638 fotos","Hace 3 meses","No tiene ascensor ni salida para silla de ruedas es la línea 1 es un poco antigua y descuidada ."
"https://lh3.googleusercontent.com/a-/ALV-UjW5Dzn5WzWZGttkeX9uyr7pIFNkTJHiCqIMLYAn2m7im-XuDuH7=w45-h45-p-rp-mo-ba3-br100","Rocio Granda","Local Guide · 57 reseñas · 2 fotos","Hace 3 meses","Esta estación tampoco está adaptada para personas con movilidad reducida"
"https://lh3.googleusercontent.com/a-/ALV-UjUdGYsBpVABogc9CFceLx4OqWG8HoP7sexLOlBunm-P6n_SH9B9iw=w45-h45-p-rp-mo-ba6-br100","Julio Diarte","Local Guide · 825 reseñas · 3.509 fotos","Hace 3 años","📌 Tiene varias salidas en la Calle Bravo Murillo en los pares e impares, le falta ascensor para personas con movilidad reducida.…"
"https://lh3.googleusercontent.com/a-/ALV-UjUVgzWlkR8Ru9-QdyGuDkKWI3eLPbr28m0gR7WTjd9f0_Heyj0=w45-h45-p-rp-mo-ba5-br100","Andres Blanco","Local Guide · 241 reseñas · 114 fotos","Hace un mes","Una estación normal, en la que se cuela mucha gente"
"https://lh3.googleusercontent.com/a/ACg8ocJjq8YlkgyiA972bULofGAGVBRaueKNfaUooH9qpX0ZKAOYUQ=w45-h45-p-rp-mo-ba4-br100","Gabriel Riveros","Local Guide · 155 reseñas · 78 fotos","Hace un año","Lugar incómodo y desordenado..se nota la diferencia negativa frente a Alcalá con sector el Carmen o Quintana!!"
"https://lh3.googleusercontent.com/a-/ALV-UjWfB6ZjjbwCsK4GzqJ732LTToUkRaxSvOmSYKsbpftuJASBQAB-=w45-h45-p-rp-mo-ba5-br100","Moises Ardila","Local Guide · 184 reseñas · 606 fotos","Hace 2 años","Igual que casi todad las estaciones"
"https://lh3.googleusercontent.com/a/ACg8ocJpN6Gv0q_fN_KNLvG8tCjLb--BTilyjb7JjM9PnCrq-H91yg=w45-h45-p-rp-mo-ba5-br100","Mari Cruz Jiménez Mellado","Local Guide · 262 reseñas · 7 fotos","Hace 3 años","Pero tienes autobuses variados y con la pandemia ya no hay cortes por carreras de bicis ni fiestas de ningún tipo, por mi mejor porque, antes me veía de cuatro caminos al metro otra vez y a buscar como llegar a tetuan y si vas cansada y un domingo y se te ocurre ir a coger autobús, uff, te acuerdas de todos, perooo!! Ahora no Ya abrieron y la zona de bravo Murillo y colindantes no está por ahora en cuarentena a veces el ascensor de cuatro caminos lo tienen cerrado por obras y esto es mucho tiempo y veces por lo que tienes que caminar innumerables escaleras en los demás accesos"
"https://lh3.googleusercontent.com/a-/ALV-UjWxyAwMgmS1i_io2MmWx7u73laGKqQNOXDz6YfP6MIKzAnOXGYr=w45-h45-p-rp-mo-ba5-br100","D. Gómez","Local Guide · 118 reseñas · 118 fotos","Hace 4 años","Voy camino del trabajo en el hospital de La Paz y me la he encontrado cerrada sin previo aviso, después de una carrera hasta la estación de Tetuan no me acepta la tarjeta del Metro he tenido que sacar otra a prisas teniendo un bono mensual en la personal... Y nadie de seguridad ni trabajando para ayudar...Total facilidades para el personal sanitario en la situación que tenemos actualmente 0."
"https://lh3.googleusercontent.com/a-/ALV-UjUH5XEla4c9zf84IKMBSvK_jyg0FX2n2_EEICmjrprYDQbkNid6xA=w45-h45-p-rp-mo-br100","Mariano Marasco","888 reseñas","Hace 2 años","Un estación de metro ( 🚊🚊) cómoda que se puede hacer varias combinaciones de otra línea del metro. A su vez sale varias calles principales del barrio de Tentuan 🚏🚏🚇🚇🚇🚇🏢🏢.…"
"https://lh3.googleusercontent.com/a-/ALV-UjXgA6DvSKA0y8s_E-5t04HFC4H3OUi7wAbt7qr_lsJTuoP4Ghb8=w45-h45-p-rp-mo-ba4-br100","Manu López","Local Guide · 9 reseñas · 2 fotos","Hace 7 años","Estación no adaptada para personas​ con movilidad reducida. El acceso por Bravo Murillo - Fulgencio de Miguel presenta techos extremadamente bajos."
"https://lh3.googleusercontent.com/a-/ALV-UjUATMmA5GlTS0sJdOJ2XCKF8XX1l7nbMHh69syqfZZV0HsXv6MT=w45-h45-p-rp-mo-ba4-br100","Jhon Fredy Serna Mejía","Local Guide · 106 reseñas · 53 fotos","Hace 9 meses","Se me facilito para interconectar con plaza castilla"
"https://lh3.googleusercontent.com/a/ACg8ocL3KzTCiUDPtaZIGf4-WIb0Ng-XBh1NEXcSzVeQCd37XbcB=w45-h45-p-rp-mo-ba4-br100","María Josefa Pérez Chaparro","Local Guide · 148 reseñas · 10 fotos","Hace un año","Muchas carencias,no hay ascensor para personas con poca movilidad,ni escaleras eléctricas"
"https://lh3.googleusercontent.com/a/ACg8ocLpK623-ToTW4zTIrFgVUZVu0_5tjsh7vwN4ec-jE5hpukl_g=w45-h45-p-rp-mo-ba6-br100","Sergio Alvarez","Local Guide · 402 reseñas · 16 fotos","Hace 7 meses","Es el barrio de Madrid donde vivo."
"https://lh3.googleusercontent.com/a-/ALV-UjWdX3tAK1ZJlSEdh8h8NGSBOAWGhVcUa-CtxrL2cSRL-XqgIQzj=w45-h45-p-rp-mo-ba8-br100","Ma Ca","Local Guide · 1.249 reseñas · 21.869 fotos","Hace 5 años","Estación de metro antigua. No está habilitada para gente con discapacidad, no hay ascensores."
"https://lh3.googleusercontent.com/a/ACg8ocK9jFVvDewvAj4r6_20bRSc0ItvfcjNWe_EZ_nheW-ej9ckvw=w45-h45-p-rp-mo-ba6-br100","A Gordo","Local Guide · 285 reseñas · 196 fotos","Hace 5 años","La accesibilidad en esta estación  es nula, y pocas veces el personal dw estación  se encuentra disponible"
"https://lh3.googleusercontent.com/a/ACg8ocI_TQq50h9PEH-Z32SAZDl8vOm4_k1FlpQ9lb1rzEl4vIPfhzpy=w45-h45-p-rp-mo-ba4-br100","Yeray Alonso","Local Guide · 123 reseñas · 324 fotos","Hace 3 años","Que perros en el andén no tiene puestas todas las salidas en los carteles y casi me confundo :("
"https://lh3.googleusercontent.com/a-/ALV-UjV7nZTDkMYsgxl1LVkqoHVLotIJ5XQPkdrwa26R8ODkezjOP63Yjw=w45-h45-p-rp-mo-ba8-br100","Miguel Ángel Terrero","Local Guide · 1.742 reseñas · 8.108 fotos","Hace 2 años","Parada de metro convencional de la línea 1 de Madrid. Con los servicios propios de una estación de metro."
"https://lh3.googleusercontent.com/a-/ALV-UjWjMmXZ0JiGCIQY4UR1Om4nPQBJZt8sdhD8jIDOBdBTQO6a76w=w45-h45-p-rp-mo-ba5-br100","Bianca Cárdenas","Local Guide · 313 reseñas · 405 fotos","Hace 4 años","Me gusta este lugar porque siempre está bien concurrido de gente de todas las nacionalidades, encuentras buenos restaurantes, bares y tiendas"
"https://lh3.googleusercontent.com/a-/ALV-UjUmHyNkLcLPiODQDwx-k6lwIV1eRtfsbp_h1qycKRYASaPmODRm=w45-h45-p-rp-mo-ba4-br100","EDDY junior Ciprian perez","Local Guide · 63 reseñas · 4 fotos","Hace 2 años","En la calle bravo Murillo hay muchas tienda en general"
"https://lh3.googleusercontent.com/a-/ALV-UjXawQl0jCc-Q0dfNDtoi67VjnU5XW2j5_umbh04tfcKeS7mPLNJ=w45-h45-p-rp-mo-ba2-br100","Claudia Aranda Gomez","Local Guide · 33 reseñas","Hace 6 años","Estacion antigua con varias salidas ninguna adaptada para personas con movilidad reducida.. carritos d bebes o maletas"
"https://lh3.googleusercontent.com/a-/ALV-UjX1vRT_TbVAdQKQwDQ1WX7rGGKXXsVjCA3MlD2Njj9047iWOyjB=w45-h45-p-rp-mo-ba6-br100","Luis Rodríguez","Local Guide · 889 reseñas · 436 fotos","Hace 6 meses","Acceso no adaptado."
"https://lh3.googleusercontent.com/a-/ALV-UjXVr8jmp9tSwrEvvxkZIH1670v2zMlMGGvxdwP17dUDcnRLF03X=w45-h45-p-rp-mo-ba6-br100","Francisco León","Local Guide · 292 reseñas · 1 foto","Hace 9 meses","Estación antigua y sin ascensor."
"https://lh3.googleusercontent.com/a-/ALV-UjV-PRc8TGILwYnlughG7YT02isDkdtNdnahhKig7gW27ZLlqoIgTA=w45-h45-p-rp-mo-ba4-br100","Joaquin Atrasto","Local Guide · 123 reseñas · 324 fotos","Hace 2 años","Regular ha perdido su esencia desde hace algunos años."
"https://lh3.googleusercontent.com/a/ACg8ocIQxCiRQ4GTEvmT095s4RfRFoAY2OJnt5-U9YYjphuuBt2hVg=w45-h45-p-rp-mo-br100","Milagros Gonzalez","4 reseñas","Hace 7 años","No tiene acceso para personas con minusvalía ni para carritos de bebés."
"https://lh3.googleusercontent.com/a-/ALV-UjVUUHNGNFQnhLFXZ1cf_nQaB1xtopudDZhQbwn1wSe0Qv8BpUGF=w45-h45-p-rp-mo-br100","Antonio Fernandez Pardo","14 reseñas · 81 fotos","Hace 10 meses","Esta en Bravo Murillo 195"
"https://lh3.googleusercontent.com/a/ACg8ocLEOnEp8-P5bC7Dy7pr8hPWU79P84ImGPY8qK2aErtvp1aiJg=w45-h45-p-rp-mo-br100","Alexander Cardona","2 reseñas · 22 fotos","Hace un año","Limpieza de peces Fileriar y mucho más"
"https://lh3.googleusercontent.com/a-/ALV-UjUMBXnZFY6xepC0eiywP33GIyGGdqLQ3B4kGatRKOiMwgnpO3D_Sw=w45-h45-p-rp-mo-ba7-br100","Antonio García Delgado","Local Guide · 796 reseñas · 7.702 fotos","Hace 8 meses","Una estación parecida a las otras."
"https://lh3.googleusercontent.com/a-/ALV-UjWieR0QUg_n7YAcbgI3no_Bxt1QD0fbN6CuoJ-4J2bo5CJGta4Z0g=w45-h45-p-rp-mo-ba5-br100","frank","Local Guide · 581 reseñas · 115 fotos","Hace 7 años","Está reformada pero es antigua y no esta adaptada para minusválidos."
"https://lh3.googleusercontent.com/a-/ALV-UjWSXt91FNBh52wj2O3fKVsWnSrWcEiBpUw_RrdKqdHrMMLd_PA=w45-h45-p-rp-mo-ba4-br100","Carlos","Local Guide · 140 reseñas · 67 fotos","Hace 7 años","No adaptada para minusvalidos ni cochecitos. Antigua y fea."
"https://lh3.googleusercontent.com/a-/ALV-UjV--SwYsyLnIOm4e-QAlX_AHJFAZEcuKidcoyikjuYUKx1Wp3uc=w45-h45-p-rp-mo-ba5-br100","Jesus maria Henao","Local Guide · 323 reseñas · 320 fotos","Hace un año","Muu bonito agradable cómodo"
"https://lh3.googleusercontent.com/a-/ALV-UjVBqM0A46YioBD_X37yc_GDdWW2Krbn3NEdH6Bn1zMbfDt9pTyfFA=w45-h45-p-rp-mo-br100","Reyes Sanchez Rico","14 reseñas · 7 fotos","Hace 5 años","Es una zona muy popular y muy de nuestro Madrid, la cervecería Estrecho muy popular y bien atendida."
"https://lh3.googleusercontent.com/a-/ALV-UjWeaZBJIiHm-0JxdJqNCHFRFs-hfV15F7RFg9ke1qvEhqTt6LGD=w45-h45-p-rp-mo-ba3-br100","barbara hernandez","Local Guide · 32 reseñas · 160 fotos","Hace 6 años","Es necesario crear acceso a minusvalidos y vochecitos de Bebé"
"https://lh3.googleusercontent.com/a/ACg8ocL6j3fUjdHjzglCFPCFitAnCJ2BggebpG8jNROfZWVFbqChuA=w45-h45-p-rp-mo-ba4-br100","Rocio Rodrigo Rubio","Local Guide · 276 reseñas","Hace 6 años","Estrecho es una estación de servicio de metro de Madrid línea 1 en el barrio Tetuán"
"https://lh3.googleusercontent.com/a-/ALV-UjU69RpMpS_EXvA-U6o6zcZzt_rgXCo4RDY5llatx4ZhA_YfgOB5=w45-h45-p-rp-mo-ba5-br100","David Asenjo","Local Guide · 160 reseñas · 849 fotos","Hace 6 años","Una escultural capilla muy bonita."
"https://lh3.googleusercontent.com/a-/ALV-UjUDiY_KdhvsjfITsJBh-8LusY03G1hS3O3KB6tT-arLInQSSEwv=w45-h45-p-rp-mo-ba4-br100","Julián Escobar","Local Guide · 110 reseñas · 90 fotos","Hace 7 años","Esta estación ya debería ser remodelada."
"https://lh3.googleusercontent.com/a/ACg8ocJVLzvSiwV5vyANyu1Ev8-5-Lv7z_lGAQURq1BBxFUK-AGLjA=w45-h45-p-rp-mo-ba4-br100","ana isabel fernandez soria","Local Guide · 92 reseñas","Hace un año","Está muy bien"
"https://lh3.googleusercontent.com/a-/ALV-UjV61ikwbgWBjaR8vH3mhA1_Gs3s5YkADCe4ONUct1CcaeHFXyj5=w45-h45-p-rp-mo-ba5-br100","Charlie Barba Gomez","Local Guide · 263 reseñas · 412 fotos","Hace 7 años","Buen funcionamiento y buen estado de limpieza"
"https://lh3.googleusercontent.com/a-/ALV-UjXsSNKpKCHAM5vdsYLVxGjLiww77-gS3NNLt0U_T_MwIKln3rEVnw=w45-h45-p-rp-mo-ba3-br100","Jorge Vilanova","Local Guide · 69 reseñas · 35 fotos","Hace 6 años","Estación donde hace un calor insano. Muy vieja"
"https://lh3.googleusercontent.com/a-/ALV-UjVeJ20SRgHyuMjalbKgR2wyqOjPBTC6wsVheAHzMczx_vNAVbUKEQ=w45-h45-p-rp-mo-ba3-br100","Barbara Milagros Acosta Rodriguez","Local Guide · 46 reseñas · 2 fotos","Hace un año","Bien"
"https://lh3.googleusercontent.com/a/ACg8ocKkCC-jWh4aN6hFlmsq19Xl0gHELxzQKelm_Q-UE42mQdRtiw=w45-h45-p-rp-mo-ba4-br100","Milagros Gonzalez","Local Guide · 37 reseñas","Hace 6 años","Espera prolongada en las cajas para abonar la compra."
"https://lh3.googleusercontent.com/a-/ALV-UjUNzwUbSCNwT1QzVSIvSulVd9b_RqTP9LgRNq3ek9JimcE-Z9qIcw=w45-h45-p-rp-mo-ba5-br100","Juan Perez","Local Guide · 211 reseñas · 222 fotos","Hace 7 años","Complicada para minusvalidos."
"https://lh3.googleusercontent.com/a-/ALV-UjUcQmkhJdfQ87OwxgtCTsZpBw_aRyYlliVu2v4BZMYJ2ICiRn54=w45-h45-p-rp-mo-ba6-br100","kepa beltran","Local Guide · 593 reseñas · 1.300 fotos","Hace 3 años","No me gusta la zona"
"https://lh3.googleusercontent.com/a/ACg8ocKX0jgO9H4EMDK-5xXh4-JlpjTTwikYyOd5A4yZ2CjbRGXxyQ=w45-h45-p-rp-mo-ba4-br100","Javier","Local Guide · 40 reseñas","Hace 3 años","Popular"
"https://lh3.googleusercontent.com/a-/ALV-UjXRCWLrq4GF3YNPYuN5Z_iRPyJ5m5XdGbt3iz2A2Dbxuh7QWCuC3g=w45-h45-p-rp-mo-ba4-br100","Nuria Martínez SEPIE","Local Guide · 108 reseñas · 76 fotos","Hace 7 años","No adaptada para minusválidos"
"https://lh3.googleusercontent.com/a-/ALV-UjXgrjOPztGJuJMPNHcM2ptpWsl2w0rb1ee_k8SHScOXWSvARhpGkQ=w45-h45-p-rp-mo-ba6-br100","Tienda Esoterica, Fabricante el Alquimista","Local Guide · 748 reseñas · 318 fotos","Hace 4 años","Exelente"
"https://lh3.googleusercontent.com/a/ACg8ocKz-xh7IADqmOF6R2jNh1yi2r2t0u-OmKeg14qnalnMJF2mMQ=w45-h45-p-rp-mo-ba3-br100","Jose Sierra","Local Guide · 28 reseñas","Hace 7 años","Falta de aire acondisionado"
"https://lh3.googleusercontent.com/a-/ALV-UjUwpCTY9oR3tfTFnZeln0YxU-BVr6bR2qraL9VB582PGICnXwlt=w45-h45-p-rp-mo-ba3-br100","Anguel Higueras","Local Guide · 3 reseñas · 6 fotos","Hace 6 años","Depende."
"https://lh3.googleusercontent.com/a/ACg8ocKyBaVi_h8zhYCTOhHL0IEjrUB1iJEytDHhGm0-wdQWKbimOOzK=w45-h45-p-rp-mo-ba4-br100","Rosario Salvador Barjola","Local Guide · 71 reseñas · 47 fotos","Hace 5 años","Céntrico"
"https://lh3.googleusercontent.com/a-/ALV-UjXOCpZ-7JeWsGiJf7QIBYbgpkckt4CDTBFE-6YGkldCEZJC4tlv=w45-h45-p-rp-mo-ba5-br100","Alex Correa Orellana","Local Guide · 439 reseñas · 89 fotos","Hace 8 años","Deberían remodelarla"
"https://lh3.googleusercontent.com/a-/ALV-UjV8VM2Mtwt9ffCdYabILaM21oojK0H9A_OKrUE9VIdgezT5FQXI=w45-h45-p-rp-mo-ba5-br100","Pablo Richieri","Local Guide · 393 reseñas · 401 fotos","Hace 7 años","Es como su nombre. Estrecho!"
"https://lh3.googleusercontent.com/a-/ALV-UjWLj-C8O9wa9tuhO-g6ZRFiGCCZ4FB1i2Beu1FcUfeJ2uNW-u-V=w45-h45-p-rp-mo-ba6-br100","Pedro Antonio Rodríguez Ortiz","Local Guide · 564 reseñas · 4.569 fotos","Hace 5 años","Barrio con sabor"
"https://lh3.googleusercontent.com/a-/ALV-UjUDt7cP4UipzejREW9jpZpbbM2nysGiHj1fzBIZHyedJxTWYQgN=w45-h45-p-rp-mo-ba4-br100","Mikel Ruiz","Local Guide · 93 reseñas · 99 fotos","Hace 6 años","NO adaptada"
"https://lh3.googleusercontent.com/a-/ALV-UjVVuR5NEe4ZBPSlK9PYJckuV384IxgebJK0EqJUXNNfFkNmuulNWQ=w45-h45-p-rp-mo-ba6-br100","Angel Leonardo Rosillo Sierra","Local Guide · 632 reseñas · 2.156 fotos","Hace 7 años","Metro de Estrecho"
"https://lh3.googleusercontent.com/a-/ALV-UjXod9_LayFfM58xNLar9ltRUC-BJfXWfRvYRdY-GSfX-XIK9Qw7iw=w45-h45-p-rp-mo-br100","Ronaldo Garcia","5 reseñas · 8 fotos","Hace un año","Es un bonito lugar, hay muchos bares y tiendas de comestibles a la parrilla."
"https://lh3.googleusercontent.com/a-/ALV-UjX0hOR1GGfd-wy2Y87OdUYSZXIHcf7XGd3t4PhfZRPaBrSJdSM3=w45-h45-p-rp-mo-ba5-br100","Kevin Piña Calatrava","Local Guide · 729 reseñas · 375 fotos","Hace un año","¡Útil para encontrar muchos restaurantes!"
"https://lh3.googleusercontent.com/a-/ALV-UjVqQfhaGgq06zx-VxOzBieOi3dg-sAdfLgsNzWav5pVzfdOYlleZA=w45-h45-p-rp-mo-ba5-br100","Carlos Jiménez","Local Guide · 58 reseñas · 1.248 fotos","Hace 4 años","Nueva normalidad. Hay lugares para ayudar a mantener el distanciamiento social."
"https://lh3.googleusercontent.com/a-/ALV-UjW5ljXwGeSf-4KxMZfU4nGA6DEHDVoTKIE5sAmOInBaSDlyDiM=w45-h45-p-rp-mo-ba6-br100","VRKO","Local Guide · 287 reseñas · 506 fotos","Hace 2 años",""
"https://lh3.googleusercontent.com/a-/ALV-UjWVbGm-9SPyg9JZQkICX6H_kTAHfoniSxfIhSfhKb66CAXV7dJA=w45-h45-p-rp-mo-ba4-br100","Daniel Arriaga","Local Guide · 295 reseñas · 78 fotos","Hace un año","Metro"
"https://lh3.googleusercontent.com/a-/ALV-UjXEFlMjx2l6P7A503GjpPl_wpesk-VuRfKZIUABUKVBfCF18L0Ybg=w45-h45-p-rp-mo-br100","Carlos Alejandro García Mota","6 reseñas","hace 5 días",""
"https://lh3.googleusercontent.com/a-/ALV-UjXo8xudogly1ZjlZAUib7Kry4J3o1mB0tG6oUg-yeMFTGayQ8dv=w45-h45-p-rp-mo-ba3-br100","Bahar Uddin","Local Guide · 16 reseñas · 12 fotos","Hace 2 semanas",""
"https://lh3.googleusercontent.com/a-/ALV-UjUGBY2OIDdUaRV0yXAuEvOssESSEBCLdDnfFM5gAMpUz8v3a1Zn8g=w45-h45-p-rp-mo-ba4-br100","Karolina Avila","Local Guide · 79 reseñas","Hace 2 meses",""
"https://lh3.googleusercontent.com/a-/ALV-UjUJcfxbV80uZepf69KDZrY3pl2v2KkqXihUJ8yD-pYO1FE95Lar=w45-h45-p-rp-mo-ba3-br100","Rafael Moreno","Local Guide · 23 reseñas · 46 fotos","Hace 2 meses",""
"https://lh3.googleusercontent.com/a-/ALV-UjWZViXX9g2AaGtd7pJv7jY-tV_3Olrg7z7YmQ-CulGjrUJzS-7fzw=w45-h45-p-rp-mo-ba5-br100","angeles perez","Local Guide · 63 reseñas · 959 fotos","Hace 3 meses",""
"https://lh3.googleusercontent.com/a-/ALV-UjXJz0Xhd_YaihfrFD1jVT3OWCRynuGMrwFo-IAJFEBSzNdGQhw=w45-h45-p-rp-mo-br100","Denys Puga","1 reseña","Hace 3 meses",""
"https://lh3.googleusercontent.com/a-/ALV-UjWyttpAqwv0pvFUOmXjidt25GMHS7tOl2cu8788ZPZJ0CSanyAdiA=w45-h45-p-rp-mo-ba5-br100","Said Mnissar","Local Guide · 207 reseñas","Hace 5 meses",""
"https://lh3.googleusercontent.com/a/ACg8ocIACuQKNCtkPS9kSWUU7lOXAb6LjCv82LJxIFmMzoUlSYOYOw=w45-h45-p-rp-mo-ba5-br100","Juan Von Luck","Local Guide · 83 reseñas · 780 fotos","Hace 6 meses",""
"https://lh3.googleusercontent.com/a-/ALV-UjX3D2k_QXfOJGTcYB3P395CzYVGhkgt1lQeIjiOwNiqZkGCf6st1Q=w45-h45-p-rp-mo-ba5-br100","Inmaculada Guijarro","Local Guide · 127 reseñas · 86 fotos","Hace 8 meses",""
"https://lh3.googleusercontent.com/a-/ALV-UjVgxfOlUQPjAm_T272WAkJEpguL_4FVU4PomH1qtSs4gbjKaN2D=w45-h45-p-rp-mo-ba4-br100","Robert Honeywell","Local Guide · 84 reseñas · 99 fotos","Hace 9 meses",""
"https://lh3.googleusercontent.com/a-/ALV-UjWud7hArdY5V9_Y8q3lkrzInXxbXM-0K4gYinoHdc4ldoH0FjTW=w45-h45-p-rp-mo-ba4-br100","Antonio Revilla","Local Guide · 163 reseñas · 83 fotos","Hace 10 meses",""
"https://lh3.googleusercontent.com/a-/ALV-UjWvQeeetnLhNN6m83YYn7noh7W6TG5h6NjoYUBNUJE-gK2Xvvi6vw=w45-h45-p-rp-mo-ba5-br100","María Calle Santiago","Local Guide · 151 reseñas · 566 fotos","Hace 11 meses",""
"https://lh3.googleusercontent.com/a-/ALV-UjUa4sqvW5Ma_61Qx0Cu4kWcQi7rYnZpTr0FXmlRR9wHSy-YDmfR=w45-h45-p-rp-mo-ba6-br100","LA LOLA","Local Guide · 457 reseñas · 1.918 fotos","Hace un año",""
"https://lh3.googleusercontent.com/a/ACg8ocL-J966hMJ2SqOcWVtsUezej0wuKoUyThEWLAkWRWoNEYBxqxk=w45-h45-p-rp-mo-ba4-br100","Isa Pérez Ramos","Local Guide · 17 reseñas · 22 fotos","Hace un año",""
"https://lh3.googleusercontent.com/a-/ALV-UjWWxV-MUbwKD0xkxAG10R6pmfHVIMZN2vaUN084nw81Yv5eZ9co=w45-h45-p-rp-mo-ba3-br100","Juan Pablo Morales Torres","Local Guide · 12 reseñas · 82 fotos","Hace un año",""
"https://lh3.googleusercontent.com/a-/ALV-UjWbKaOvzD3pVe1x3HISw37TjydNG5w5qm6qYVsCObgYRoJBKq87=w45-h45-p-rp-mo-ba5-br100","participante","Local Guide · 302 reseñas · 72 fotos","Hace un año",""
"https://lh3.googleusercontent.com/a-/ALV-UjVtoeq2t7habBGj97_N8RA_Woa7U5NaM4N1OXtxfkc9QetPq0QuPQ=w45-h45-p-rp-mo-ba4-br100","Sanders Michell","Local Guide · 51 reseñas · 52 fotos","Hace un año",""
"https://lh3.googleusercontent.com/a/ACg8ocIW5wTekoihZ427-D8ViLHQQzpcq2OTJa1AdZoyg3YqnqF7ug=w45-h45-p-rp-mo-ba3-br100","Jose Manuel","Local Guide · 18 reseñas · 41 fotos","Hace un año",""
"https://lh3.googleusercontent.com/a/ACg8ocJvDxatU5jqwAcB1v9GT6Io6zcxDOaAEBZ6clFQQdoAvlfXNQ=w45-h45-p-rp-mo-ba5-br100","mar garcia gomez","Local Guide · 130 reseñas · 84 fotos","Hace un año",""
"https://lh3.googleusercontent.com/a-/ALV-UjVCnbtoahQSiVBtWNgVzAfDbUV4-cFIxFVGGUjG-o4uwTgQyW4X=w45-h45-p-rp-mo-ba4-br100","Pelayo Jardón Pardo de Santayana","Local Guide · 68 reseñas · 124 fotos","Hace un año",""
"https://lh3.googleusercontent.com/a-/ALV-UjWjyexrj1gkJqx5rZbc_6bwla5TbJSUV0CasOKlvgL_teQalfzW=w45-h45-p-rp-mo-ba4-br100","Raquel Hoyos Ballescas","Local Guide · 145 reseñas · 1 foto","Hace un año",""
"https://lh3.googleusercontent.com/a-/ALV-UjWZbYuNCNdr174hHsW7LthGCLpsy4gwszDQJM4CHSUlkvcCHPVexg=w45-h45-p-rp-mo-ba5-br100","Nilza Carmona","Local Guide · 78 reseñas · 1.279 fotos","Hace un año",""
"https://lh3.googleusercontent.com/a-/ALV-UjXbswQSrQagdrQDj1p330EMAHdjsOC2Vvclkc6jYC6jLz_wA1gN=w45-h45-p-rp-mo-ba4-br100","Yurany H.","Local Guide · 2 reseñas","Hace un año",""
"https://lh3.googleusercontent.com/a-/ALV-UjUh9VSaTi0FwhkCmQjxS3xCTTllQDe0Yddksga-8iEySjmXaG7U=w45-h45-p-rp-mo-ba4-br100","Alberto Piccininno","Local Guide · 119 reseñas · 2 fotos","Hace un año",""
"https://lh3.googleusercontent.com/a-/ALV-UjXASB5uRjMTAXTM3_Z6K7zL-DfQLh_WALIv-8QCzrVhQC3xJXrE=w45-h45-p-rp-mo-ba5-br100","Cactus lee","Local Guide · 404 reseñas · 1.016 fotos","Hace 2 años",""
"https://lh3.googleusercontent.com/a/ACg8ocL6IpD4ZXqjaOv7571GkB1Da822tRd3q1_qpXkJf6K82Xdg-w=w45-h45-p-rp-mo-br100","guillermo sarcos","8 reseñas · 1 foto","Hace 2 años",""
"https://lh3.googleusercontent.com/a-/ALV-UjW47maHh3xxxeraaTyozP2l96Jgi9-jRvzCFW2G9xqQZhBGT0G0=w45-h45-p-rp-mo-ba7-br100","Cesar Maillo","Local Guide · 608 reseñas · 5.514 fotos","Hace 2 años",""
"https://lh3.googleusercontent.com/a-/ALV-UjXkYOfFwlufK5saFknfrCQrD2DbRmahNwvtyfogDV4wu-HVpRyHqw=w45-h45-p-rp-mo-ba5-br100","Javier Zamora","Local Guide · 14 reseñas · 300 fotos","Hace 2 años",""
"https://lh3.googleusercontent.com/a/ACg8ocIdmgKJyL_yG55gTm8OU20JkekEOmX68eLcjZ0z1NFdcsqX=w45-h45-p-rp-mo-ba5-br100","Marga Segura","Local Guide · 107 reseñas · 192 fotos","Hace 2 años",""
"https://lh3.googleusercontent.com/a-/ALV-UjWcli4xlfb_g8WvikQilhbeBABYtSchP99oSu_QKSUhXQiZy9N4=w45-h45-p-rp-mo-ba5-br100","Mary Katherine Tarcita Robles","Local Guide · 11 reseñas · 1.100 fotos","Hace 2 años",""
"https://lh3.googleusercontent.com/a/ACg8ocJyPL5-EitGP-XWE4Kq3X3OdmQ_IIlRy4Ixias2n_9alXMLEw=w45-h45-p-rp-mo-ba4-br100","sulmy maria martinez","Local Guide · 50 reseñas · 177 fotos","Hace 2 años",""
"https://lh3.googleusercontent.com/a-/ALV-UjUc07p-zzeunVNLtZk6q17FP1FtjczI4mljY7QMrsyySAEDzpXaxQ=w45-h45-p-rp-mo-ba3-br100","Patrice Emery","Local Guide · 21 reseñas · 113 fotos","Hace 2 años",""
"https://lh3.googleusercontent.com/a-/ALV-UjVAq_yUiwaIA97WJjeHFrWm30CuKK6TX6QGwAhybRcZgmAD9B4=w45-h45-p-rp-mo-ba5-br100","Nairobys Jimenez","Local Guide · 157 reseñas · 200 fotos","Hace 2 años",""
"https://lh3.googleusercontent.com/a/ACg8ocJQYeUmMtsabOIYqAym1xJrA0gLmOWDZzxYOq8UtOIz6bOVKg=w45-h45-p-rp-mo-ba4-br100","Marina LC","Local Guide · 123 reseñas · 95 fotos","Hace 2 años",""
"https://lh3.googleusercontent.com/a-/ALV-UjUUykC2I145kmNKFdTbX4UVRxp1-CVbw3JWrSnAnb0DlAnkzaoOnw=w45-h45-p-rp-mo-ba4-br100","Jorge Pérez Antolín","Local Guide · 84 reseñas","Hace 2 años",""
"https://lh3.googleusercontent.com/a-/ALV-UjWHk_QipfxqJnp6TTr4N2el6UoqHJXf5FQANwDiMY1YJBVgQ56RtA=w45-h45-p-rp-mo-ba4-br100","Javi","Local Guide · 100 reseñas · 455 fotos","Hace 3 años",""
"https://lh3.googleusercontent.com/a/ACg8ocImZCBq5y3Rmpvrq1miDZ_JvhAlplereFrkju0bu3K6fAvVaA=w45-h45-p-rp-mo-ba4-br100","Um Er","Local Guide · 17 reseñas · 5 fotos","Hace 3 años",""
"https://lh3.googleusercontent.com/a/ACg8ocJYn0q7Nn0tReEjj0WlWevg_WQ9ciuVZz_MpWNnt6riZKJubA=w45-h45-p-rp-mo-ba4-br100","ZOILA LUZ ARIZA ALVAREZ","Local Guide · 65 reseñas · 28 fotos","Hace 3 años",""
"https://lh3.googleusercontent.com/a/ACg8ocJaLMmCsWPaQM4zDr0nDHgb7gw6xGSYxAeUYOvJMAC4DY6EZg=w45-h45-p-rp-mo-ba3-br100","Alvaro Rodriguez","Local Guide · 7 reseñas","Hace 3 años",""
"https://lh3.googleusercontent.com/a/ACg8ocKA6P1Y0Hcuvk4Vd7yRx7AsIRsJu1ZQCaTRgDJwPltuvFH1p7L3=w45-h45-p-rp-mo-ba3-br100","Dahiana Belen Echeverria Bogarin","Local Guide · 11 reseñas · 11 fotos","Hace 4 años",""
"https://lh3.googleusercontent.com/a/ACg8ocI5S-ZUqguchcFNTWSZdX_7J17SeANzvl5-_phaZwFCUy8QIyAp=w45-h45-p-rp-mo-ba6-br100","Analyn fernandez","Local Guide · 29 reseñas · 2.774 fotos","Hace 4 años",""
"https://lh3.googleusercontent.com/a-/ALV-UjW9uS2CGAaAbh0_fGcllPRdl5N2f3LbnFxQH1AfxZLFkD8GWbe2=w45-h45-p-rp-mo-ba6-br100","YangHung Chang","Local Guide · 536 reseñas · 862 fotos","Hace 4 años",""
"https://lh3.googleusercontent.com/a-/ALV-UjXvDX2va4yHepfofDCLNVGpi-S9n0tfCPoStHjPhmSlLnvp-GrBMQ=w45-h45-p-rp-mo-ba8-br100","Andres Celada","Local Guide · 1.223 reseñas · 25.163 fotos","Hace 4 años",""
"https://lh3.googleusercontent.com/a/ACg8ocJt7GN2x20Wp-YjZncxEORbBZAckVXm3KqOyZYf1imGyQ-_tg=w45-h45-p-rp-mo-ba4-br100","Guille Willy","Local Guide · 30 reseñas · 194 fotos","Hace 4 años",""
"https://lh3.googleusercontent.com/a/ACg8ocI1SE116puYJ12kCWzWVXumyUGpJuFjzssPBvBA0INIjhjrCQ=w45-h45-p-rp-mo-br100","Ricardo Bogarin","2 reseñas · 4 fotos","Hace 4 años",""
"https://lh3.googleusercontent.com/a-/ALV-UjU_CibVmMV1s55KsuIspJrwdB1ddwKUlowesqHzrvElHkeWXhQ=w45-h45-p-rp-mo-ba5-br100","David J. Sánchez-C.J.","Local Guide · 242 reseñas · 54 fotos","Hace 5 años",""
"https://lh3.googleusercontent.com/a-/ALV-UjWKZr43KdwSLEW1vezo9GUfO9tc5pFQiyI9xowOi120DmUO5qtTAQ=w45-h45-p-rp-mo-ba4-br100","Aurora Dilidili M.","Local Guide · 71 reseñas · 124 fotos","Hace 5 años",""
"https://lh3.googleusercontent.com/a-/ALV-UjW-EdDIcr3qaT27tgwpMrc0lXV5aeM5NHTI_x8vpcWvLbo_0v5u2w=w45-h45-p-rp-mo-ba3-br100","Romina Marando","Local Guide · 6 reseñas · 150 fotos","Hace 6 años",""
"https://lh3.googleusercontent.com/a-/ALV-UjX0U1Ok5_nuzgV92Ut9cp_I3iKJ9R1AK6WkSsEX9-KOxunTki7p=w45-h45-p-rp-mo-br100","Esmael 19","2 fotos","Hace 6 años",""
"https://lh3.googleusercontent.com/a-/ALV-UjWfftIAaJf18_4Uk8k3yAOkPYDxgRpvJ-W6zpsJX8AxOMnlZNeM=w45-h45-p-rp-mo-ba4-br100","Jaime Martín Prieto","Local Guide · 84 reseñas · 4 fotos","Hace 6 años",""
"https://lh3.googleusercontent.com/a-/ALV-UjUiwCRLEx2zzNimMacWBH2Z_4hpOUkeRGgYl6TmB3emZhFv-sW4qA=w45-h45-p-rp-mo-ba4-br100","Konysita","Local Guide · 53 reseñas · 88 fotos","Hace 6 años",""
