"URL","Usuario","Info","Fecha","Reseña"
"https://lh3.googleusercontent.com/a-/ALV-UjXO9ugZGmxnfMMpfy8CAXjDXXo0E1YiW0qcCp3-oEcEzjPajLoN=w36-h36-p-rp-mo-ba5-br100","Chloe y Lucas","Local Guide · 175 reseñas · 555 fotos","Hace 6 años","Tiene accesibilidad...eso lo hace una estación de 5 estrellas.. es inadmisible que en estas fechas aún sigamos con estaciones sin ascensores o escaleras mecánicas. Esta algo descuidada  y es algo estrecha, pero cumple con su propósito satisfactoriamente. Estación que debes tomar si quieres ir a la playa de Madrid Río"
"https://lh3.googleusercontent.com/a-/ALV-UjWzblVqaRNmVRZy7VBAiDE_T0ZAqJ6D08ws2wqDx56tN-2Uyqj7=w36-h36-p-rp-mo-ba5-br100","Guillermo Musica _","Local Guide · 286 reseñas · 228 fotos","Hace un mes","### UBICACIÓN Y ACCESIBILIDAD
LA ESTACIÓN DE METRO PIRÁMIDES SE ENCUENTRA EN EL DISTRITO DE LA LATINA, AL SUROESTE DE MADRID. ES UNA ESTACIÓN DE INTERCAMBIO CLAVE QUE FORMA PARTE DE LAS LÍNEAS 5 Y 10 DEL METRO.

### DISEÑO Y ESTRUCTURA
PIRÁMIDES PRESENTA UN DISEÑO FUNCIONAL CON VARIAS ENTRADAS Y SALIDAS BIEN SEÑALIZADAS. LA ESTACIÓN ESTÁ EQUIPADA CON ESCALERAS MECÁNICAS Y ASCENSORES, FACILITANDO EL ACCESO A PERSONAS CON MOVILIDAD REDUCIDA Y OTROS USUARIOS.

### SERVICIOS Y COMODIDADES
- **CONECTIVIDAD:** COMO NODO DE INTERCAMBIO ENTRE LAS LÍNEAS 5 Y 10, PIRÁMIDES OFRECE UNA EXCELENTE CONECTIVIDAD. ESTO PERMITE A LOS USUARIOS TRANSFERIRSE FÁCILMENTE ENTRE ESTAS DOS LÍNEAS Y ACCEDER A DIFERENTES ÁREAS DE MADRID.
- **ENTORNO:** LA ESTACIÓN ESTÁ SITUADA EN UNA ZONA RESIDENCIAL Y COMERCIAL, CON ACCESO A VARIOS SERVICIOS COMO TIENDAS, RESTAURANTES Y EL CENTRO COMERCIAL PLAZA DE LA VID. TAMBIÉN ESTÁ CERCA DE ESPACIOS VERDES Y ÁREAS DE RECREO.
- **SEGURIDAD:** PIRÁMIDES ESTÁ BIEN VIGILADA CON CÁMARAS DE SEGURIDAD Y PRESENCIA DE PERSONAL DE SEGURIDAD, LO QUE PROPORCIONA UN ENTORNO SEGURO PARA LOS USUARIOS.

### EXPERIENCIA DE USUARIO
LOS USUARIOS VALORAN LA ESTACIÓN DE PIRÁMIDES POR SU FUNCIONALIDAD Y SU BUENA CONEXIÓN ENTRE LÍNEAS. LA LIMPIEZA Y EL MANTENIMIENTO SON ADECUADOS, Y LA SEÑALIZACIÓN ES CLARA, LO QUE FACILITA LA NAVEGACIÓN. LAS MÁQUINAS EXPENDEDORAS DE BILLETES Y LOS PUNTOS DE INFORMACIÓN SON ACCESIBLES Y ÚTILES.

### OPINIÓN GENERAL
PIRÁMIDES ES UNA ESTACIÓN CLAVE EN LA RED DE METRO DE MADRID, DESTACADA POR SU FUNCIONAMIENTO COMO NODO DE INTERCAMBIO ENTRE LAS LÍNEAS 5 Y 10. SU UBICACIÓN EN UNA ZONA RESIDENCIAL Y COMERCIAL, JUNTO CON SU FUNCIONALIDAD Y ACCESIBILIDAD, LA HACE UNA PARADA POPULAR Y CONVENIENTE PARA LOS VIAJEROS.

EN RESUMEN, LA ESTACIÓN DE METRO PIRÁMIDES ES UNA PARADA EFICIENTE Y BIEN EQUIPADA QUE OFRECE UNA CONEXIÓN ÓPTIMA ENTRE DIFERENTES LÍNEAS DEL METRO Y PROPORCIONA UNA EXPERIENCIA DE USUARIO POSITIVA GRACIAS A SU DISEÑO FUNCIONAL Y LA PROXIMIDAD A DIVERSOS SERVICIOS."
"https://lh3.googleusercontent.com/a-/ALV-UjW3jX9zWkkQwYG3AwM0UgpglZNA0P_6Tjqm88Ol-PBpBAkTHtVV=w36-h36-p-rp-mo-ba5-br100","George I. King","Local Guide · 343 reseñas · 502 fotos","Hace 4 años","Me sorprende como a partir de ciertas hora las estaciones parecen abandonadas. Llegue a la estacion de Piramides para cojer linea 5. Baje por las escaleras de la estacion y vi q la puerta de la entrada del metro esta cerrada con otra puerta de hiero. No habia ningun cartel ni nota informativa. Me preocupe q me he quedado sin transporte. Fui a preguntar a la ventanilla de Cercanias Renfe, pero no habia nadie. Tampoco se veían vigilantes de seguridad, nadie. Logo fijándome en la app de maps me entere que el metro tiene otra entrada bajando por la misma calle hacia el rio. Cuando ya estaba en el vestibulo me fije en los carteles informativos y vi q no habia ni una nota informativa o señal q la otra entrada la cierran pronto como suelen poner en otras estaciones del metro. Perdi el tren que tenia previsto cojer y tuve que esperar el siguente tren que tardo en llegar mas de 15min y asi se me retraso toda la noche. Bueno nada grave, pero mi sorpresa es como en una estacion centrica que conecta metro con renfe no hay ningun empleado de ninguna las dos empresas . Ni vigilantes? Y la seguridad del viajero? Por los precios que nos cobran el servicio hay q tener de nivel, o por lo menos cumplir lo basico."
"https://lh3.googleusercontent.com/a/ACg8ocLtqUXqUa-Ri_yFjKWT7oT6BgEEgqpSBpdtiYiK1lsm-hweruw=w36-h36-p-rp-mo-ba6-br100","T","Local Guide · 343 reseñas · 809 fotos","Hace 7 meses","Pirámides es un intercambiador de transporte situado, pese a lo que su nombre sugiere, bajo el Paseo de las Acacias de Madrid, en las proximidades de la glorieta de Pirámides y el antiguo Estadio Vicente Calderón. Confluyen en esta estación la Línea 5 del Metro de Madrid, y las líneas C-1 y C-10 de Cercanías Madrid. En el pasado, se intentó cambiar de nombre la estación, denominándola como Vicente Calderón, dada la proximidad al estadio homónimo, o como Jesús Gil, como homenaje al expresidente del Atlético de Madrid, siendo la primera la opción que ha sido más solicitada."
"https://lh3.googleusercontent.com/a-/ALV-UjUi3gk6EseD8H9N5EgD_K3h-lIFTuS_HNze95WUXeoSlRhFBvjy=w36-h36-p-rp-mo-ba3-br100","Bea mhi","Local Guide · 37 reseñas · 3 fotos","Hace un año","Siempre horrible. Trenes que no llegan, eso no es culpa de la estación pero por señalarlo . El personal no es nada agradable, al menos los que me han atendido a mí que han sido varios porque es la estación más cercana a mi casa, te atienden de mala gana y sin dar información concreta. Y cuando llueve te mojas si estás dentro."
"https://lh3.googleusercontent.com/a-/ALV-UjWOxQ_bizQmLz3PNkUIGFgGw1wjcaW2A7gkFY6nB24zkIHRg_87eg=w36-h36-p-rp-mo-ba3-br100","Jerry Blanco","Local Guide · 66 reseñas · 25 fotos","Hace 2 años","Zona  tranquila  segura comercios cercanos hoteles disponibles por la zona  calles bien  cuidadas aunque para comprar un apartamento algunos realmente están  sobrevalorados hasta cerca y muy cerca del  millón de euros hahahahaha"
"https://lh3.googleusercontent.com/a/ACg8ocJlGGuJQY5stKcDrDJHUTUqo8r0CZYeAUjq_20v5uK76pXUUg=w36-h36-p-rp-mo-ba3-br100","Raquel Soriano Espinosa","Local Guide · 24 reseñas · 1 foto","Hace 2 meses","No encontré la entrada para sillas de ruedas, no hay señalización suficiente"
"https://lh3.googleusercontent.com/a-/ALV-UjWBbwZ3NMWVVCwqIz5ew4JqPjlwKlyRmc1Np3_k9j_sHRMyep3t1A=w36-h36-p-rp-mo-ba8-br100","Blacky. (Blacki.)","Local Guide · 406 reseñas · 36.936 fotos","Hace 2 meses","Un lugar emblemático para Madrid."
"https://lh3.googleusercontent.com/a-/ALV-UjWuxLEtAytpi81fcjTzLHqfis-xXM8zzDZTbOfVMZ9JTIzmKgIC=w36-h36-p-rp-mo-br100","Harry Daswani Armas","26 reseñas · 17 fotos","Hace 9 meses","Conexiones muy buenas pero horarios muy malos, no respeta ninguno. Siéntate y espera porque nunca llega a su hora.

Consejo: Ve con antelación y no vayas con prisas porque siempre llegarás tarde"
"https://lh3.googleusercontent.com/a-/ALV-UjVPlI3_WxZ-JbiFDSG6A1n_aKR_BFRpvuYb0hLgejNuccGQun5Z=w36-h36-p-rp-mo-ba8-br100","José Julio Melgares","Local Guide · 2.805 reseñas · 12.351 fotos","Hace 7 años","Estación de Cercanías de Renfe y de Metro de Metro de Madrid. Muy transitada cuando hay algún evento en el estadio Vicente Calderón."
"https://lh3.googleusercontent.com/a/ACg8ocIvLlIIEhtvoc3-o5yR1mp3-r6JQhUWSX24jLXqdEqMIMuHZg=w36-h36-p-rp-mo-ba2-br100","Antonio Ojeda","Local Guide · 23 reseñas","Hace 3 meses","Vergonzoso, no hay un viernes que funcione el cercanías en tiempo..."
"https://lh3.googleusercontent.com/a/ACg8ocJHPZ4BoZqBazPWJa9LZl5BOM04_2rFnGFz9a2Yb2uKgLPduA=w36-h36-p-rp-mo-ba3-br100","Johen Bottaro","Local Guide · 85 reseñas · 32 fotos","Hace 3 años","A cada semana que pasa de este año los trenes van llegando un minuto más tarde que increíble como jueguen con los horarios de las personas! Eso si cada fin o inicio de mes nunca faltan los revisores con mucha multa pero poca información y ayuda para el usuario y no toco el tema de los aforos porque ya está más que claro que les importa nada"
"https://lh3.googleusercontent.com/a-/ALV-UjXauPUQGEtcVe7cNo10DrziJrbUiCApN7OI_3WZoIHsLqsTBU8=w36-h36-p-rp-mo-br100","Alberto Navarro","20 reseñas · 2 fotos","Hace 8 meses","No se cumple ningún horario de los programados. La estación de cercanías en un desastre. Sin información, sin apenas personal"
"https://lh3.googleusercontent.com/a-/ALV-UjWPg7ctfVUYnzFfqxsU6VqKp52WUWpUfJ5jrDI-hvmKR_rBzJr5=w36-h36-p-rp-mo-ba4-br100","Francisco Muñoz Malpartida","Local Guide · 35 reseñas · 656 fotos","Hace 5 años","Estación algo antigua, pero por lo menos cumple con su función. En el caso de cercanías Renfe, los trenes si son modernos, puntuales y rápidos. Un aspecto que se debe mejorar es que una vez intenté comprar agua en las maquinas expendedoras de los andenes, y estaban todas fuera de servicio!"
"https://lh3.googleusercontent.com/a-/ALV-UjVOdYmNBy9iLvsfFnuRJ9Y7rOmzbdWnQAhR4cOJ75p81iTL9hcCZw=w36-h36-p-rp-mo-ba4-br100","Orisbel Fuentes","Local Guide · 74 reseñas · 499 fotos","Hace un año","Estación de metro y de Renfe Cercanías de Madrid de lujo como no puede ser diferente da gusto viajar en metro por Madrid se anda rápido y economico si tienes tarjeta de abono de transporte público si no la tienes pues no es tan barato pero sigue siendo funcional"
"https://lh3.googleusercontent.com/a-/ALV-UjVoW2YOMtjZRDUNgcQaNkxrFh1_8t-BQ6eKxN3oQB6Mb-fyh0t2=w36-h36-p-rp-mo-ba4-br100","R N","Local Guide · 89 reseñas · 26 fotos","Hace 3 años","Casi siempre que he ido no hay nadie en la taquilla, y por una vez tuvimos suerte y había alguien.
Queríamos comprar un billete con puntos de Renfe y la máquina nos daba error, fuimos a la ventanilla y se le expliqué al comercial que queríamos comprarlo con puntos a lo que me respondió: yo no puedo mirar cuántos puntos tienes.
Después de mucho insistirle le convencí para que intentara hacer la venta con puntos, y finalmente  pudimos. ¿Tanto costaba intentarlo sin protestar? No veo que tengan tanto trabajo.. luego que si se pierden puestos de trabajo por las máquinas, al menos éstas no ponen malas caras"
"https://lh3.googleusercontent.com/a-/ALV-UjU370A-AEGn0mwIaLQY4aymQDu2UbWyYcXb1phHtcLsmYykbpY=w36-h36-p-rp-mo-ba7-br100","Javier V.R","Local Guide · 591 reseñas · 1.821 fotos","Hace 9 meses","Estación cercana a Madrid Río, bastante accesible gracias a su ascensor lateral que permite llegar a la planta de acceso en la zona de vías."
"https://lh3.googleusercontent.com/a-/ALV-UjUhIeVqe8LCRjUGwf53B6TmMUrAqOKPK9lDNUtvswp8OSb8zdtDMQ=w36-h36-p-rp-mo-ba5-br100","Jesús Martínez Polo","Local Guide · 155 reseñas · 1.171 fotos","Hace un año","Es una glorieta con mucho tráfico. No hay servicios públicos ni fuente de agua potable. Un sitio de paso."
"https://lh3.googleusercontent.com/a-/ALV-UjWayWyNqNOT-60T4TsX24ye92XluiV_nrzlNaI82tSK6YLgHbQ=w36-h36-p-rp-mo-ba6-br100","francisco guevara","Local Guide · 221 reseñas · 4.608 fotos","Hace 3 años","Renfe muy buena ubicación rápido acceso para las afueras de Madrid, y las 5 estrellas las coloco por el sistema de escaleras mecánicas que se paran automáticamente al salir de ellas y arrancan apenas al subir"
"https://lh3.googleusercontent.com/a-/ALV-UjXAM9ZwCGiASgWLTtzcGE9zkvFq1fN2glAGqCH6Ld9SF2fPqZ49Dw=w36-h36-p-rp-mo-ba5-br100","Laura Trujillo","Local Guide · 230 reseñas · 561 fotos","Hace un año","Parada de la línea 5 en Madrid , entre Marqués de Vadillo y Puerta de Toledo . Suele estar bastante concurrido ."
"https://lh3.googleusercontent.com/a-/ALV-UjWkHP_20xsCe8to6QM0UmNp5bvGFrwfCpPPDo9QLn7AgMdc9K7M=w36-h36-p-rp-mo-ba4-br100","Raul Monreal","Local Guide · 130 reseñas · 7 fotos","Hace un año","Una estación muy bien ubicada cerca de Madrid rio y con buen acceso."
"https://lh3.googleusercontent.com/a-/ALV-UjUNT0k2l2V2xXN6dXckEcbcCzNWB_6d8Qkwom4a3OehiCS45BE60g=w36-h36-p-rp-mo-ba6-br100","Maxi Gala","Local Guide · 690 reseñas · 3.134 fotos","Hace un año","Pasan pocos trenes,cuesta ver la entrada del metro cuando sales del cercanias.
Material antiguo"
"https://lh3.googleusercontent.com/a/ACg8ocI7Ok8jcnXjIoV_vplKd_yCkTOUyFxXUZ6Mbg7OhCGiO-WQ2Q=w36-h36-p-rp-mo-br100","Jeison Cantarero","5 reseñas","Hace 11 meses","La peor estación viene cuando le da la gana cada 20 o media hora viene un tren"
"https://lh3.googleusercontent.com/a/ACg8ocKOdgnXz0BdWSyZt4aCs3zqv75JIUWRd5dLOiI-zQdvjDzzmQ=w36-h36-p-rp-mo-br100","Joan Jar","1 reseña","Hace 7 años","Situación excelente, trato personal recepción  magnífico servicio desayuno extraordinario relación calidad precio situación  y trato humano destacan le no se puede pedir más  aún  hotel de este nivel, gracias por el trato demostrado"
"https://lh3.googleusercontent.com/a-/ALV-UjWUIKAEGWLFw7u_x1jHeZAV1HTm6MHD4udTgefvQwj2mEd8jFJ0=w36-h36-p-rp-mo-ba4-br100","Felix figueroa lugo","Local Guide · 161 reseñas · 196 fotos","Hace 4 años","Una estación bien ubicada y limpia"
"https://lh3.googleusercontent.com/a-/ALV-UjWgSmYTTWgD5sacMeA0n6fjzI5VyBDHv0pg240UuJQquiwDmTaOZA=w36-h36-p-rp-mo-ba6-br100","Alicia García Ramírez","Local Guide · 367 reseñas · 595 fotos","Hace 2 años","Estación de renfe cercanías de Madrid, que tiene conexión con la linea 5 de metro. Un poco oscura, pero bien señalizada"
"https://lh3.googleusercontent.com/a-/ALV-UjXrqU0mLlh_v7Pfgl6IAE7YJQxVsHngAI7iMkR3UCXNFmNqPgcvHA=w36-h36-p-rp-mo-ba4-br100","Juan Luengo","Local Guide · 171 reseñas · 269 fotos","Hace 6 años","Es la boca de metro que más utilizo principalmente por las opciones que te da. Tienes el cercanias y el metro línea 5 la cual pasa por los principales lugares del centro y tiene prácticamente todas las líneas para hacer transbordo. Además los trenes pasan muy amenudo"
"https://lh3.googleusercontent.com/a-/ALV-UjXzvAqaMonQrGiUPzE80wQS0EZTzIqxoqR9oMpaqzvbqvqvhhX_=w36-h36-p-rp-mo-ba5-br100","Oscar Cia","Local Guide · 447 reseñas · 71 fotos","Hace 2 años","Como toda la Red de cercanías una basura, va mal no cumplen con los horarios. A ver lo habren ya a la competencia."
"https://lh3.googleusercontent.com/a/ACg8ocJ4saLd5jylejM5CWv8ZGgQQ78afBPlWMtyM0ZzVCilToZWtPZy=w36-h36-p-rp-mo-br100","w. sáiz","2 reseñas","Hace 9 meses","mala experiencia m vasila
no lleva a dosde 😠😠…"
"https://lh3.googleusercontent.com/a-/ALV-UjWdX3tAK1ZJlSEdh8h8NGSBOAWGhVcUa-CtxrL2cSRL-XqgIQzj=w36-h36-p-rp-mo-ba8-br100","Ma Ca","Local Guide · 1.250 reseñas · 21.908 fotos","Hace 6 años","La estación es un poco antigua, al menos tiene ascensores y comunica con el metro de pirámides (línea 5). Suelen pasar con bastante frecuencia"
"https://lh3.googleusercontent.com/a/ACg8ocL6j3fUjdHjzglCFPCFitAnCJ2BggebpG8jNROfZWVFbqChuA=w36-h36-p-rp-mo-ba4-br100","Rocio Rodrigo Rubio","Local Guide · 276 reseñas","Hace 6 años","Pirámides es una estación de tren y metro de Madrid de cercanías RENFE C1 C7 C10 y del metro de Madrid línea 5 en las proximidades de la glorieta de pirámides y el estadio Vicente Calderón en el paseo de las acacias en Madrid España"
"https://lh3.googleusercontent.com/a-/ALV-UjWs999LSqUdG8tn4XxRQ-Skjspz3xu4OHYwjLedC9Qu85xk9QBo=w36-h36-p-rp-mo-ba4-br100","Teresa Medina Cano","Local Guide · 96 reseñas · 1 foto","Hace 11 meses","Un buen hotel , con magnífico desayuno ...."
"https://lh3.googleusercontent.com/a/ACg8ocIppS3zVaqZ9ZbeRTLwGHX9f4vgY0__9Rb2gOjyxRFkvLtPFg=w36-h36-p-rp-mo-ba6-br100","eduardo laguna","Local Guide · 463 reseñas · 441 fotos","Hace un año","Accesible tiene renfe y metro en la misma estacion"
"https://lh3.googleusercontent.com/a-/ALV-UjXbMGYuVVfnejwkb-ZizSvHZx6B32ZjzGFQjY_pEVncnboxwfKs=w36-h36-p-rp-mo-ba5-br100","Jose Manuel Martínez Gil","Local Guide · 782 reseñas · 12 fotos","Hace 6 años","Muy buena estación, intercambiador de lujo, renovada, con todo, aparte de conexión con la L5."
"https://lh3.googleusercontent.com/a-/ALV-UjVIIg4M4U2HtDXK_dOXRByy0qT71_eJdue2kgpcn5mAITS2IS2JFg=w36-h36-p-rp-mo-br100","Isidro","616 reseñas","Hace 7 años","El fugaz recuerdo de que por estas vías, que unían las antiguas estaciones del Norte, Imperial, Peñuelas, Delicias y Atocha, hace años, solo pasaban largos trenes de mercancías."
"https://lh3.googleusercontent.com/a/ACg8ocJyan8yiZQeMqcywRY2SRONar_J6dVYml-MFFV_QZwAIaM80A=w36-h36-p-rp-mo-ba5-br100","Ri Rodriguez","Local Guide · 198 reseñas · 187 fotos","Hace 7 años","Esta estación cuenta con cercanías, metro L5 y paradas de autobuses en la misma puerta."
"https://lh3.googleusercontent.com/a/ACg8ocKgsWXpCHM36phswFJY6t4ZHvGndeAQGQmQkyNMQQdSBhXSXA=w36-h36-p-rp-mo-br100","alejandro sanchez prieto","2 reseñas","Hace 2 años","Siempre con retraso es frustrante 😤 el abono no se retrasa ni un día para cobrarte…"
"https://lh3.googleusercontent.com/a/ACg8ocLnRSYjyR97lRgZoBlnoGcJ0ULEA1bQLOYuvcz69V_TI4MIdQ=w36-h36-p-rp-mo-br100","lilian vega","7 reseñas","Hace un año","Los problemas y discapacidades del personal no les da derecho a tratar mal y con chulería a los usuarios."
"https://lh3.googleusercontent.com/a/ACg8ocJBaJHn9LoUZz4JyYWKqT0lyXE6v7tB5Q-Uuq69mO_aB_Gd_jU=w36-h36-p-rp-mo-ba5-br100","martin biggi","Local Guide · 466 reseñas · 345 fotos","Hace un año","El ascensor bastante descuidado por el resto todo bien"
"https://lh3.googleusercontent.com/a/ACg8ocIxeOOXsVbuqC187UlVsXfUDl4fcJTGxZ-t8Lk4QfqXRFfYTw=w36-h36-p-rp-mo-ba4-br100","Pablo López","Local Guide · 204 reseñas · 48 fotos","Hace un año","Es un sitio limpio,carteles con indicaciones confusas"
"https://lh3.googleusercontent.com/a-/ALV-UjXs3AKo4-mF9goAAmxSiBQIi-eCVUKAUP4-113meQv6L9ESH7Rm=w36-h36-p-rp-mo-ba4-br100","Gloria Lozano Cano","Local Guide · 123 reseñas · 24 fotos","Hace 2 años","Miracle Magic, tienda de moda a precios asequibles cerca de la Gta. de Pirámides (C/Acacias)"
"https://lh3.googleusercontent.com/a-/ALV-UjX2zi-pc-HIMixguFYxP2qDINgakd0pw_Thu00XKpeTRnoAlRjfwQ=w36-h36-p-rp-mo-ba5-br100","Ángel Meléndez Ronda","Local Guide · 114 reseñas · 167 fotos","Hace 5 años","Deberían renovar la estación"
"https://lh3.googleusercontent.com/a-/ALV-UjVYCcV2hjSVEXb1AZtUGSr1eiKRxHRblO26eljYgAqo8FlUgJ0W=w36-h36-p-rp-mo-ba5-br100","Isidoro Toribio","Local Guide · 262 reseñas · 1.106 fotos","Hace 6 años","Muchos trenes en ambas direcciones. Tiene ascensores a la calle y a los andenes"
"https://lh3.googleusercontent.com/a-/ALV-UjUCtLWM5jUnLfS81zemr2pehTD1rH6GKat_hW-hZ0vGkcaLlrQ=w36-h36-p-rp-mo-ba5-br100","María Victoria Sancristóbal Gracia","Local Guide · 217 reseñas · 139 fotos","Hace un año","Bonitas vistas y emblemático lugar"
"https://lh3.googleusercontent.com/a-/ALV-UjWMjsxQqSmaoAJsPhPSZO-rr43PAV45KS5djNAaMLpTtpD6e7BF=w36-h36-p-rp-mo-ba4-br100","Aida Gayo","Local Guide · 48 reseñas · 13 fotos","Hace 7 meses","Un poco sucio"
"https://lh3.googleusercontent.com/a-/ALV-UjUAR2xYQjnGTJyVgEhFMQJVMUEFgLbwdi7cnsIsrixGbfy-Tp69=w36-h36-p-rp-mo-br100","Carmen teresa Paz","7 reseñas · 6 fotos","Hace 4 años","Es muy bonito, limpio y céntrico..."
"https://lh3.googleusercontent.com/a/ACg8ocIpn-vkQVjzqwkt1EhuZv8NfH-R9xszFH3baEKPTM2beE6zdw=w36-h36-p-rp-mo-ba6-br100","carlos chun","Local Guide · 241 reseñas · 1.044 fotos","Hace 7 años","Días de futbol, final de una época, se trasladan de campo, fin a un estadio el CALDERÓN."
"https://lh3.googleusercontent.com/a-/ALV-UjXArlfKyDc3VjJWrebjebYDRcoHuy8DWjdda7BW6PXTQ_S66zwRNA=w36-h36-p-rp-mo-ba6-br100","Alfredo Martin","Local Guide · 625 reseñas · 2.430 fotos","Hace 3 años","Estación del metro con escaleras mecánicas en mal estado tienes que bajar baja.do los escalones y son demasiados"
"https://lh3.googleusercontent.com/a-/ALV-UjX1Cnuf2cAttBymBScppGJArUd2JGw5t9iWOm4aswBnyCug2RTT=w36-h36-p-rp-mo-ba4-br100","Mario Lozano","Local Guide · 130 reseñas · 62 fotos","Hace 7 años","Bastante mala climatización en verano. Es un asadero de carne."
"https://lh3.googleusercontent.com/a-/ALV-UjVY5aB3hmi4lzw049CoubCN_pOH2EuIJQhP2d_hs6eyEd5pF73VRA=w36-h36-p-rp-mo-ba6-br100","Andres Daza","Local Guide · 543 reseñas · 15 fotos","Hace 6 meses","Como todas las plazas"
"https://lh3.googleusercontent.com/a/ACg8ocJO6bH65KvUMQMCeqzqUeWfN2eL-kp3aKrWLSnle4mDSYeYdQ=w36-h36-p-rp-mo-ba4-br100","Jav Ricochet","Local Guide · 66 reseñas · 13 fotos","Hace 7 años","Ahora que quitan el Calderón les será difícil recuperarse de este duro revés."
"https://lh3.googleusercontent.com/a/ACg8ocJoHe2DDLaRmcthbH-A0LQyNEUOSFgyOMYiulldKt-I2R-ogA=w36-h36-p-rp-mo-br100","Cinthya Salinas","13 reseñas","Hace 5 años","Que nunca coinciden los horarios que especifica en la página y los de información no son lo bastante amables .."
"https://lh3.googleusercontent.com/a-/ALV-UjVlIRcPy8hoKzVyQ_dESxkhqzDY23wRcw1eKqbWxl5PSUrmFdHHSQ=w36-h36-p-rp-mo-ba7-br100","Josep Coll i Roig","Local Guide · 240 reseñas · 8.771 fotos","Hace 6 meses","Estación de metro"
"https://lh3.googleusercontent.com/a-/ALV-UjWRsd_c0Y_4Ib-skOmbNal6C-Aeyw03UykgNJHorQitj83YMNNfqQ=w36-h36-p-rp-mo-ba4-br100","IDIS Dueñas","Local Guide · 93 reseñas · 14 fotos","Hace 4 años","Muy bonito bellesa se flores"
"https://lh3.googleusercontent.com/a-/ALV-UjUwn-0Y4p79DWl8JB7csMUTSNDRoFV2w-zNw5VziePOi74yk7IM=w36-h36-p-rp-mo-ba5-br100","MERCEDES MONEO","Local Guide · 104 reseñas · 561 fotos","Hace 3 años","Miracle Magic, la mejor tienda de moda de la zona."
"https://lh3.googleusercontent.com/a-/ALV-UjXzwj5_eXY3x4kWgMvzqQZy-GjGciaEN6aDfvLwM83lBBLKrgsN=w36-h36-p-rp-mo-br100","celia merino","1 reseña","Hace un año","Nunca llega a su hora"
"https://lh3.googleusercontent.com/a-/ALV-UjUw9ilRTRvu-Ei-P6ycU-7E_ym0vc-Kip5F3qZUR66CTnzuxIh4=w36-h36-p-rp-mo-ba5-br100","Carmen Pérez Pérez","Local Guide · 838 reseñas · 45 fotos","Hace 8 años","Comunica con Renfe y la línea 5 de metro,lleva al cutre Vicente Calderón."
"https://lh3.googleusercontent.com/a-/ALV-UjXl9Tgk9U1a97wDEetGpKKjuQpygIywSACkWd34_dzBlCQBZfn-=w36-h36-p-rp-mo-br100","Miguel Angel Molina Rivero","523 reseñas · 19 fotos","Hace 6 años","Está muy bien ubicada"
"https://lh3.googleusercontent.com/a/ACg8ocL9hFPNgMF6uCYoN2GKJRopHrcJqV1TObW1l_Tc63GE2tUi9A=w36-h36-p-rp-mo-ba5-br100","Jose Maria Martin","Local Guide · 188 reseñas · 44 fotos","Hace 7 años","Bueno espero que mejore un poco"
"https://lh3.googleusercontent.com/a/ACg8ocKrngMHbHKDe99n176yOCCBda66kfuR3dYNPAkC_3dzRUrphA=w36-h36-p-rp-mo-ba4-br100","Oscar Gutierrez Mogollon","Local Guide · 59 reseñas · 63 fotos","Hace un año","Buena zona"
"https://lh3.googleusercontent.com/a-/ALV-UjU8M4lLDZAuk5_7-6osXpqwybySZFKpPLPgnz1gLMiJ4oV6POsf=w36-h36-p-rp-mo-ba4-br100","Eduardo Gonzalez","Local Guide · 147 reseñas · 146 fotos","Hace un año","Hermoso"
"https://lh3.googleusercontent.com/a-/ALV-UjXNcFIT-Bki8e2uI4PK-iXViBP6qROBMqPpPcwXaOGafMMilJ4xEA=w36-h36-p-rp-mo-ba6-br100","Ricardo Alfonzo","Local Guide · 575 reseñas · 1.095 fotos","Hace un año","Bien"
"https://lh3.googleusercontent.com/a/ACg8ocLA5QDZ_yxHXmIfCxtmPZ5l3NHxErC46V_sa9_iV5kv7BdVng=w36-h36-p-rp-mo-br100","David Fernandez","14 reseñas","Hace 3 años","Keops, Kefrén y Micerinos :)"
"https://lh3.googleusercontent.com/a-/ALV-UjXVr8jmp9tSwrEvvxkZIH1670v2zMlMGGvxdwP17dUDcnRLF03X=w36-h36-p-rp-mo-ba6-br100","Francisco León","Local Guide · 292 reseñas · 1 foto","Hace un año","Funcional."
"https://lh3.googleusercontent.com/a-/ALV-UjUz-35RgKekSwcV9JFPaKOCR_qXy0bXeC6LNLsGE5F-8hhMhfjV=w36-h36-p-rp-mo-ba3-br100","Angél Reyes","Local Guide · 6 reseñas · 60 fotos","Hace 7 años","Buen sitio"
"https://lh3.googleusercontent.com/a-/ALV-UjVrTXHelxaI1PD08Ew5ltCOOoLcIzGFIg2DYrQl-c9mdGq3c5sJGA=w36-h36-p-rp-mo-ba3-br100","JR DYM","Local Guide · 29 reseñas · 66 fotos","Hace 8 años","Limpia"
"https://lh3.googleusercontent.com/a-/ALV-UjVgObcjFXGQDnV-dc6QGU2WONbTw3t2v6qpCbYHocZK2fishUU=w36-h36-p-rp-mo-ba2-br100","Jesus Alberto Quijada","Local Guide · 14 reseñas","Hace 7 años","(y)"
"https://lh3.googleusercontent.com/a-/ALV-UjVY_SIMn8V0lN7Vhs5dSvPDxKr5fwlDglCreDAPSzP4EyHradBHNQ=w36-h36-p-rp-mo-ba3-br100","Wilmer Rojas","Local Guide · 64 reseñas · 27 fotos","Hace 2 años","Hermoso"
"https://lh3.googleusercontent.com/a-/ALV-UjUtmNoUa9Ixg_ESs5pf8_eYlpWyBT9PwCvo9yK4Y_g-8fWmWHk=w36-h36-p-rp-mo-ba4-br100","Jorge Lucas Naranjo","Local Guide · 92 reseñas · 107 fotos","Hace 7 años","Buen sitio"
"https://lh3.googleusercontent.com/a/ACg8ocIWYwD3B2H-Q0pG7yFOeO05RWlzCaTayQpm3B9pOBDn-W87Dw=w36-h36-p-rp-mo-br100","Fran Torres","6 reseñas · 3 fotos","Hace 5 años","Lamentable"
"https://lh3.googleusercontent.com/a/ACg8ocK-ClZ-WjwGS3RaLuFG6Ss2iHmttr73--YM2Am-vqVbsWIIaw=w36-h36-p-rp-mo-ba3-br100","Efthimios","Local Guide · 47 reseñas · 28 fotos","Hace 6 años","Buenas conexiones con el resto de la ciudad. Limpio."
"https://lh3.googleusercontent.com/a-/ALV-UjVcsrqnswXS-6yuu0-wekX7-soPztwma_xeXul7R7JyqrpiJTNb=w36-h36-p-rp-mo-br100","Franco Candela","123 reseñas · 181 fotos","Hace 7 años","Oye.... Me gusta esta estación."
"https://lh3.googleusercontent.com/a-/ALV-UjUkv_j6EEWn-__McuWrCJmf1YRpSEwe-jmTp3iHOzDZUgkKMkA=w36-h36-p-rp-mo-br100","Kayla Rivers","79 reseñas","Hace 7 años","Excelente ubicación, servicio de primera clase, personal de recepción, desayuno, situación económica y trato humano. Excelente relación calidad-precio incluiría más. No se puede pedir más para un hotel de este nivel. Gracias por mostrar la oferta."
"https://lh3.googleusercontent.com/a-/ALV-UjVLNpgMTZb5rwaqEBfhLtyLsu5_f7C2aR9phJBx8eP7m12IS5aEfw=w36-h36-p-rp-mo-ba5-br100","Martin R","Local Guide · 221 reseñas · 114 fotos","Hace 4 meses","Está bien"
"https://lh3.googleusercontent.com/a-/ALV-UjVlD3PgDsIa9ORF_RxSr5sR7arp8bDafJp0muT9VEfLB721OBk=w36-h36-p-rp-mo-ba7-br100","Lucian Ghindeanu","Local Guide · 731 reseñas · 14.175 fotos","Hace 7 años","Estación de tren a la que se puede llegar directamente desde el aeropuerto con Renfe C1, que tiene conexión con el metro y otras líneas de tren. Está situado al lado del estadio del Atlético de Madrid."
