"URL","Usuario","Fecha","Reseña"
"https://lh3.googleusercontent.com/a-/ALV-UjWdX3tAK1ZJlSEdh8h8NGSBOAWGhVcUa-CtxrL2cSRL-XqgIQzj=w36-h36-p-rp-mo-ba8-br100","Ma Ca","Hace 3 meses","Estación de metro que pertenece a las lineas 2 y 4. No dispone de ascensores. Hay 2 salidas a la calle."
"https://lh3.googleusercontent.com/a-/ALV-UjVRFb4Fx960MWh-uEFGgAueTh4rs7UUJUEz8HaVln1EkhZ9YS8D=w36-h36-p-rp-mo-ba3-br100","Engerber Paz","Hace un mes","Una vergüenza el servicio luego de las 12 de la noche, sencillamente apagan la pantalla y te dejan esperando 10/15/20 min lo que les salga a ellos y ni se te ocurra reclamar porque el malo eres tú. El metro va de mal a peor."
"https://lh3.googleusercontent.com/a-/ALV-UjUjijtYlnMxdghjud5YbeD_NxxMuWs8tYv-3GtEZ7QIoSHjn8R-kg=w36-h36-p-rp-mo-ba5-br100","Carmen F","Hace 5 años","Adoro este edificio de la Plaza San Bernardo...con su estructura piramidal, el jardín de cada terraza y la hiedra colgando, la fuente en el medio de la plaza, me fascina. Zona transitada cerca de otro sitio bien conocido , Plaza Bilbao, nudo entre Alberto Aguilera y Fuencarral: restaurantes, pubs, bares, tiendas, teatros etc"
"https://lh3.googleusercontent.com/a/ACg8ocIe8SbAHfUtE1JzppzXAoNxuBxx7eOiAWeUmEOqIUiCJZNKNA=w36-h36-p-rp-mo-ba6-br100","Monalisa Rayada","Hace 5 años","Una de las estaciones por la que se accede a Malasaña, hermosa rotonda con fuente y arquitectura señorial."
"https://lh3.googleusercontent.com/a-/ALV-UjVPlI3_WxZ-JbiFDSG6A1n_aKR_BFRpvuYb0hLgejNuccGQun5Z=w36-h36-p-rp-mo-ba8-br100","José Julio Melgares","Hace 3 años","Tiene dos accesos/salidas. Falta de ascensores. En esta estación podemos acceder a las líneas 2 y 4 del Metro de Madrid."
"https://lh3.googleusercontent.com/a-/ALV-UjU7EqmbJpTifj0XFQjdFkWFLScMxfv7tdtcLBM6MXYJ8XIlW-X2JQ=w36-h36-p-rp-mo-ba7-br100","Cris Sánchez De Paz","Hace 6 meses","La estación esta genial, en la zona hay muchos bares y da a plaza España"
"https://lh3.googleusercontent.com/a-/ALV-UjUZlDLzrReJfJSSDhTtcu5TmYBlSX9uT0ZsMSuN5NUZn8stfoCaaA=w36-h36-p-rp-mo-ba4-br100","Neska Polita","Hace 3 años","Son mi vida y mi latido y aunque por desgracia ya ,os juro que hay momentos a lo largo del mi vida, tiene que ser así para sobrevivir ,"
"https://lh3.googleusercontent.com/a-/ALV-UjVjRoYkIWQdpptZlyZATMyYea5wtGZQAXpzDcmsCR7_7vH2mQX9rg=w36-h36-p-rp-mo-ba7-br100","Jorge Salgado González","Hace 2 años","Glorieta con fuentes y entorno verde"
"https://lh3.googleusercontent.com/a-/ALV-UjV16gHSb-QQgx_3kCgfiAvuRuzhihpnNe2lCta3xosDFfwdv8E6GQ=w36-h36-p-rp-mo-ba6-br100","Gamo","Hace un año","Cerca de cines, restaurantes y bares de Malasaña. Como toda estación de Madrid, cuando llueve se vuelve caótica y lenta la frecuencia. Además de aparecer charcos dentro de la estación"
"https://lh3.googleusercontent.com/a-/ALV-UjUYd4MtTSShlAZTdDW7ukfVz3IWgrifeMuPw0SAGYX5C1BQNWjPyw=w36-h36-p-rp-mo-ba5-br100","Inma Andrés","Hace 5 meses","No hay ascensor y montón de escaleras"
"https://lh3.googleusercontent.com/a-/ALV-UjWby7_BNwEkzVljJUVi9duEDACxlejWzxhGP5-PSuRagtmhKI3AIg=w36-h36-p-rp-mo-ba6-br100","juan carlos hurtado delgado","Hace 2 años","Está empezando a tener otra vez, Vida. La Pandemia cerro muchas Tiendas, pero están empezando abrir Nuevas. Me gustaría que entré todos, nos ayudemos y hagamos que los Comerciantes. No nos hundamos. Tengo mi pequeño taller y apoyo a mi vecino. Esa es la única manera de Seguir. Visitemos Madrid, como uno de fuera. Disfrutando"
"https://lh3.googleusercontent.com/a-/ALV-UjVmd2w8nlkmhv0KzaR_kkezF6Io_kLgOjvZotitivFfMX-LIfAICQ=w36-h36-p-rp-mo-ba7-br100","Julián Martín","Hace 4 años","Es una plaza de Madrid muy céntrica. Tiene de todo a su alrededor: el parque de plaza del Conde de valle de Súchil, cines, etc Es de resaltar un edificio ejemplar de hormigón con jardines colgantes. Es una magnífica muestra de arquitectura vanguardista del Siglo XX. Magnífica comunicación, Metro, autobús."
"https://lh3.googleusercontent.com/a-/ALV-UjVQwWRBt2LV6in6eYjRFn4aRVxnSaE_lucPxFbWwJMq_CLTPO59=w36-h36-p-rp-mo-ba7-br100","カステロロシオ","Hace 5 años","Estación de metro de San Bernardo. En RL distrito centro, Chamberi. La estación tiene dos líneas de metro; línea 2 y 4. Las dos son bastante viejas, necesitan una remodelacion.…"
"https://lh3.googleusercontent.com/a-/ALV-UjURzRUvdErbUfsDaL2Y8ae0aeXz0K60xXehvDTY8ZcJEFpbJulc=w36-h36-p-rp-mo-ba5-br100","Javier Miranda Jiménez","Hace 3 años","Preciosa estación de metro. De las más bonitas de Madrid. Situada en el clásico y burgués barrio de Gaztambide."
"https://lh3.googleusercontent.com/a-/ALV-UjWyZaupLKUQMlAB_CoHumBFm7pdWU3V9uB0Dp7vOKfZGrK-iWvc6Q=w36-h36-p-rp-mo-ba8-br100","ANTONIO CRUZ SANCHEZ","Hace 2 meses","Estación de las más clásicas del metro de Madrid, tiene su encanto"
"https://lh3.googleusercontent.com/a-/ALV-UjUdGYsBpVABogc9CFceLx4OqWG8HoP7sexLOlBunm-P6n_SH9B9iw=w36-h36-p-rp-mo-ba6-br100","Julio Diarte","Hace un año","Excelente ubicación"
"https://lh3.googleusercontent.com/a-/ALV-UjXd1CPQuP3_0E0cIGYGvwC5tKgLQr2-u8KCLWn8Lc1MYaFfobRc=w36-h36-p-rp-mo-ba3-br100","Adonisdlcv","Hace 7 años","Lugar maravilloso para hacer fotos al atardecer"
"https://lh3.googleusercontent.com/a-/ALV-UjWGu-Z39F9cPLzH9LflQooNv6U_lcLkN2PJHumrddhYizfG_fSA=w36-h36-p-rp-mo-ba3-br100","Francisco Javier Barrero Garcia","Hace un año","Peluquería par señora y caballero con excelente trato al cliente"
"https://lh3.googleusercontent.com/a-/ALV-UjWzQG28-9r0s2MWknhEpSWS8mrx_xZfLf-QQL0UNFG3nYyfALP-=w36-h36-p-rp-mo-ba2-br100","Yassin Desuani","Hace un año","Buena estacion, limpia y sin mucho atasco"
"https://lh3.googleusercontent.com/a-/ALV-UjUgZMJ8UpdvIXAZCibhcDbFS4FN2KwVc5yw9jWLjqy06x0GSEE-=w36-h36-p-rp-mo-ba5-br100","Jordi Sillero","Hace 6 años","Resulta muy fácil guiarse a través del metro si eres de fuera. Podrían tener iniciativas así para otras ciudades como un metro conjunto Terrassa-Sabadell."
"https://lh3.googleusercontent.com/a/ACg8ocIazesZAwOii7ej8NHaoUla21EXM2-0fBo7NS1O7PH9yMZJeQ=w36-h36-p-rp-mo-ba4-br100","sara d v","Hace 6 años","Estación de Metro con dos accesos. Uno a la Calle Carranza y otro por Alberto Aguilera. No es accesible para discapacitados."
"https://lh3.googleusercontent.com/a-/ALV-UjVWLRxTiyFLfVFPvKkxHl8XiEhbznzwxrdipuRbKVgkqydr-j9B=w36-h36-p-rp-mo-ba6-br100","Fernando Rebollo","Hace 5 años","San Bernardo. Malasaña. De los mejores barrios para tomar copas de Madrid."
"https://lh3.googleusercontent.com/a-/ALV-UjXsLT3q9RBTGSriBEVb7ztJ1puJdWNqJlpu1rpWojOIxqMWlbP8=w36-h36-p-rp-mo-ba5-br100","Jose Pascua","Hace 4 años","Lugar céntrico muy bien comunicado pero con mucho tráfico y ruido"
"https://lh3.googleusercontent.com/a/ACg8ocKyBvrX_OAwtjWLTZHXRWL-IgwgaZloy5uMUKHhHJ2sDymZQw=w36-h36-p-rp-mo-ba6-br100","J. Garcia","Hace 2 años","Se puede tomar unas buenas cañas en plena plaza"
"https://lh3.googleusercontent.com/a/ACg8ocL6j3fUjdHjzglCFPCFitAnCJ2BggebpG8jNROfZWVFbqChuA=w36-h36-p-rp-mo-ba4-br100","Rocio Rodrigo Rubio","Hace 6 años","San Bernardo es una estación del servicio de metro de Madrid línea 2 y 4 al lado de la plaza de San Bernardo"
"https://lh3.googleusercontent.com/a-/ALV-UjWBvQfUp_iuvWUxNIB_4cyRTwFkeKBhWvAKY3PR27vx9zJ0FEkZ=w36-h36-p-rp-mo-ba5-br100","Nacho Varela","Hace 3 meses","Una estación de metro..."
"https://lh3.googleusercontent.com/a-/ALV-UjVV7Pi3XhEHnaAQQlxGYol5MfXcBnsDQfG_Lkf_bphICMqpcq9M=w36-h36-p-rp-mo-ba3-br100","Exploring With Santi","Hace 6 años","Poco se habla de que un dia paseando por aqui.... tachannnnn!! Me cruce con Antonio Tejero"
"https://lh3.googleusercontent.com/a-/ALV-UjWkBFuKyLHk-Xc75Z8IyUQuPW9Si-8ZXYf3nUn_f2Yrb9lBPOcZ=w36-h36-p-rp-mo-ba4-br100","Alfredo Peña","Hace 4 años","Desde algún lugar de SAN BERNARDO JAJA, un abrazo"
"https://lh3.googleusercontent.com/a-/ALV-UjVjjObCQbEDFapl2OvEo3I9hzbnumpYJcm20udLB9TLPpjRhB06Xw=w36-h36-p-rp-mo-ba5-br100","Daniel Bathory de Ecsed (dabathory)","Hace 3 años","Varios cafés"
"https://lh3.googleusercontent.com/a-/ALV-UjUro4Kv8QWw50i5tUTKB81r8RW98WMfLcmKqWUmqPXcBH-sGpM=w36-h36-p-rp-mo-ba3-br100","Paul T.","Hace un año","No tiene ascensores"
"https://lh3.googleusercontent.com/a-/ALV-UjVedifjDpa8zj2W7koMbdWJo72ZJU9FKMc-AIf6C_2Y30C6aBbT8Q=w36-h36-p-rp-mo-ba7-br100","Mildred León","Hace 6 años","Accesible y siempre hay alguien para ayudar."
"https://lh3.googleusercontent.com/a-/ALV-UjUKmBf2wRuOuSMRCA_8syx1EhIdGdyFaHSn8YzqtAvvStBKFKGM=w36-h36-p-rp-mo-ba4-br100","Raul C R","Hace 6 años","Bastante normal. El personal es agradable."
"https://lh3.googleusercontent.com/a-/ALV-UjUBO_QLsrcKab68aN2sh20jcAKAd0TKhTkFG73qF0qkqpLlKd-xNw=w36-h36-p-rp-mo-ba3-br100","Javier Olmedo","Hace 6 años","Muy sencilla y trasbordo muy corto"
"https://lh3.googleusercontent.com/a-/ALV-UjXwkPhYOEt-sakA93KBMZ0CX0Gzqu3GE541Y2I-qcfefsNtgrs=w36-h36-p-rp-mo-br100","Belinda Sánchez","Hace 6 años","Me gusta este lugar!!"
"https://lh3.googleusercontent.com/a/ACg8ocLGNou_YbKxOes5-GZID4-nKJV0nAY0xjw5LgHJtLecU3DSKg=w36-h36-p-rp-mo-ba6-br100","Jesus Hernandez Jimenez","Hace 5 años","Glorieta de San Bernardo, Madrid"
"https://lh3.googleusercontent.com/a/ACg8ocKlwu1LvmWSR40MlVN0T_W57g-Xr5WjWBIlJ6U98QlagVRuEQ=w36-h36-p-rp-mo-ba5-br100","Borja Martínez","Hace 7 años","Estación centrica y accesible."
"https://lh3.googleusercontent.com/a-/ALV-UjWbGKVNUIH8s4zKQHTfVJ4fkrk4NukhFKwjiyNjrVB14D7CwdI=w36-h36-p-rp-mo-ba5-br100","Carmen Moreda","Hace 6 años","Madrid en estado puro"
"https://lh3.googleusercontent.com/a/ACg8ocIWDaK6oAm1xoc18tNXFVscpo87Nht5bFJHo1qnX-JWH_HJ5g=w36-h36-p-rp-mo-ba4-br100","Manuel Gómez","Hace 8 años","Estacion centrica y accesoble"
"https://lh3.googleusercontent.com/a-/ALV-UjVtkhxK78tTnzPdcKiAmLeRBw9jTZWl8JtTPonRFGKxKApR-Sk1lA=w36-h36-p-rp-mo-ba4-br100","Mathias Gamondi","Hace 4 años","Glorieta de San Bernardo"
"https://lh3.googleusercontent.com/a-/ALV-UjV8VM2Mtwt9ffCdYabILaM21oojK0H9A_OKrUE9VIdgezT5FQXI=w36-h36-p-rp-mo-ba5-br100","Pablo Richieri","Hace 7 años","Referencia de Madrid"
"https://lh3.googleusercontent.com/a-/ALV-UjV8LBKgimyhG4b0Vd07JYKS-nlDLRXeqm8ylUi62Jife4DnBuB2=w36-h36-p-rp-mo-ba5-br100","Ana Montero","Hace 4 años","Precioso!!"
"https://lh3.googleusercontent.com/a-/ALV-UjX365C6S11vq1mdfp3rO9olG8dPuA9GLicNIBvqUCeWSj97kFozTQ=w36-h36-p-rp-mo-ba4-br100","Rafael Diaz Moreno","Hace 6 años","Estación liosa"
"https://lh3.googleusercontent.com/a-/ALV-UjUpLEkMbqQ117vEXR5NomvRhhZgkwVvVtKfHyjAnrI4JKwbnhs2=w36-h36-p-rp-mo-ba5-br100","snarkyguy","Hace 7 meses","Como la mayoría de las estaciones de Metro de Madrid, San Bernardo está limpia y bien mantenida. Las puertas están bien definidas en cuanto a quién va a dónde. Dentro de la estación, el andén está limpio y bien cuidado. ¡No hay ningún problema!"
"https://lh3.googleusercontent.com/a/ACg8ocL2DLo9gGrJGZAOiosvk7ooaaUUJc12MObX57ct23qLvNZs0A=w36-h36-p-rp-mo-ba5-br100","Тамара Прокопчук","Hace 6 meses","Hermoso... Ojalá la renovación terminara pronto."
"https://lh3.googleusercontent.com/a-/ALV-UjXf3sotMKdDqdcck2mvH_grfuOkdePY6q2hu92f-AePiitJ1Lwf2w=w36-h36-p-rp-mo-br100","Luís Barros","Hace 9 meses","Un lugar súper concurrido, lleno de gente, comercios, colegios, bomberos, metro, de todo un poco... 👍👍…"
"https://lh3.googleusercontent.com/a-/ALV-UjU4011LARt_YAAYkI08kKFui3izWZJA26lV-nyG9xKc8PIEsmA6WQ=w36-h36-p-rp-mo-ba4-br100","Zaddock Bandi","Hace un año","Muy calmado. No hay mucha gente en comparación con otros lugares. Hay algo para todos en todas partes"
"https://lh3.googleusercontent.com/a-/ALV-UjX4owUFn7ZxqQB9Nxbt66ZMkU6-z6YiggwpwlVkEGEIHZziFGUc=w36-h36-p-rp-mo-ba7-br100","Chienwen Chen","Hace 5 años","No hay ascensor, lo que resulta muy incómodo para los pasajeros que transportan objetos pesados."
"https://lh3.googleusercontent.com/a-/ALV-UjWIJIgFCqd28K1gLGWsHJJgSHxP66ENZ-ab4QaJ5GsBojlJcmY3=w36-h36-p-rp-mo-ba7-br100","Andrew Kan","Hace 5 años","Estación limpia con líneas 2 y 4. Entradas sólo en dos esquinas del cruce."
"https://lh3.googleusercontent.com/a-/ALV-UjXHW0cgSQ6ToS9J3GoM7hfXg_go0KZtkM003DZkz6D7w5jJLJeU=w36-h36-p-rp-mo-ba5-br100","Vittorio Iignat","Hace 4 años","Muy lindo"
"https://lh3.googleusercontent.com/a-/ALV-UjXGl17cWWNLU_1pXLiXkQfKVGXKCOBsbpjynaxmzYD-A7cA3-3UGw=w36-h36-p-rp-mo-ba3-br100","Miguel Truchado Martín","Hace un año",""
"https://lh3.googleusercontent.com/a-/ALV-UjXoZ99enDZsYVjtn9aTXE1TYE98U0NdKYcEN7XctHOkG-4fHWXugw=w36-h36-p-rp-mo-br100","Rafat Hamada","Hace 7 años","Buena estación de metro"
"https://lh3.googleusercontent.com/a-/ALV-UjVUOOxr3nuGmfOLe1O4TnbgtJcj5IxxYd7-bKkEPAVA9pqCLOR8HA=w36-h36-p-rp-mo-br100","Sebastian Micell (Seba El Oriental)","Hace un año",""
"https://lh3.googleusercontent.com/a-/ALV-UjUWCXH1E844ZFah3fwhjJ73aIJNn28WfcyJdsIFfq2DRqmOunJp=w36-h36-p-rp-mo-ba4-br100","Alba Sofia Roselló Cuevas","Hace un año",""
"https://lh3.googleusercontent.com/a-/ALV-UjW1Ay5jiM7yPiPxicJqyCqtWwgY1dPi6fNbff9sjyFEnEBiB716kQ=w36-h36-p-rp-mo-ba8-br100","Anikó Bozó","Hace un año",""
"https://lh3.googleusercontent.com/a-/ALV-UjUEvNz3Jj9dnSn0xhVuyPXcKMxVt1g7aG-xOQaO-QAI_vk9dTQ=w36-h36-p-rp-mo-ba6-br100","carla gonzalez-casanova","Hace un año",""
"https://lh3.googleusercontent.com/a-/ALV-UjVeSUR3v31grGvfXVKJHr7dVsLWL9PPqHqO_pQfNjEYQumBTJFJrQ=w36-h36-p-rp-mo-ba3-br100","Nuria","Hace un año",""
"https://lh3.googleusercontent.com/a-/ALV-UjVr2UgCqSbMKuez-HXNokZnREkyLBozyvGecefuPQ0HZ-UQkrttQQ=w36-h36-p-rp-mo-ba5-br100","Mafer Rincon","Hace 2 años",""
"https://lh3.googleusercontent.com/a/ACg8ocK0uyUab1XSgG9nUuPascYc2fC58eUyMWiwnURdUu2A1rJKfg=w36-h36-p-rp-mo-ba5-br100","Elvira Moratilla","Hace 2 años",""
"https://lh3.googleusercontent.com/a-/ALV-UjX5GYFCOY7BImYBAsceFwrILiArWebU3dJagtAseMS4XvPTFMzx=w36-h36-p-rp-mo-br100","Rms Rhlm","Hace 2 años",""
"https://lh3.googleusercontent.com/a-/ALV-UjWpDI7p2g4368xURt4s9qdPrPlkSoos2ljwqxIxwB2rhMMIN3QYrg=w36-h36-p-rp-mo-ba7-br100","Santiago Caballero","Hace 2 años",""
"https://lh3.googleusercontent.com/a-/ALV-UjUy-gzCmbTyZyUGWJ3dKHXuGrUrcjpIye7u_dTSTsLnEJYm9x-Zhw=w36-h36-p-rp-mo-ba5-br100","Anabel Domínguez","Hace 3 años",""
"https://lh3.googleusercontent.com/a/ACg8ocJz0FeS2ocdGPg713apeGlaNSD49WIE3TJy_YM9t6RcchBl7g=w36-h36-p-rp-mo-ba4-br100","Mpilar Fernandez Gomez","Hace 3 años",""
"https://lh3.googleusercontent.com/a-/ALV-UjXVchAkc2bF5fzcBdaqFO1rK2BpzUSVF05fPlMtjPHyaomDyOFt=w36-h36-p-rp-mo-ba5-br100","Ben Jefferis - Willow Rivers Wealth","Hace 3 años",""
"https://lh3.googleusercontent.com/a-/ALV-UjWJ3k1sEZgvFRH2Y1HQqahu0IQEq4Uu4ro-4bcp4WSjCuNa79BNWw=w36-h36-p-rp-mo-ba5-br100","Cristobal","Hace 3 años",""
"https://lh3.googleusercontent.com/a-/ALV-UjU9ghNfefBm3zGwPxhHNWXeW-g-1A6hKGOygno1PZlxLImpI95oMQ=w36-h36-p-rp-mo-ba6-br100","Borja Notario","Hace 3 años",""
"https://lh3.googleusercontent.com/a-/ALV-UjWEMV72MkS_O5dr2Hoki37LtsUU3648AXXobobMpsb3XauCQTNv=w36-h36-p-rp-mo-ba4-br100","Jian Ming Chen","Hace 3 años",""
"https://lh3.googleusercontent.com/a-/ALV-UjUBBCwiWn7v-G8WTSlTuQAoKIncm8Dqv3pVtn2ujkKjOakeE5FHEg=w36-h36-p-rp-mo-ba4-br100","Miguel Rodriguez","Hace 3 años",""
"https://lh3.googleusercontent.com/a-/ALV-UjVUBJaoAKtrx389C3pBi1k_IVhTlLwl9lEME6Ghow76tDwv51Y=w36-h36-p-rp-mo-ba5-br100","Adrián Conrado","Hace 3 años",""
"https://lh3.googleusercontent.com/a/ACg8ocIiOXUXynlS-Wy0F6sMLxfsVEnWANqXJZnq1maWTJg0qnbDRw=w36-h36-p-rp-mo-ba2-br100","Alvaro Yángüez","Hace 3 años",""
"https://lh3.googleusercontent.com/a-/ALV-UjVFRGSrI52rG7TpYcWfOflmQfqKgRBuGvJeyrMnhG7ZA8YfzSW0YA=w36-h36-p-rp-mo-ba7-br100","Carlos Subirats","Hace 3 años",""