"URL","Usuario","Fecha","Reseña"
"https://lh3.googleusercontent.com/a-/ALV-UjVdYzCSFKWHtFMvn_ohoWImOm9TtbpaqOFcPY-ORc9tO4yDagrW4w=w36-h36-p-rp-mo-ba7-br100","LA NENA VIAJERA","Hace 2 años","He vivido 5 años en Puente de Vallecas y nunca me había acercado a conocer el Casco Histórico de su villa, hoy me pillaba cerca y he ido a ver algunos de sus murales y ya de paso el centro."
"https://lh3.googleusercontent.com/a-/ALV-UjXnewNEbYYaXdHD0epgVByIWzW2jKqBZMPTzU18-HYzM_sBuOGCqw=w36-h36-p-rp-mo-ba8-br100","Doncelador","Hace 4 años","Estación de #metro Madrid correspondiente a la línea 1, es accesible para personas con movilidad reducida, cuenta con ascensor y escaleras mecánicas. Tiene dos salidas al Paseo Federico García Lorca y Plaza Sierra de Gador. Está dentro de la zona tarifaria A, suele estar limpia y en buenas condiciones."
"https://lh3.googleusercontent.com/a-/ALV-UjWLUJm5mrGB_D7m9tcWyEVLF3bDQBiKKmdlfC8f71jl2_CzaP3l=w36-h36-p-rp-mo-ba5-br100","Jesús Grande","Hace 3 años","En la presentación de un acto por el Orgullo 2021 en Villa de Vallecas en el que se han dramatizado poemas de Lorca, Cernuda, Gloria Fuertes, Óscar Wilde y Jacinto Benavente. Con la presencia de todos los representantes de la Junta de Distrito, menos los de siempre (tampoco se ha notado). Encantado y muy contento."
"https://lh3.googleusercontent.com/a-/ALV-UjVrKU0qjSzZiYB961HUI7ALnZPHAEUjE5n8VMgMoHU6gKQypgmF=w36-h36-p-rp-mo-ba3-br100","Óscar C.","Hace un año","Gran distrito de Madrid, en la zona sureste de la capital. Entre el Ensanche, Santa Eugenia y el pueblo, da gusto vivir aquí. No confundir con Puente de Vallecas, pues no tiene nada que ver un distrito con otro."
"https://lh3.googleusercontent.com/a-/ALV-UjXEtA2Ob9T1ujtHcDTO1f-J5uYKJzONbS1AHj_EuxoznJ3yKrF-TQ=w36-h36-p-rp-mo-ba4-br100","Jorge Velarde","Hace 4 meses","Excelente lugar con excelente historia"
"https://lh3.googleusercontent.com/a/ACg8ocJcCCj3DND_l0Xu_nXsppeGnDjBV8hTEF0iSFqx8oG6SESK2g=w36-h36-p-rp-mo-ba4-br100","R Castello","Hace 4 años","Es un barrio de toda la vida, tiene mucho encanto. Las personas mayores en sus bancos.. habría cosas que mejorar, pero aún así a mi me encanta pasear por la villa y su ambiente familiar."
"https://lh3.googleusercontent.com/a-/ALV-UjUdGYsBpVABogc9CFceLx4OqWG8HoP7sexLOlBunm-P6n_SH9B9iw=w36-h36-p-rp-mo-ba6-br100","Julio Diarte","Hace 4 años","📌 Tiene varias salidas y fácil acceso para personas con movilidad reducida con ascensor. #juliodiarte…"
"https://lh3.googleusercontent.com/a-/ALV-UjW4j8MgZhVz6GuGxsz8qa76XJ-lGDvusGIU6UdCdByC4DRlchD8=w36-h36-p-rp-mo-ba5-br100","Carmen Coelho","Hace 2 años","A la estatua del Oso y el Madroño de Madrid le ha salido competencia. Desde hoy se gestan ya en un taller 40 réplicas exactas del emblemático monumento de la Puerta del Sol. En diciembre formarán parte de una exposición en el centro cultural Matadero y en 2022 ocuparán de forma temporal los lugares más emblemáticos de Madrid para el disfrute de los ciudadanos. Las nuevas representaciones tienen más color: una está dedicada al metro de Madrid por su labor esencial en tiempos difíciles; otra pone cara a las profesiones que estuvieron en primera línea en la pandemia, una ilustra la espera de los vecinos en los balcones; otra más refleja un cielo azul de esperanza; y todas transmiten el mismo sentimiento: gratitud. La iniciativa responde al concurso de diseño amateur ¡Muchas gracias, Madrid!, un certamen que invitaba a la ciudadanía a rediseñar el Oso y el Madroño para homenajear a las personas y colectivos que lucharon y luchan contra la pandemia. El concurso, organizado por EL PAÍS y la cadena SER en colaboración con el Ayuntamiento de Madrid, recibió cerca de 500 candidaturas de entre las que el jurado eligió este miércoles la ganadora y los 39 diseños que la acompañarán en su exhibición por la ciudad."
"https://lh3.googleusercontent.com/a-/ALV-UjUi9V1WsYHU8ew0KQ9Xi3Up2lIMhyvt1avQxEX2mPk92Jleihmc=w36-h36-p-rp-mo-ba5-br100","YURY GONZALEZ","Hace 2 años","Excelente lugar para compartir con familiares y amigos. Me encantó la limpieza y orden de las calles y sus edificios muy lindos"
"https://lh3.googleusercontent.com/a/ACg8ocJpC4R7bmJpsVVIhmtuyvrfQg4I0HfHn1UjdatQ4TtX76Z1kA=w36-h36-p-rp-mo-ba5-br100","Andrea Jiménez","Hace 6 meses","Estación de metro sin seguridad. Gente fumando en el andén."
"https://lh3.googleusercontent.com/a-/ALV-UjWJ7iPvXQGH9v7wQDKuXDpV8Dh0joQEF4bXfUSj36fAMkcihiUB=w36-h36-p-rp-mo-ba4-br100","Javier Marcote","Hace 2 años","Linda estación, en general bien cuidada y sus alrededores de día, están muy bien y tranquilo. De noche no es peligroso, pero hay que estar atento."
"https://lh3.googleusercontent.com/a-/ALV-UjUPUaPNBCLrSdL8Pemy3CEr_ckB57c-JEUsfpJSTnHsPDKAtiOH=w36-h36-p-rp-mo-ba5-br100","Francisco Merin","Hace 5 años","Ubicada en el centro de Villa de Vallecas. Con dos salidas diferenciadas. Posee un ascensor para ser más accesible a personas con dificultades de movilidad. Muy diáfana y moderna. Tiene escaleras mecánicas para hacer más fácil su comunicación."
"https://lh3.googleusercontent.com/a/ACg8ocI0FFialuupmvY1_TZ9Yxe4pk6ZKIa5Qp6jbG1KXW0hOeQ6bg=w36-h36-p-rp-mo-ba6-br100","Mercedes Cuenca Garcia","Hace 8 meses","Es un barrio majisimo buena gente"
"https://lh3.googleusercontent.com/a/ACg8ocKDSn76f7GCbK0caqXeUsRffFQpLgBflK8_S17NCBfDCi1i9w=w36-h36-p-rp-mo-br100","Juan Sanchez-Bermejo","Hace un año","Aquí si nos encontramos con los/las ex. Y con los amigos y vecinos. Esto si es Comunidad y esto si es Madrid no el decorado que nos quieren vender."
"https://lh3.googleusercontent.com/a/ACg8ocI-ngtaKNlNcBIfcUAQY4e4z3v4HWu2oZ9JwxaQgGoa0BUVEA=w36-h36-p-rp-mo-br100","Eugenio Solera","Hace 4 años","Tomamos un menú degustación y todo de muy buena calidad y muy buena presentación. Del precio no puedo opinar, porque fue una invitación."
"https://lh3.googleusercontent.com/a-/ALV-UjWdL-h05KzstqHzSkXKJufC2jIiUDWsI0aUdA62cmsj1GRKu2lFFQ=w36-h36-p-rp-mo-ba4-br100","Marali Solorzano","Hace un año","La iglesia tiene alrededor restaurantes, para disfrutar de diferentes platillos"
"https://lh3.googleusercontent.com/a-/ALV-UjVfYaJFSUmCCd9G2zOKlc3Im5ebzSmDv9LkqV2OjcynKAQiTk0=w36-h36-p-rp-mo-ba5-br100","Ascensión García Torres","Hace 8 meses","Es el barrio más chulo de Madrid"
"https://lh3.googleusercontent.com/a-/ALV-UjUeIXF7fkUnRGK9RM6FxY_lYX741jxUXOmpabVF0bdqBOl_jzRu7g=w36-h36-p-rp-mo-ba5-br100","Rosa Acuña","Hace 2 años","Un lugar super tranquilo agradable varias opciones para comer y tomar algo .. me gusta"
"https://lh3.googleusercontent.com/a-/ALV-UjV6hi9MBF-DCPMegHe9xjTAqsQUlnXTqLPb5mp27QOOwKvl8DDq3g=w36-h36-p-rp-mo-ba6-br100","Angel Castellote","Hace 2 años","Otro bonito además de histórico barrio de la también villa de Madrid"
"https://lh3.googleusercontent.com/a-/ALV-UjWdX3tAK1ZJlSEdh8h8NGSBOAWGhVcUa-CtxrL2cSRL-XqgIQzj=w36-h36-p-rp-mo-ba8-br100","Ma Ca","Hace 2 años","Estación de metro que pertenece a la línea 1. Estación de metro de las antiguas.  Dispone de cobertura móvil."
"https://lh3.googleusercontent.com/a/ACg8ocL2KdLmon0HeweQdlNJYh_1hdeymw2M-TYxiwCPGPX3-AACCw=w36-h36-p-rp-mo-br100","Juan Ecchhe","Hace 11 meses","Es un sitio muy bonito"
"https://lh3.googleusercontent.com/a-/ALV-UjXKfISaQfalZzwoeDkM5ud5lCLJOUh5Fhi9RDuFXjqZYgNIbKg=w36-h36-p-rp-mo-ba3-br100","San asdf","Hace 7 años","Me gusta xq es como un pueblo xo hay de todo!Lo q no me gusta es para aparcar,no hay hueco"
"https://lh3.googleusercontent.com/a-/ALV-UjXFZmGXj_N0PdjOuj5-aFiuTvbtw01McxdzStn122Z64f01sNn3=w36-h36-p-rp-mo-ba4-br100","Miguel Angel Melendez Martin","Hace 3 años","Muy bonito aunque en esta fecha mucho calor"
"https://lh3.googleusercontent.com/a-/ALV-UjWKsignZVSw6zz4-Q7sZEzYMtYvdtd6-oduXxl9kpJGH9jgSQjNkg=w36-h36-p-rp-mo-ba4-br100","Maria Isabel Najera Cortes","Hace 2 años","Iglesia de San Pedro ,muy hermosa."
"https://lh3.googleusercontent.com/a-/ALV-UjVfDva7_lxsHhEqpyk4nwg0wph2eP2Q76zbR_ccfoYw8Nk3bAZ4=w36-h36-p-rp-mo-ba5-br100","Luis albert Flores","Hace un año","Buena zona y tranquila"
"https://lh3.googleusercontent.com/a-/ALV-UjW1dzbdkBMGfavH8IokWcxxbMdE6p3Ofx49feAuNA1jPcAOipNF=w36-h36-p-rp-mo-ba4-br100","Victor Gasia","Hace 2 años","gente cálida y un barrio agradable."
"https://lh3.googleusercontent.com/a-/ALV-UjU7u-fgvEYzdJoMwt-mcLwll6KDY1o-6sP8BGL-p3qJvNbjehg=w36-h36-p-rp-mo-ba4-br100","Jennifer Barreto","Hace 4 años","Encuentras de todo en este lugar. Muy limpio!"
"https://lh3.googleusercontent.com/a/ACg8ocIJantIn1423RmfvsDG-GdR_VT13-nIVJaUQawwnrftcCTiuA=w36-h36-p-rp-mo-ba5-br100","Bertha Suarez","Hace 3 años","Lindo y acogedor pueblito madrileño!"
"https://lh3.googleusercontent.com/a-/ALV-UjUfU9k_F-HbQ08wsx-_1zKoAbp19H4ZEHrXXK74cqjxGKVVsent=w36-h36-p-rp-mo-ba2-br100","Gear Tineo","Hace 4 años","Calles grandes y bonitas"
"https://lh3.googleusercontent.com/a-/ALV-UjUcXEppGy1IIOJfHgcAwFzJwot7OsRPeRCxXc4vNLnzgAfG03cvOA=w36-h36-p-rp-mo-ba5-br100","Julissa Garcia","Hace un año","Hermosa Catedral"
"https://lh3.googleusercontent.com/a/ACg8ocJCZ4MEXJMOQ6cEqepeVL96rpDdp3Rb5-n0YPZAS5Iqeh_ERA=w36-h36-p-rp-mo-ba3-br100","cristian Terriña Montes","Hace 3 años","No esta siteo como parada"
"https://lh3.googleusercontent.com/a-/ALV-UjUZvuXpfTuxc4DfAg2OKIt_EAcZ3IcTd3M77LsgWW_7ve4s8FcA=w36-h36-p-rp-mo-ba6-br100","Jota Eme","Hace 2 años","Un pueblo auténtico"
"https://lh3.googleusercontent.com/a-/ALV-UjXR_ZUBU0_PMt-4U8X-Ilw882Z9t1ta5gXYwwbRpuzwpPxbC_Us=w36-h36-p-rp-mo-ba3-br100","Nerida Delfina Samaniego Torres","Hace 3 años","Limpio y seguro"
"https://lh3.googleusercontent.com/a-/ALV-UjW2JrBkb5ijTXLaJzUdSKjMTfuqwxgfWoOMeaLsR1-UofZrFmMWHg=w36-h36-p-rp-mo-ba6-br100","Amy Orquidea","Hace un año","Preciosa Villa"
"https://lh3.googleusercontent.com/a-/ALV-UjWwn_TpOVLk0qN5wOhYZoZmwPhHfA1vo2J1ULmUTqQns_HEKuKh=w36-h36-p-rp-mo-ba3-br100","Jose Villasante","Hace 4 años","Bonito..."
"https://lh3.googleusercontent.com/a-/ALV-UjUFo1jhw0pqo8pZnX-TIsa5AtquuUV22UJkIyTQXOn5hgrI3uy7=w36-h36-p-rp-mo-ba5-br100","Chema Jimenez","Hace 2 años","Como todas"
"https://lh3.googleusercontent.com/a/ACg8ocKCc2CKbzM0iqFYk2b7rbGn46r4_MhZF89aYrNIy7ixuM_xMA=w36-h36-p-rp-mo-ba3-br100","Monica Hernandez","Hace 6 años","Es muy preciso!"
"https://lh3.googleusercontent.com/a-/ALV-UjVMA8VNGVLIuCICv1wCSGjHVemiTkVpKBznvqzgZOf-m5P7XxHk=w36-h36-p-rp-mo-ba6-br100","Onelia Greatty","Hace 5 años","Vía pública"
"https://lh3.googleusercontent.com/a-/ALV-UjWainKesgselEgurKkUu_-RUw8xFGRPYelxACUXLz6HcGZ32HDR=w36-h36-p-rp-mo-br100","李用心","Hace 7 años","Casualmente estaba pasando por allí. El ambiente es bastante bueno y hay bebidas gratis. Iré allí a menudo en el futuro."
"https://lh3.googleusercontent.com/a-/ALV-UjUoqlVEjs7EL0Ypcxub1L2t2jf-dh9lnZfiuzZinDiYSlVGhYDDfw=w36-h36-p-rp-mo-ba5-br100","JMatos","Hace 3 años","Es una práctica estación de metro."
"https://lh3.googleusercontent.com/a-/ALV-UjUQiuYLXy1r1vuw_vrzh7oWH2hhTy-RAK44Dl_6FB66tpqTh84v=w36-h36-p-rp-mo-ba5-br100","Pep Barranco","Hace un año","no me gusta"
"https://lh3.googleusercontent.com/a-/ALV-UjUcKi-RfaQkzSDxEc4AbgnMPLjf0yWmeI1kaSvNpAK6NtIqFPWP=w36-h36-p-rp-mo-ba5-br100","NAS","Hace un mes",""
"https://lh3.googleusercontent.com/a-/ALV-UjVit3h6IJKYqheMz4KXsylQ6OLUE3PM27Ulki87fZuWofSdiiRl=w36-h36-p-rp-mo-ba5-br100","Susana López","Hace 2 meses",""
"https://lh3.googleusercontent.com/a-/ALV-UjUBg_bG7Jy467hMwp_ZiSdsF0felwLRSy9nfL0kxRcvAECd6BoI0w=w36-h36-p-rp-mo-ba7-br100","Alberto Martín de Hijas Liste","Hace 4 meses",""
"https://lh3.googleusercontent.com/a-/ALV-UjXh6DvtCtu-kr6poMMnqB1mwelxeWWhUyhbAsQrWQt83cqRkj8C=w36-h36-p-rp-mo-ba5-br100","Marco Monge Pascual","Hace 5 meses",""
"https://lh3.googleusercontent.com/a/ACg8ocKljxao7zwR3KvujW7M-bGLPCHg9Y1TBLv9BJ4HhJwSVAPlhQ=w36-h36-p-rp-mo-ba4-br100","Karina Asuaje","Hace 9 meses",""
"https://lh3.googleusercontent.com/a-/ALV-UjVAxhCKRrha0hV2NZTAjnvbUZ-YwX4lEkobM0DwRudhW1EVuhw=w36-h36-p-rp-mo-ba4-br100","Ivan Tamahkyarov","Hace 10 meses",""
"https://lh3.googleusercontent.com/a-/ALV-UjXbsz4HJkoVQsbL6BbmYsTj5Q1NFXx_8srznKvq5S3z3dPohyUr4A=w36-h36-p-rp-mo-ba3-br100","ELDVI","Hace 11 meses",""
"https://lh3.googleusercontent.com/a/ACg8ocJufdWVX8fUHzQ7P6LVnPqFHM3CTK_Vukr-5itR8p0UdXdH-Q=w36-h36-p-rp-mo-ba6-br100","Rafael Viñuela","Hace un año",""
"https://lh3.googleusercontent.com/a-/ALV-UjV_XF8nEtLZg-3_IFJkke4bul0Y63QmeuTOxidjg0NZZT3fLgKn=w36-h36-p-rp-mo-ba4-br100","Alejandra Zelaya","Hace un año",""