"URL","Usuario","Fecha","Reseña"
"https://lh3.googleusercontent.com/a-/ALV-UjWzblVqaRNmVRZy7VBAiDE_T0ZAqJ6D08ws2wqDx56tN-2Uyqj7=w36-h36-p-rp-mo-ba5-br100","Guillermo Musica _","Hace un mes","### UBICACIÓN Y ACCESIBILIDAD LA ESTACIÓN DE METRO VISTA ALEGRE SE ENCUENTRA EN EL DISTRITO DE CARABANCHEL, AL SUROESTE DE MADRID. ESTA ESTACIÓN FORMA PARTE DE LA LÍNEA 5 DEL METRO, UNA DE…"
"https://lh3.googleusercontent.com/a-/ALV-UjWjT4hav9VVLhFt_TcC40cymNvnGYOAazyxzXe5KP74swveVcHd_g=w36-h36-p-rp-mo-ba6-br100","Jose Ricardo Nieto Primera","Hace una semana","No tiene acceso para personas con movilidad reducida"
"https://lh3.googleusercontent.com/a/ACg8ocJGVuoHX8HHSt1aXWXcPJbbjIZl6i92ZHTUbBt546DpbGvn-Q=w36-h36-p-rp-mo-br100","Mirtha AG","Hace 6 meses","La tienda muy bien ubicado y los personales son muy amables y atentos y tiene buen precio y calidad"
"https://lh3.googleusercontent.com/a/ACg8ocKOh9t2qgTBFvo_f0xYWk_RU6oQq_j5o3klTq3tSb8Gj6MH5g=w36-h36-p-rp-mo-br100","Hedera Helix","Hace 10 meses","No tiene ascensor, es algo que le falra a muchas estaciones de la línea 5 lamentablemente. Tiene dos salidas, una de ellas da a la plaza donde hay mucho movimiento,"
"https://lh3.googleusercontent.com/a/ACg8ocKXCbA9nS-RATIXAfKY4sfEJS7Pr6DLjRehMCEgfsGbYnfH=w36-h36-p-rp-mo-ba4-br100","Manuel Gomez","Hace un año","Céntrico,que puedo decir del metro de Madrid, Única pega de esta boca demasiadas escaleras debería ser más accesible para personas con discapacidad"
"https://lh3.googleusercontent.com/a-/ALV-UjVvPM93_CbqpT142d2w-EWXDq9T2iZho-QDIOuwJrbkf9-MQ19NZg=w36-h36-p-rp-mo-ba4-br100","Mª Teresa González","Hace 2 años","En el metro de Madrid siempre sucede lo mismo y se resume en la frase que dice “todo es susceptible de mejorar o de empeorar”. En este caso mejorar. Pueden mejorar horarios, frecuencia de metros, etc"
"https://lh3.googleusercontent.com/a/ACg8ocLRMBb47GHJTTYwb7ADRhiMLkGG1WxsRgoJLcfFUNoJuKPylQ=w36-h36-p-rp-mo-br100","Vicente Porras","Hace un año","Las escaleras de salida de esta estación son penosas por su altura, no accesibles para personas con discapacidad."
"https://lh3.googleusercontent.com/a-/ALV-UjWYZL6kT92tDF8wFbje4t9mzVC8GT_PrD6qmBrrDfWrVkdciK-Dvw=w36-h36-p-rp-mo-ba4-br100","Miguel Angel Robleda Cedenilla","Hace un año","El metro, por lo general, está de cine. Las veces que he estado en Madrid siempre lo uso, es muy barato y rápido para desplazarte por la ciudad."
"https://lh3.googleusercontent.com/a/ACg8ocJx3VFgqTGdH5JsPrJCILCWgt_qn6Ka9PI74sPN1bKwWGhKEQ=w36-h36-p-rp-mo-ba6-br100","Salva Arellano","Hace un año","Excelente local para conciertos. Se ve y se oye muy bien, tanto en pista como en grada."
"https://lh3.googleusercontent.com/a/ACg8ocILHBXl2Re0V2g4O0txaVdKFRAvoQn9arWka2CzTzROCU-IBA=w36-h36-p-rp-mo-br100","Eva isabel García de la fuente","Hace un año","Techos muy bajos. Todo escaleras. Y ningún ascensor"
"https://lh3.googleusercontent.com/a-/ALV-UjW2404QX4MlhMAI3p1jlSNNxJS96XfLjHrhcbX9I4PvCS-RSQdC=w36-h36-p-rp-mo-ba3-br100","arodis Jimenez","Hace un año","Buen servicio no les doy 5 por que no tiene ascensor para discapacitados"
"https://lh3.googleusercontent.com/a-/ALV-UjX10yplZnlMObX8wTUfbvDrxdgTJKy0-gkJ_okDi6BBFHfksLoY2A=w36-h36-p-rp-mo-ba3-br100","Ana Madrid","Hace un año","Muy buena comunicación al outlet del corte inglés a 4 minutos caminando."
"https://lh3.googleusercontent.com/a-/ALV-UjViGAlAG6lKZ2wvNOKUdoHVwvw28TfWKlmckNX7VwoCkRo_RU5p=w36-h36-p-rp-mo-ba4-br100","Faraon Manran","Hace un año","Barrio de la periferia. Tiene el palacio vista alegre. Está muy bien."
"https://lh3.googleusercontent.com/a-/ALV-UjU8IeVPbqqLy8n8mZxnPsZSgmGLM3yntmS6JHqZ2Yw3tTrQVG4=w36-h36-p-rp-mo-ba5-br100","Helen L","Hace un año","Una estación de metro más, sin acceso para sillas de ruedas y poco vigilado"
"https://lh3.googleusercontent.com/a-/ALV-UjV_2dO1AwjqcHyAo96XHvCyXsxqtoZ2bmLdKkU5nWww5zORy03lSg=w36-h36-p-rp-mo-ba4-br100","Oswaldo Bermeo","Hace 2 años","Es una estación limpia y siempre los operadores atento por cualquier irregularidad"
"https://lh3.googleusercontent.com/a/ACg8ocJM15xQXL64h6eqWhswz6sjHIzzQbThjQ8ghiJbJgdJox_suQ=w36-h36-p-rp-mo-ba5-br100","Alma Lop","Hace 2 años","Todo muy bien, limpio, pero no tiene ascensor."
"https://lh3.googleusercontent.com/a-/ALV-UjXC0Fswj7mqsYyPLne0D0-ano8_8zw5mPOh7vlWtrZx3hOU-MaJyg=w36-h36-p-rp-mo-ba5-br100","Krloz 10","Hace 2 años","Está bien ubicado y tiene banco cercas y mercados pero de noche con cuidado"
"https://lh3.googleusercontent.com/a/ACg8ocL_8OK42xikcIehNYxnaOyRAuRY1K2qrfy4MaVqEaY0PvEExEI=w36-h36-p-rp-mo-br100","Dani Lopez “Longs”","Hace un año","Muy mal no me he encontrado a Rosendo por aquí"
"https://lh3.googleusercontent.com/a/ACg8ocKoLeBxFOQ8ZwREBHJHO9wupL4Ha87He6CxAYRgl2SCb2zB_Q=w36-h36-p-rp-mo-ba4-br100","Isabel Cid Linde","Hace 2 años","Sí esta muy bien me gusta como lleger"
"https://lh3.googleusercontent.com/a-/ALV-UjWEm2i9kD7gHWs-L37FXP7AIBzKIJrwEoYzgJsqDqwkhp0rtoU=w36-h36-p-rp-mo-ba4-br100","Pablo Fuentes Vicente","Hace un año","Gran metro, te alegra la vista"
"https://lh3.googleusercontent.com/a-/ALV-UjVjlHoMcf16xOiCw7yPs1USmXgNPBFhmOd1VVihPUsiVtJ2NmM=w36-h36-p-rp-mo-ba6-br100","Grazia Sanna","Hace 2 años","Buen estado de estaciones aunque podrian mejorar"
"https://lh3.googleusercontent.com/a-/ALV-UjUg5AecJVv6wr0xtDy143LaJ6OTXKgUnPkVnxvjwosUZasqL-fK=w36-h36-p-rp-mo-br100","Andres Avila","Hace un año","Lugar muy tranquilo,  para relajarse"
"https://lh3.googleusercontent.com/a-/ALV-UjW16pZg5MEP9xSk2V7HMycxFeMBGQsfPwSJo-zy6e_VGvY4naA=w36-h36-p-rp-mo-ba3-br100","Arthur Vianna","Hace 2 años","No tene aceso para silla ruedas."
"https://lh3.googleusercontent.com/a-/ALV-UjWJiBGOk3-z-xX_Q0sIP7d-21JjXNddhad6A8Z0BbUBbEbCGJxD=w36-h36-p-rp-mo-ba4-br100","Maria Del Pilar Vidal Ruiz","Hace un año",". Muy bueno"
"https://lh3.googleusercontent.com/a-/ALV-UjV7RrIqrdFi06-1-Is0X8J7xE4Be5QLjTAxgEl-AvLoYsI_mfYTYg=w36-h36-p-rp-mo-br100","jose antonio lopez","Hace 2 años","Muy mal salir y entrar escaleras peligrosas"
"https://lh3.googleusercontent.com/a/ACg8ocIRlBPuh3lc0V-wmtC27SeK6w3ILAYAUHojXWHsEZgD8LOki3m7=w36-h36-p-rp-mo-br100","Lidia Palacios","Hace 2 años","Muy bien"
"https://lh3.googleusercontent.com/a-/ALV-UjX2LoUB3ahp4xhpDSXJ7egAdA4-Jj3bJp7F_WeNafbdt9tgbPQ=w36-h36-p-rp-mo-ba4-br100","rainiero mendez","Hace 10 meses","Muy concurrida"
"https://lh3.googleusercontent.com/a-/ALV-UjXa8TcLGLO67iZa80c7JxeAOI0TzbKgL45g29QBLiiQpCZuWdPu2Q=w36-h36-p-rp-mo-ba6-br100","Alicia camellin","Hace 3 meses","Metro de Madrid...."
"https://lh3.googleusercontent.com/a-/ALV-UjXuI3uJ0FtrX-vRAweC7hG-yp7-u6LUNBkAAxarGJ87wTlIIHAN=w36-h36-p-rp-mo-ba5-br100","Jose ramon Esperalta lopez","Hace 11 meses","Bueno"
"https://lh3.googleusercontent.com/a-/ALV-UjXPd1MQWYEeIRoWWeKx1pkMuBXG7pboxQv7Z6iGY2rnkCsYHvgs=w36-h36-p-rp-mo-ba5-br100","DAVID BELLAS","Hace 2 años","Falta ascensor"