"De lunes a viernes. Pasan con frecuencia de 6 minutos. Pero fines de semana y festivos fatal , cada media hora , abierto y no muy cómodo"
"Parada de metro ligero al aire libre."
"Parada comoda, con marquesina, sitio para sentarse y anuncio de llegada de trenes. A veces fallan las máquinas de compra de billete."
"Bélgica es una estación del servicio de metro ligero 2 en somosaguas en Madrid España"
"Es una parada de metro ligero al aire libre"
"Usa la app de metro ligero o te eternizarás esperando"
"Muy bien"
"Trabajo"
