"Muy mal climatizado. En general las instalaciones son sucias, y encima por entrar a los baños te hacen pagar 1 euro. El único baño gratuito está muy sucio y huele horrorosamente mal, yo fui 3 días después y seguía oliendo igual, lo que hace pensar que no se limpió ."
"La estación está al público desde 1990. Siempre limpia, cuidada y accesible. Varias compañías de Bus en los que puedes recorrer España. También con largo recorrido, Rumanía, Bélgica, Alemania, Francia etc. A un magnífico precio para tu viaje. Con conductores profesionales. Asientos con pantalla interactiva, WiFi, wc. Sus paradas pertinentes, para cambio de conductor y descanso. Velocidad muy controlada por tacómetros. Control de seguridad. En la misma estación puedes coger metro y cercanías. Taxi. Hay servicios de restaurantes, tiendas y máquinas para comprar baterías y cables. A la salida exterior tienes centro comercial y bares. El autobús siempre es una opción para llegar a tu destino, no es como antiguamente un calvario. Mi empresa favorita Busbud."
"La estación de metro Méndez Álvaro es una estación importante en la red de Metro de Madrid, situada en el distrito de Arganzuela. Esta estación es también un nodo crucial debido a su conexión con la estación de trenes y autobuses Méndez Álvaro. ### Líneas de Metro Méndez Álvaro es servida por: - Línea 6 (Circular) ### Conexiones Adicionales - Cercanías Renfe: Conexiones con varias líneas de tren de cercanías (C-1, C-5, C-7, C-10). - Estación de Autobuses Sur: Importante estación de autobuses que conecta Madrid con numerosas ciudades en España y Europa. ### Ubicación La estación se encuentra en el barrio de Palos de Moguer, en el distrito de Arganzuela. Está situada en la calle de Méndez Álvaro, cerca del Paseo de Santa María de la Cabeza. Esta ubicación la convierte en un punto de acceso clave tanto para el transporte local como para el transporte de larga distancia. ### Servicios y Facilidades La estación de Méndez Álvaro ofrece varias facilidades para los usuarios: - Ascensores y escaleras mecánicas para mejorar el acceso. - Instalaciones accesibles para personas con movilidad reducida. - Máquinas expendedoras de billetes y puntos de recarga de abonos. - Conexiones con autobuses urbanos e interurbanos, lo que permite a los pasajeros continuar su viaje hacia diferentes partes de la ciudad y otras localidades. ### Importancia Méndez Álvaro es una estación clave debido a su papel como nodo de transporte multimodal. La combinación de metro, trenes de cercanías y autobuses interurbanos facilita el acceso a muchas partes de Madrid y a destinos más lejanos. La Línea 6, siendo circular, permite un desplazamiento eficiente alrededor de la ciudad y conexiones con otras líneas de metro. ### Lugares de Interés Cercanos - Planetario de Madrid y Parque Tierno Galván: Como mencioné anteriormente, un centro de divulgación científica y un gran parque urbano con áreas recreativas y espacios verdes. - Estación de Autobuses Sur: Un importante punto de salida y llegada para autobuses interurbanos e internacionales. - Centro Comercial Méndez Álvaro: Ofrece una variedad de tiendas, restaurantes y opciones de entretenimiento. Si necesitas más detalles, como horarios específicos o información adicional sobre los servicios disponibles en la estación, estaré encantado de proporcionártela."
"Una de mis estaciones preferidas de Madrid. Los policías pasean todo el día por la estación, mínimo, de dos en dos, por lo que es de las más seguras de Madrid. Es un gran Inter cambiador de metro, tren y autobuses que salen o llegan a Madrid. Puedes comer, descansar, hacer compras en una amplia variedad de negocios, leer… Además está rodeada de bares, tiendas, espacios al aire libre… Estupenda, limpia y muy cuidada."
"El metro Linia 6 MENDEZ ALVARO- ya SEGUNDA VEZ  veo como están Fumando la gente- adentró de estación de metro- Molestando MUCHO!!! ENCIMA CON CALOR QUE TENEMOS!!! el SEGURIDAD que veo cada día -es completamente INÚTIL!!!  I no se trata sólo del MENDEZ ALVARO!!! Unos  están sujetando paredes-que no se caen! Otros apoyando dormiendo la máquina  de acceso- sin dejar pasar! PARA QUE SIRVEN??- NO LO SÉ!!!"
"Méndez Álvaro es una estación tanto de metro como de Cercanías. Pertenece a la línea 6 de metro, y a la 2 del mencionado Cercanías. La estación se encuentra en curva. Es sábado y hay poca gente, casi nada concurrido. Cerca se encuentra el corte inglés."
"¿Hasta cuando nos van a tratar como borregos? ¿Dónde están los bancos para sentarse (abajo a donde los autobuses)? La gente joven termina sentada o tumbada en el suelo 🤷🏻‍♀️ ¿Alguien ha pensado para los mayores y para las mamás (hoy estaba observando una mamá dando pecho de pie, a su bebé.)? Es una vergüenza. 🤨"
"Instalaron unas luces azules, para publicitar algo, en el pasadizo de la estación al metro, que son malísimas. Para las personas con problemas de visión u otro tipo de sensibilidad es horrible caminar por ahí."
"Es vergonzoso que solamente haya 4 enchufes en la estacion, veniamos de un viaje largo granada-madrid, y al subir a la renfe a coger el tren direccion fuenlabrada/humanes tuvimos que esperar 50 minutos hasta que llegó. Ibamos sin bateria con los moviles apagados y de la desesperacion al ver que no venia el tren pensamos en bajar a cargar el movil 5 minutos para coger un uber, pero cual fue nuestra sorpresa cuando vimos que solo habia 4 enchufes y todos ocupados ya que la gente es tan empatica que usan el movil mientras lo cargan y no dejan que se liberen los enchufes para que todos los que lo necesiten lo puedan usar. Vergonzoso que en la estacion principal de autobuses de madrid no haya enchufes"
"Me parece delictivo que te cobren un euro por usar los aseos, es un abuso. Y claro los establecimientos próximos NO TIENEN ASEOS!!!😳 así tienen el negocio asegurado. Así que cuando vayas a la estación a coger un bus de 1 o más horas de trayecto ve evacuado ya de casa o a claudicar. Hoy día 05 de julio los precios para mear están en 2€, ya está bien de tanto abuso. Y no nos olvidemos que Lis aseos de la estación donde paran los buses, curiosamente siempre está ocupados por el servicio de limpieza. Sinverguenzas."
"Hoy fui a coger un autobús para ir a Nerja y el conductor del autobús me ha dicho que no iba a Nerja le enseñé mi billete y no me hizo caso ni siquiera lo miro y paso de mi y me he quedado en tierra al final fui al mostrador y conseguí uno para mañana a primera hora adiós"
"El problema no es con la estación, es con las máquinas expendedoras que tiene. Te gastas 25€ para comprar una batería portátil, la puerta de la máquina no va por lo que no puedes coger lo que acabas de comprar. Llamas a atención al cliente y te dan un número para reclamar que cuesta 3€ el minuto y no hay ninguna otra forma de poner una reclamación. Seguridad no quiso ni acompañarme a ver el problema y no fueron de ningún tipo de ayuda. Por no decir que la máquina de por sí tampoco tiene ningún número de contacto o número de identificación, así que para reclamar te las apañas tú solo."
"Estación horrorosa. Acoso total de mendigos pidiendo de todo y dentro de la estación los guardias de seguridad  una hora antes del cierre te obligan a ir a la parte de atrás de la estación,donde hace un frío polar , además de hacer preguntas estúpidas. Máquinas de café y chips que se tragan el dinero y no te dan el producto,y si llamas al número de averías te cuelgan el teléfono. Vamos una estación horrible en todo. No recomiendo esta estación ni para cinco minutos."
"Esta situada en la C/ Méndez Álvaro tiene muy buen acceso ya que enlaza con varias líneas de cercanías Renfe y Metro de Madrid son instalaciones amplias y con fácil aa las dársenas de salida y llegado de autucares"
"Son unos sinvergüenzas pues que te cobran un euro para entrar al servicio y eso no tenía que estar permitido"
"Son unos sinvergüenzas cobran un euro para entrar al servicio y encima están muy sucios por el dinero que cobran podían limpiar más"
"Poca gente para atenderte en mes de vacaciones y debería haber gente para agilizar a los pasajeros sacar billetes!!!"
"En general, todo está bien aquí. Hay cafeterías y el lugar está limpio. Sin embargo, no hay enchufes disponibles y es necesario pagar por el uso de los aseos. Además, una de las salas está cerrada. Esto resulta bastante incómodo cuando se tienen pertenencias o una maleta."
"Hay Metro, Cercanía, y muchas empresas de autobuses para destinos distintos. La estación es guarra. Los aseos no tienen ni siquiera papel ingiénico. La mitad de los ascensores no funcionan."
"Una estación de autobuses donde no hay bancos para sentarse. Los usuarios tenemos que esperar sentados en el suelo o de pie. Hay unos pocos armatostes que supongo les llamarán respaldos o algo así. Este tipo de mobiliario debería ser ilegal. Su función es estorbar y evitar que haya algún banco donde alguien ose tumbarse, sobre todo personas sin hogar.. Los baños te cobran por entrar a usarlos. De vergüenza y mucho más para ser un lugar público."
"8:30 de la mañana 1/10. Las pantallas no ponen la dársena donde sale mi autobús... después de media hora recorriendo la estación por casualidad veo un autobús de la empresa con la que viajaba que se está yendo... casi lo pierdo... nunca informaron de la dársena. En el transcurso de la hora intento ir al baño. Los de no pagar están cerrados porque están limpiando pero no veo a ninguna limpiadora. Arriba, los de pago uno no se podía pasar porque el acceso estaba roto y en el otro fila de todos los viajeros... pagar un euro para un baño viejo y donde la limpieza no es muy exhaustiva. Las escaleras mecánicas de bajada están paradas y es un peligro bajar tan cargada. También fila en los ascensores porque señores, vamos cargados con maletas, es una estación. Una de las estaciones de Madrid con la cantidad de cajeros diarios y los servicios mínimos para la seguridad de los viajeros, información y... etc. no se cumplen. A pesar de que algunos billetes por precio son equiparables al de AVE."
"Hay un baño gratuito al lado de la dársena 31 abajo en las dársenas al fondo el de arriba lo cobran aun euro me parece una vergüenza"
"Me gustaba ir al  C.Comercial. de Méndez  Álvaro.  Una pena  que  lo hayan cerrado.La Estación  Sur está  muy bien  para  desplazarse  en  Bus.."
"Magnífica terminal de buses alsa y sosibus, moderna monitoriada.. Ordenada.. 👍🏾Limpia.. Conecta a metros y renfe..…"
"Me pareció muy bien. Limpia, amplia y la información adecuada. El personal es muy amable."
"Una estación, muy frecuentada por tal motivo hay demasiada gente siempre... Los baños cobran 1€ y suelen estar sucios siempre y con mal olor"
"Estación de autobuses muy grande y con muchos destinos. Eso sí, hace poco han puesto baños de pago y te cuesta mear 1€, en unos aseos pequeños y viejos, en fin, un abuso."
"Accesos en muy mal estado. Poco accesibles y con tornos que golpean al entrar porque no están bien calibrados y sin protecciones de goma, con pantallas de lectura sin texto y aunque indican la flecha de prioridad si viene alguien en sentido contrario no se cambian a la ""X"". Mi hija pequeña ya ha sido golpeada varias veces. Os animo a registrar reclamaciones en RENFE a través de la foto del código QR."
"La estación en general está bien. Los baños de arriba los han puesto de pago, pero abajo en la estación de bus siguen siendo gratuitos aunque no están tan limpios ni suele haber papel. La información de la Renfe siempre está desactualizada, solo informan sobre la línea 5, pero no sobre la 1 ni la 10."
"He querido sacar una botella de agua. La primera máquina en la planta de arriba no me la pero me devuelve el dinero, otro intento en la planta de abajo, no me la da y se queda con el dinero. 1,70€ por cada uno que lo intente! Buen negocio."
"La estación de sur es el encuentro de muchas de las agencias de viajes de autobús, cuenta con un centro comercial que se puede aprovechar por si tienes que esperar tu viaje."
"Está bastante bien, lo que no me gusta tanto, es que tengas  que pagar 1€ por entrar al 🚽 me parece que es excesivo, tienes lo opción de ir a los que están en la plan baja, el problema, que están muy sucios, huelen mal y a veces no están disponibles todos. Sería posible mejorar? Gracias.…"
"Estación de Autobuses de Zona Sur de Madrid con lineas que operan enntoda España. Ciertamemte en epocas de verano o Semana Santa hay mucha gente por los desplazamientos. Se ha quedado algo anticuada y el parking además de ser abusivo, es incomododisimo para circular, maniobrar y aparcar."
"Vergonzoso, sin más!!! Este misma noche 6/9/2023, la guardia de seguridad, una señora y un compañero suyo joven, me han echado a la calle en plena noche, a base de voces y un trato cual increpante, a la 1 de la madrugada. Simplemente porque les ha dado la real gana, palabras textuales, de la señora de seguridad. Dejando a otras varias personas en el cuarto que tienen habilitado para supuestamente gente que viaja a primera hora a larga distancia que es mi caso. Porque según la susodicha señora ella es la que decide quién se queda y quién se va. Me ha dado vergüenza ajena, ya que nunca en 40 años que tengo he visto un trato similar sin razón alguna por parte de nadie. Sinceramente, muy disgustada y decepcionada con el personal que se supone salvaguarda la estación de Méndez Álvaro. Haré lo posible para no tener que pasar por allí."
"La Estación de autobuses bien pero se cobra 1 EURO!!!  POR ENTRAR AL BAÑO. ME PARECE UN AUTÉNTICO ROBO.. Estaría de acuerdo  en que se cobrara 0,50 para mejorar limpieza pero 1 euro es un robo a mano armada"
"El personal de seguridad, no tiene modales. Tratan a las personas sin respeto, se creen los dueños de la estacion. Sólo hay unos  pocos cargadores eléctricos para conectar el teléfono"
"Vuelvo a hacer esta reseña ya que me la han borrado. Hay que pagar para ir al baño.. una vergüenza. Por mi parte, esto repercutirá también en las cafeterías que hay... No pienso volver a tomarme nada allí si después no puedo ir al servicio"
"Es una buena estación de bus. Única pega solo han dejado 2 servicios para viajeros sin tener que pagar. La limpieza deficiente. Siempre llenos"
"Mi novio estaba pasando el billete pa entrar a Méndez Álvaro y le estaba viendo me ha venido una señora de allí, y me ha quitado el bono transporte sin venir a cuento y me ha hablado fatal, educación cero, era una señora q tendría más de 40 años, pelo corto y blanco, con gafas. Una maleducada y una sinvergüenza. No tiene por que quitarme la tarjeta, se pregunta y se la doy educadamente."
"Estación de autobuses que cierra a la 1 AM hasta las 5/6 am. Osea tienes que ingresar antes de esas horas si tú autobús sale en ese rango horario. Tiene un sitio especial para descansar. Posee lockers para dejar tu equipaje por 5 euros, muy conveniente si llegas y sales de ahí y tienes (cómo en mi caso) más de 12 hs de espera. Puedes aprovechar y recorrer algo de Madrid sin tanto peso a cuestas. Se llega fácil desde el aeropuerto (vía Renfe) y la estación de tren queda muy cerca."
"Lamentable el boikot que hacen en cuanto a los baños, los pocos gratuitos sucios hasta más no poder, para que claro vayas al que pagas 1€, que es un lío para entrar con la maleta. Hay gente que viaja con los justo para estar cobrando 1€ por persona y luego hacer que los que no pagues estén realmente inmundos"
"Baños cerrados en la planta inferior, mala limpieza.. pocos sitios donde comer algo rico. Sitio oscuro y necesidad de reformas"
"Lo que me faltaba por ver en una estación de autobuses donde viajas horas en un autobús sin poder ir al baño, una necesidad básica de todo ser humano, y que llegues a la estación y te quieran cobrar 1€ !!!!!! Pero estamos locos??? De verdad que a quién se le ha ocurrido?? Pero qué os pensáis que somos?? Precio del billete 25 ... guarde 1€ para ir al baño antes de salir o al finalizar su viaje... Gracias por confiar en las estaciones públicas de Madrid. De locos locos."
"Hay parking barato con acuerdo con la cadena de parkings municipales de Madrid. No indican bien dónde están las Dársenas de los autobuses."
"Octubre de 2022. Es vergonzoso el estado de la estación, a esto se añade la situación de llevar 15 diás averiadas las escaleras mecánicas de acceso a Renfe y Metro. Es penoso ver a personas mayores y otras cargadas de maletas subiendo y bajando a pie en una única escalera."
"Después de pagar tu billete te encuentras con que los baños tienen un torno en el que hay que meter un euro o no entras. Para los que vamos con tarjeta y no llevamos suelto genial. Como si por el billete pagases ya poco"
"1 euro para usar los baños. Un robo a mano armada. Debería de haber baños gratuitos para la gente que va a viajar en autobús al menos"
"LA PEOR OFICINA DE HACER LA TARJETA DE TRANSPORTE PÚBLICO. Las personas que trabajan ahí son unas IMPRESENTABLES, poco profesionales. TE PIDEN SACAR CITA PREVIA Y LUEGO TE HACEN ESPERAR. MENTIRAS QUE CLASE DE PREFERENCIA ES ESA"
"Un abuso el cobro de 1 euro por entrar a los baños. No informando que hay baños gratuitos en las darsenas. Los cuales carecen de higiene (ni rollos de papel higienico, sucisimos, y charchos en el suelo ) al final te  conducen a pagar 1 euro por unos baños mas limpios. Con el billete de bus podrian controlar el acceso al baño."
"Indignante que te cobren 1€ por usar el baño, algo necesario antes de subir a un bus durante horas! Un atraco, si tienes un billete de bus no deberías pagar por entrar, ya estás pagando el servicio. Y sí tienes una urgencia y no tienes una moneda, o tienes que entrar varias veces."
"Los baños de arriba están en obras y han habilitado otro al lado donde hay que pagar un euro por usarlo y no se puede ni pasar, por una barandilla de control que no hay quien la mueva con  la maleta. Los baños de abajo de las dársenas sí se pueden usar gratis."
"Uno de los ejes de comunicación más importantes de Madrid con la estación de autobuses."
"La estación no está mal , pero lo que si que me parece mal es que te cobren por usar el Baño, cuando tiene todos en obras. Ya pagamos el billete, lo próximo que  será pagar por usar las escaleras."
"No soy de comentar , 1 euro para ir al baño??? Una estación de bus  publica. La gente en las dársenas sentadas en el suelo ? Una barra para apoyarse. De verdad, vaya solidaridad. No se para q pagamos impuestos. Quien sea el responsable que se lo haga mirar."
"Después de tomar un café dentro de la estación y comprar un billete de autobús.. Te dicen que por pasar al servicio, tienes que pagar 1€. ¿Que va a ser lo siguiente, pagar por respirar el aire que hay dentro o por pisar el suelo? Vergonzoso. 0 motivación para coger el transporte público."
"Estoy muy indignada. Ahora resulta que tienes que pagar 1 euro por hacer un pis antes de coger tu bus de 8 horas. Me parece acojonante que ya te cobren hasta por un servicio que es vital y que debería ser gratuito. Una vergüenza."
"Pasan las décadas y está estación no mejora. No hay donde sentarse abajo en las dársenas. La gente acaba tirada por el suelo. La parte de arriba necesita un lavado de cara. No parece Madrid."
"Los baños cerca de las dársenas 31-32, están picas veces limpios y desinfectados, huelen mal. Por favor, pasen con más regularidad a limpiar."
"Solo hay un baño habilitado, ya que el resto están cerrados por obras, mientras que los de pago sí están disponibles. Algunas escaleras mecánicas están paradas y no se puede ir con maletas."
"Pésima estación de autobuses para los años en los que estamos. Señores, estamos en el siglo 21, ya es hora que remodelen las instalaciones así como el parking. Cuando accedes en vehículo al parking, parece que accedes a una ratonera: suciedad, desperfectos y muy poca iluminación a la entrada. Los accesos peatonales desde el mismo a la estación son pésimos. En cuanto a los autobuses, espacio mínimo de seguridad entre los asientos, seguro que incumplen con la distancia de seguridad entre los mismos. Ante una frenada de emergencia habría muchos problemas de rodilla como mal menor; ya no quiero contar ante un accidente o que el pasajero delantero quiera reclinar su asiento. El autobús inició el trayecto desde origen con varias filas de asiento libres a ambos lados. Vaya, seguro que siendo la primera ruta de la mañana no han podido quitar asientos. Ojalá no tengan ningún accidente o contratiempo con nadie, pues se les caería el pelo. Miren por la comodidad del pasajero, hoy día hay transportes de animales mucho más cómodos. La única estrella se la doy al conductor, por su amabilidad y profesionalidad en todo el trayecto. Felicitaciones, Señor Conductor."
"Todo está bien aquí en general, hay cafeterías, todo está limpio, hay sala de espera, pero no hay enchufes, hay que pagar por los aseos, y un está cerrado.... Es súper incómodo cuando tienes cosas, maleta,"
"Estaciónn Méndez Álvaro muy amplia. Andenes grandes aunque le haría falta una buena reforma."
"El único motivo por el que alguien puede poner 5 estrellas a esta estación es porque está comprado o es amigo de. De la estación de autobuses de la capital de España te esperas algo más. Desesperante buscar dónde cargar tu móvil u ordenador si debes estar varias horas. Y sí, hay puestos para cargar el móvil, pero unos 8 huecos para las150 personas que querrían hacerlo a la vez. Ni los negocios que hay, ni la estética, ni el cuidado y limpieza de la estación ni el propio edificio parecen de una gran capital europea. Una pena."
"Me parece LAMENTABLE. Poco sitio para sentarse, los servicios asquerosos y sin papel higiénico. Han puesto uno de pago, al que no pude entrar por no llevar suelto. Hay un señor allí vigilando, pero no vale para mucho pues no dispone de cambio para poder entrar. Que haya que pagarlo no me parece bien, pero si a cambio de eso está limpio... podría llegar a estar dispuesto. Pero habrá que dar facilidad en el modo de pagarlo. Cambio y tarjetas. Que estamos en Madrid en 2022!!!"
"Estación con buenas conexiones de bus para toda España"
"He tenido que coger un autobús en Méndez Álvaro y solo había un baño y oh sorpresa!!! Cobraban 1 euro!!!por algo básico y necesario, me sentí atracada y muy enfadada, una tomadura de pelo 😡😡😡…"
"1 euro para entrar en el baño y ni siquiera es de oro y la señora muy borde. 🙄🙄…"
"El terminal bien, todo bien indicado"
"Las últimas remodelaciones están muy bien y adaptadas a todo tipo de personas, aunque los servicios dejan algo que desear... aunque se ve algún que otro robo tiene buena vigilancia... pero es una estación muy importante y transitable de Madrid.... supongo que son cosas normales dado que une muchos puntos de España."
"Me parece triste y penoso que en un lugar público haya que pagar 1€ por entrar al wc. Que vergüenza..."
"Un pasajero se ha quedado en tierra en el trayecto Madrid-Granada con fecha 11-03-2019 y hora 1:30 de la madrugada. No se si estas leyendo esto pero tus cosas las dejare con el conductor cuando acabe el trayecto así que no te preocupes"
"Las estación de autobuses de la capital de un país no puede tener escasez de medios.. Bancos para los pasajeros en las dársenas.. Personal de información a partir de las 11 y falta de un lugar abierto al menos hasta las 12 para poder tomarse un café.. Descansar y cargar el móvil... Es tercermundista"
"Todo muy limpio ,pero las tiendas y cafeterías cierran muy pronto para la gente que viaja de noche y le apetezca comprarse algo para tomar"
"La estación es amplia y está relativamente bien.... Ahora hay 3 baños uno en refacción, uno que está escondido y el otro te cobran 1 euro para entrar... Como te va a cobrar 1 euro para ir al baño viejo sabiendo que es una bendita terminal... Increíble."
"Esta estación parece para ciudadanos de segunda clase, hay suciedad por todas partes, no digamos ya en los baños, que son inmundos. Me parece un maltrato al ciudadano mantener  unas instalaciones en este estado, teniendo en cuenta que el precio de los billetes es similar y en algunos casos superor a otros medios de transporte, pongamos por ejemplo el tren."
"Hoy he viajado desde la estación Méndez Álvaro y para pasar a los en aseos hay que pagar 1€. Me parece un abuso, ya que es un servicio que debe prestar las instalaciones de dicha estación."
"Buen acceso y aparcamiento. Limpia y bien señalizada. Parte comercial anticuada"
"Vergonzoso que haya que pagar para entrar al baño, se supone que es un lugar público no???, Ahh y los ascensores para bajar a las Dársenas no funcionan.....un desastre."
"Las escaleras mecánicas llevan más de 2años sin funcionar y la gente con los carros de los niños y las maletas se las ven y se las desean. Una vergüenza de transporte público con lo carísimo que es. Además que los sueldos de los conductores de tren tienen que ser malísimos porque están en huelga más tiempo que en activo haciendo a los usuarios víctimas de sus quejas."
"Como se nota que viajar en autobús es de gente más humilde y aquí Ayuso no gasta, es literalmente cómo viajar al pasado, mal cuidada, obsoleta, con solo dos baños y tampoco muy cuidados... Vamos para una ciudad pequeña mal pero para Madrid, penosa."
