"Tiene un parking muy cómodo. En la estación de ven las cigüeñas, super chulas!!!"
"Metro Linea 9 en el cual el itinerario aproximado entre tren y tren es de 10 minutos. Consta de un amplio estacionamiento externo, al aire libre. En esta línea de metro puede acceder una persona con sillas de ruedas ya que tiene ascensores."
"8 AM la estación llena, llegan dos vagones, no se puede entrar al metro, Piensan que somos Ganado, definitivamente Si. Los que usamos el transporte público tenemos Dignidad. USTEDES NO Que os Vote Chapote"
"Buenas estación, accesible, cuidado con el parking, no tienen cámaras si os dan un golpe al coche o le pasa lo que sea os lo coméis solos."
"Sus fiestas son espectaculares, como las de toda la vida, para todas las edades"
"Parada Metro línea 9, està en medio de los campos de fútbol de la Casa Grande, la màs cercana al Parque Regional Sureste. Párking grande."
"Sencilla y Compacta, pero muy completa."
"Comunicación rápida con vías de acceso y buenos lugares para visitar"
"8 am de la mañana dos vagones sin poder montar en el metro.. De nuevo incumpliendo servicio, maltratando a los usuarios quien es el responsable de esto. En mi trabajo ya se hubiera puesto remedio... Sustituir a estos inútiles que usan cargos públicos para maltratar a a los usuarios.. Ustedes responsables no son personal adecuado. Para dirigir este fracaso de metro el dinero público mis impuestos los. Usan ustedes para sistemáticamente maltratar."
"2 vagones para esta línea que supuestamente pasa casa 9 min y tarda hasta 15 y además el día de hoy lleva 10 min de retraso en paradas sin explicación"
"Una vergüenza, venimos de puerta de Arganda unos desde cercanías Renfe y otros desde la continuación de la línea 9 de metro, pues solo dos vagones para todo el mundo, el vagón lleno,todos juntos. Imposible guardar distancia de seguridad, añadan más vagones para cumplir la ley, no creo que esto sea legal..."
"El metro de Madrid está muy bien Pero el servicio de metro de puerta de arganda a Rivas es pésimo Falta más frecuencia o más barato Muy caro para el servicio que tiene que dar Es más barato ir a Madrid desde Paco de Lucía (Norte de Madrid) que desde Rivas"
"Exelente cuidado en todos los sectores.. buena limpieza y atención de los empleados a la hora de atender y ayudar.."
"Facil acceso desde la autovia. Buena conexión con Madrid via metro."
"Zona sur de la ciudad, junto al núcleo primigenio de Vaciamadrid. Está conectada con la línea 9 una de las más destacadas! Buena conexión con importantes centros comerciales de la zona (Leroy Merlin - Decathlon - Media Markt) Recomendamos."
"Estación con ascensor perteneciente a la Línea 9 (morada) del Metro de Madrid, y correspondiente a la zona B2. Situada en la zona sur de Rivas Vaciamadrid, en lo que es la zona más antigua."
"Pésimo servicio de metro. Pocas frecuencias que se traducen en largos tiempos de espera, precio más caro del billete, pocos vagones y horario restringido. Horrible"
"Me encanta. Restaurante asiático con una carta variada y muy bien preparada. Personal muy agradable."
"En plena estación del metro se puede apreciar un fabuloso nido de cigüeña"
"Buen sitio para pasear cerca rio Jarana y Manzanares."
"Me gusta su limpieza"
"Es, un pueblo, muy bonito y tranquilo."
"Fácil acceso y gran parking para coches."
"Muy bien"
"Un pueblo muy bonito"
"Retrasos cada poco. Va muy lento."
"La estación de metro más cercana al centro comercial H2OCIO"
"Buen sitio"
"Una estación de metro muy chula"
"Bien"
"Buen parking"
"Este es uno de esos pueblos que esperas encontrar en esta increíble ciudad, algo tranquilo, sin ningún ruido, piscina local, iglesia, parques, algunos cerca de lagos y no está tan lejos."
"Localidad en las afueras de Madrid dirección Valencia."
"Muy hermoso"
