"La Estación de metro y de Renfe de Sol es grande, moderna y con buena limpieza considerando la gran cantidad de usuarios que la utilizan diariamente. Su ubicación céntrica la convierte en una de las estaciones importantes de la ciudad de Madrid. Es accesible tanto por escaleras como por ascensor. No le coloco un 5 de puntuación ya que considero que todo servicio y/o instalación es mejorable. Un punto mejorable sería el aumento de trenes por razones obvias. La población madrileña y de sus alrededores se ha incrementado exponencialmente lo que ha resultado en el aumento correspondiente en el número de usuarios de este tipo de transporte público."
"Excelente labor del equipo de seguridad de la estación, brindando seguridad a los ciudadanos… En el día de hoy evitaron un robo a mi persona de un teléfono por parte de unas ratas, actuando con rapidez y eficacia. Excelente trabajo y muchas gracias."
"La estación de sol. Una de las más prácticas en todos los sentidos. También la primera como tal desde 1919. Haciendo este servicio. Cuenta con ascensores en todas las plantas subterráneas y salidas al exterior.       Puedes cojer la línea 1…"
"El día de hoy en la estación del metro de sol Fuimos víctimas de hurto en un establecimiento de comida muy reconocido cerca de la zona Por una banda criminal Que se dedica a esta modalidad de robo pidiendo que les ayuden con comida pero aprovechan cualquier descuido para robar lo que puedan En este caso Las autoridades del metro de Madrid interceptaron a este personaje rata que no merece otra descripción y hacen el debido proceso Doy las gracias a todo el equipo de seguridad de metro por su excelente labor y gran manejo de la situación Este mensaje lo hago con el fin de resaltar la labor de el camarero del restaurante quien nos ayudo y de los vigilantes del metro GRACIAS METRO MADRID"
"Hola, soy Isabel de @im.saso !! Todavía recuerdo entrar en esta estación por primera vez y pensé que estaban regalando algo. Perfectamente señalizado por todo lado, informadores que te resuelven todas las dudas y gente afanada como si fuera el fin del mundo. Pero es la estación que al salir te lleva directamente al corazón de Madrid. Si tuviera aseos sería todo un plus para la estación. Te dejo algunas fotos y vídeos, espero que sean de tu ayuda ¡Un saludo!"
"Un sitio estupendo.con su plaza,su km 0 .precioso.la estación Buenos accesos."
"Estación grande y limpia. Tienes unas cuantas tiendas de souvenirs, en el metro tienes un stand de tarjetas Lyca, Micropréstamos Vivus, para picar algo Rodilla, muchos músicos que dan ambiente de fiesta. En Cercanías en cambio tienes stand de tarjetas Lebara, lotería y Belros. Lo malo es que no tiene baños públicos."
"Estación de metro Sol , lugar muy concurrido, es una zona turística de Madrid, son muy lindas las arquitecturas y diseños de los edificios ♥️"
"Es una de las estaciones emblemáticas de la línea 1 de Metro Madrid. Creo que no hace muchos meses fue cerrada para mejorar infraestructura de la estación pero la verdad es que si así ha sido no veo por ningún lado ninguna mejora. El olor que desprende el suburbano es horrible. A todo menos higiénico. Esta parada de metro tiene correspondencia con la Línea 2 y 3 y con Cercanias RENFE."
"Tienen que venir con más frecuencia los metros, esperando 8 minutos, no he podido entrar en el que vino porque estaba lleno, y ahora me toca esperar otros 8 minutos, una vergüenza!"
"Son unos ladrones, hice una carga doble por error y al llamar me dicen que me acerque a cualquier oficina, voy a 3 y ninguna quiere hacerse responsable, luego voy a esta pficina de Sol y me salen con la excusa de que solo son 24hr para hacer devolucion. Solo ponen pegas para no devolverte TU dinero, lo peor es que se piensan que es dinero de ellos y les descontaran de sus sueldos, en realidad es de la empresa."
"Ayuda basura lo que tienen de personal en el metro de sol. Que vergüenza! Una niña de 13 años queriendo recibir ayuda de encontrar a su madre llamando por teléfono y nadie del servicio del metro, vigilantes la deja un móvil para poderla localizar, no han querido ayudarla. Menuda vergüenza! Como para tener a un niño perdido por el metro. En esto se ha convertido la sociedad. Vaya humanidad que ni a los niños españoles los quieren ayudar. Que asco de gente funcionaria. Que asco!!!!! Así nos va con gente asi. Vaya asco!  Gracias. Gracias por vuestra misera ayuda! Dais asco!!!!!!"
"La infraestructura de la estación es correcta, sin embargo, los paneles informativos con los horarios de las salidas de los trenes rara vez funcionan o, incluso, dan información errónea. Las líneas C-3 Aranjuez  (todo 2023 en obras y con trayecto por sol suspendido) y C-4 Parla que pasan por esta estación sufren retrasos (o adelantos) constantes respecto al horario de salida programado que se da en la aplicación de Renfe. La frecuencia de la linea C3 no baja de 20min y en algunos momentos del día sube a 35min. Claramente insuficiente."
"Pongo una Estella y porque no me deja poner menos, es una auténtica vergüenza el retraso de los trenes entre aranjuez-chamartin/ chamartin-aranjuez, PONEEEER MAS TRENEEEEEES!!!!! O por lo menos que los pocos que hay cumplan con sus horarios establecidos!!"
"Deberia tener más trenes en frecuencia y el fin de semana el metro hasta más tarde de la 1:30am, seria igualmente rentable!"
"El metro los findes lamentables, 20 min esperando la linea 1 en Sol, sí, será agosto, pero viajamos igual. Y encima hoy con Rastro iremos hacinados. Se cargan todo, pero como ellos tienen sus coches oficiales ni les preocupa"
"Si pudiera colocaría un cero. Lamentable el servicio de renfe. Tren que deja abandonado a sus pasajeros en la estación las matas por incendio en la vía. Lamentable que el encargado que esté de turno no sepa gestionar transporte para pasajeros y sea un maleducado, sin poder ofrecer solución a nada. Cada vez el servicio es peor."
"Vergonzoso lo que me ha pasada, después de estar esperando la renfe para alcobendas 40 minutos sin llegar me subí para preguntar una chica que estaba en la entrada me dijo que estaba de retraso luego me bajé y otra vez me quedé esperando casi 45 minutos hasta que me subí por segunda vez le pregunté a la misma chica me dijo que no sabe el porqué y llamó al responsable le explico lo que me pasó y su contestación fue que hay obra y que hay que hacer trasbordo en nuevos ministerios y lo peor me dijo que había que preguntar antes así si quisiera ir a otro destino hay que preguntar antes es increíble a parte no ponen nada de obras ni se escuchaba por megáfono que hay obras ni nada así que el valor del viaje me lo comí yo y nada el viaje me costó el doble y más 1h30 de tardanza"
"El 30 de agosto a las 11:15 la rubia que está en atencion al cliente de la salida a sol se iba a comer una hoja de reclamaciones por su mal trato hacia los clientes!! La preguntas algo y pasa de levantarse , te manda a las maquinas solo, para reirse ella junto a su compañero. Y desde su silla, que parece que lo tiene pegado, se ríe de que no saben como van las maquinas.En fin estupida y maleducada!!  Te recuerdo que es tu trabajo."
"La mejor estación de metro (🚊🚊🚊) que tiene la Ciudad de Madrid 🔴⚪🔵🐻🐻.  Para mí fue único, por qué se viaja cómodamente (😁😁💪💪👭👭🧑‍🤝‍🧑👫). A su vez tiene varías salidas cómodas te sacan a la zona de la Gran Vía y la Plaza Mayor (🔄🔄🏛️🏛️⛲🏢🏢🏫🏫🏦🏦).…"
"No es posible pagar sin contacto por tus billetes, solo en efectivo o con tarjeta física. Y por supuesto no hay ventanillas con datáfonos , para quitar las ventanillas de han dado prisa pero para modernizar los sistemas fe pago y pagar sin contacto o con tu móvil no corren tanto, súper arcaico , siempre por detrás estos servicios , a ver si despiertan un poco y se ponen al día con los modos de vida"
"La chica de pelo rizado rubio es muy muy estúpida, la gente le pregunta y le molesta hacer su trabajo. A unos guiris delante de mi les ha cobrado 10viajes para quitarselos de encima cuando no querian eso. Es absurdo que la gente que viene a visitar madrid deba adquirir una tarjeta que pagas cuando te vas a volver a tu lugar y no la vas a utilizar más. El metro es viejo, pequeño, ni se iluminan las paradas para guiarte dentro del vagón, hay espacios donde el techo es muy bajo. Para ser el metro de la capital, deja mucho que desear."
"Horrible, metro de Madrid en general, un verano nefasto en todas las instalaciones, escaleras averiadas durante semanas, cortes   de líneas sin servicio de autobuses, puertas que golpean a ancianos y niños al validar el ticket... Señores de metro las personas siguen trabajando incluso en verano, seguimos pagando un abono transporte, aún superando los 40 grados en los andenes, x favor cuando un correcto servicio del metro de Madrid que tanto publicitais... Si en metro se llega, pero a que precio..?? O en cuanto tiempo..."
"C4 San Sebastián de los reyes , lenta se para, horarios previstos nunca los cumplen. Si fuera que se equivocan por 5 10 minutos.. pero no tren lento se para mucho 1h 30 de viaje hasta la última parada. Como siempre a llegar tarde al trabajo. Gracias renfe."
"Es vergonzoso que en medio de un pandemia mundial, las frecuencias de los trenes disminuyan. En plena hora punta (y cuando no lo es también), apenas hay sitio para entrar en los vagones. ¿Dónde está el interés por la seguridad de los ciudadanos del que tanto se alardea?"
"Hay una señora rubia en el área de cercanías que directamente no sabe trabajar. Me echó la bronca y amenazó con quitarme el abono por un error que la renfe tuvo. Muy muy desagradable, hablaba con aires de superioridad. Cuidado."
"Renfe = Mala(isima) atención al cliente. La tarjeta magnética de 10 viajes se desmagnetiza (ya nos ha pasado 2 veces) y no te ofrecen solución, por lo que pierdes los viajes que tenías comprados."
"¿El personal de esta estación que esta de adorno? Cobrando un sueldo por no hacer nada... Se me acaba de colar un señor y se lo digo a la chica de esta estación,y hace un gesto de darla igual. ¿Enserio? ¿Tengo yo que pagar 82 euros mensuales para todos los días en cualquier estación se me cuele alguien y a Renfe le de lo mismo? REPITO, TODOS LOS DÍAS. No es solo una falta de respeto del que se cuela,que se esta aprovechando de mi dinero,que a mi no me sobra, sino también por  parte del personal. Sois una vergüenza,no os olvidéis que somos clientes.Permitis el acoso,el robo,el escandalo,la inseguridad y las faltas de respeto."
"El cercanías está señalizado de pena. No indican que tren pasa por cada andén y teniendo en cuenta que tardan unos 20 minutos, como tengas que cambiarte de un andén a otro, no llegas al trabajo ni de coña. Un desastre."
"Deberían mirar más a quién tiene contratada esta empresa, las taquilleras de la estación de Sol , dos mujeres bajitas y entradas en carnes , no me quisieron vender un billete porque sólo podía pagar con tarjeta y ellas me obligaban a pagar con efectivo, además decir que en las máquinas expendedoras es imposible la compra con tarjeta si tu tarjeta no lleva contactless.Ese fue el motivo por el que me dirigí a las taquillas, para tener personas contratadas que no hacen su trabajo que las despidan y contraten a gente del paro que no será por personas encantadas de tener ese puesto de trabajo y no a vagas como esas."
"Estación con mucha afluencia de pasajeros debido a su ubicación en pleno centro turístico de Madrid: La puerta del Sol. Con acceso a líneas de autobuses urbanos y Cercanías Renfe."
"Céntrica y bulliciosa, la plaza de la Puerta del Sol es uno de los emblemas de Madrid. En su planta semicircular confluyen varias de las calles históricas y más transitadas de la ciudad, como Mayor, Arenal, Alcalá o Preciados, y concentra varios de los elementos más representativos de esta urbe. Uno de ellos, es el famoso reloj de la Casa de Correos, sede de la Comunidad de Madrid, que cada 31 de diciembre marca las doce campanadas del nuevo año ante una multitud que se congrega a sus pies, para tomarse las doce uvas tradicionales en una ceremonia que se retransmite por televisión a millones de españoles."
"Cercanías sol cerrado, nosotros no lo sabemos y viene uni de seguridad muy desagradable, hablando mal y grosero... Para eso.... Que pongan una verja o algo. Por favor... Luego hay gente sin trabajo... Día 11 de julio del 2021 a las 15:43"
"2 veces e intentado comprar en la máquina dispensadora que está dentro del renfe de sol en la vía parla Aranjuez y la máquina se queda mi dinero no es a la única persona que le ha pasado porque muchas personas en esta segunda vez que me pasó me han dicho que también les ha pasado acomodar esas máquinas o si no funcionan quitarlas"
"Cercanías Renfe. Máquinas expendedoras de billetes solo admiten dinero en metálico y Renfe. No admite tarjetas ninguna de ellas."
"Esta cerrando días que no están anunciados. Hoy es 27 y no dejan hacer trasbordos ni tienen parada en sol. Muy descontenta con esto pues me perjudica al volver del trabajo a casa"
"Estación  de metro de la linea 1 y conexión  con la 2 y la tres. Por su ubicación es una de las estaciones del metrpolitano madrileño con un importante numero de pasajeros y mucho movimiento. Yo creo que es la estacion  más conocida del metro y por la que es muy dificil no pasar si usas el transporte público, que siempre deberiamos utilizar y en Madrid aún más si cabe."
"Para ir al centro de Madrid no hay mejor medio de transporte. La estción es super segura, limpia y cuenta con muchísimos servicios. Conecta directamente con el metro. Del centro al aeropuerto (T4) en 30 minutos."
"Me gustaria saber por que en la salida y entrada a la renfe, hay una corriente de aire enorme. Es una duda que siempre comparto con mi compañera y ninguno de los dos sabemos responderla. Un saludo."
"Train STATION (Cercanias) Calor y poca ventilación. en la zona alta Tengo dudas si es un defecto de diseño o ahorro De verguenza con el turismo que visita Madrid. Efectuada reclamación a este particular. No tiene justificación, con tanto técnico y politico,"
"Estacion de Renfe con direccion a chamartin y atocha en pleno centro de Madrid una grandiosa zona turistica con acsensor y escaleras Mecanicas & estacion de metro linea 1 linea 3 y linea 4 de metro de Madrid con una tienda de alimentacion y algunas tiendas de merceria y unas medidas Sanitarias correspondientes en exelencia"
"Siempre lo mismo la estación de sol los Renfes que vas por por nuevo ministerio Chamartín nunca respecta su hora siempre llegan  más de 10minuto de retraso sin aviso es una vergüenza  muchas gente llega tarde a su trabajo por culpa de de los renfes ."
"Estación amplia,limpia,luminosa y moderna. Une metro y renfe. Muy céntrica. Buenos accesos para personas con movilidad reducida ♿. Tienes varias líneas de METRO 1,2,3 y de CERCANIAS C2 C3 y RENFE. 100% recomendable."
"Trato nefasto, no te dejan estar de pie porque dicen que podemos sacar fotos y es ilegal, pierdo la vez por un número,cuestion de segundos, lo indico y  se me obliga a coger vez de nuevo con muy malos modos."
"En atención al cliente del metro (consorcio) normal q vaya tan lento. Una chica con el WhatsApp y las otras no paran de hablar."
"Es de las mejor organizadas . Tiene buena distribución a muchos lugares de Madrid . Tiene varias salidas . Es muy comoda"
"Emblemático aunque hay que admitir los andenes de metro se quedan muy pequeños para todo el flujo que soportan, una ampliación- remodelación no le.viene mal, por lo demás es muy señalizada está muy bien"
"Vergüenza, compramos tickets de metro y cercanías,nos damos una vuelta y al volver a casa nos pone que están caducados, preguntamos y nos dicen que duran 2 horas sacados, en ningún sitio al comprarlo lo pone. Reclamación al canto, andaría con cuidado."
"Una de las mejores estaciones de metro de Madrid en este momento está suspendida la línea dos en sentido Retiro por las obras en Canalejas"
"Necesitábamos un lavabo con urgencia y, ante nuestra sorpresa, no hay. Ni siquiera de pago"
"Los trenes no paran en Sol de 19:00 a 21:00 horas!!! Parece que los que trabajamos lo tenemos que sufrir, pero los que están de compras no tanto!!!"
"NUNCA funcionan las máquinas expendedoras, a pesar de ser muchas.  Conclusión : vete con tiempo o perderás el tren."
"Olor nauseabundo cada vez que entras en una estación que siempre está concurrida."
"El ascensor de acceso a las líneas de Colmenar y Alcobendas San Sebastián de los Reyes está continuamente averiado"
"Estacion de metro y tren de cercanias amplia y de fácil acceso tanto por escaleras, como ascensor y escaleras mecánicas, sólo le falta unos aseos públicos para ser perfecta... y algún ascensor más no estaría mal"
"Perdí mi abono de transporte y me dirigí a la estación, a servicio al cliente, sin cita previa, y la atención fue excelente, además muy rápido el trámite."
"Los madrileños nos merecemos un metro que pase con más frecuencia. Cualquier ciudad europea tiene mejor servicio. Una vergüenza."
"Incompetentes. Accidente en la estación  de Renfe Sol y se hicieron los suecos durajte mucho tiempo. Buena cuenta de ello sacarán los abogados."
"En este lugar bajando las escaleras hacia el tren de cercanias renfe se pueden apreciar unas ruinas conservadas de la antigua Iglesia de Nuestra Señora del Buen Suceso."
"No iban las máquina para recargar la tarjeta Renfe (Cercanías) y la atención del personal pésima, muy malos modales."
"Es un lugar muy central, cerca de todo en el centro de Madrid."
"Hoy he visto pasar 3 hombres sin mascarillas y el de seguridad estaba de espaldas, no hay control en medias Covid 19"
"Muy mal Son muy impuntuales Es un caos Y lo de cerrar Sol en diciembre es una vergüenza Hay gente que hace transbordo ahí para ir al trabajo"
"La verdad que el servicio de hoy impresentable después de 1 hs esperando nos informan que hagamos transbordo en Chamartín y en Chamartín el personal muy desubicado diciendo  que nk perdamos más el tiempo ahí"
"Será muy moderna y funcional.... Pero es una sauna en la que hace un calor asfixiante"
"Muy buena estación para ir a madrid centro"
"Falta de puntualidad Falta de previsión Fuera del horario punta puedes esperar…. Falta de frecuencia"
"La renfe es la peor compañía de transportes de la historia. Un 0."
"Estación grande con conexión de metro 2,3 y 1 y también renfe, al salir esta la plaza de sol y el km 0"
"Estación normal de metro lo único bueno el personal que te ayuda si tienes duda con las líneas."
"nos han parado cuando queríamos entrar como si nos hubiéramos colado, muy mal educados"
"10 minutos para comprar un suplemento de billete en la taquilla..."
"Un trato excelente por parte de los empleados, muy atentos a la hora de resolver dudas, gracias!!"
"Mi reconocimiento para el trabajo de los chicos de chaleco naranja que en días concurridos como hoy evitan que se colapse de toda la gente que había"
"Horrible malas instalaciones y malos profesionales al servicio de los viajeros. Es mejor que busquéis un medio de transporte alternativo."
"Estación con punto de info turística, comunicada con otras líneas y con cercanías de Renfe."
"En horas punta es una estación con gran afluencia de viajeros"
"Siempre de dia  o de noche bello!!"
"Me flipa ver moverse a tanta gente en un mismo lugar. Un poco de inseguridad."
"Lineas 1, 2 y 3 de metro. Con multitud de salidas.peatonales.y ascensores."
"Siempre un buen lugar para comenzar por Madrid"
"Fuera de servicio METRO LÍNEA 2 ,Dirección Atocha - Sol"
"Muy buena combinación Metro y Renfe ."
"Más policía por favor"
"Metro y Cercanías en una estación moderna y totalmente céntrica"
"se han flipao con los precios en las maquinas expendedoras"
"Plaza muy grande y mucha diversidad"
"Buena instalacion en un lugar tan céntrico."
"Buena atención al cliente y trato agradable"
"Con la familia en Navidad para ver la iluminacion"
"Es un metro decente."
"Mítica!"
"Precioso"
"Hace un calor insano"
"Espaciosa."
"Madrid,Madrid, Madrid 🎶🎵🥁…"
"La estación de Ferrocarril es más moderna que la de Metro. Tenga en cuenta que hay muchos carteristas que pululan por la zona."
"Renfe, Madrid, Sol. Pero por nuestra exposición a Renfe como turistas, en una porción bastante grande del país, probablemente se podría leer esto como ""Renfe España"". Brillante ""conjunto de trenes"" y frecuencia de servicio. Me encanta el…"
"Estación de tren en el centro de Madrid en la Puerta del Sol. Hay trenes de cercanías y líneas de Metro 1, 2 y 3. Esta estación es muy transitada y turística. Es bueno para el distrito comercial."
"¡Gran servicio!"
"Madrid es increíble y muy limpia."
"Está un poco sucio los fines de semana."
"Actualmente en construcción 8/6/22"
"Hermoso"
"compañia de ladrones"
