"La estación de metro Vicente Aleixandre es una estación de la red de Metro de Madrid, ubicada en el distrito de Chamberí. Fue renombrada en 2017 en honor al poeta Vicente Aleixandre, Premio Nobel de Literatura, antes conocida como ""Metropolitano"". ### Línea de Metro Vicente Aleixandre es parte de la: - **Línea 6 (Circular)** ### Ubicación La estación está situada cerca del Parque de las Naciones, en una zona residencial con una considerable presencia estudiantil, debido a su proximidad a varias universidades, como la Universidad Complutense de Madrid y la Universidad Politécnica de Madrid. ### Servicios y Facilidades La estación cuenta con diversas facilidades para los usuarios: - **Ascensores y escaleras mecánicas** para mejorar el acceso. - **Instalaciones accesibles** para personas con movilidad reducida. - **Máquinas expendedoras** de billetes y puntos de recarga para abonos. ### Historia Originalmente inaugurada como ""Metropolitano"" en 1987, la estación cambió de nombre en 2017 para honrar al ilustre poeta Vicente Aleixandre, que residió cerca de esta área. ### Importancia Vicente Aleixandre es una estación importante por su ubicación estratégica en una zona universitaria y residencial. Facilita el acceso a los campus de las principales universidades de Madrid y conecta con la Línea 6, una de las líneas más transitadas del metro de Madrid debido a su recorrido circular. Si necesitas más detalles, como horarios específicos o información adicional sobre los servicios disponibles en la estación, házmelo saber."
"Las escaleras mecánicas se averían cada dos por tres y tardan de media 3 a 4 semanas en arreglarlas. Si a eso se suma la carencia de ascensores, se hace muy complicado bajar a personas mayores, gente con equipaje de viaje, con carritos de niño o con movilidad reducida."
"Es una estacion de Metro. No tiene misterio. Es como todas, bien. En la salida a Juan XXIII tiene tres tramos de escalera mecánica."
"Antigua estación de Metropolitano. .................................................................................................... Renovada parcialmente, el cambio más notable en el interior…"
"Antigua parada de Metropolitano. Bocas de metro muy simples. Sin ningún ascensor para gente con minusvalías. En el mapa solo pone que hay una pero realmente hay dos. Suele estar bastante limpia para estar en un ambiente universitario."
"Me he pasado de parada y he tenido que bajarme en esta estación para dar la vuelta. Pues eso cuesta un billete de metrobus: Cambiar de anden implica salir de los tornos: fatal, fatal."
"Hay dos salidas de metro y no una, ambas sin ascensor y sin accesos habilitados para minusválidos. Siendo salidas que dan acceso a varias facultades y a varios colegios mayores deberían estar habilitadas y no lo están, llevan muchos años así."
"Sin ascensor ni por lo tanto acceso a minusválidos. Fallo garrafal en la disposición de los tornos que te puede hacer perder un viaje del metrobus como no vayas atento."
"Actualmente han cambialo el nombre a esta estación de metro. Hasta el 01/12/2018 fue la estación de Metropolitano, fecha en la que cambiaron su denominación, pasándose a llamar Vicente Alexandre, para evitar equívocos con el nombre del nuevo estadio del Atlético de Madrid."
"No posee ascensor, tiene muchas escaleras, lo cual complica el uso para personas discapacitadas"
"Sin ascensor ni acceso de ningún tipo para minusválidos. Muy mal"
"La línea 6 está bajo el infierno y no es accesible sin escaleras... Costará dejar de llamarla Metropolitano."
"Metropolitano es igual al metro pero llamada litano me gusta esta preciosa estación de metro de Madrid"
"Para cambiar de sentido hay que pagar otro viaje o volver a pasar la tarjeta transporte"
"estacion de metro y nada mas, como todos los demas"
"A ver, oligofrénicos, que ahora es vicente alexaindre jaja equisdé"
"Estación de metro de Madrid de la linea 6 sin conexiones."
"No accesible. Si te equivocas de andén no puedes cambiar."
"Todo bien"
"El metro de Madrid tiene buen servicio"
"Jaja"
"No esta mal. Podría estar mejor señalizado."
"🎃🎆🎇✨🎈🎉…"
"Parada de metro cercana a la EOI."
"Que vuelva Metropolitano!!"
"Demasiados pisos"
"Nuevo nombre de la estación"
"Buena estación de metro. Sólo un gran problema: tienes que pagar un billete extra si tomas el andén equivocado. Tampoco hay ascensores."
"No hay ascensor para personas discapacitadas fuera de la estación de metro."
"El nuevo nombre es Vicente Aleixandre. Se cambiaron de ""Metropolitano"" el 10 de diciembre de 2018."
"acogedor"
