"URL","Usuario","Fecha","Reseña"
"https://lh3.googleusercontent.com/a-/ALV-UjWV-rVJPj8oQ7sh09xQkzi-RNqSBb2iRL7_XdlzncAzQOFB4oAFvg=w36-h36-p-rp-mo-ba4-br100","Luis Díaz","Hace 2 meses","Una vergüenza el servicio de metro… hacinados como hormigas viajan los que acuden a este servicio. Lugar de propagación de enfermedades, ventilación inadecuada y poca higiene."
"https://lh3.googleusercontent.com/a/ACg8ocK7CwSxrEVcKEiWF8hEbNL0w-kOl1C8_PkkJVZYnsQS004EuQ=w36-h36-p-rp-mo-ba4-br100","Conchi Duran Lopez","Hace una semana","El metro muy limpio, pero hay muchas escaleras mecánicas para bajar y escaleras de piedra para subir andando  y esto dificulta mucho a las personas que tienen problemas de rodillas y caderas"
"https://lh3.googleusercontent.com/a-/ALV-UjVdmWXwBAid06ybsVKip_nS2KGGJhGKA6fwYr2oq6HOaJ3e6fig0Q=w36-h36-p-rp-mo-ba5-br100","Gustavo Ruiz","Hace 4 meses","Antes, con los comercios en el interior, donde se podía adquirir algo y tomar café, era más cálida. Ahora, pues como otras muchas, pelín inhóspita."
"https://lh3.googleusercontent.com/a-/ALV-UjWdX3tAK1ZJlSEdh8h8NGSBOAWGhVcUa-CtxrL2cSRL-XqgIQzj=w36-h36-p-rp-mo-ba8-br100","Ma Ca","Hace 6 años","Estación de metro antigua. Pertenece a las líneas 6 y 9 de metro. Tiene cobertura móvil. Está cerca del hospital Gregorio Marañón."
"https://lh3.googleusercontent.com/a/ACg8ocLZ895_HugTPZmZ798wIV0KKCGccjgTniTeyajuVeYVtjoFFg=w36-h36-p-rp-mo-ba3-br100","Rubén González","Hace 7 meses","El anden de la linea 9 parece África te comen los mosquitos. Por favor, hagan algo. Hay agua estancada en las vías y tanto las paredes como los techos llena de mosquitos. Se oye como pasa el agua de algún pozo o alcantarillado. Estacion antigua le haría falta una reforma pero ya!! No se como nadie se queja. Usar y pagar por un servicio diario y que a nadie le importe como los vagones de metro cada vez huelen peor y están cada vez más sucios..."
"https://lh3.googleusercontent.com/a-/ALV-UjWxtakekwjDOj8MvSP6Vfy8hz1t_-DeZ_1VIaOg_H3km1qr4Vac=w36-h36-p-rp-mo-ba5-br100","Paloe","Hace 4 meses","Estacion accesible con ascensor desde la calle y escaleras mecánicas"
"https://lh3.googleusercontent.com/a-/ALV-UjUyrqs2TqYwyUZhK6e9v-kbEYlMt3NmZnTtqBI0rRi8xbScNR_h=w36-h36-p-rp-mo-ba4-br100","Angel Moran","Hace 4 meses","Estación súper tranquila con poca afluencia de personas."
"https://lh3.googleusercontent.com/a/ACg8ocKlKQvMLY8Dx6gY3otu342h9ZL4CXefYSoAEDnJ0SZnEy1Olw=w36-h36-p-rp-mo-ba4-br100","Gemma León","Hace 4 semanas","Es una estación muy complicada para encontrar la salida correcta"
"https://lh3.googleusercontent.com/a-/ALV-UjUdGYsBpVABogc9CFceLx4OqWG8HoP7sexLOlBunm-P6n_SH9B9iw=w36-h36-p-rp-mo-ba6-br100","Julio Diarte","Hace 2 años","📌 Esta muy bien los accesos, lo bueno es que tiene ascensor.…"
"https://lh3.googleusercontent.com/a/ACg8ocLtqUXqUa-Ri_yFjKWT7oT6BgEEgqpSBpdtiYiK1lsm-hweruw=w36-h36-p-rp-mo-ba6-br100","T","Hace 7 meses","Estación de metro de líneas 6 y 9."
"https://lh3.googleusercontent.com/a/ACg8ocIGm1UVSeCYqkRMok24u_X890C9Z_zgRqeZP6SqncD_uazR-Q=w36-h36-p-rp-mo-ba3-br100","MELOSANSE J","Hace un año","5 tramos de ESCALERAS L 9 😆 Proximidad al centro Deportivo y Piscina Mundial 86, Centro Escolar Bachiller Montserrat y otros.…"
"https://lh3.googleusercontent.com/a/ACg8ocKiGpUfejN-1QP4Lich0kqzRIBeedhUm-rRJgDs3jMAqJVxnw=w36-h36-p-rp-mo-ba4-br100","Alejandra","Hace 5 meses","En el nuevo Vips la comida y la atención excelente"
"https://lh3.googleusercontent.com/a-/ALV-UjXJyyeoemDuZZ0LL-xLiKRWffH1eZVL1Cr80PKxEXV2r2urjFzm=w36-h36-p-rp-mo-ba5-br100","Felicidad Portillo Giron","Hace 4 meses","Muy bien"
"https://lh3.googleusercontent.com/a-/ALV-UjWY6fE96-BJeOs6wDoNWhd1VW4oT-SEM25YeOouPdfqQ6ppEEs=w36-h36-p-rp-mo-ba3-br100","emilio villacorta alonso","Hace 4 años","Bonito barrio con un gran parque para hacer mucho deporte y muy cerca del parque del retiro."
"https://lh3.googleusercontent.com/a-/ALV-UjVFIzZMeDcLKwctGf5aukVx53k0CzHHZYNUhzjmPSUQjr4N-nHC=w36-h36-p-rp-mo-ba5-br100","Mogamonte (Mogamonte)","Hace 2 años","No lo han renovado y cusnfo lo hacen, es de la peor manera posible. Arrasan con los arboles les da igual la naturaleza y el calor. Com9 plaza España, uns esplanade de cemento y sin árboles, que coge 50°de temperatura. Lo mismo Sol,, o mi casa, q por un lado hay una plaza adoquinada sin un árbol y por el otro lado un aparcamiento. Resultado???? 55° de temperatura por el día, 40°por la noche, eso rd cuidsr del ciudadano sin recursos?? Además, no se riegan JAMÁS los árboles que hsy, ni los recién plantados : SE MUEREN : DESPILFARRO... ESO NO PASA E. N B. DE SALAMANCA, VERDAD????"
"https://lh3.googleusercontent.com/a/ACg8ocLTVoJgPZTt8VgNAJPSqH_EgZzqMlzr-lMFFVye96LdQCe_cBub=w36-h36-p-rp-mo-ba4-br100","Ana Álvarez","Hace un año","Cerca del Hospital Gregorio Marañón, céntrico, mucha hostelería (no todos recomendables), muchas terrazas habilitadas para invierno y para estar con mascotas."
"https://lh3.googleusercontent.com/a-/ALV-UjW4zXb0A_Qr-gplRtewimQsjXPYFCg09HcFz3uvUxizKbuMW42l=w36-h36-p-rp-mo-ba5-br100","Cristina González","Hace 10 meses","Parada de metro y bastantes líneas de buses. Zona comercial muy completa, con locales, mercado, restaurantes, terrazas,..."
"https://lh3.googleusercontent.com/a-/ALV-UjX1y6rP8Mlk7z7Zh6F5bHCU56dApxF1kmiPcgl5xd8hMfF-R9s-=w36-h36-p-rp-mo-ba5-br100","Jesus H","Hace un año","He ido muchas veces al lado esta para jugar pádel SMP y comercio de todo tipo cafeterías y para jugar al mus que que iba  a todo esto etc"
"https://lh3.googleusercontent.com/a-/ALV-UjXvWxnLLUu0iVpFeJm3uHInAUVBnF9HPfKPadUP5EBh6LF_vqqN=w36-h36-p-rp-mo-ba3-br100","Reebok Adidas","Hace 2 años","Llevo muchos años usando ese metro y está todo muy bien..aunque algunas veces los metros suelen tardar mucho pero después todo lo demás va d maravilla"
"https://lh3.googleusercontent.com/a-/ALV-UjXnewNEbYYaXdHD0epgVByIWzW2jKqBZMPTzU18-HYzM_sBuOGCqw=w36-h36-p-rp-mo-ba8-br100","Doncelador","Hace 4 años","Estación con acceso a las líneas 6 y 9 de metro Madrid. Es accesible para personas con movilidad reducida, dispone de ascensores y escaleras mecánicas. Tiene cobertura móvil en toda la estación. Dispone de cuatro accesos a lo largo de la calle Doctor Esquerdo."
"https://lh3.googleusercontent.com/a-/ALV-UjUIdVMJlrqr5uGfJe2i79gkfh2pURMNVP06hvCamVTbwTytxY7MrA=w36-h36-p-rp-mo-ba4-br100","Javier Rodriguez Viñas","Hace 6 años","Estación de Metro que conecta las líneas 6 (Circular) y 9 (Paco de Lucía - Arganda del Rey) de Metro bajo la C/ Doctor Esquerdo (cerca del Hospital Gregorio Marañón) en el distrito de Retiro. La estación está accesible parcialmente, porque aunque si tiene ascensores para bajar a la Línea 6, no los tiene para bajar o cambiar a la 9."
"https://lh3.googleusercontent.com/a-/ALV-UjV7fi3yhj9mvWBMafP55eBm_4mX6nXxz2W7jAN11yOmgdFXO9VZ=w36-h36-p-rp-mo-ba4-br100","john ram","Hace un año","Es una estación de metro muy concurrida pero también muy segura. Puede hacer transbordo con la línea 6 que también te permite comunicarte con Renfe y con un gran número de estaciones."
"https://lh3.googleusercontent.com/a-/ALV-UjVunaNOZGhGzcqK65c6DRIkkYThl7KDkr2Fe1KB8vFcNb_fREu1=w36-h36-p-rp-mo-ba3-br100","george impulsa","Hace 5 meses","Nada en especial una estación más del metro"
"https://lh3.googleusercontent.com/a/ACg8ocLCXpI1RloSqTCClnFa0pk8e22civhGIBh_6hHZo2j20R9_VQ=w36-h36-p-rp-mo-ba3-br100","Javier García","Hace 2 años","El menú de hoy domingo muy buena pero el segundo cochillo super pequeño que tuve que reclamar que me hiciese el cambio que me ponía una costillita pequeña me hizo el cambio pero su trato cambio con nosotros y solemos ir bastante y no es barato"
"https://lh3.googleusercontent.com/a-/ALV-UjVfPsRzyhd5n_bEu4rcKd6jHP6VE_H7dWtC9M_yTqQMEnYhF2Cm=w36-h36-p-rp-mo-ba3-br100","Luis Gonzaga","Hace 3 años","Seguimos en pandemia deous de semana Santa ..ni un solo control de acceso al metro ..por aforo la frecuencia del metro cada vez peor ..y ustedes señores. Políticos sentados en sus despachos ..haciendo campaña electoral ..los demás a trabajar en hurnas de Covid El Metro ...mucho gel higiénico y poca frecuencia"
"https://lh3.googleusercontent.com/a-/ALV-UjWz_sgqkDO1QNwFP0PIB3QpFegezTvR40c0tVoWDkYNqyuIi-sl=w36-h36-p-rp-mo-ba4-br100","M. Elizabeth Navarro","Hace 2 años","Muy buena zona, calles amplias con bastantes negocios, y es una zona tranquila, muy bien comunicado y con bastantes supermercados cerca. Ubicado al lado del parque del Parque del Retiro."
"https://lh3.googleusercontent.com/a-/ALV-UjU9QN-OWbOjqOp32L8zzahs4S8dWx1qR92XhFlblHr6bhYei_fkWw=w36-h36-p-rp-mo-br100","Jose Enrique Marin Fernandez","Hace 8 años","Sainz de Baranda es una estación de las líneas 6 y 9 del Metro de Madrid situada bajo la calle del Doctor Esquerdo, en las proximidades de la intersección con la calle Alcalde Sainz de Baranda, en el madrileño distrito de Retiro"
"https://lh3.googleusercontent.com/a/ACg8ocJQ6rvQMS2mo6NfLWuDKzW5WWf2Jh6DmZSc8EtyqIjepXM9wA=w36-h36-p-rp-mo-ba2-br100","Jorge B","Hace 3 años","A ver si se indica mejor si hay obras si no o si el tren da la vuelta. La línea 6 es un suicidio si vas con poco tiempo."
"https://lh3.googleusercontent.com/a-/ALV-UjURzRUvdErbUfsDaL2Y8ae0aeXz0K60xXehvDTY8ZcJEFpbJulc=w36-h36-p-rp-mo-ba5-br100","Javier Miranda Jiménez","Hace 3 años","Estación de metro correspondiente a la línea 6. Es bonita, limpia y está bien situada."
"https://lh3.googleusercontent.com/a/ACg8ocKMhfux4HgvneAfSijc1pIfzPw9sTn7hQ4XrHfQd4Koiojocw=w36-h36-p-rp-mo-ba6-br100","J. Noir","Hace 7 años","Estación con ascensor perteneciente a la Línea 9 (morada) y Línea 6 o Circular (gris) del Metro de Madrid, y correspondiente a la zona A."
"https://lh3.googleusercontent.com/a-/ALV-UjWvQeeetnLhNN6m83YYn7noh7W6TG5h6NjoYUBNUJE-gK2Xvvi6vw=w36-h36-p-rp-mo-ba5-br100","María Calle Santiago","Hace 2 años","Buena conexión con otras líneas como la línea 6 una estación decente y metro de los nuevos."
"https://lh3.googleusercontent.com/a/ACg8ocJInZo_m06359QC5T2nLaKyc3lGq1t4tsd0MCxeFX8hucaWeFg=w36-h36-p-rp-mo-ba6-br100","Chema R","Hace 9 meses","Escaleras y más escaleras y trenes cada 11 minutos un sábado"
"https://lh3.googleusercontent.com/a/ACg8ocIX2bNHIpiIBD-upC6MMAOhjmr6MFvN04eI2i46BTrnYnKqCw=w36-h36-p-rp-mo-ba2-br100","José Carlos Blázquez Fernández","Hace 3 años","Escalera mecánica en salida a la calle muy buen acceso"
"https://lh3.googleusercontent.com/a-/ALV-UjVbY0VyJC1aGQbU-lePpbrpvUYJSfuX8vNHIX4cT6yjs74h-q4rMA=w36-h36-p-rp-mo-ba5-br100","Wileiner Moises Figurelli","Hace 7 meses","Todo bien y bonito"
"https://lh3.googleusercontent.com/a-/ALV-UjWcHgpYnHSfs-PF1L5ZNZ8JjPdp97LHgq3wyRIaeXGcVJj7vWq9=w36-h36-p-rp-mo-ba5-br100","Alberto González","Hace 8 años","Cuenta con ascensor para ambas lineas y subir a la superficie. Cuatro salidas y personal de manera continua."
"https://lh3.googleusercontent.com/a-/ALV-UjX_N0JFUcFR-pDdNO_jSxjIREMj9pVB2XEiAaSmC5NbF7L9m0I-=w36-h36-p-rp-mo-ba3-br100","Alonso Roldan","Hace 2 años","Estación bien comunicada con escaleras y ascensor y bien cuidada."
"https://lh3.googleusercontent.com/a-/ALV-UjU-RSO_SlsdDXBrg5lz1UIWL812oQtjaP-3uWNFGcMPqr31K2s=w36-h36-p-rp-mo-ba3-br100","alvaro moreno castillo","Hace un año","Super bien comunicado y difícil de perderse, además la gente super maja que te ayuda en todo!!!!!"
"https://lh3.googleusercontent.com/a-/ALV-UjUQgJSLLOAqJzxkuH2PTYbGwxpXu-k4lSArs2GXHw48nAC4tmxb=w36-h36-p-rp-mo-ba6-br100","DieGo BeNet","Hace un año","Acceso al metro líneas 6 y 9 cercanas al hospital y hotel Ayre."
"https://lh3.googleusercontent.com/a-/ALV-UjXkElzfd1fqqf55cVRB4iJ89eq5iq4DPWGSau6x-xAxkAzcSfUCvA=w36-h36-p-rp-mo-ba4-br100","JM","Hace 8 años","Estación de metro cercana al hospital universitario Gregorio Marañón y relativamente cercana (unos 10 minutos andando) al Parque del Buen Retiro."
"https://lh3.googleusercontent.com/a-/ALV-UjV_rFDTuufh5UWUG-dX23_LT7FUo4TAE6sEBHhMucp0meYTgcsm=w36-h36-p-rp-mo-ba4-br100","Juan Zurita Montero","Hace 2 años","Cruce neurálgico de varias líneas de metro con gran afluencia de personas"
"https://lh3.googleusercontent.com/a-/ALV-UjWhF7l1k2-0stlKs7lyLJFC8BuBSFkwYHI7doJaiyTfJWw-EMY-=w36-h36-p-rp-mo-ba6-br100","jose antonio santos toledo","Hace 2 años","Bien, una estación modernizada de la Red de metro"
"https://lh3.googleusercontent.com/a/ACg8ocLNkW9mKcoszxmDg0KmFT_bkK3X_t2P273DYRBeVcNDdeWuPg=w36-h36-p-rp-mo-ba3-br100","Cloudyroom Wallace","Hace un año","Porfavor poner aire acondicionado que es insoportable el calor que hace en la estación"
"https://lh3.googleusercontent.com/a-/ALV-UjUc3IlcjOprhDMO3Kf1BV_QwGfRm2lkj5lEfaq6YxpV5nCh_H7h=w36-h36-p-rp-mo-ba4-br100","Alberto Busutil","Hace 4 años","Estación de metro de Madrid, conecta las lineas 6 y la 9"
"https://lh3.googleusercontent.com/a-/ALV-UjVksKMECkLZERt-fObXWhfpH88va3lzOc_92gmjcb1vuDnL_UPLLA=w36-h36-p-rp-mo-ba3-br100","Leonardo Espinosa Deulofeu","Hace 2 meses","Excelente!!"
"https://lh3.googleusercontent.com/a/ACg8ocLebqSgzI6ZpqDuDhfgegCzItPigVKWNSNm_M8VpZ5PNw3Vpw=w36-h36-p-rp-mo-ba4-br100","Gloria Trejo","Hace 2 años","Precioso el icónico piruli por su 40 aniversario iluminada de arriba abajo"
"https://lh3.googleusercontent.com/a-/ALV-UjWyZaupLKUQMlAB_CoHumBFm7pdWU3V9uB0Dp7vOKfZGrK-iWvc6Q=w36-h36-p-rp-mo-ba8-br100","ANTONIO CRUZ SANCHEZ","Hace un año","Estación de toda la vida, te tocará caminar mucho entre las diferentes líneas"
"https://lh3.googleusercontent.com/a-/ALV-UjWiNgeMNPdSFyo3wQLCyeV3K1DJVpwP0_XexvgSJj-JG3s2TMvoTQ=w36-h36-p-rp-mo-ba7-br100","Jose Maria Cid Montes","Hace 3 años","Buena estación de metro. Ascensores. Limpieza adecuada."
"https://lh3.googleusercontent.com/a/ACg8ocLc5gw8dmGUCfGy1zCe-9IDgg2XGq0Tv1b6gQ53sZFQjoDFGQ=w36-h36-p-rp-mo-ba4-br100","Lorena Díaz López","Hace 7 años","El acceso del ascensor es muy cómodo para acceder a la línea 6"
"https://lh3.googleusercontent.com/a-/ALV-UjUUCQK5DXwepNpQaEdGC9dz7y-qWi6LEUCjACzE0_LBsleBDY3b=w36-h36-p-rp-mo-ba6-br100","Joaquin Abellan Ossenbach","Hace 6 meses","Muy bonita"
"https://lh3.googleusercontent.com/a-/ALV-UjUXFC8s-uYIGmtZU9mH1UZlUIbIcGqBh3Pho20VF4n_dKLbzHE7=w36-h36-p-rp-mo-ba6-br100","DANY YOLI","Hace 3 años","Estación de Metro, correspondiente a la Línea 6."
"https://lh3.googleusercontent.com/a-/ALV-UjWpLUa7UpV3pnMiyT5j_Gj9CwUiow1kEp_z7NPOITEQ3FE77UWT_A=w36-h36-p-rp-mo-ba6-br100","Aviva Bergman","Hace un año","Muy accesible usando el ascensor."
"https://lh3.googleusercontent.com/a/ACg8ocL6j3fUjdHjzglCFPCFitAnCJ2BggebpG8jNROfZWVFbqChuA=w36-h36-p-rp-mo-ba4-br100","Rocio Rodrigo Rubio","Hace 6 años","Sainz de Baranda es una estación del servicio de metro de Madrid línea 6 y 9 en el distrito Retiro en Madrid España"
"https://lh3.googleusercontent.com/a-/ALV-UjVL47RxMzlLlwZbRa5u6da0FXQTcyMASZKFNbM6pVM9zBlx6qDv3g=w36-h36-p-rp-mo-ba4-br100","Gustavo Calle","Hace 6 años","Bien. Ninguna queja conmla estación. Enlaza con.las líneas 6 y 9."
"https://lh3.googleusercontent.com/a/ACg8ocKuz9-uih3LEfT-LTOBTXwUkTEGZSlia6otD01mrpnRVrkOog=w36-h36-p-rp-mo-ba3-br100","María de la Concepción Penalva Yuste","Hace un año","Tienes muchos sitios donde tomarte un cafe"
"https://lh3.googleusercontent.com/a/ACg8ocLFu471BY3q0XhpsYpQ0ruzMRg3narmxg-Of8OC0kpqmjcBSg=w36-h36-p-rp-mo-ba5-br100","Iván","Hace 7 años","Muy buena estación de metro, con ascensores directos con salida a la superficie."
"https://lh3.googleusercontent.com/a-/ALV-UjURwOBk_NlDTaTI2WCnof-7ChL3okUrlFDqEQu-UnIEG0d8UixT=w36-h36-p-rp-mo-ba4-br100","Roberto López González","Hace 3 años","Buena zona para un terraceo de primavera o verano."
"https://lh3.googleusercontent.com/a-/ALV-UjXBHipn0MFFcfSitFXlvak5e6KRZY5FNrwjILd4jeQSjbhjg8LPIg=w36-h36-p-rp-mo-ba5-br100","Lalegríadelahuerta yolé","Hace un año","Por segunda vez encuentro con el tren de la Navidad."
"https://lh3.googleusercontent.com/a/ACg8ocLUWOZvjykVWm7bZ1NNk8yDyAsmKdow7B0-HZDlFBJWZ12D4A=w36-h36-p-rp-mo-ba5-br100","Carmen Zincke","Hace un año","Normalmente están las escaleras averiadas"
"https://lh3.googleusercontent.com/a-/ALV-UjXJLSftLvWL8lkUp4-tm1-Q6Oc_0YKSJTfBZ7Hys2SjKdmjtaVL=w36-h36-p-rp-mo-ba4-br100","J rues","Hace 6 años","Enlace con la línea 9 bastante largo. Un ascensor vendría bien"
"https://lh3.googleusercontent.com/a-/ALV-UjVOxTzVuU3DzKD_xDt2llq47ro0PupzXodA-Pi_SBA3hzMjVlBdYQ=w36-h36-p-rp-mo-ba6-br100","Raul Domínguez Galache","Hace 5 años","Estación de metro de las líneas 6 y 9. Con escaleras mecánicas."
"https://lh3.googleusercontent.com/a-/ALV-UjWccXMgvcCqyxi2a41jWN0HaHp67iA7qYk_Tu2RKhJWTNJUQuQk=w36-h36-p-rp-mo-ba6-br100","Manuel Ángel Hidalgo Martínez","Hace 5 años","Cierra muy pronto el metro, pero hay sitos cerca bonitos"
"https://lh3.googleusercontent.com/a-/ALV-UjW01UcjHPfM4F6_lN_HlkruOrdNWuMnf0i8N7ftqyE0tT3BAFXN=w36-h36-p-rp-mo-br100","Walter fogelbach","Hace un año","No visite ningún lugar"
"https://lh3.googleusercontent.com/a-/ALV-UjV6Jcki_0YV5p27j7kA-RMVeEY4qJUQf9xR1-CUAyO7Kb6EW2GU_Q=w36-h36-p-rp-mo-ba3-br100","Pedro Iván Carrasco","Hace un año","Acceso directo al Pirulí de RTVE."
"https://lh3.googleusercontent.com/a-/ALV-UjX8TdKmYpfsHv0jSfRNniyW3FHpDU8wJI8_TgaXgq_NS56YyvLP=w36-h36-p-rp-mo-ba4-br100","Ruben Doblado","Hace 7 años","Casi siempre hay aparcamiento libre frente a Citroën"
"https://lh3.googleusercontent.com/a-/ALV-UjV8VM2Mtwt9ffCdYabILaM21oojK0H9A_OKrUE9VIdgezT5FQXI=w36-h36-p-rp-mo-ba5-br100","Pablo Richieri","Hace 7 años","Buena zona con parque de escalada con rocodromo y agua potable."
"https://lh3.googleusercontent.com/a-/ALV-UjU6aS1Smd2Ygqf94Tx1Rjmu1csdOOEvxgZTsfp6heVEVeLPb_R0=w36-h36-p-rp-mo-ba4-br100","Ana V","Hace 2 años","Estación de metro limpia y cuidada."
"https://lh3.googleusercontent.com/a-/ALV-UjUEyx0duhQv6TttJ_UL9rD--TX_HnjI_hixLI4LxfpGWcgWA3M=w36-h36-p-rp-mo-ba2-br100","ana belén cruz (anaANIMAC)","Hace 6 años","Zona perfecta para dar un paseo"
"https://lh3.googleusercontent.com/a-/ALV-UjWYZBmkuvRQqWeaA0fMLMzWbqLZp0HNe1fcMqBfQZdvp-kIRHVjwg=w36-h36-p-rp-mo-ba4-br100","Ingrid Martinez","Hace 10 meses","Muy accesible"
"https://lh3.googleusercontent.com/a/ACg8ocLDEthTgthmrEK4w7tZ3Q3s4eaW-5K6fF6p7wQmdOSEjE_hNw=w36-h36-p-rp-mo-ba6-br100","fer fuente","Hace un año","Se puede mejorar."
"https://lh3.googleusercontent.com/a-/ALV-UjWOZmk4DU8xPRsDC1qqwnpOYOE-lGk-I6CTkRGHuLQI3v6VyVFt4g=w36-h36-p-rp-mo-ba6-br100","Maik Aparicio","Hace 3 años","Arrechiiiiiiisimo¡¡ Simplemente arrechisimo!!!"
"https://lh3.googleusercontent.com/a-/ALV-UjWBbwZ3NMWVVCwqIz5ew4JqPjlwKlyRmc1Np3_k9j_sHRMyep3t1A=w36-h36-p-rp-mo-ba8-br100","Blacky. (Blacki.)","Hace un año","Bueno para pasear 👍.…"
"https://lh3.googleusercontent.com/a/ACg8ocLzz9k2UJciACU6Goh72Z5UzGBPrikOap-MDvGREw3merRYOJkP=w36-h36-p-rp-mo-ba4-br100","Pedro Diaz Hernández","Hace un año","Va muy lento"
"https://lh3.googleusercontent.com/a-/ALV-UjVCv41F9vMitVnNUxrIQzixAY4XZybsDiIfWfxYz7Sb50Yx_Fc=w36-h36-p-rp-mo-ba5-br100","Manuel de andrade","Hace un año","Bueno"
"https://lh3.googleusercontent.com/a/ACg8ocL3usqEeAb56WTrnfypFKR3stQ4bwuz7rIdevJyrQEikQvrixU=w36-h36-p-rp-mo-ba6-br100","Aurora G.","Hace 7 años","Un poco laberíntica porque tiene varias salidas"
"https://lh3.googleusercontent.com/a-/ALV-UjW6hZuCCu3VA1wFIjXlC_C99gRAEG-VjSOFAJjzQrIURI7aWWVFzw=w36-h36-p-rp-mo-ba4-br100","Egidio Ruben González","Hace 2 años","Lindo Lugar"
"https://lh3.googleusercontent.com/a-/ALV-UjXcPB-TEbtPYbflWCLZg-o1h5A_SYqNk0FJLWm1OlwNMNFuzQ=w36-h36-p-rp-mo-ba4-br100","Marimar Lopez","Hace un año","Limpieza"
"https://lh3.googleusercontent.com/a-/ALV-UjVedifjDpa8zj2W7koMbdWJo72ZJU9FKMc-AIf6C_2Y30C6aBbT8Q=w36-h36-p-rp-mo-ba7-br100","Mildred León","Hace 6 años","Ha mejorado mucho."
"https://lh3.googleusercontent.com/a-/ALV-UjXqwdjeIYE3xnNyJJs1VpfiI8LmYI5YZOAxWPwc5ddPyBiwZLh82g=w36-h36-p-rp-mo-ba4-br100","Manuel Xardonmanrofer","Hace 4 años","MI BULEVARD, UN ENCANTO"
"https://lh3.googleusercontent.com/a-/ALV-UjW7_DSXmbYYSufydFPCugH4_Gmp0vMsBzgcRh7ApIHXXFasnpdF=w36-h36-p-rp-mo-ba5-br100","Umbelino Ladron de Guevara","Hace 7 años","Limpia y cuidada"
"https://lh3.googleusercontent.com/a-/ALV-UjVf2MVz7zqSTY8-m5g1m3Ew34xGxhNZ04nM1NM72F6ZliwPo8S2=w36-h36-p-rp-mo-br100","Lucas Rivera Ciliberti","Hace 8 años","el rocodromo"
"https://lh3.googleusercontent.com/a-/ALV-UjXHrIYYrZ7wjwamDufRC7Ca50X3P4QIZIWyj1jsAz-4qc2fedNWOQ=w36-h36-p-rp-mo-ba6-br100","Leonardo Dancu","Hace un año","Limpio"
"https://lh3.googleusercontent.com/a-/ALV-UjW96WPj6AT547NCx0jhHEQ-KYYGJ5YzW_DpQF2dWBRP3EqOE6Lm=w36-h36-p-rp-mo-ba5-br100","LH Sumon","Hace 6 años","Impresionante"
"https://lh3.googleusercontent.com/a/ACg8ocI63Ck78Tm3fVmqnjI76Ua6jqT9Bfzx5h2gTfeBphMagOUWRg=w36-h36-p-rp-mo-ba4-br100","Jaime Copin Perera","Hace 8 años","Normal"
"https://lh3.googleusercontent.com/a-/ALV-UjXsliPlZ80SNTEyvMGGo6uX6-0FRsMaZ9CT5lMn4j_5wJU523g=w36-h36-p-rp-mo-br100","Mauricio bustamante cardenas","Hace un mes",""
"https://lh3.googleusercontent.com/a-/ALV-UjV8Vd4P-0w4zKSc4k8gPZLHnzNUNaVAq4RGEiBPsWlqeuz4QjE=w36-h36-p-rp-mo-ba5-br100","Miguel Angel","Hace 2 meses",""
"https://lh3.googleusercontent.com/a-/ALV-UjWPeA1fYFHBt8pqPBH2a7GJy16UEvmhQxXiW4gkl0gZ8pdQLUEG=w36-h36-p-rp-mo-ba3-br100","Cristián Vera Lyon","Hace 4 meses",""
"https://lh3.googleusercontent.com/a-/ALV-UjWsjWraDk4f_JzlJhslbqrSAr5G3-X8jvBovcMEH_rG25vndlfZPg=w36-h36-p-rp-mo-ba6-br100","Rafael Hernán","Hace 4 meses",""
"https://lh3.googleusercontent.com/a/ACg8ocKn-clxUXlsxt4zIrWxNU0YxO5FTfY9rLuk3fbcu4dLcUHIkw=w36-h36-p-rp-mo-ba4-br100","Maria Jose Rodriguez Poblete","Hace 5 meses",""
"https://lh3.googleusercontent.com/a/ACg8ocLf8tiIHrDLksxsUoNdZZ_Zh8PRsSJhhPudDgkpkzBz4v0P_g=w36-h36-p-rp-mo-ba6-br100","Angel Lamela","Hace 5 meses",""
"https://lh3.googleusercontent.com/a/ACg8ocIU0pByyDxMFE9kYj3jsLe7j9nRvwPvvBEjXwDQykalsxbS3A=w36-h36-p-rp-mo-ba4-br100","Inma Vera","Hace 6 meses",""
"https://lh3.googleusercontent.com/a-/ALV-UjWHPTsycITlRRXO93CrFZe_vxMCKs9ZZu2rGtVqJKkqH_HVP3kA=w36-h36-p-rp-mo-ba3-br100","nelson tankiono","Hace 6 meses",""
"https://lh3.googleusercontent.com/a-/ALV-UjVQZmjiJM6qEz8HRxyx52P4zVnVUcqLBpKdb1B9A_SB1cOwaNY=w36-h36-p-rp-mo-br100","angela frias martinez","Hace 6 meses",""
"https://lh3.googleusercontent.com/a/ACg8ocJ_BxejigyjYOBvLkSgjq1meiwTO4pXmsgROLUmDcmThVVtpw=w36-h36-p-rp-mo-ba3-br100","Nadia Șut","Hace 7 meses",""
"https://lh3.googleusercontent.com/a/ACg8ocLhmutZ4vF6ry0Me7Wv3Q7cyqeJq4q63m-qbjeN6FbzyFhpxw=w36-h36-p-rp-mo-ba2-br100","Víctor","Hace 7 meses",""
"https://lh3.googleusercontent.com/a-/ALV-UjUJcf_kuISESkgCJH4xsHsrBqqgyrSUZVTtHWSw5_c_dgH9_PQC=w36-h36-p-rp-mo-ba5-br100","Chakir Doukali","Hace 7 meses",""
"https://lh3.googleusercontent.com/a/ACg8ocLdNnhV1ITDzDPAEpHfUpUrBe3e8DFZFzMxLtjCp7i9yocQrQ=w36-h36-p-rp-mo-ba4-br100","Carlos Remartinez","Hace 7 meses",""
"https://lh3.googleusercontent.com/a-/ALV-UjU8a6GReya8VAoJ9spqUmiS5bI55nomw-zvU914PJyKoGzQcczIxw=w36-h36-p-rp-mo-ba5-br100","Irene Andrades","Hace 7 meses",""
"https://lh3.googleusercontent.com/a/ACg8ocKkUAZ7aFbWeRMcXvgVKkx7BuzwpH2oNxuw8IPK04R47mCTKQ=w36-h36-p-rp-mo-ba4-br100","Auxiliadora Luna Elias","Hace 8 meses",""
"https://lh3.googleusercontent.com/a-/ALV-UjWJevPfmHH54BBe42kZSjok9qdGnT1R1LAw4c_whySvujqV_PQs=w36-h36-p-rp-mo-ba4-br100","manolo leiro","Hace 8 meses",""
"https://lh3.googleusercontent.com/a/ACg8ocKkC7O7Q22loPrT5VshTN2ANLYp812qOevBIV94VilqKz5buw=w36-h36-p-rp-mo-ba5-br100","Ariadna Ferga","Hace 9 meses",""