"URL","Usuario","Fecha","Reseña"
"https://lh3.googleusercontent.com/a/ACg8ocKg9jaj8W1WJg9l9JqAuE6BRkOI2-iSka8icIIsymQ7IU_qtA=w36-h36-p-rp-mo-br100","Giancarlo Cuevas Ledesma","Hace una semana","Sois unos irresponsables, como puede ser que tengamos que salir de trabajar a las tantas corriendo para llegar a tres olivos,  que el cartel ponga 2 minutos y cuando llega el metro diga que no admite pasajeros, el siguiente viene en 11 minutos y cuando llega nos dejáis dentro 10 minutos más para salir, parece que lo hacéis queriendo macho, que hay personas que queremos llegar a casa y no tener que tener que ir a Cibeles porque ustedes quieran. Dais vergüenza!!!!"
"https://lh3.googleusercontent.com/a-/ALV-UjXkUDcty2ZptPMh-np9zpv8B1Jg-jFY-8GJfEYTtQRReYtSLkKK=w36-h36-p-rp-mo-br100","Alfonso Basco","hace 6 días","Si vas a algún sitio con prisa, Tres Olivos es la estación a evitar. No hay explicación razonable a por qué al llegar un tren, en vez de esperar 15 segundos a esos pasajeros, el otro tren se vaya rápidamente antes de que puedan subirse.Y tengan que esperar un promedio de 6 ó 7 minutos hacia Infanta Sofía. En verano, fines de semana o en las noches, puede llegar a 15 minutos de espera, porque no se les ha esperado 15 segundos para que puedan subirse. Llevo décadas usando el Metro en Madrid y es un metro excelente en comparación con el de muchas otras ciudades. Pero Tres Olivos, al margen del cambio de tren, es la estación peor organizada de todo el Metro. Los cambios de tren en hora punta son (evitablemente) caóticos al no haber tornos suficientes, y en horario normal también hay problemas: el tren se queda parado sin avanzar a 20 metros de la estación (esto ocurre muy a menudo), o el conductor se queda un buen rato con las puertas abiertas sin arrancar (y no para esperar al siguiente tren, ya que luego sí arranca rápido cuando llega el otro tren sin que nadie pueda subir), o cuando por fin llega el tren después de mucho esperar resulta que ""no admite viajeros"", o que haya que ir al andén de enfrente y todo el mundo agolpándose subiendo y bajando escaleras para no perder el tren que está en el otro andén, o que el conductor se lo tome con demasiada calma paseando hasta la cabina para poner el tren en marcha, ya que no hay ninguna prisa para él... sí para los pasajeros que llevan 10 minutos esperando. Tres Olivos no es como un trasbordo entre diferentes líneas de Metro. Es mucho peor: en tiempos, en mala coordinación, en gente muy nerviosa por el caos de esta estación... Veo a diario personas mayores, o con niños, o con necesidades especiales para las que esta estación es un gran reto. No hablo solo de que hay que cambiar de tren (lo cual ya de por sí es un trastorno y no tiene sentido al no ser cambio de zona/tarifa), sino de los múltiples fallos evitables que tiene el uso de esta estación. ¿No es posible pensar un poco más en los viajeros en esta estación? ¿Tan difícil es coordinar la llegada de un tren con la salida del otro? ¿Cuesta tanto poner más tornos? ¿No es posible que cuando un tren no admite viajeros, el siguiente tren tarde un poco menos, en vez de un poco más (como suele ocurrir)? Lo de esta estación es un despropósito, y no es casualidad que varias personas conocidas que viven en zona norte, han acabado cambiando el metro por el coche por los inconvenientes de Tres Olivos. [En la imagen, la espera tras un tren que se ha ido mientras bajábamos del otro, y no ha sido capaz de esperar 15 segundos para evitar que todos los pasajeros esperemos 15 minutos]."
"https://lh3.googleusercontent.com/a-/ALV-UjWSb35j8JqeD0Va4sU-QDWaJclYlb0anxWfqvF_Smo_4Nj_EdpT=w36-h36-p-rp-mo-ba3-br100","Sara Niño","Hace 4 meses","Un infierno de transbordo. Todos los días se te va un tren en las narices (digo yo que están en contacto unos con otros y saben cuándo llegan y se van), algo que no es casualidad… parece hecho para enfadar aún más al viajero, que tiene que ir aguantando que el metro se pare en el túnel y que vaya hasta los topes (tren corto). No llegaría el dinero para hacer algo un poco mejor… Claro que para otras cosas sí hay dinerito."
"https://lh3.googleusercontent.com/a-/ALV-UjWdX3tAK1ZJlSEdh8h8NGSBOAWGhVcUa-CtxrL2cSRL-XqgIQzj=w36-h36-p-rp-mo-ba8-br100","Ma Ca","Hace 6 años","Sinceramente me parece una tontería cambiar de tren para seguir en la línea 10 hasta otras paradas, además de tener que pasar por tornos que no tienen ningún sentido, siendo la misma zona tarifaria, pero bueno. Salvo eso la estación es amplia, moderna, está habilitada para gente con discapacidad y está limpia."
"https://lh3.googleusercontent.com/a-/ALV-UjUr0poA5093LFm8_97hULGULh2crXP_wv7s4Lsgk0vHp4YXKyU=w36-h36-p-rp-mo-br100","Ignacio","Hace 2 meses","Una vergüenza de estación . Tienes que ir a trabajar y salgas antes o después de casa , toooodos los días tienes que ver cómo los trenes se paran en los túneles , los trenes no admiten viajeros ...y esto no ocurre en esta estación sino varias estaciones antes. NADIE te dice nada por megafonía. Cliente de metro desde siempre y en el trayecto entre Begoña y las Tablas se ríen en tu cara .el intercambiador no tiene sentido y para cuando llega el metro ya han aparecido otros cuatro por lo hablar de lo lento que va a veces . A ver si mejorais el servicio que los vamos dentro LO PAGAMOS."
"https://lh3.googleusercontent.com/a/ACg8ocKm4h2-RYGYnCuct1MM_H5fgRvwjwYGhkGlcCB3_TN0Fv2q8Q=w36-h36-p-rp-mo-br100","Eduardo","Hace 5 meses","Un desastre. La peor estación de Madrid. Se pierde muchísimo tiempo entrando a la estación y cambiando de tren. Pocos trenes y mal coordinados en un lugar siempre a reventar en las horas punta. Puedes llegar tarde a trabajar aunque vayas con tiempo de sobra. Horrible."
"https://lh3.googleusercontent.com/a-/ALV-UjUdGYsBpVABogc9CFceLx4OqWG8HoP7sexLOlBunm-P6n_SH9B9iw=w36-h36-p-rp-mo-ba6-br100","Julio Diarte","Hace un año","📌 Varias veces he utilizado esta estación y no hubo retrasos.…"
"https://lh3.googleusercontent.com/a-/ALV-UjXN_8lqZwvWDE74pWGuKtN8T-Z0Z0XB0ObVFxmYncca5qwLmULnPQ=w36-h36-p-rp-mo-ba8-br100","David Gutiérrez Sacristán SPAIN","Hace 4 años","Línea 10 de metro. Lo único malo que hay en la línea 10 en la zona norte es que hay que hacer un cambio de tren."
"https://lh3.googleusercontent.com/a/ACg8ocLOWeBacLXa93iswccHHeW2kpdTg7ZmNBN2b-Vq_nXY-1hN9Q=w36-h36-p-rp-mo-br100","arantza bouzas","Hace 10 meses","Estáis cobrando por hacer transbordo quién viene de la línea 10 de las tablas un viaje más? No tenéis vergüenza."
"https://lh3.googleusercontent.com/a-/ALV-UjVg219GHs16_3IQvPWnkQ4rSLHeNLNM3PkE3I8lYhvp_5D7_3Om=w36-h36-p-rp-mo-ba5-br100","Agoraht 21","Hace un año","Para entrar a Metronorte, tienes que validar un viaje en zona B1. Tiene sentido que exista esa zona tarifaria, lo que no tiene ningún sentido es que para entrar en cualquier estación de Metronorte tengas que validar un viaje desde B1 y al llegar a Tres Olivos tengas que validar otro viaje adicional para poder continuar. Ya te están cobrando la zona tarifaria B1 que es más cara porque cubre un trayecto más largo. ¿Qué sentido tiene entonces que te cobren un viaje de B1 y luego otro viaje adicional?"
"https://lh3.googleusercontent.com/a/ACg8ocKKz3BVzKt7C6tjYJdT2xDu1SYtG59ri6yq4Vk4FJTiUdmGrw=w36-h36-p-rp-mo-ba2-br100","turinete123","Hace 5 años","Un completo desastre. Transbordo a reventar de gente porque te hacen pasar a un tren más pequeño. Perdidas ingentes de tiempo por dos motivos: 1- los trenes no están coordinados y hay largas esperas para cambiar de andén. 2- Las regulaciones de tráfico antes de llegar a 3 olivos son inhumanas, con esperas de más de 10 minutos en medio de un túnel entre estación y estación. Y todo esto a diario!! Huyan."
"https://lh3.googleusercontent.com/a-/ALV-UjUjG-S3EJdKijSlMCX61U3cD9U3RWmYBkPx3mUwJe4sHwyIWYdd=w36-h36-p-rp-mo-ba2-br100","Serhii Bilous","Hace 2 años","En Alcobendas va tren cada 9-15 min(o mas peor 18 min)  y desde Madrid 3-5 min ! Imaginate cuando hay gente esperando tren en Alcobendas en tiempo PIC !!,  ademas era siempre en pandemia COVID-19. No hay sincronización entre los trenes. Las buriqetas son lentos y aveses come dos viajes !!!! Porque necesitamos cambiar los trenes para continuar el viaje, algen puede resplicar?! El servicio desde estacion tres olivos hasta h.infanta sofia peor!!! Losiento pero eso verda. Transporte publico es bueno pero aquí no! Si quieres perder tiempo ADELANTE 😸"
"https://lh3.googleusercontent.com/a-/ALV-UjV1RfktfE1aEv2jUy3XVoEgYcpZyf6pcpy5pF-aklJblPD2WrA2lw=w36-h36-p-rp-mo-br100","Samira Ennahouti","Hace 2 años","La peor estación de metro sin duda. El maquinista cierra las puertas en las narices cuando llega el otro metro para hacer el trasbordo. Esperas largas. Cuando llega el siguiente, indica que no acepta viajeros. Incluso llendo con tiempo vas a llegar tarde."
"https://lh3.googleusercontent.com/a/ACg8ocKBKoUJyxSs3xqgwbxSRSobreraxA2GEKo6_uLWwnxwoCKPxQ=w36-h36-p-rp-mo-ba5-br100","Enrique Garrido","Hace 8 años","Un señor alto y rellenito con ojos claros (lo digo por si necesitan auda en Tres Olivos no se la pidan a él) me atendió, le dije que se desmagnetizó el billete y que si podría sacarme otro con los viajes que me quedaban, cosa que siempre me han hecho sin problemas en otras estaciones de metro, pero el pasó de mí, simplemente me abrió el torno mientras seguía hablando por teléfono con su amigo, al llegar a mi destino lo dije en el vestíbulo de la estación y me sacaron otro nuevo, pero me advirtieron que debería reclamar ya que en caso de que me hubiera pillado un revisor me hubieran multado. Y ya no hablemos del cambio de tren, que en cuanto llegas a un andén te tienes que bajar y esperar a otro, por lo menos que sincronicen los horarios."
"https://lh3.googleusercontent.com/a-/ALV-UjXU9d7q8U2Sb1_ypf446EQAktKLLl66P7XqOq56uEMRGN-v3h5o=w36-h36-p-rp-mo-ba5-br100","Jesus Valverde Romero","Hace 7 años","La estación es moderna y adaptada para personas con movilidad reducida. Por favor habiliten trenes que, a ciertas horas, continúen en recorrido sin hacer el transbordo... Físicamente es posible y a los trabajadores que sufrimos el despropósito de planteamiento de la estación 2 veces cada día, nos ahorraría hasta 15min. de trayecto. Gracias"
"https://lh3.googleusercontent.com/a-/ALV-UjUWbPyO177rKwicBpJZDM-ToDoEy-MOXkKKPPew4jJVAIinZSXC=w36-h36-p-rp-mo-br100","Sergio González Requena","Hace 7 años","Esta estación es lo peor que he visto. Te cambian de un tren grande a uno de solo tres vagones, lo que te hace ir incómodo el resto del viaje en hora punta. Peor aún en verano a la vuelta del trabajo, con el calor agobiante en el tren, y que ni se dignan a poner el aire. Para colmo, a veces te hacen cambiar de andén a la vuelta. Y qué decir de los tornos que te obligan a pasar la tarjeta y generan una cola enorme, solo para pasar al otro andén (muchas veces algunos ni funcionan). Desquiciante."
"https://lh3.googleusercontent.com/a-/ALV-UjUXl4-okvhI4nS8zDqppN__vTLOaiAFKEGnoVtAuTEr0FyupYfm=w36-h36-p-rp-mo-ba5-br100","Carmen Franco","Hace 2 años","Que retraso de estación, tener que hacer un trasbordo, y ni hablar del máster que hay que hacer para comprar un ticket para chamartín, deberían de tener el sistema de Londres, se ahorrarían mucho, yo tengo deficiencia visual y me fue un calvario llegar al hospital infanta Sofía"
"https://lh3.googleusercontent.com/a/ACg8ocLDRjTNNr9QiWL30xpA_cTmPqCB8yLd9vVFW0PzNrCeGaR2dQ=w36-h36-p-rp-mo-br100","Marta Montero Lavado","Hace un año","Es difícil llegar en hora a los sitios si pasas por esta estación, los tiempos de espera son impredecibles, por la tarde eternos, he llegado a esperar más de 20 minutos en esta parada que ni si quiera es cambio de línea de metro…"
"https://lh3.googleusercontent.com/a-/ALV-UjWp0JSZTpXMzuxwo1T8A4xCDRRFvuzI5ic1B22b-6xLZig9b747Hg=w36-h36-p-rp-mo-ba7-br100","Victor Iglesias","Hace 6 años","Estación amplia, limpia y bien señalizada. Problema: hay que cambiar de tren porque el gobierno de la CAM en su día quería cobrar en función de los pasajeros a partir de ese tramo."
"https://lh3.googleusercontent.com/a/ACg8ocJTlSehUjhJd-26htgOHDjKTDZr70FgXgszNb8ugkVf1pow2g=w36-h36-p-rp-mo-ba2-br100","luis","Hace 5 años","Fatal, la Organización de las horas es de broma,  cuando llegas a hacer el intercambio,  el otro tren se marcha antes de que habrán las puertas del tullo. Por la noche,  el último tren que viene desde hospital infanta Sofía dirección puerta del Sur,  NO TIENE CONEXIÓN porque aunque es una sola línea, sale de la estación antes que llegue la continuación de la línea."
"https://lh3.googleusercontent.com/a/ACg8ocLEApEnbQa-uMNHtVmY7kIIxUX1XQEEKQT6qWkxVac-LXyqJg=w36-h36-p-rp-mo-br100","Wikii Lokii","Hace 3 años","Humillante, vergonzoso e inhumano. Que un un anden de 10 metros de largo por 5 de ancho tengan que haber mas de 200 personas apelotonadas como si fuéramos vacas esperando ir al matadero. Que ya no es que esperan a que venga un tren para juntarnos, es qué se esperan a juntar uno dos y tres trenes para acumular 200 personas y meternos a presión."
"https://lh3.googleusercontent.com/a-/ALV-UjVuvWmlBd9LFmqYtExxIKU13yvl2pXUSFf3ZV06ZGT6IyI7tlnb=w36-h36-p-rp-mo-ba5-br100","Mario Rodriguez Gonzalez","Hace 2 años","Estación de Metro de Madrid perteneciente a la línea 10. Contiene la correspondencia entre líneas 10A y 10B (metronorte) Desde aquí se puede llegar hasta la estación de Puerta del Sur a través de la línea 10A o hasta Hospital Infanta Sofía de la línea 10B. Si quieres acceder a la línea 10B deberás de estar en posesión de un título que da acceso a Metro Norte."
"https://lh3.googleusercontent.com/a-/ALV-UjVdkUT6TBU2NbnS-kPi9IbEOYfc6zGDu1-qEaeq6cbrK6XhYEA=w36-h36-p-rp-mo-ba3-br100","Javier Valecillos","Hace 2 años","La peor estación de Madrid todos los días el transbordo a las 12 de la noche tiene una espera de 30 minutos hay personas que trabajamos y usamos esta via para ir al trabajo"
"https://lh3.googleusercontent.com/a/ACg8ocKb9ZkDTpKFV5L8gO6MS8MaQB7QCdLYLxlhMNxfJc7l6CYaOw=w36-h36-p-rp-mo-ba3-br100","Alberto","Hace 5 años","El cambio en Tres Olivos es para matar a alguno. Hoy, 14 minutos de espera. Es una línea hasta Tres Olivos y otra línea más allá de Tres Olivos, aunque en los mapas ponga que es todo línea 10. No hay ni la mínima intención de coordinar los trenes. Es una vergüenza absoluta que, cómo cómo siempre, tenemos que pagar los ciudadanos. Si alguien tiene intención de trabajar por el centro, que no se le ocurra vivir más allá de Tres Olivos."
"https://lh3.googleusercontent.com/a-/ALV-UjXF75lHeMZ_JHpWWVlanH5ql0dUg2qIW5WyzRB5Cugb7BTslAv6kQ=w36-h36-p-rp-mo-ba4-br100","Guillermo Calvo","Hace un año","Una de las peores estaciones de metro. Siempre retrasos, no tiene ningún sentido el cambio de trenes para la misma línea. Un despropósito de estación."
"https://lh3.googleusercontent.com/a-/ALV-UjVrMVqGk-n8NrQYfuzrOCI-dL8A3HIyCBT-VnNRQIRRKyRilUbtlA=w36-h36-p-rp-mo-ba4-br100","Arantza Bouzas Martínez","Hace un año","No tiene sentido que obligar a las personas a cambiar de andén y validar el puñetero ticket formándose unas colas a las 07h00 de la mañana."
"https://lh3.googleusercontent.com/a-/ALV-UjXYUcvUuuRybgb8H3ZeMnMfIpcXBx2-hFhBqZPcjHzcJwsBQ7c=w36-h36-p-rp-mo-ba4-br100","Álvaro Cid Rodríguez","Hace 8 años","No entiendo cómo a estas alturas hay estaciones como estas, en las que te tienes que cambiar de tren para seguir hasta tu destino, siendo la misma línea. A causa de esto, es frecuente encontrarte trenes que no admiten viajeros, largas colas y trenes sobreocupados..."
"https://lh3.googleusercontent.com/a-/ALV-UjUD_KJQoS25Saypj_fB-TpCMLWxAcVF7Cq1totl7HVffpGkA8XV=w36-h36-p-rp-mo-ba5-br100","Julio Gómez","Hace 8 años","De las peores estaciones de la Red de Metro. Obligan a un cambio sin sentido de andén que genera un cuello de botella al no haber tormos suficientes. Además, se pasa de un tren de 5 vagones a uno de 3, así que son habituales los  empujones y la multitud."
"https://lh3.googleusercontent.com/a-/ALV-UjXaMIoRGUlWKoFt3dSKOPNTZRdtYT7xWLLsjEJJK4DOM_FsIq1y=w36-h36-p-rp-mo-br100","Patri Gómez","Hace 2 años","Una Estrella me parece demasiado, a parte de tener que coger un metro dentro de la misma línea, no se coordinan y lo que es peor, esperan a que llegue el metro para cerrar las puertas e irse sin coger a los viajeros de la misma línea."
"https://lh3.googleusercontent.com/a-/ALV-UjV63eP6lFSd89z8HqAkQOzQdJ4pyc5_1zjahlVc3vOOkoAPJvaX=w36-h36-p-rp-mo-ba5-br100","Javier Pérez","Hace 8 años","Terrorífica estación. Es un horror el cambio de tren, siempre. No están coordinados. A veces además te hacen cambiar de anden. Poquísimos tornos y se pasa a un tren con una capacidad mucho inferior. Lo peor que he visto nunca."
"https://lh3.googleusercontent.com/a-/ALV-UjUxaS1A_fWgQl1KInmhX6gRkOLASr0twkoVyHfb-gau6d5MAfeX=w36-h36-p-rp-mo-br100","SanMarc","Hace 2 años","Llevamos como 15 minutos de ...tiempo de espera nos metemos en la vagon y a continuacion nos echan del vagon con una voz que pega uno del metro que ni que estuviramos en la mili ... después de salir del vagon nos dicen que es el en otro anden ...pagamos un abono para tener beneficios y ayudas no para ponernos problemas todos los dias Vergonzoso!!"
"https://lh3.googleusercontent.com/a/ACg8ocJHLs0C2pyzVCZ_kvVn9C5xJGqmIl0ILjMLMlH0jvc28NKSig=w36-h36-p-rp-mo-br100","antonio maldonado","Hace 5 años","A parte del cambio innecesario de tren que ya comenta todo el mundo, se supone que debería haber trenes hasta las 2:00 y ya me ha pasado en dos ocasiones el llegar sobre la 1:15 y encontrarme con que ya no hay trenes que circulen en dirección Hospital Infanta Sofía, encontrándome con la única posibilidad de coger un taxi para llegar a mi destino con el gasto que ello supone..."
"https://lh3.googleusercontent.com/a-/ALV-UjUCZrLXI-7jT8KLnyBBAjrcc1V8TVg1gZgvjzMXpTTpaavXEt0=w36-h36-p-rp-mo-ba4-br100","Alvaro","Hace 7 años","La cosa más inútil de todo el metro de Madrid. Hacen perder el tiempo a diario a miles de personas. Ya que hacen éste sin sentido al menos que los sincronicen, además de la que lían cada mañana, si vas por la noche te puede tocar hacer un trasbordo y tirarte esperando al otro tren 15 minutos, ah! Con suerte de que no te deje tirado en tres olivos porque no haya otro metro al cual conectarte. INUTILES"
"https://lh3.googleusercontent.com/a-/ALV-UjXv7myWe3cwn7YXcu1mcaVlYZkblpal9N3z3jS974DO1yDZqT7C=w36-h36-p-rp-mo-br100","Jesús Javier Rodríguez Guyón","Hace 2 años","Este intercambio de línea funciona fatal, siempre antes de llegar se detiene hasta 5 minutos o más en la estación fuencarral y cuando el metro llega a tres olivos el otro tren se va… para luego tener que esperarlo 6 min como mínimo."
"https://lh3.googleusercontent.com/a-/ALV-UjW4XGMNKkB1sSLgmXzSQeVq0U_6C98es6Wli49FoiE_eNlZkRAZRQ=w36-h36-p-rp-mo-ba4-br100","Omar Sánchez (Josh)","Hace 2 años","De lo peor que hay del metro de Madrid Un transbordo absurdo que lo único que hace es empeorar el servicio El responsable de la estación lo podrían echar a la calle Es inexplicable la gestión de esta estación"
"https://lh3.googleusercontent.com/a/ACg8ocKreXYwtHnHV6fZO7czE97MHRsRU7ZtYdiyiaG8Ni9D0u74rw=w36-h36-p-rp-mo-br100","Aracelis Boente","Hace 2 años","Me gustaría saber quién es l a mente brillante de metro que lleva al a estación de TRES OLIVOS creo ya es bastante absurdo hacer un trasbordo en esta estación y para colmo sin todas las máquinas en funcionamiento FATAL crecen los casos de covid, gente aglomerada por que para poner la guinda en el pastel de esta mente brillante ✨ aveces deciden que hay que dar también la vuelta hasta el otro andén y justo en horas picos esto pasa todos los días es increíble que que no se piense en el usuario"
"https://lh3.googleusercontent.com/a-/ALV-UjXHmIXczcj1GxIeEGm2mU-ay2rd13RUqG00lEITOqNLiLbkgxY=w36-h36-p-rp-mo-br100","Jose luis Gonzales","Hace 3 años","Una pesima atencion al cliente es una estacion de la linea 10 con sentido alcobendas donde se hace un trasbordo de metro a otro aveces te hacen cambiar las mayoria de las veces de andenes otras oportunidades el metro llega de un lado mas que de otro y va muy lento y unos seguritas que parecen Robocop esperando que las personas se pasen sin tarjeta para detenerle"
"https://lh3.googleusercontent.com/a/ACg8ocIvz6uUeDrZ4Z0PzAPkrUDrjgWhkZcLNEyhw0DTZxYyKtOE2Q=w36-h36-p-rp-mo-br100","Javier Balboa","Hace 2 años","La mayor vergüenza del metro. Foco de covid desde el primer día.menuda vergüenza.ojalá no pague nadie. O quizá algún día hagan una huelga x el usuario. Jamás. Vergüenza"
"https://lh3.googleusercontent.com/a-/ALV-UjXVGINV38emmBizMK_jCYFI6MKZDB96nlLzpq_5LscHQN8fsR4HXw=w36-h36-p-rp-mo-ba3-br100","E RT","Hace 7 años","Maldigo a la alcaldesa/concejal/cuñao que diseñó esta basura, haciendo perder  diariamente cientos de horas a los curritos madrileños al transbordar en la misma línea 10 Me cago en vuestros muertos Espero que al menos os llenarais los bolsillos de dinero pagado con nuestro tiempo y esfuerzo"
"https://lh3.googleusercontent.com/a-/ALV-UjWRy0LmewB6L4iHQckt9S0P3Q2OQohM-oEWqJufVCTRTdZ-LXF9=w36-h36-p-rp-mo-br100","Miguel Angel Delcan","Hace 2 años","Transbordo innecesario, incoherente e inútil; ilógico hacer este intercambio en la misma ciudad de madrid y sin cambio de zona."
"https://lh3.googleusercontent.com/a/ACg8ocKVOrd2r_gIfZm3ekyKZ_USlnHrngvJwhyQ0b9AEdt8fktFAQ=w36-h36-p-rp-mo-ba4-br100","Ramiro Bianchi","Hace 2 años","Dberian Mejorar la Higiene de los baños, mas alla de eso los  asecnesores para andar con valijas, niños o cochecitos de bebes."
"https://lh3.googleusercontent.com/a-/ALV-UjXSeC9jU5wL0RaoUgMRmRrjqL5ABzHPCbNa1YdYjOeWQHKhM-b3Tg=w36-h36-p-rp-mo-ba5-br100","Luis Boville Lobo","Hace 8 años","Fatal estación en la que te hacen cambiar de vía y de metro para continuar en la misma línea 10. Hay tornos de por medio, aglomeraciones y colas. A veces hacen esperar un metro a que llegue otro y se llene más. Nefasto."
"https://lh3.googleusercontent.com/a/ACg8ocK9VapD3jJvriYyyVsf7PJ6iyaQ_6e2cQMtaxWtWLWPQX_bpg=w36-h36-p-rp-mo-br100","carmen hernandez","Hace 7 años","La gente no esta contenta con nada...antes de tener metro en esta zona de Alcobendas, tenias que viajar en autobus que salian desde plaza castilla...uf eso si que era lo peor, pero vamos ... quien no ha probado algo peor, no saben apreciar las mejoras."
"https://lh3.googleusercontent.com/a/ACg8ocL3KrQgB24hhiBEMhin5q6UdSVvIaoF1EvPJYcqY8XwojntCao=w36-h36-p-rp-mo-ba3-br100","candido sanchez romero","Hace 4 años","Se respira aire limpio y buenos restaurantes"
"https://lh3.googleusercontent.com/a-/ALV-UjVPAiYAK6LY0x9sw0-2pvCxzYNfWR7tEd3qpwBTH53RvbsWaCVlog=w36-h36-p-rp-mo-ba4-br100","Víctor Redondo","Hace 5 años","Como experimento social tiene mucho potencial, el Dr. Mengele estaría orgulloso. Como estación de Metro, es una buena demostración de que el mundo es un sitio devastador, cruel y lleno de maldad."
"https://lh3.googleusercontent.com/a-/ALV-UjUVnQMh4nFyJWeGoU12SWfPoqmZqvpUrW1oXiR_XIi2wxfZIAU=w36-h36-p-rp-mo-ba6-br100","Fernando Fábrega Schiozzi","Hace 3 meses","Geniales."
"https://lh3.googleusercontent.com/a-/ALV-UjVbY0VyJC1aGQbU-lePpbrpvUYJSfuX8vNHIX4cT6yjs74h-q4rMA=w36-h36-p-rp-mo-ba5-br100","Wileiner Moises Figurelli","Hace 7 meses","Todo bien"
"https://lh3.googleusercontent.com/a/ACg8ocIem4vUQp61hDt7QlQ3hugn7RbtvE8pzZ16b-uTY1qzYafzZA=w36-h36-p-rp-mo-br100","Joaco Moresco","Hace un año","Estación grande, limpia y cómoda. Los trenes llegan con rapidez"
"https://lh3.googleusercontent.com/a-/ALV-UjU7Lt0n-4ilJ0bNE9qTS1aksvPgiLKLEcYKovhgswXP0PGBerK67w=w36-h36-p-rp-mo-ba5-br100","Jesus Ruiz Polo","Hace un año","No coinciden los trenes de ambos andenes, lo que produce aglomeración"
"https://lh3.googleusercontent.com/a/ACg8ocIrlmCeC3XYaomP8ijvdIkGOHFqFaoQywd1UnivUJiDxTx6UQ=w36-h36-p-rp-mo-br100","Patricia Laurin","Hace un año","Una pérdida de tiempo enorme y un fastidio tener que cambiar de tren para seguir en la misma línea."
"https://lh3.googleusercontent.com/a-/ALV-UjW1pgzWdA6_OdGGtr7MBv8jo4K_0v_Kpl3WUwT3_zfuI1vYV5oI=w36-h36-p-rp-mo-ba6-br100","Hector Portela","Hace 4 años","Muy buena accesibilidad en una única entrada y salida.  Hay acceso para silla de ruedas a través de ascensor."
"https://lh3.googleusercontent.com/a-/ALV-UjVt7KyCXhZmOMSik2qUS5wVO5Z5VUSuN1ygFBdrl4wzfjJ2n5O6cQ=w36-h36-p-rp-mo-ba4-br100","Merche Sanchez Sanchez","Hace 5 meses","Rápido"
"https://lh3.googleusercontent.com/a-/ALV-UjXwh_35kPEvVjMoiqS9ipHIBn6M-OWJvao19ddIMqjdJnPUa0s5sg=w36-h36-p-rp-mo-ba5-br100","Luis A. Villalba","Hace un año","Los cambios de trenes son caóticos y hacen esperar mucho a los viajeros"
"https://lh3.googleusercontent.com/a/ACg8ocLqab32DOCMPm-LYsW_LXJK_ESp9qb33ERVYwS_QjHIymBRzw=w36-h36-p-rp-mo-ba3-br100","Amet Gaston","Hace un año","Tardan mucho en llegar y salir los trenes"
"https://lh3.googleusercontent.com/a-/ALV-UjXlATBqfLc7nDL47g9p1UtJrj5-sOPq7TEizWSMVAInzLVMc_MK=w36-h36-p-rp-mo-ba6-br100","marcelo carot","Hace 2 años","Buenas instalaciones. Como todas las de metrónomo. Buenos accesos. Siempre limpio y ordenado. Buena refrigeración."
"https://lh3.googleusercontent.com/a-/ALV-UjWe0ixI5DBSMvDHGMzp4EJCBs2xvBt9Fq1iEdmGh98cEe0HgJOuZw=w36-h36-p-rp-mo-ba3-br100","Eleazar Spak","Hace un año","Trasbordo sin sentido y mal coordinado, lamentable."
"https://lh3.googleusercontent.com/a/ACg8ocLKu8_HNMOLlQdByD_JaPQoqZoS_ddi6j5yHpc9xLV0hHnKrw=w36-h36-p-rp-mo-br100","rubik brops","Hace un año","Horrible por Dios que eliminen este transbordo y dejen de hacer perder el tiempo a todos los ciudadanos que tienen que pasar diariamente por él"
